score,date,title,author,url,subreddit,text
387,2022-09-07,"(South)Korean nuclear fusion reactor achieves 100 million°C for 30 seconds.mA sustained, stable experiment is the latest demonstration that nuclear fusion is moving from being a physics problem to an engineering one",u/izumi3682,https://www.reddit.com/r/Futurology/comments/x8l6k6/southkorean_nuclear_fusion_reactor_achieves_100/,Futurology,https://archive.ph/fS7AK
1,2022-09-07,Flip that flat flapjack 🥞 into a firm peach 🍑 with the NEW Row-N-Ride™ Plus Assisted Squat Machine | Sunny Health &amp; Fitness,u/Professor_Stonehaven,https://www.reddit.com/r/Futurology/comments/x8lu3r/flip_that_flat_flapjack_into_a_firm_peach_with/,Futurology,https://youtu.be/tX9Wo153EOc
1,2022-09-07,"Acabo de crear mi OF, sígueme ❤️ me encantaría conocerte 😍",u/Angie-orozco,https://www.reddit.com/r/Futurology/comments/x8m318/acabo_de_crear_mi_of_sígueme_me_encantaría/,Futurology,https://onlyfans.com/angie050799
6,2022-09-07,Ukraine conflict: THeMIS robot delivered to Kyiv as Russia announces bounty for system's capture,u/Test19s,https://www.reddit.com/r/Futurology/comments/x8m4sa/ukraine_conflict_themis_robot_delivered_to_kyiv/,Futurology,https://www.janes.com/defence-news/news-detail/ukraine-conflict-themis-robot-delivered-to-kyiv-as-russia-announces-bounty-for-systems-capture
22,2022-09-07,what does the future look like to you?,u/RonFrambuesas,https://www.reddit.com/r/Futurology/comments/x8nb8w/what_does_the_future_look_like_to_you/,Futurology,"Since I was young, I have always been obsessed with the future and trying to depict the future from the past/present.

I have no professional experience and do not work in the field of future, past or present stuff and can offer you only my personal thoughts. 

I am keen to know other people's visions of the future and how their personal past and present might have influenced their vision of the future"
1,2022-09-07,Huawei Releases Mate 50 series World’s First Satellite Communication Smartphone -,u/[deleted],https://www.reddit.com/r/Futurology/comments/x8ogxm/huawei_releases_mate_50_series_worlds_first/,Futurology,
1125,2022-09-07,"With Stable Diffusion, you may never believe what you see online again. AI image synthesis goes open source, with big implications.",u/izumi3682,https://www.reddit.com/r/Futurology/comments/x8otzg/with_stable_diffusion_you_may_never_believe_what/,Futurology,https://arstechnica.com/information-technology/2022/09/with-stable-diffusion-you-may-never-believe-what-you-see-online-again/
0,2022-09-07,Three technologies to slash carbon emissions at the World’s Top 50 Innovators 2022 in London,u/[deleted],https://www.reddit.com/r/Futurology/comments/x8ouzz/three_technologies_to_slash_carbon_emissions_at/,Futurology,
1,2022-09-07,Which stock do you think will dominate the future?,u/Accomplished_Force68,https://www.reddit.com/r/Futurology/comments/x8p3ga/which_stock_do_you_think_will_dominate_the_future/,Futurology,[removed]
2973,2022-09-07,The Supply Chain to Beat Climate Change Is Already Being Built,u/Leprechan_Sushi,https://www.reddit.com/r/Futurology/comments/x8p9vz/the_supply_chain_to_beat_climate_change_is/,Futurology,https://www.bloomberg.com/opinion/articles/2022-09-06/solar-industry-supply-chain-that-will-beat-climate-change-is-already-being-built
1,2022-09-07,Ronald Lee - Overpopulation &amp; Demographic Transition,u/altpropulsion,https://www.reddit.com/r/Futurology/comments/x8pmnz/ronald_lee_overpopulation_demographic_transition/,Futurology,https://www.youtube.com/watch?v=r3kJz-R1gL8
60,2022-09-07,Infrared laser charger wirelessly beams power to devices 100 ft away,u/[deleted],https://www.reddit.com/r/Futurology/comments/x8prm8/infrared_laser_charger_wirelessly_beams_power_to/,Futurology,
18,2022-09-08,Most Major Carbon Capture and Storage Projects Haven't Met Targets,u/[deleted],https://www.reddit.com/r/Futurology/comments/x8py41/most_major_carbon_capture_and_storage_projects/,Futurology,
1052,2022-09-08,Analysis: Banned U.S. AI chips in high demand at Chinese state institutes,u/[deleted],https://www.reddit.com/r/Futurology/comments/x8q60z/analysis_banned_us_ai_chips_in_high_demand_at/,Futurology,
0,2022-09-08,"A vast amount of CO2 is released in the atmosphere to produce many materials in everyday use like steel, plastic and paper. These three technologies could slash carbon emissions and are being showcased at the World’s Top 50 Innovators 2022",u/chelsea_bear,https://www.reddit.com/r/Futurology/comments/x8qfo0/a_vast_amount_of_co2_is_released_in_the/,Futurology,https://www.codex.com/co2-slashed-at-the-worlds-top-50-innovators-2022/
1,2022-09-08,we can automate everything/ my page is proof,u/[deleted],https://www.reddit.com/r/Futurology/comments/x8rgcf/we_can_automate_everything_my_page_is_proof/,Futurology,[removed]
1,2022-09-08,"HELLO EVERYONE THAT WANTS TO MAKE $10,000 READ THIS!!",u/JRnDeanna1,https://www.reddit.com/r/Futurology/comments/x8s04p/hello_everyone_that_wants_to_make_10000_read_this/,Futurology,[removed]
116,2022-09-08,Updates on potential hair regrowing therapies,u/[deleted],https://www.reddit.com/r/Futurology/comments/x8si5u/updates_on_potential_hair_regrowing_therapies/,Futurology,
1,2022-09-08,Thousands Of Viewers Watched A Fake Apple Crypto Scam On YouTube,u/[deleted],https://www.reddit.com/r/Futurology/comments/x8tpgz/thousands_of_viewers_watched_a_fake_apple_crypto/,Futurology,
1,2022-09-08,the future is here with ai automation,u/[deleted],https://www.reddit.com/r/Futurology/comments/x8ucf5/the_future_is_here_with_ai_automation/,Futurology,[removed]
99,2022-09-08,"Hot and bothered: The climate getting warmer may be fuelling online hate speech, new study finds",u/sector3011,https://www.reddit.com/r/Futurology/comments/x8v70a/hot_and_bothered_the_climate_getting_warmer_may/,Futurology,https://www.euronews.com/next/2022/09/08/hot-and-bothered-why-the-climate-getting-hotter-may-be-fuelling-online-hate-speech
0,2022-09-08,Top Mobile App Development Company | Mobile App Developers in Dubai,u/Taniyakhan2,https://www.reddit.com/r/Futurology/comments/x8vo3a/top_mobile_app_development_company_mobile_app/,Futurology,https://www.techgropse.com/mobile-app-development-company-dubai-uae
6,2022-09-08,"So, these bees are swarming this porch light, what's the safest and most modern way to relocate them in order to protect these fuzzy creatures?",u/Educational_Sector98,https://www.reddit.com/r/Futurology/comments/x8wsuu/so_these_bees_are_swarming_this_porch_light_whats/,Futurology,[removed]
453,2022-09-08,We’re moving into a more optimistic era for climate action,u/WallStreetDoesntBet,https://www.reddit.com/r/Futurology/comments/x8xf87/were_moving_into_a_more_optimistic_era_for/,Futurology,https://www.ft.com/content/bb468d16-c260-4da1-aa2d-8633f8b1f4ad
0,2022-09-08,How To Lower Your Energy Bills (BEAT THE COST OF LIVING CRISIS),u/Tiss-Con,https://www.reddit.com/r/Futurology/comments/x8xyem/how_to_lower_your_energy_bills_beat_the_cost_of/,Futurology,https://www.youtube.com/watch?v=jjwVylWXbSQ
16865,2022-09-08,Nuclear fusion reactor in Korea reaches 100 million degrees Celsius,u/Gari_305,https://www.reddit.com/r/Futurology/comments/x8yjse/nuclear_fusion_reactor_in_korea_reaches_100/,Futurology,https://interestingengineering.com/science/korea-nuclear-fusion-reactor-100-million-degrees
4,2022-09-08,Nuclear Fusion Reactor Sustains Plasma at 100 Million Degrees C for 20 Seconds,u/[deleted],https://www.reddit.com/r/Futurology/comments/x8zjlk/nuclear_fusion_reactor_sustains_plasma_at_100/,Futurology,
0,2022-09-08,Why The Future Of Work Could Take Place In The Metaverse,u/[deleted],https://www.reddit.com/r/Futurology/comments/x8znpg/why_the_future_of_work_could_take_place_in_the/,Futurology,
3259,2022-09-08,A new submerged wave energy generator had 99% uptime with no maintenance for 10 months | The company aims to deploy 1 GW of wave energy systems by 2035.,u/chrisdh79,https://www.reddit.com/r/Futurology/comments/x8zus5/a_new_submerged_wave_energy_generator_had_99/,Futurology,https://interestingengineering.com/innovation/new-submerged-wave-energy-generator
129,2022-09-08,A ‘doomsday glacier’ the size of Florida is disintegrating faster than thought,u/[deleted],https://www.reddit.com/r/Futurology/comments/x8zwf0/a_doomsday_glacier_the_size_of_florida_is/,Futurology,
143,2022-09-08,Uber Eats and Nuro sign a 10-year deal to do robot food delivery in California and Texas,u/Gari_305,https://www.reddit.com/r/Futurology/comments/x903r4/uber_eats_and_nuro_sign_a_10year_deal_to_do_robot/,Futurology,https://www.theverge.com/2022/9/8/23339830/uber-eats-nuro-robot-delivery-ten-year-deal-california-texas
1,2022-09-08,Paperless customer interaction,u/Lock2Key,https://www.reddit.com/r/Futurology/comments/x90ien/paperless_customer_interaction/,Futurology,[removed]
943,2022-09-08,An ACL Tear That Heals Itself? The FDA approved a new technique that uses growth factors to stimulate the ACL to repair itself.,u/CuriousMan100,https://www.reddit.com/r/Futurology/comments/x92bcm/an_acl_tear_that_heals_itself_the_fda_approved_a/,Futurology,https://www.wsj.com/articles/an-acl-tear-that-heals-itself-11662564861?mod=hp_featst_pos4
33,2022-09-08,"For the first time in the world, a robot has become the CEO of a company",u/nowadayswow,https://www.reddit.com/r/Futurology/comments/x92egg/for_the_first_time_in_the_world_a_robot_has/,Futurology,https://www.worldopress.com/post/for-the-first-time-in-the-world-a-robot-has-become-the-ceo-of-a-company
1,2022-09-08,"(Butters remix) ...And to Those I Love, Thanks for Sticking Around by $uicideboy$ - YouTube Music",u/HistoryOk7396,https://www.reddit.com/r/Futurology/comments/x92np2/butters_remix_and_to_those_i_love_thanks_for/,Futurology,https://music.youtube.com/watch?v=Yvq9bVQ18no&amp;feature=share
1,2022-09-08,Will 3D bioprinting become a reality in the near future?,u/kjwhimsical-91,https://www.reddit.com/r/Futurology/comments/x930c9/will_3d_bioprinting_become_a_reality_in_the_near/,Futurology,[removed]
150,2022-09-08,Agrivoltaics: Co-locating solar and agriculture yields mutual benefits,u/ObtainSustainability,https://www.reddit.com/r/Futurology/comments/x931hy/agrivoltaics_colocating_solar_and_agriculture/,Futurology,https://pv-magazine-usa.com/2022/09/08/agrivoltaics-co-locating-solar-and-agriculture-yields-mutual-benefits/
15,2022-09-08,"Language, virtual realities, and our quest to be at home in the world",u/DMattin,https://www.reddit.com/r/Futurology/comments/x93wks/language_virtual_realities_and_our_quest_to_be_at/,Futurology,https://nwsh.substack.com/p/the-worlds-to-come-instalment-one
0,2022-09-08,Using AI for conversion of energy from waste,u/[deleted],https://www.reddit.com/r/Futurology/comments/x959wy/using_ai_for_conversion_of_energy_from_waste/,Futurology,
6,2022-09-08,"Grapes, berries and robots: is Silicon Valley coming for farm workers jobs? | California",u/[deleted],https://www.reddit.com/r/Futurology/comments/x95e5b/grapes_berries_and_robots_is_silicon_valley/,Futurology,
76,2022-09-08,"US military, Rocket Lab sign deal to study cargo launches bound for Earth",u/[deleted],https://www.reddit.com/r/Futurology/comments/x95jmj/us_military_rocket_lab_sign_deal_to_study_cargo/,Futurology,
1,2022-09-08,Jambon Et Coquetiers,u/tarotoo1,https://www.reddit.com/r/Futurology/comments/x97s5b/jambon_et_coquetiers/,Futurology,https://www.divlancer.com/article/9317/10348
1,2022-09-08,"If Europe continues its terrible energy crisis, caused by anti-Russia sanctions that have led to massive fuel shortages, what will Europe look like in 3, 5, or 10 years?",u/Extremely-Bad-Idea,https://www.reddit.com/r/Futurology/comments/x98tya/if_europe_continues_its_terrible_energy_crisis/,Futurology,[removed]
1,2022-09-08,Key earth systems headed toward collapse if emissions aren't cut,u/Ecstatic_Choice_5482,https://www.reddit.com/r/Futurology/comments/x9a5sq/key_earth_systems_headed_toward_collapse_if/,Futurology,[removed]
1,2022-09-08,"Nuclear fusion is moving steps towards commercial use, experts say",u/[deleted],https://www.reddit.com/r/Futurology/comments/x9aoaa/nuclear_fusion_is_moving_steps_towards_commercial/,Futurology,
1,2022-09-08,Richard Branson has big plans for the future of travel,u/waximpulse,https://www.reddit.com/r/Futurology/comments/x9bx5m/richard_branson_has_big_plans_for_the_future_of/,Futurology,https://www.youtube.com/watch?v=OMmTYiCvLhc
2,2022-09-08,Future iPhone 14,u/gazakevy,https://www.reddit.com/r/Futurology/comments/x9d1iu/future_iphone_14/,Futurology,[removed]
2638,2022-09-08,Cars could soon ‘run on thin air’ thanks to hydrogen breakthrough,u/Dr_Singularity,https://www.reddit.com/r/Futurology/comments/x9dkts/cars_could_soon_run_on_thin_air_thanks_to/,Futurology,https://uk.news.yahoo.com/cars-could-soon-run-on-thin-air-thanks-to-hydrogen-breakthrough-151322536.html
1,2022-09-08,"I like AI, but people think that AI evolves very, very fast,",u/Accomplished_Force68,https://www.reddit.com/r/Futurology/comments/x9dlfo/i_like_ai_but_people_think_that_ai_evolves_very/,Futurology,[removed]
264,2022-09-08,Scientists Discover How Cells Repair Longevity-Promoting “Recycling System”,u/Dr_Singularity,https://www.reddit.com/r/Futurology/comments/x9du3e/scientists_discover_how_cells_repair/,Futurology,https://scitechdaily.com/scientists-discover-how-cells-repair-longevity-promoting-recycling-system/
1,2022-09-08,DON’T SKIP THIS VIDEO 😳 #shorts,u/Sorry_Pair_4733,https://www.reddit.com/r/Futurology/comments/x9ezcp/dont_skip_this_video_shorts/,Futurology,https://youtube.com/shorts/aamgnz60utI?feature=share
1,2022-09-08,Join my discord please,u/ocean_wave_death,https://www.reddit.com/r/Futurology/comments/x9f6qa/join_my_discord_please/,Futurology,[removed]
1,2022-09-08,The Digital Down,u/MelvilleBragg,https://www.reddit.com/r/Futurology/comments/x9fbsn/the_digital_down/,Futurology,https://youtu.be/kKQH8J14lcg
1,2022-09-08,This guy 😂😂😂,u/[deleted],https://www.reddit.com/r/Futurology/comments/x9frbk/this_guy/,Futurology,
9858,2022-09-08,"World on brink of five ‘disastrous’ climate tipping points, study finds",u/cyberpunk6066,https://www.reddit.com/r/Futurology/comments/x9h6yh/world_on_brink_of_five_disastrous_climate_tipping/,Futurology,https://www.theguardian.com/environment/2022/sep/08/world-on-brink-five-climate-tipping-points-study-finds
1,2022-09-08,"Architect Uses an AI Imagery Program Midjourney to Design Future Cities, and the Results Are Otherworldly",u/[deleted],https://www.reddit.com/r/Futurology/comments/x9ikg8/architect_uses_an_ai_imagery_program_midjourney/,Futurology,
2276,2022-09-08,Countries growing 70% of world's food face 'extreme' heat risk by 2045,u/MyVideoConverter,https://www.reddit.com/r/Futurology/comments/x9j3ga/countries_growing_70_of_worlds_food_face_extreme/,Futurology,https://www.france24.com/en/live-news/20220908-countries-growing-70-of-world-s-food-face-extreme-heat-risk-by-2045
92,2022-09-08,AI researchers improve method for removing gender bias in machines built to understand and respond to text or voice data,u/WallStreetDoesntBet,https://www.reddit.com/r/Futurology/comments/x9k8p4/ai_researchers_improve_method_for_removing_gender/,Futurology,https://techxplore.com/news/2022-09-ai-method-gender-bias-machines.html
0,2022-09-09,This is the future of the game! The newest concept metaverse space using unreal engine 5 this game can operate using VR technology!,u/KimmyKitchen,https://www.reddit.com/r/Futurology/comments/x9mfpx/this_is_the_future_of_the_game_the_newest_concept/,Futurology,https://www.tiktok.com/@metawebviralhits/video/7140493626022448386?is_from_webapp=1&amp;sender_device=pc&amp;web_id=7115824236639864321
1,2022-09-09,Is this real? How does Meta keep destroying reality. Any employees want to comment?,u/bakjar,https://www.reddit.com/r/Futurology/comments/x9mtky/is_this_real_how_does_meta_keep_destroying/,Futurology,https://www.reddit.com/r/technews/comments/x9af8l/meta_dissolves_team_responsible_for_discovering/?utm_source=share&amp;utm_medium=ios_app&amp;utm_name=iossmf
4742,2022-09-09,Cancers in adults below 50 have 'dramatically increased': Report,u/MyVideoConverter,https://www.reddit.com/r/Futurology/comments/x9no1z/cancers_in_adults_below_50_have_dramatically/,Futurology,https://abcnews.go.com/Health/cancers-adults-50-dramatically-increased-report/story?id=89475807
1,2022-09-09,ssssssssssssssssssssssssssssssssssssssssss,u/ednatmp15,https://www.reddit.com/r/Futurology/comments/x9oh3j/ssssssssssssssssssssssssssssssssssssssssss/,Futurology,https://www.youtube.com/watch?v=gouLMuqkBaU&amp;list=PL_PGSFXZ2axjfzh1CCzCUO4tMwXGlTUyU
1,2022-09-09,NFT Ticketing Services Australia,u/Blockchaintechss,https://www.reddit.com/r/Futurology/comments/x9omcu/nft_ticketing_services_australia/,Futurology,https://blockchaintechs.io/nft-ticketing-services-australia/
1,2022-09-09,The goal of human civilization,u/Ifti101,https://www.reddit.com/r/Futurology/comments/x9p25r/the_goal_of_human_civilization/,Futurology,[removed]
1,2022-09-09,Free PayPal money,u/[deleted],https://www.reddit.com/r/Futurology/comments/x9r5u3/free_paypal_money/,Futurology,[removed]
1,2022-09-09,I have a theory and a solution. if you need to ask or add anything go ahead,u/Seedone55,https://www.reddit.com/r/Futurology/comments/x9sqix/i_have_a_theory_and_a_solution_if_you_need_to_ask/,Futurology,[removed]
1,2022-09-09,Conure has developed a smart waste management called BinWise,u/usman280622tech,https://www.reddit.com/r/Futurology/comments/x9st9l/conure_has_developed_a_smart_waste_management/,Futurology,[removed]
1,2022-09-09,05 Unique gadgets with minimal designs || Gadgets Hub,u/gadgetshub,https://www.reddit.com/r/Futurology/comments/x9tez3/05_unique_gadgets_with_minimal_designs_gadgets_hub/,Futurology,https://youtu.be/X_cOVfZBTlk
1,2022-09-09,Binance BitTorrent Quiz Answers – Learn and Earn $BTTC! Updated Version 2022,u/allquizanswer,https://www.reddit.com/r/Futurology/comments/x9twk7/binance_bittorrent_quiz_answers_learn_and_earn/,Futurology,https://www.freequizanswer.com/2022/09/Binance-BitTorrent-Quiz-Answers.html
1,2022-09-09,Binance BitTorrent Quiz Answers – Learn and Earn $BTTC! Updated Version 2022,u/allquizanswer,https://www.reddit.com/r/Futurology/comments/x9twru/binance_bittorrent_quiz_answers_learn_and_earn/,Futurology,https://www.freequizanswer.com/2022/09/Binance-BitTorrent-Quiz-Answers.html
1,2022-09-09,Binance BitTorrent Quiz Answers – Learn and Earn $BTTC! Updated Version 2022,u/allquizanswer,https://www.reddit.com/r/Futurology/comments/x9tx2l/binance_bittorrent_quiz_answers_learn_and_earn/,Futurology,https://www.freequizanswer.com/2022/09/Binance-BitTorrent-Quiz-Answers.html
0,2022-09-09,Using AI in character creation,u/[deleted],https://www.reddit.com/r/Futurology/comments/x9u9ks/using_ai_in_character_creation/,Futurology,
118,2022-09-09,"Researchers from the Nano and Molecular Systems Research Unit at the University of Oulu in Finland, have developed a cost-effective way to transform water into fuel",u/Dr_Singularity,https://www.reddit.com/r/Futurology/comments/x9uhu7/researchers_from_the_nano_and_molecular_systems/,Futurology,https://techxplore.com/news/2022-09-cost-effective-fuel.html
8718,2022-09-09,EU proposes new rules to make phones and tablets last longer,u/Sariel007,https://www.reddit.com/r/Futurology/comments/x9ui1d/eu_proposes_new_rules_to_make_phones_and_tablets/,Futurology,https://www.engadget.com/eu-rules-phone-tablet-reparability-battery-life-software-updates-163636788.html
1,2022-09-09,get solar energy before the winter ;),u/Callingsun,https://www.reddit.com/r/Futurology/comments/x9vzw9/get_solar_energy_before_the_winter/,Futurology,https://aco.fan/3qat4XX
7,2022-09-09,Would You Ditch All This Chaos for a Country in the Cloud?,u/[deleted],https://www.reddit.com/r/Futurology/comments/x9wkah/would_you_ditch_all_this_chaos_for_a_country_in/,Futurology,
28,2022-09-09,Creating characters using AI,u/[deleted],https://www.reddit.com/r/Futurology/comments/x9xyku/creating_characters_using_ai/,Futurology,
17262,2022-09-09,"General Motors says it will sell an electric SUV with a range of 250 miles per charge for $30,000 from next year.",u/lughnasadh,https://www.reddit.com/r/Futurology/comments/x9y96e/general_motors_says_it_will_sell_an_electric_suv/,Futurology,https://techxplore.com/news/2022-09-cheaper-electric-vehicles-high-battery.html?
1,2022-09-09,Patients' view on their current and future mode of medical consultation,u/Ok-Contest-635,https://www.reddit.com/r/Futurology/comments/x9z300/patients_view_on_their_current_and_future_mode_of/,Futurology,[removed]
8178,2022-09-09,Meta dissolves team responsible for discovering 'potential harms to society' in its own products,u/spiritoffff,https://www.reddit.com/r/Futurology/comments/xa3hky/meta_dissolves_team_responsible_for_discovering/,Futurology,https://slatereport.com/tech/meta-dissolves-team-responsible-for-discovering-potential-harms-to-society-in-its-own-products/
1,2022-09-09,"Data visualization is one of your best skills for analyzing the future. To make sure we don’t repeat the past, we need to analyze the patterns that have come before. That means we need as much data as we can get and we need powerful tools and skills for visualization of those patterns. A Must watch!",u/VeritasSammy,https://www.reddit.com/r/Futurology/comments/xa3u4g/data_visualization_is_one_of_your_best_skills_for/,Futurology,https://www.youtube.com/watch?v=q7c6JhuVINQ
1,2022-09-09,NASA eyes late September for its next attempt to launch the Artemis moon mission,u/Godener99,https://www.reddit.com/r/Futurology/comments/xa4zhp/nasa_eyes_late_september_for_its_next_attempt_to/,Futurology,https://www.youtube.com/watch?v=BLa_c7JsyNY
472,2022-09-09,"Study of 300,000 people finds telomeres, a hallmark of aging, to be shorter in individuals with depression or bipolar disorder and those with an increased genetic risk score for depression",u/[deleted],https://www.reddit.com/r/Futurology/comments/xa56l6/study_of_300000_people_finds_telomeres_a_hallmark/,Futurology,
1,2022-09-09,Exhibition of interesting gel blaster and foam bullet guns!,u/No-Dentist-4014,https://www.reddit.com/r/Futurology/comments/xa64iq/exhibition_of_interesting_gel_blaster_and_foam/,Futurology,https://youtube.com/shorts/qpE15llmmfA?feature=share
107,2022-09-09,Solar deployed in the USA may triple in the next five years,u/[deleted],https://www.reddit.com/r/Futurology/comments/xa6lev/solar_deployed_in_the_usa_may_triple_in_the_next/,Futurology,
1,2022-09-09,Europa at Jupiter by Todor Vankov,u/behind_the_sun2,https://www.reddit.com/r/Futurology/comments/xa6tbp/europa_at_jupiter_by_todor_vankov/,Futurology,[removed]
0,2022-09-09,Ivermectin added to the NIH list of FDA-approved treatments for COVID-19,u/RequiDarth1,https://www.reddit.com/r/Futurology/comments/xaa7r5/ivermectin_added_to_the_nih_list_of_fdaapproved/,Futurology,https://www.covid19treatmentguidelines.nih.gov/therapies/antiviral-therapy/ivermectin/
2095,2022-09-09,Solar in the U.S. is forecast to triple in five years: Capacity is expected to grow from 129 GW today to 336 GW by 2027,u/ForHidingSquirrels,https://www.reddit.com/r/Futurology/comments/xaa7wa/solar_in_the_us_is_forecast_to_triple_in_five/,Futurology,https://pv-magazine-usa.com/2022/09/09/solar-energy-in-the-u-s-may-triple-in-five-years/
830,2022-09-09,"Climate tipping points of coral die-off, ice sheet collapse closer than thought",u/afeeney,https://www.reddit.com/r/Futurology/comments/xaayr8/climate_tipping_points_of_coral_dieoff_ice_sheet/,Futurology,https://www.reuters.com/business/environment/climate-tipping-points-coral-die-off-ice-sheet-collapse-closer-than-thought-2022-09-08
22,2022-09-09,Equity Crowdfunding Is Creating Opportunity for Minority &amp; Women Owned Startup Founders,u/[deleted],https://www.reddit.com/r/Futurology/comments/xabv7a/equity_crowdfunding_is_creating_opportunity_for/,Futurology,
1,2022-09-10,"Thought - The information about the model of the world in your head, whether it be via your interests and curiosities, or your discoverable choices by technology, is the most intimate knowledge a human possess.",u/willwalker123,https://www.reddit.com/r/Futurology/comments/xafqye/thought_the_information_about_the_model_of_the/,Futurology,[removed]
0,2022-09-10,Prolegomenon to undermining the foundations/fundamentals of science,u/qiling,https://www.reddit.com/r/Futurology/comments/xahjnx/prolegomenon_to_undermining_the/,Futurology,[removed]
1,2022-09-10,"AI video generation, improvement dimensions",u/Worldly-Gur8731,https://www.reddit.com/r/Futurology/comments/xahjwu/ai_video_generation_improvement_dimensions/,Futurology,[removed]
1,2022-09-10,"AI video generation, improvement dimensions",u/Redvolition,https://www.reddit.com/r/Futurology/comments/xahlj2/ai_video_generation_improvement_dimensions/,Futurology,[removed]
4,2022-09-10,Official .ST Domain name registry,u/Temporary_Ad_163,https://www.reddit.com/r/Futurology/comments/xajlk4/official_st_domain_name_registry/,Futurology,http://www.EVstandardbattery.com
1,2022-09-10,Unusual climate events of the near future,u/Dolphin_Vision,https://www.reddit.com/r/Futurology/comments/xako5i/unusual_climate_events_of_the_near_future/,Futurology,[removed]
7251,2022-09-10,Infrared Laser can Transmit Electricity Wirelessly Over 30 Meters,u/[deleted],https://www.reddit.com/r/Futurology/comments/xalf33/infrared_laser_can_transmit_electricity/,Futurology,
