score,date,title,author,url,subreddit,text
45963,2022-09-15,Billionaire No More: Patagonia Founder Gives Away the Company | Ownership transferred to a trust to ensure the company’s independence and ensure that all of its profits — some $100 million a year — are used to combat climate change and protect undeveloped land around the globe.,u/-AMARYANA-,https://www.reddit.com/r/Futurology/comments/xen80i/billionaire_no_more_patagonia_founder_gives_away/,Futurology,https://www.nytimes.com/2022/09/14/climate/patagonia-climate-philanthropy-chouinard.html
1,2022-09-15,8 High-Paying and Popular Data Analytics Careers You Must Look At -,u/[deleted],https://www.reddit.com/r/Futurology/comments/xeoq1z/8_highpaying_and_popular_data_analytics_careers/,Futurology,[removed]
1,2022-09-15,8 High-Paying and Popular Data Analytics Careers You Must Look At -,u/Emily-joe,https://www.reddit.com/r/Futurology/comments/xeoqil/8_highpaying_and_popular_data_analytics_careers/,Futurology,https://magzinenow.com/8-high-paying-and-popular-data-analytics-careers-you-must-look-at/
1,2022-09-15,The iPhone 14 ditches physical SIM cards for E-SIM,u/hsnnajam7,https://www.reddit.com/r/Futurology/comments/xeq5n9/the_iphone_14_ditches_physical_sim_cards_for_esim/,Futurology,[removed]
1,2022-09-15,Climate Change Map USA - 1895/2021 -,u/scimmia_toscana,https://www.reddit.com/r/Futurology/comments/xetf19/climate_change_map_usa_18952021/,Futurology,https://statisticsanddata.org/data/climate-change-map-usa/
724,2022-09-15,Ethereum completes the 'merge' that will make its crypto transactions greener | It now uses 'proof of stake' instead of mining to approve new transactions.,u/chrisdh79,https://www.reddit.com/r/Futurology/comments/xetqvj/ethereum_completes_the_merge_that_will_make_its/,Futurology,https://www.engadget.com/ethereum-merge-drastic-energy-reduction-104839341.html
1,2022-09-15,Vexie Cash | Crypto Game,u/MNZZL,https://www.reddit.com/r/Futurology/comments/xev3z0/vexie_cash_crypto_game/,Futurology,[removed]
1,2022-09-15,Why aren’t trains operating on autopilot yet?,u/[deleted],https://www.reddit.com/r/Futurology/comments/xevot7/why_arent_trains_operating_on_autopilot_yet/,Futurology,[removed]
1,2022-09-15,Scientists propose controversial plan to refreeze North and South Poles by spraying sulphur dioxide into atmosphere,u/[deleted],https://www.reddit.com/r/Futurology/comments/xevtpq/scientists_propose_controversial_plan_to_refreeze/,Futurology,
1,2022-09-15,Cheap Phone Gadgets For Every Age,u/Zestyclose_Spare_325,https://www.reddit.com/r/Futurology/comments/xevw39/cheap_phone_gadgets_for_every_age/,Futurology,https://gadgetroyal.com/
3485,2022-09-15,Scientists propose controversial plan to refreeze North and South Poles by spraying sulphur dioxide into atmosphere,u/WorldandSportsNews,https://www.reddit.com/r/Futurology/comments/xevwht/scientists_propose_controversial_plan_to_refreeze/,Futurology,https://news.sky.com/story/scientists-propose-controversial-plan-to-refreeze-north-and-south-poles-by-spraying-sulphur-dioxide-into-atmosphere-12697769
178,2022-09-15,Recruiter vs. computer: is AI really determining if you get hired?,u/berlinparisexpress,https://www.reddit.com/r/Futurology/comments/xewgyh/recruiter_vs_computer_is_ai_really_determining_if/,Futurology,https://www.welcometothejungle.com/en/articles/artificial-intelligence-in-recruitment
30,2022-09-15,Global ‘Stilling’: Is Climate Change Slowing Down the Wind?,u/Sariel007,https://www.reddit.com/r/Futurology/comments/xewlaz/global_stilling_is_climate_change_slowing_down/,Futurology,https://e360.yale.edu/features/global-stilling-is-climate-change-slowing-the-worlds-wind
1,2022-09-15,Stem Cell Clinic Puerto Vallarta MX,u/askadamlpc,https://www.reddit.com/r/Futurology/comments/xexwjj/stem_cell_clinic_puerto_vallarta_mx/,Futurology,[removed]
1124,2022-09-15,"SpaceX hits a milestone as Starlink arrives in Antarctica, high-speed internet now available on all seven continents | The Starlink dish can withstand extreme temperatures as low as -22 degrees Fahrenheit.",u/chrisdh79,https://www.reddit.com/r/Futurology/comments/xeygwy/spacex_hits_a_milestone_as_starlink_arrives_in/,Futurology,https://interestingengineering.com/innovation/starlink-arrives-antarctica-high-speed-internet
1,2022-09-15,What is DAO; How Does DAO Make Money?,u/Blockchaintechss,https://www.reddit.com/r/Futurology/comments/xez26r/what_is_dao_how_does_dao_make_money/,Futurology,https://blockchaintechs.io/what-is-dao-how-does-dao-make-money/
319,2022-09-15,Of God and Machines: The future of artificial intelligence is neither utopian nor dystopian—it’s something much more interesting.,u/filosoful,https://www.reddit.com/r/Futurology/comments/xf0tpf/of_god_and_machines_the_future_of_artificial/,Futurology,https://www.theatlantic.com/technology/archive/2022/09/artificial-intelligence-machine-learing-natural-language-processing/661401/
1,2022-09-15,Customer Acquisition and Retention: What's the Difference? - MAZAIA TECH-UNIQUE INFORMATION,u/[deleted],https://www.reddit.com/r/Futurology/comments/xf1kjr/customer_acquisition_and_retention_whats_the/,Futurology,https://dealxb2022.blogspot.com/2022/09/customer-acquisition-and-retention.html
0,2022-09-15,Available on Pancake swap,u/Ceaser2332,https://www.reddit.com/r/Futurology/comments/xf22ov/available_on_pancake_swap/,Futurology,[removed]
1,2022-09-15,Is Ford Serious,u/EVenthusiast00,https://www.reddit.com/r/Futurology/comments/xf32yn/is_ford_serious/,Futurology,[removed]
1,2022-09-15,Is Ford Serious?,u/EVenthusiast00,https://www.reddit.com/r/Futurology/comments/xf35r3/is_ford_serious/,Futurology,[removed]
0,2022-09-15,Convince me that EV is the solution.,u/my941,https://www.reddit.com/r/Futurology/comments/xf3afq/convince_me_that_ev_is_the_solution/,Futurology,"Convince me that electric vehicles are the solution.

Convince me that we will be able to consistently charge/power every electric vehicle when they need to be.

Convince me that lithium isn’t endgame, and that soon enough we will find a sustainable alternative - that it won’t become the new “oil”, a natural resource we overwhelmingly strip from the planet.

Convince me electric cars will be made to last, and the batteries too. Ford Model Ts are still driven around. I mean seriously, I see them all the time.

Convince me that we aren’t being tricked into thinking it’s the solution. I know, but don’t write it off just yet. After all, once we go electric, people will feel more of an urge to “upgrade” more often as the technology advances, similar to how many treat smartphones. Why not put the time and effort into developing a good compressed-air powered solution? We know they can work, albeit they do need more research.

Convince me that electric vehicles are the solution.
If this future is coming to us sooner than later, and seemingly forced upon, convince me this is the right way forward. 

I’m not an EV hater by any means, I too want a viable alternative to I.C, but I am very skeptical, and I am currently not convinced that EV is the proper thought-out solution."
735,2022-09-15,Wind energy hits record peak of 146 per cent of state demand in South Australia,u/ForHidingSquirrels,https://www.reddit.com/r/Futurology/comments/xf40en/wind_energy_hits_record_peak_of_146_per_cent_of/,Futurology,https://reneweconomy.com.au/wind-energy-hits-record-peak-of-146-per-cent-of-state-demand-in-south-australia/
1,2022-09-15,Hi I’m mike,u/Michaelrobbinson,https://www.reddit.com/r/Futurology/comments/xf4j0g/hi_im_mike/,Futurology,[removed]
54,2022-09-15,The Defense Innovation Unit’s ‘Private Money’ Approach Aims to Produce Reusable Hypersonic Test Aircraft Fast,u/WallStreetDoesntBet,https://www.reddit.com/r/Futurology/comments/xf55z6/the_defense_innovation_units_private_money/,Futurology,https://www.forbes.com/sites/erictegler/2022/09/15/the-defense-innovation-units-private-money-approach-aims-to-produce-reusable-hypersonic-test-aircraft-fast/
79454,2022-09-15,"Christianity in the U.S. is quickly shrinking and may no longer be the majority religion within just a few decades, research finds",u/mossadnik,https://www.reddit.com/r/Futurology/comments/xf7eyc/christianity_in_the_us_is_quickly_shrinking_and/,Futurology,https://www.cbsnews.com/news/christianity-us-shrinking-pew-research/
88,2022-09-15,XTURISMO hoverbike takes flight: 'What we've all dreamed of since we were little kids',u/stankmanly,https://www.reddit.com/r/Futurology/comments/xf8uj6/xturismo_hoverbike_takes_flight_what_weve_all/,Futurology,https://www.detroitnews.com/story/business/autos/2022/09/14/xturismo-hoverbike-what-weve-all-dreamed-of-detroit-auto-show/10376337002/
1,2022-09-15,Russia's Top-Secret Future Tech Powered Armor Immune to. 50 cal bullets,u/Warrior_Scientist,https://www.reddit.com/r/Futurology/comments/xf9teg/russias_topsecret_future_tech_powered_armor/,Futurology,https://www.youtube.com/watch?v=wDrgNXFl2H0
57,2022-09-15,Regenerative habitats for a community-type society,u/trvsgrant,https://www.reddit.com/r/Futurology/comments/xfannl/regenerative_habitats_for_a_communitytype_society/,Futurology,https://auravana.org/standards/hss-auracurve/
89,2022-09-15,TGV unveils high-speed trains of the future,u/isamson,https://www.reddit.com/r/Futurology/comments/xfaqxq/tgv_unveils_highspeed_trains_of_the_future/,Futurology,https://edition.cnn.com/travel/article/tgv-m-next-generation-high-speed-train-france/index.html
0,2022-09-15,"How to Sell, Auction, and Buy NFTs on Coinbase",u/tim_macgyver,https://www.reddit.com/r/Futurology/comments/xfbpoc/how_to_sell_auction_and_buy_nfts_on_coinbase/,Futurology,https://youtu.be/EHtrqlIEWmE
1,2022-09-15,Is microalgae the sustainable food of the future? https://algae.chat/7zj06w,u/algae_chat,https://www.reddit.com/r/Futurology/comments/xfdqky/is_microalgae_the_sustainable_food_of_the_future/,Futurology,https://firebasestorage.googleapis.com/v0/b/postly-548c1.appspot.com/o/4500e4b243fa77e20976e8f7f78d5e11eddcb3ab4d6b3757819bacd05fe92df6.png?alt=media&amp;token=bffdebe3-21dc-4e08-a495-261363cdc564
1607,2022-09-15,Scientists are using AI to dream up revolutionary new proteins. Huge advances in artificial intelligence mean researchers can design completely original molecules in seconds instead of months,u/Dr_Singularity,https://www.reddit.com/r/Futurology/comments/xfe4ok/scientists_are_using_ai_to_dream_up_revolutionary/,Futurology,https://www.nature.com/articles/d41586-022-02947-7
0,2022-09-15,YouTuber Clambers Inside Chernobyl's Nuclear Sarcophagus,u/sfsolarboy,https://www.reddit.com/r/Futurology/comments/xfekyq/youtuber_clambers_inside_chernobyls_nuclear/,Futurology,https://futurism.com/the-byte/youtuber-inside-chernobyl-nuclear-sarcophagus
134,2022-09-15,Assassination drones and bio weapons: the future of warfare?,u/Fluffy_Friends,https://www.reddit.com/r/Futurology/comments/xfgb06/assassination_drones_and_bio_weapons_the_future/,Futurology,https://www.aljazeera.com/program/the-bottom-line/2022/9/15/assassination-drones-and-bioweapons-the-future-of-warfare
0,2022-09-16,Humanity must return to Agrarianism,u/ilikestartups,https://www.reddit.com/r/Futurology/comments/xfi04s/humanity_must_return_to_agrarianism/,Futurology,"Modern technology is not sustainable. 

As recent events in Russia show, shutting down even a single oil pipeline can devastate economies from thousands of miles away, soaring inflation, and even cause economic recession.

The fact is that we have too many computer chips making complex decisions, they're buying and selling commodities, they're manipulating the price of stocks, they're replacing jobs in the factories and they're swindling the average Joe out of making a living.

I don't know about you, but I for one, don't want to receive a computer from Elon Musk and implant it into my brain so he can gain control of my mind.

I don't want to live in a pod and receive my news media through an algorithm instead of from a fellow human being.

And I don't want all of these noxious chemicals spewing forth from distasteful factories, poisoning our children and our dogs, making them become transgendered, misgendered, cisgendered, and so forth.

The fact is that flame, is not the only thing that 'flame retardants' 'retard'. Read that again. Read that frontwards and backwards for me. Until it sinks in.

That's why we need to give the land back to the people and return to a more natural and holistic way of life."
1,2022-09-16,5 Ways to Bring Digital Evolution with Agile &amp; DevOps,u/[deleted],https://www.reddit.com/r/Futurology/comments/xfjfdf/5_ways_to_bring_digital_evolution_with_agile/,Futurology,
1,2022-09-16,How To Secure Your NFT Digital Asset Safe?,u/Blockchaintechss,https://www.reddit.com/r/Futurology/comments/xfjpzb/how_to_secure_your_nft_digital_asset_safe/,Futurology,https://blockchaintechs.io/how-to-secure-your-nft-digital-asset-safe/
1,2022-09-16,sssssssssssssssssssssssssssssssssssssssssssss,u/gefiwat853,https://www.reddit.com/r/Futurology/comments/xfkgvn/sssssssssssssssssssssssssssssssssssssssssssss/,Futurology,https://www.youtube.com/watch?v=jdh1-xXQFNE&amp;list=PLc_cDVa-WktBDJN5ezxvfiZF0CIod8FNZ
1,2022-09-16,"What are the most visceral climate scenarios (or those which are already here), which could jar people to demand immediate emergency action?",u/[deleted],https://www.reddit.com/r/Futurology/comments/xfngjk/what_are_the_most_visceral_climate_scenarios_or/,Futurology,[removed]
1,2022-09-16,"What are the most visceral climate scenarios (or those which are already here), which could jar people to demand immediate emergency action?",u/[deleted],https://www.reddit.com/r/Futurology/comments/xfnz38/what_are_the_most_visceral_climate_scenarios_or/,Futurology,[removed]
14,2022-09-16,"What are the most visceral climate scenarios (or those which are already here), which could jar people to demand immediate emergency action?",u/letourpowerscombine,https://www.reddit.com/r/Futurology/comments/xfo099/what_are_the_most_visceral_climate_scenarios_or/,Futurology,"For example:

* The breaking of the Doomsday glacier, causing immediate sea level rise and genocide for island and coastal cultures around the world.
* Proliferation of fungal infections, which we have few remedies for. Also, proliferation of fungal infections among plants and wildlife, which disrupt/threaten food webs and many species' abilities to survive.
* The collapse of the Mediterranean sea ecosystem due to ocean trawling and hotter conditions —&gt; *dead fish floating to shore, waters and beaches becoming toxic/unsafe to swim in for humans?*
* The inescapability of PFAS, which is now found in rain samples all around the world.
* Increasing intensity of storms and extreme weather events, unlike what we've seen before. Hail storms that penetrate house walls. Lightning storms that fry all the electrical appliances and systems in your house.
* The inter-relation of heat, violence, social collapse, rape, domination by force, collapse of human rights norms and collapse of political systems
* Mass migration, combined with a lack of reception policies, leading to social tensions, poverty, and mass injustices

This question comes as OP explores narratives/stories (e.g. short films, songs, imagery) which could impart these impending experiences to people — to inform people of what's happening all around us (as the media is silent), and jar people to demand immediate + urgent emergency action. *If you're interested in collaborating on stories/narratives about these scenarios, mention it in a reply or send a DM — looking for collaborators!*

Scenarios can be any scale/scope — global (sea level rise), regional (droughts across Somalia), local (the consequences of a dried up lake/river in a place), and tragedies / scenarios that affect species and cultures at an even more local level (e.g. Walruses falling off cliffs en masse [due to lack of sea ice](https://thehill.com/opinion/energy-environment/439241-walruses-are-jumping-off-cliffs-to-their-deaths-yes-because-of/))"
15,2022-09-16,Radical Dacia Manifesto concept hints at future production car features,u/muhimalife,https://www.reddit.com/r/Futurology/comments/xfo3kp/radical_dacia_manifesto_concept_hints_at_future/,Futurology,https://www.autoexpress.co.uk/dacia/358811/radical-dacia-manifesto-concept-hints-future-production-car-features
1,2022-09-16,"US House of Representatives Committee of Science holds hearing on 'fountain of youth' geroscience therapies to improve healthspan, by treating common diseases like Alzheimer's or stroke by targeting aging biology",u/[deleted],https://www.reddit.com/r/Futurology/comments/xfpxqi/us_house_of_representatives_committee_of_science/,Futurology,
1,2022-09-16,"US House of Representatives Committee of Science holds hearing on 'fountain of youth' geroscience therapies to improve healthspan, targeting aging biology to treat common diseases like Alzheimer's or stroke",u/[deleted],https://www.reddit.com/r/Futurology/comments/xfpz2u/us_house_of_representatives_committee_of_science/,Futurology,
1,2022-09-16,"How The New US Climate Law Can Empower Individuals To Fight Climate Change And Save You Thousands Of Dollars In The Process. Rebates and tax credits can lower the cost of solar panels, energy-efficient appliances and electric vehicles.",u/[deleted],https://www.reddit.com/r/Futurology/comments/xfpzlv/how_the_new_us_climate_law_can_empower/,Futurology,
0,2022-09-16,"How the New US Climate Law Can Empower Individuals To Fight Climate Change And Save You Thousands of Dollars In The Process. Rebates and tax credits can lower the cost of solar panels, energy-efficient appliances and electric vehicles.",u/[deleted],https://www.reddit.com/r/Futurology/comments/xfq2v0/how_the_new_us_climate_law_can_empower/,Futurology,
1,2022-09-16,"US Government Committee of Science holds hearing on 'fountain of youth' geroscience therapies to improve healthspan, targeting aging biology to treat common diseases like Alzheimer's or stroke",u/[deleted],https://www.reddit.com/r/Futurology/comments/xfq8vf/us_government_committee_of_science_holds_hearing/,Futurology,
1,2022-09-16,US Government Committee of Science holds hearing on anti-aging therapies as a way to improve healthspan - by targeting aging biology to treat common diseases like Alzheimer's or stroke,u/[deleted],https://www.reddit.com/r/Futurology/comments/xfqbd7/us_government_committee_of_science_holds_hearing/,Futurology,
1499,2022-09-16,Solar Panels Floating in Space Could One Day Power Your Home,u/TinyTornado7,https://www.reddit.com/r/Futurology/comments/xfqbxg/solar_panels_floating_in_space_could_one_day/,Futurology,https://www.bloomberg.com/news/articles/2022-09-16/solar-panels-floating-in-space-could-one-day-power-your-home
1,2022-09-16,US Government Committee of Science holds hearing on anti-aging therapies as a way to improve healthspan - by targeting aging biology to treat common diseases like Alzheimer's or stroke,u/[deleted],https://www.reddit.com/r/Futurology/comments/xfqiwt/us_government_committee_of_science_holds_hearing/,Futurology,
381,2022-09-16,US Government Committee of Science holds hearing on 'fountain of youth' geroscience therapies as a way to improve healthspan - by targeting aging biology to treat common diseases like Alzheimer's or stroke,u/StoicOptom,https://www.reddit.com/r/Futurology/comments/xfqkgb/us_government_committee_of_science_holds_hearing/,Futurology,https://www.wpbstv.org/watch-live-house-committee-holds-hearing-on-anti-aging-therapies/
2,2022-09-16,[CALL FOR HACK ORGANISERS],u/teensinai,https://www.reddit.com/r/Futurology/comments/xfrbl6/call_for_hack_organisers/,Futurology,[removed]
1,2022-09-16,DATAMETREX LAUNCHES SMART FACTORY PLATFORM in the US,u/investormyles,https://www.reddit.com/r/Futurology/comments/xfrj4x/datametrex_launches_smart_factory_platform_in_the/,Futurology,https://www.datametrex.com/post/datametrex-launches-smart-factory-platform
1,2022-09-16,Christianism declining? Thank God!,u/Stock_Cryptographer3,https://www.reddit.com/r/Futurology/comments/xfrtr4/christianism_declining_thank_god/,Futurology,[removed]
0,2022-09-16,Fetal dna cataloged for future crimes?,u/liketheavocado,https://www.reddit.com/r/Futurology/comments/xfrwu7/fetal_dna_cataloged_for_future_crimes/,Futurology,[removed]
16351,2022-09-16,"World’s largest carbon removal facility could suck up 5 million metric tonnes of CO2 yearly | The U.S.-based facility hopes to capture CO2, roughly the equivalent of 5 million return flights between London and New York annually.",u/chrisdh79,https://www.reddit.com/r/Futurology/comments/xfs9hd/worlds_largest_carbon_removal_facility_could_suck/,Futurology,https://interestingengineering.com/innovation/worlds-largest-carbon-removal-facility
1,2022-09-16,"Open-source commercial-scale composter turns food waste into fertilizer, sequestering greenhouse gases and reducing landfill.",u/[deleted],https://www.reddit.com/r/Futurology/comments/xfsbib/opensource_commercialscale_composter_turns_food/,Futurology,
1,2022-09-16,A Google Software Engineer Believes the Company’s AI has Come to Life,u/[deleted],https://www.reddit.com/r/Futurology/comments/xfskze/a_google_software_engineer_believes_the_companys/,Futurology,
1,2022-09-16,5 Internet Marketing Services That Will Help Increase Your Business Exposure - MAZAIA TECH-UNIQUE INFORMATION,u/[deleted],https://www.reddit.com/r/Futurology/comments/xftyv4/5_internet_marketing_services_that_will_help/,Futurology,https://dealxb2022.blogspot.com/2022/07/Internet-Marketing-Services.html
60,2022-09-16,Designing new proteins in seconds instead of months via AI.,u/[deleted],https://www.reddit.com/r/Futurology/comments/xfu5wn/designing_new_proteins_in_seconds_instead_of/,Futurology,
22,2022-09-16,AI Is a Celebrity Technology,u/AlbertoRomGar,https://www.reddit.com/r/Futurology/comments/xfw8uz/ai_is_a_celebrity_technology/,Futurology,https://thealgorithmicbridge.substack.com/p/ai-is-a-celebrity-technology
1022,2022-09-16,Scientists hail autoimmune disease therapy breakthrough,u/PizzaTucker,https://www.reddit.com/r/Futurology/comments/xfwte3/scientists_hail_autoimmune_disease_therapy/,Futurology,https://www.theguardian.com/science/2022/sep/15/scientists-hail-autoimmune-disease-therapy-breakthrough-car-t-cell-lupus?CMP=oth_b-aplnews_d-1
1,2022-09-16,IS Ford Nuts,u/EVenthusiast00,https://www.reddit.com/r/Futurology/comments/xfyfa0/is_ford_nuts/,Futurology,[removed]
2942,2022-09-16,This Japanese start-up has designed a high-speed motorcycle that can fly for 40 minutes,u/mancinedinburgh,https://www.reddit.com/r/Futurology/comments/xfz8iz/this_japanese_startup_has_designed_a_highspeed/,Futurology,https://www.euronews.com/next/2022/09/16/this-japanese-start-up-has-designed-a-high-speed-motorcycle-that-can-fly-for-40-minutes
97,2022-09-16,This is how the UN's worst scenario was normalized and distorted our view of global warming,u/SumDumScientist,https://www.reddit.com/r/Futurology/comments/xfz90r/this_is_how_the_uns_worst_scenario_was_normalized/,Futurology,https://www.warpnews.org/premium-content/this-is-how-the-uns-woirst-case-scenario-was-normalized-and-distored-our-view-of-global-warming/
1,2022-09-16,Future of religion?,u/EntertainmentAny4509,https://www.reddit.com/r/Futurology/comments/xfzjwk/future_of_religion/,Futurology,[removed]
0,2022-09-16,The all-electric SUV Chevy Equinox EV will be introduced as a sportier on 2024,u/[deleted],https://www.reddit.com/r/Futurology/comments/xg0gz9/the_allelectric_suv_chevy_equinox_ev_will_be/,Futurology,
354,2022-09-16,The Benjamin Button Effect: Scientists Unlock The Key To Reversing Aging,u/WallStreetDoesntBet,https://www.reddit.com/r/Futurology/comments/xg18mt/the_benjamin_button_effect_scientists_unlock_the/,Futurology,https://worldcrunch.com/tech-science/cellular-reprogramming-reverse-aging
1,2022-09-16,What A Trip: Delix Therapeutics is Treating Mental Health at Scale with Psychoplastogens,u/jonathan-d-grinstein,https://www.reddit.com/r/Futurology/comments/xg193i/what_a_trip_delix_therapeutics_is_treating_mental/,Futurology,[removed]
1,2022-09-16,Mars Perseverance Rover Finds Organic Matter in Rock,u/[deleted],https://www.reddit.com/r/Futurology/comments/xg2ddt/mars_perseverance_rover_finds_organic_matter_in/,Futurology,
1,2022-09-16,Why do you come to this sub ?,u/[deleted],https://www.reddit.com/r/Futurology/comments/xg2jx3/why_do_you_come_to_this_sub/,Futurology,[removed]
1,2022-09-16,The B2B SaaS Sales Funnel - What it is and how to optimize it - MAZAIA TECH-UNIQUE INFORMATION,u/[deleted],https://www.reddit.com/r/Futurology/comments/xg2z52/the_b2b_saas_sales_funnel_what_it_is_and_how_to/,Futurology,https://dealxb2022.blogspot.com/2022/09/b2b-saas-sales-funnel.html
3,2022-09-16,China Seeks Bids to Build Nine CSP Plants - SolarPACES,u/Baselines_shift,https://www.reddit.com/r/Futurology/comments/xg55fh/china_seeks_bids_to_build_nine_csp_plants/,Futurology,https://www.solarpaces.org/?p=15203&amp;preview=true
2,2022-09-16,New paper by Google and Oxford scientists claims AI will soon destroy mankind,u/WallStreetDoesntBet,https://www.reddit.com/r/Futurology/comments/xg6zzo/new_paper_by_google_and_oxford_scientists_claims/,Futurology,https://bgr.com/science/new-paper-by-google-and-oxford-scientists-claims-ai-will-soon-destroy-mankind/
317,2022-09-16,Warp drives: Physicists give chances of faster-than-light space travel a boost,u/genericdude999,https://www.reddit.com/r/Futurology/comments/xg84s0/warp_drives_physicists_give_chances_of/,Futurology,https://www.space.com/physicists-give-warp-drives-a-boost
