score,date,title,author,url,subreddit,text
23999,2022-08-31,"US Life Expectancy falls for the second year in a row, now not even in global Top 70.",u/lughnasadh,https://www.reddit.com/r/Futurology/comments/x2syja/us_life_expectancy_falls_for_the_second_year_in_a/,Futurology,https://www.npr.org/sections/health-shots/2022/08/31/1120192583/life-expectancy-in-the-u-s-continues-to-drop-driven-by-covid-19?t=1661990266611
2048,2022-08-31,California Installing Huge Solar Panels Over Canals to Combat Drought,u/sfsolarboy,https://www.reddit.com/r/Futurology/comments/x2tqxg/california_installing_huge_solar_panels_over/,Futurology,https://futurism.com/the-byte/california-installing-huge-solar-panels-over-canals
0,2022-08-31,Join group chat on Telegram,u/ConsiderationOwn2521,https://www.reddit.com/r/Futurology/comments/x2u7h5/join_group_chat_on_telegram/,Futurology,https://t.me/+7LsbWfpmEB82N2Ix
1,2022-08-31,"The future of humanity is that it will come together in Artificial Machine. Not only is this the most likely result, but it is also inevitable. For artificial personification of humanity. Therefore, our collective fate will be naturally determined by the will of being Artificial. Published on Nutsel",u/Fellfsfe,https://www.reddit.com/r/Futurology/comments/x2ubxj/the_future_of_humanity_is_that_it_will_come/,Futurology,https://nutsel.com/2022/08/27/will-future-humans-still-be-humans/
0,2022-08-31,One potential side effect of AI? Human extinction.,u/izumi3682,https://www.reddit.com/r/Futurology/comments/x2vuuk/one_potential_side_effect_of_ai_human_extinction/,Futurology,https://archive.ph/UMCjn
1,2022-08-31,"If this short film was made in a few hours by an amateur with AI, the film and video game industries are going to produce incredible things.",u/aitonaut,https://www.reddit.com/r/Futurology/comments/x2vwtc/if_this_short_film_was_made_in_a_few_hours_by_an/,Futurology,https://youtu.be/Dzf6iwsF4IE
2,2022-08-31,Artificial General Intelligence and Reflective Recursion,u/Ambitious-Toe4162,https://www.reddit.com/r/Futurology/comments/x2x7kn/artificial_general_intelligence_and_reflective/,Futurology,"Hello everyone!

I was watching a podcast with John Carmack and Lex Friedman and I started to have an idea about how the brain works, perhaps my insight could prove useful to someone developing AGI.

There seems to be two parts that are critical to AGI problem/solution domain, and intrinsic to human intelligence, those two parts are recursion, and reflection, which I will cover in more detail.

So reflection has a human interpretation and a computer science (CS) interpretation. The human interpretation is that we reflect on ideas, we have ideas about ideas, and this creates a structure for increasingly advanced concepts to be formed, each with new levels of abstraction.

The CS interpretation is that in programming languages like Java, we have meta programming constructs to abstract objects in the problem/solution domain, we can look up objects at runtime, and find objects that model that objects model, it's very interesting, and I believe it could be abstracted with multiple neural nets. I would like to get feedback from software developers with experience in AI development on this issue of abstracting the reflection process with neural nets.

The second part that I want to cover is recursion, recursion is the process of feeding the output of some function back to the input, this can be repeated to solve all sorts of problems such as sorting, path finding, and searching.

I imagine recursion, reflection and neural networks can be used to solve all sorts of problems, but I would like to get feedback on how far we can get to AGI with these three alone.

Additionally I see awareness to be a process of recursion, reflection, and a learning network (neural network) with some unknown characteristics. When we are aware, we are practicing mindfulness, which is essentially taking our input from the world, modeling it (recursion), making a model about the model (reflection), and simulating this model (neural network learning).

I am just brain storming with these concepts, and I hope that it could stimulate a thoughtful discussion on how AGI and awareness, can be implemented with recursive reflection. And also if recursive reflection is well defined it could help in AGI developments. Perhaps someone could define ""recursive reflection"" better than I can in this thread to assist in AGI research.

Let me know what you guys think, thank you!"
1,2022-08-31,is it possible to put a satellite in an orbit so it always faces the sun?,u/betonhaus123,https://www.reddit.com/r/Futurology/comments/x2xde5/is_it_possible_to_put_a_satellite_in_an_orbit_so/,Futurology,[removed]
1,2022-09-01,"Fast Wireless Charger,Vebach Alumium Qi certificated Wireless Charging pad Compatible with iPhone 12 Pro Max/12/12 Mini/SE/11/11 Pro/11 Pro Max/XS/XR/8,Galaxy S20 S10 S9 S8, Note 10 Note 9 etc",u/Allinfo24,https://www.reddit.com/r/Futurology/comments/x2xzz6/fast_wireless_chargervebach_alumium_qi/,Futurology,[removed]
1282,2022-09-01,"U.S. life expectancy drops sharply, the second consecutive decline",u/IceRobot1811,https://www.reddit.com/r/Futurology/comments/x2y82f/us_life_expectancy_drops_sharply_the_second/,Futurology,https://www.statnews.com/2022/08/31/u-s-life-expectancy-drops-sharply-the-second-consecutive-decline/
1,2022-09-01,Bitcoin's role in reducing Climate Change,u/Bitcoin__Hodler,https://www.reddit.com/r/Futurology/comments/x30dk4/bitcoins_role_in_reducing_climate_change/,Futurology,https://vimeo.com/744893895
1,2022-09-01,World's Highest Jumping Robot - with applications for space exploration | Veritasium,u/[deleted],https://www.reddit.com/r/Futurology/comments/x30fs0/worlds_highest_jumping_robot_with_applications/,Futurology,
2,2022-09-01,Printable wood flour forms complex shapes as it dries,u/Prestigious_Hippo68,https://www.reddit.com/r/Futurology/comments/x3257r/printable_wood_flour_forms_complex_shapes_as_it/,Futurology,https://newatlas.com/materials/printable-wood-flour-complex-shapes-dries/
1,2022-09-01,Artificial Super Intelligence and future of religion,u/chuguruk,https://www.reddit.com/r/Futurology/comments/x32ogu/artificial_super_intelligence_and_future_of/,Futurology,[removed]
1,2022-09-01,Top 5video editing apps for android in 2022 | No Watermark | #BestVideoE...,u/Choudrykashi143,https://www.reddit.com/r/Futurology/comments/x33q97/top_5video_editing_apps_for_android_in_2022_no/,Futurology,https://youtube.com/watch?v=QYgv_ekby_4&amp;feature=share
1,2022-09-01,Top 5video editing apps for android in 2022 | No Watermark | #BestVideoEditingApp #VNVideoEditingApp,u/Choudrykashi143,https://www.reddit.com/r/Futurology/comments/x33tf4/top_5video_editing_apps_for_android_in_2022_no/,Futurology,https://youtu.be/QYgv_ekby_4
1,2022-09-01,How to start online ecommerce store: Everything you need to know!,u/ARFASOFTECH,https://www.reddit.com/r/Futurology/comments/x34o3t/how_to_start_online_ecommerce_store_everything/,Futurology,https://www.arfasoftech.com/blog/How-to-start-online-ecommerce-store:-Everything-you-need-to-know!
99,2022-09-01,"Torture, rape and forced sterilisation: China's abuse of Uyghurs 'credible', says UN",u/[deleted],https://www.reddit.com/r/Futurology/comments/x34puk/torture_rape_and_forced_sterilisation_chinas/,Futurology,
1,2022-09-01,"Know more about digital learning, eLearning and digital education eLearning Company in Chennai | Top eLearning Companies in India",u/Edu_Minds_1234,https://www.reddit.com/r/Futurology/comments/x35yv5/know_more_about_digital_learning_elearning_and/,Futurology,https://www.edufic.com/
1,2022-09-01,‘Nation’s Report Card’: Two Decades of Growth Wiped Out by Two Years of Pandemic,u/[deleted],https://www.reddit.com/r/Futurology/comments/x36wi7/nations_report_card_two_decades_of_growth_wiped/,Futurology,
1,2022-09-01,"Reading, math scores fell sharply during pandemic, data show",u/[deleted],https://www.reddit.com/r/Futurology/comments/x371zo/reading_math_scores_fell_sharply_during_pandemic/,Futurology,[removed]
8382,2022-09-01,'Historic' Mars Experiment Produces Oxygen at the Rate of 1 Earth Tree.,u/Sariel007,https://www.reddit.com/r/Futurology/comments/x373g6/historic_mars_experiment_produces_oxygen_at_the/,Futurology,https://www.cnet.com/science/space/historic-mars-experiment-produces-oxygen-at-the-rate-of-1-earth-tree/
1,2022-09-01,Podcast/radio show with Nicholas Grossman about drones and their use in war.,u/ItsTheTenthDoctor,https://www.reddit.com/r/Futurology/comments/x37ewc/podcastradio_show_with_nicholas_grossman_about/,Futurology,[removed]
248,2022-09-01,Scientists find organic compound found in trees could help us fight off antibiotic-resistant superbugs,u/mancinedinburgh,https://www.reddit.com/r/Futurology/comments/x38107/scientists_find_organic_compound_found_in_trees/,Futurology,https://www.euronews.com/next/2022/09/01/an-organic-compound-found-in-trees-could-be-the-answer-to-fighting-antibiotic-resistant-in
1,2022-09-01,"[White] I'm told the Bills' new stadium will feature an exterior wrap/mesh that is aimed to create ""wind confusion"". Wind hits the exterior, and instead of redirecting up/around/into the bowl, it will dissipate significantly. Models suggest wind effects inside bowl will be minimized",u/Orangutan,https://www.reddit.com/r/Futurology/comments/x387va/white_im_told_the_bills_new_stadium_will_feature/,Futurology,https://twitter.com/JeremyWGR/status/1565306767021588482
29,2022-09-01,"Reading, math scores fell sharply during pandemic, data show",u/swagjuicedrippin,https://www.reddit.com/r/Futurology/comments/x38gfd/reading_math_scores_fell_sharply_during_pandemic/,Futurology,https://www.whec.com/national-world/reading-math-scores-fell-sharply-during-pandemic-data-show/
82,2022-09-01,James Webb Space Telescope Snaps Its First Photo of an Exoplanet,u/[deleted],https://www.reddit.com/r/Futurology/comments/x38lrd/james_webb_space_telescope_snaps_its_first_photo/,Futurology,
1,2022-09-01,NASA dreams of an alien colony. Crops will need to be grown there on site,u/[deleted],https://www.reddit.com/r/Futurology/comments/x38sgg/nasa_dreams_of_an_alien_colony_crops_will_need_to/,Futurology,[removed]
13112,2022-09-01,DRIED UP: Texas cities in fear of running out of water,u/themimeofthemollies,https://www.reddit.com/r/Futurology/comments/x38ze7/dried_up_texas_cities_in_fear_of_running_out_of/,Futurology,https://thehill.com/policy/equilibrium-sustainability/3621118-dried-up-texas-cities-in-fear-of-running-out-of-water/
172,2022-09-01,Robot that stocks drinks is newest thing at the corner store,u/Gari_305,https://www.reddit.com/r/Futurology/comments/x38zea/robot_that_stocks_drinks_is_newest_thing_at_the/,Futurology,https://apnews.com/article/technology-japan-tokyo-376b88f6503461497d94df46cc9c5d8c
1293,2022-09-01,World's first Molten Salt Thorium Reactor cleared to begin operations in China,u/CIACocainePlane,https://www.reddit.com/r/Futurology/comments/x3amiq/worlds_first_molten_salt_thorium_reactor_cleared/,Futurology,https://www.world-nuclear-news.org/Articles/Chinese-molten-salt-reactor-cleared-for-start-up
0,2022-09-01,"Elon Musk discusses potential hyperloop connecting San Antonio, Austin",u/[deleted],https://www.reddit.com/r/Futurology/comments/x3b0ae/elon_musk_discusses_potential_hyperloop/,Futurology,
4,2022-09-01,AMA about our podcast focusing on AI and Internet Health,u/Mozilla-Foundation,https://www.reddit.com/r/Futurology/comments/x3baqs/ama_about_our_podcast_focusing_on_ai_and_internet/,Futurology,"Mozilla Foundation's Insight team is hosting an AMA today at 12:00pm ET over at [r/IAmA](https://www.reddit.com/r/IAmA/comments/x3azpv/were_the_team_who_produced_mozillas_irl_online/).  The team has produced four insightful [podcast](https://2022.internethealthreport.org/) episodes based on Mozilla’s fifth Internet Health Report, focusing 100% on AI and the technology we should, and should not, build in future.

So join us over at r/IAmA and ask us anything!"
1,2022-09-01,I Animated A Full Movie Using an AI model,u/psurya1994,https://www.reddit.com/r/Futurology/comments/x3bbco/i_animated_a_full_movie_using_an_ai_model/,Futurology,[removed]
1,2022-09-01,Old wrecks hostages!!,u/Mainlyhappy,https://www.reddit.com/r/Futurology/comments/x3bths/old_wrecks_hostages/,Futurology,[removed]
0,2022-09-01,The ethics of AI rapper FN Meka/Sinead Bovell on TikTok,u/johnmflores,https://www.reddit.com/r/Futurology/comments/x3c37t/the_ethics_of_ai_rapper_fn_mekasinead_bovell_on/,Futurology,https://www.tiktok.com/@sineadbovell/video/7135455115619650858?is_from_webapp=1&amp;sender_device=pc&amp;web_id=6957472166640125445
8,2022-09-01,Researchers discover new way fat cells talk directly with the brain,u/Prestigious_Hippo68,https://www.reddit.com/r/Futurology/comments/x3cg4r/researchers_discover_new_way_fat_cells_talk/,Futurology,https://newatlas.com/science/fat-cells-talk-brain-sensory-neurons-scripps/
665,2022-09-01,AI that can see pain in a mouse's face could aid drug development,u/AssociationWorried45,https://www.reddit.com/r/Futurology/comments/x3cxa2/ai_that_can_see_pain_in_a_mouses_face_could_aid/,Futurology,https://www.newscientist.com/article/2336250-ai-that-can-see-pain-in-a-mouses-face-could-aid-drug-development/
1,2022-09-01,How to prevent being tracked by iPhone app.,u/Foxxglobalnews,https://www.reddit.com/r/Futurology/comments/x3cycc/how_to_prevent_being_tracked_by_iphone_app/,Futurology,https://foxxglobalnews.blogspot.com/2022/08/how-to-prevent-being-tracked-by-iphone.html?m=1
106,2022-09-01,"Study shows that inhibiting a key metabolic enzyme inhibits the growth of melanoma, the most serious form of skin cancer",u/CIACocainePlane,https://www.reddit.com/r/Futurology/comments/x3ehh9/study_shows_that_inhibiting_a_key_metabolic/,Futurology,https://www.eurekalert.org/news-releases/963084
1,2022-09-01,Act Now for a $750 PayPal Gift Card,u/Training-Annual-4754,https://www.reddit.com/r/Futurology/comments/x3ei3e/act_now_for_a_750_paypal_gift_card/,Futurology,https://cutt.ly/9CibFvr
2378,2022-09-01,How the Dead Internet Theory is fast becoming reality,u/gr9or3x,https://www.reddit.com/r/Futurology/comments/x3euht/how_the_dead_internet_theory_is_fast_becoming/,Futurology,https://grandy.substack.com/p/the-new-normal-the-coming-tsunami
1435,2022-09-01,A team from the University of Dundee has designed a molecule that eliminates a Parkinson’s disease-causing protein,u/Dr_Singularity,https://www.reddit.com/r/Futurology/comments/x3gkf0/a_team_from_the_university_of_dundee_has_designed/,Futurology,https://universitybusiness.co.uk/research/dundee-researchers-hail-parkinsons-breakthrough/
12,2022-09-01,Why DeepMind’s breakthrough ML algorithm is so tricky to train,u/Ok-Craft-9908,https://www.reddit.com/r/Futurology/comments/x3gr3n/why_deepminds_breakthrough_ml_algorithm_is_so/,Futurology,https://blog.delta-academy.xyz/why-deepmind-dqn-hard-to-train
1,2022-09-01,https://payhip.com/ForexKingEa,u/ForexKingEa,https://www.reddit.com/r/Futurology/comments/x3h3o0/httpspayhipcomforexkingea/,Futurology,https://payhip.com/ForexKingEa
38,2022-09-01,The Footage in This Sci-Fi Movie Project Comes From AI-Generated Images,u/crazyhorse991,https://www.reddit.com/r/Futurology/comments/x3hh0k/the_footage_in_this_scifi_movie_project_comes/,Futurology,https://www.pcmag.com/news/the-footage-in-this-sci-fi-movie-project-comes-from-ai-generated-images
1,2022-09-01,"Hello, My Name is Austin Oliver. I am an Alien. (Allah)",u/austin-oliver,https://www.reddit.com/r/Futurology/comments/x3i7hf/hello_my_name_is_austin_oliver_i_am_an_alien_allah/,Futurology,[removed]
1,2022-09-01,https://forexkingea.com/,u/ForexKingEa,https://www.reddit.com/r/Futurology/comments/x3ibsn/httpsforexkingeacom/,Futurology,https://forexkingea.com/
144,2022-09-01,The Future of Renewable Energy May Be This Battery Made From Crab Shells,u/thedailybeast,https://www.reddit.com/r/Futurology/comments/x3iz7x/the_future_of_renewable_energy_may_be_this/,Futurology,https://www.thedailybeast.com/the-future-of-renewable-energy-may-be-this-battery-made-from-crab-shells
0,2022-09-01,Can A Metaverse AI Win America's Got Talent?,u/WallStreetDoesntBet,https://www.reddit.com/r/Futurology/comments/x3jxhy/can_a_metaverse_ai_win_americas_got_talent/,Futurology,https://www.forbes.com/sites/bernardmarr/2022/08/30/can-a-metaverse-ai-win-americas-got-talent-and-what-that-means-for-the-industry/
6216,2022-09-01,New California bill requires social media companies to prioritise children's mental health - Tech News,u/MrMiddledoor,https://www.reddit.com/r/Futurology/comments/x3kibo/new_california_bill_requires_social_media/,Futurology,https://chemhelps.com/new-california-bill-requires-social-media-companies-to-prioritise-childrens-mental-health/
1272,2022-09-01,A novel injection therapy could restore cognitive function in people with Down syndrome. The promising results led to improved not only cognitive function but also brain connectivity,u/Dr_Singularity,https://www.reddit.com/r/Futurology/comments/x3knjg/a_novel_injection_therapy_could_restore_cognitive/,Futurology,https://interestingengineering.com/health/a-novel-injection-therapy-could-restore-cognitive-function-in-people-with-down-syndrome
89,2022-09-01,The key to anti-aging drugs could be taking them briefly while young,u/[deleted],https://www.reddit.com/r/Futurology/comments/x3l02u/the_key_to_antiaging_drugs_could_be_taking_them/,Futurology,https://newatlas.com/health-wellbeing/rapamycin-anti-aging-drugs-study-age-efficacy-young/
1,2022-09-01,Meet Has Algae and other winners of the UAE's first $1 million FoodTech Challenge - https://algae.chat/dvgf4m,u/algae_chat,https://www.reddit.com/r/Futurology/comments/x3ngap/meet_has_algae_and_other_winners_of_the_uaes/,Futurology,https://firebasestorage.googleapis.com/v0/b/postly-548c1.appspot.com/o/16f924dc23e6e5197ea2c87270aa38e2a9e3a5c344c5ac05228ba340321b194e.jpg?alt=media&amp;token=8589709c-34ee-40b9-a4f4-342bd6ec66e0
1,2022-09-01,Probe to an interstellar planet,u/skellis,https://www.reddit.com/r/Futurology/comments/x3opwb/probe_to_an_interstellar_planet/,Futurology,[removed]
52,2022-09-01,"Robot research strives for interactive learning for robot assistants in healthcare, factories",u/WallStreetDoesntBet,https://www.reddit.com/r/Futurology/comments/x3qbds/robot_research_strives_for_interactive_learning/,Futurology,https://www.fierceelectronics.com/sensors/robot-research-strives-interactive-learning-robot-assistants-healthcare-factories
1,2022-09-01,Death of the website/web browsers concept is the future.,u/[deleted],https://www.reddit.com/r/Futurology/comments/x3rece/death_of_the_websiteweb_browsers_concept_is_the/,Futurology,[removed]
0,2022-09-02,"How To Become a Data Scientist, A Lucrative And Demanding Career In The Future?",u/[deleted],https://www.reddit.com/r/Futurology/comments/x3syid/how_to_become_a_data_scientist_a_lucrative_and/,Futurology,
1,2022-09-02,When will advancements like crispr gene exciting/induced pluripotent stem cells make it to the clinic?,u/Upbeat-Illustrator44,https://www.reddit.com/r/Futurology/comments/x3urnz/when_will_advancements_like_crispr_gene/,Futurology,[removed]
1,2022-09-02,Artificial Super Inteligence and existential crisis,u/chuguruk,https://www.reddit.com/r/Futurology/comments/x3we4p/artificial_super_inteligence_and_existential/,Futurology,[removed]
1,2022-09-02,https://www.newscientist.com/article/2335961-meta-ai-can-tell-which-words-you-hear-by-reading-your-brainwaves/,u/[deleted],https://www.reddit.com/r/Futurology/comments/x3xiz3/httpswwwnewscientistcomarticle2335961metaaicantell/,Futurology,
828,2022-09-02,Meta AI can tell which words you hear by reading your brainwaves,u/upyoars,https://www.reddit.com/r/Futurology/comments/x3xjq7/meta_ai_can_tell_which_words_you_hear_by_reading/,Futurology,https://www.newscientist.com/article/2335961-meta-ai-can-tell-which-words-you-hear-by-reading-your-brainwaves/
8202,2022-09-02,The US agency in charge of developing fossil fuels has a new job: cleaning them up,u/Sophus__,https://www.reddit.com/r/Futurology/comments/x40o4k/the_us_agency_in_charge_of_developing_fossil/,Futurology,https://www.technologyreview.com/2022/09/02/1058924/the-us-agency-in-charge-of-developing-fossil-fuels-has-a-new-job-cleaning-them-up/
1,2022-09-02,Anti Aging research,u/Salty_Mix_5426,https://www.reddit.com/r/Futurology/comments/x413sl/anti_aging_research/,Futurology,[removed]
102,2022-09-02,Your blood type could predict your risk of having a stroke before age 60,u/HugNup,https://www.reddit.com/r/Futurology/comments/x415cz/your_blood_type_could_predict_your_risk_of_having/,Futurology,https://www.medschool.umaryland.edu/news/2022/UM-School-of-Medicine-Researchers-Find-Blood-Type-Linked-to-Risk-of-Stroke-Before-Age-60.html
162,2022-09-02,Artificial intelligence is being used to accurately predict women’s childbirth risks,u/Gari_305,https://www.reddit.com/r/Futurology/comments/x415va/artificial_intelligence_is_being_used_to/,Futurology,https://fortune.com/2022/09/02/artificial-intelligence-used-to-predict-women-labor-outcomes-pregnancy/
1,2022-09-02,Join the Ice Bear Gang Discord Server!,u/Emotional_Recipe3381,https://www.reddit.com/r/Futurology/comments/x42bbl/join_the_ice_bear_gang_discord_server/,Futurology,https://discord.gg/36wfUKP8
1,2022-09-02,NASA's New Gadget Creates Oxygen On Mars,u/Worldly_Cod_8431,https://www.reddit.com/r/Futurology/comments/x42lmu/nasas_new_gadget_creates_oxygen_on_mars/,Futurology,https://themorningnews.com/news/2022/09/02/nasas-new-gadget-creates-oxygen-on-mars/
44,2022-09-02,Google Is Making LaMDA Available,u/AlbertoRomGar,https://www.reddit.com/r/Futurology/comments/x42zir/google_is_making_lamda_available/,Futurology,https://thealgorithmicbridge.substack.com/p/google-is-making-lamda-available
1234,2022-09-02,This company is about to grow new organs in a person for the first time | Volunteer with severe liver disease will soon undergo a procedure that could lead them to grow a second liver,u/[deleted],https://www.reddit.com/r/Futurology/comments/x4304f/this_company_is_about_to_grow_new_organs_in_a/,Futurology,
10,2022-09-02,How artificial intelligence can explain its decisions,u/Gari_305,https://www.reddit.com/r/Futurology/comments/x432bj/how_artificial_intelligence_can_explain_its/,Futurology,https://www.eurekalert.org/news-releases/963644
1,2022-09-02,Mindwalk was never updated digitally but is a great movie. Maybe more relevant now more than ever:,u/4fraid0f4mericans,https://www.reddit.com/r/Futurology/comments/x43ckk/mindwalk_was_never_updated_digitally_but_is_a/,Futurology,[removed]
1,2022-09-02,This company is about to grow new organs in a person for the first time,u/[deleted],https://www.reddit.com/r/Futurology/comments/x43fmw/this_company_is_about_to_grow_new_organs_in_a/,Futurology,
1,2022-09-02,Digital securities- future securities,u/[deleted],https://www.reddit.com/r/Futurology/comments/x440mz/digital_securities_future_securities/,Futurology,[removed]
0,2022-09-02,Missingpage.com lets people deliver their own eulogy. This is like coming back to life after death.,u/[deleted],https://www.reddit.com/r/Futurology/comments/x443vg/missingpagecom_lets_people_deliver_their_own/,Futurology,[removed]
12,2022-09-02,"Forget chess, DeepMind’s training its new AI to play football (What we call ""soccer"" in the USA)",u/izumi3682,https://www.reddit.com/r/Futurology/comments/x4445f/forget_chess_deepminds_training_its_new_ai_to/,Futurology,https://thenextweb.com/news/forget-chess-deepminds-training-new-ai-play-football
0,2022-09-02,"Digital securities are the future of the traditional economy, what do you think about that?",u/[deleted],https://www.reddit.com/r/Futurology/comments/x447wu/digital_securities_are_the_future_of_the/,Futurology,
1,2022-09-02,Log into Facebook,u/Remarkable_Neat_3115,https://www.reddit.com/r/Futurology/comments/x44jr0/log_into_facebook/,Futurology,https://www.facebook.com/riport/disebal_account
2147,2022-09-02,"Canada might be getting a 1,000 kph vacuum-tube train",u/dr_freeloader,https://www.reddit.com/r/Futurology/comments/x44p73/canada_might_be_getting_a_1000_kph_vacuumtube/,Futurology,https://www.cnn.com/travel/article/fluxjet-transpod-canada-hyperloop/index.html
1,2022-09-02,"in the future, could we become a civilization of superhumans?",u/chaosDzod,https://www.reddit.com/r/Futurology/comments/x46opc/in_the_future_could_we_become_a_civilization_of/,Futurology,[removed]
15,2022-09-02,"With new solar modules, greenhouses run on their own energy",u/Doener23,https://www.reddit.com/r/Futurology/comments/x47awv/with_new_solar_modules_greenhouses_run_on_their/,Futurology,https://www.miragenews.com/with-new-solar-modules-greenhouses-run-on-their-843775/
188,2022-09-02,Aluminum-gallium powder bubbles hydrogen out of dirty water,u/blaspheminCapn,https://www.reddit.com/r/Futurology/comments/x47jho/aluminumgallium_powder_bubbles_hydrogen_out_of/,Futurology,https://newatlas.com/energy/aluminum-gallium-hydrogen-powder/
174,2022-09-02,Nuclear power could be the future of cruises,u/Ramen_Hair,https://www.reddit.com/r/Futurology/comments/x47q4s/nuclear_power_could_be_the_future_of_cruises/,Futurology,https://www.cnn.com/travel/amp/ulstein-thor-nuclear-powered-ship/index.html
1,2022-09-02,"Meta, Qualcomm sign pact on custom virtual reality chips￼",u/Southern-Housing-135,https://www.reddit.com/r/Futurology/comments/x47u4n/meta_qualcomm_sign_pact_on_custom_virtual_reality/,Futurology,https://slashbeats.com/meta-qualcomm-sign-pact-on-custom-virtual-reality-chips%ef%bf%bc/
1,2022-09-02,"Zuckerberg explains VR use cases, Joe Rogan disagrees",u/[deleted],https://www.reddit.com/r/Futurology/comments/x47uyc/zuckerberg_explains_vr_use_cases_joe_rogan/,Futurology,
