score,date,title,author,url,subreddit,text
0,2022-09-24,SaaS founders what do you think about this solution?,u/LiveGenie,https://www.reddit.com/r/Futurology/comments/xmt1mx/saas_founders_what_do_you_think_about_this/,Futurology,"So we are building [LiveGenie](http://www.livegenie.co/) a 2-in-1 solution for SaaS founders to increase revenue and reduce customer churn.

With live video chat as a core feature you will:

Engage with your website visitors on live with screen sharing and conduct live demos instead of waiting for booking and suffering from a high ratio of unattended meetings.

Engage with your users for live customer support and with your free users during onboarding in order to convert them to paid customers.

The main goal of the solution is to add a significant human connection to your website and software.

On top of live video chat you will have the possibility to co-browse with your users and get an AI Transcription for automatic meeting reports which you can easily integrate into your CRM or your support software.

Please tell us how we can improve the product?"
2,2022-09-24,"This tournament lists a set of projects aiming to improve the long-term future, and offers cash prizes to people who either (1) predict which ones get funded or (2) change the decision about which ones to fund or how much to fund them. Total prize pool is $13,000, and the projects sound really cool!",u/etothe_ipi,https://www.reddit.com/r/Futurology/comments/xmthb8/this_tournament_lists_a_set_of_projects_aiming_to/,Futurology,https://manifold.markets/group/clearer-thinking-regrants/about
1,2022-09-24,Introduction to K-Means Clustering for Aspiring Data Scientists | USDSI,u/ankitaanand22,https://www.reddit.com/r/Futurology/comments/xmu4fz/introduction_to_kmeans_clustering_for_aspiring/,Futurology,https://www.usdsi.org/data-science-insights/k-means-clustering-for-aspiring-data-scientists
5,2022-09-24,An app that uses AI to see which Celebs Photoshop/Facetune their Instagram pictures.,u/[deleted],https://www.reddit.com/r/Futurology/comments/xmuz3l/an_app_that_uses_ai_to_see_which_celebs/,Futurology,
249,2022-09-24,"Suzuki to double cars transported by rail in India, cutting emissions Japanese automaker builds train terminals at two assembly plants",u/[deleted],https://www.reddit.com/r/Futurology/comments/xmvb61/suzuki_to_double_cars_transported_by_rail_in/,Futurology,https://asia.nikkei.com/Business/Automobiles/Suzuki-to-double-cars-transported-by-rail-in-India-cutting-emissions
229,2022-09-24,Scientists Feed Power From Idle Electric Cars Back Into National Grid. A great find if you could commercialize it very quickly though. I wonder if this is doable to boost power grids even in Western Europe alone.,u/Educational_Sector98,https://www.reddit.com/r/Futurology/comments/xmvx16/scientists_feed_power_from_idle_electric_cars/,Futurology,https://viraltab.news/bright-sparks-boffins-feed-power-from-idle-electric-cars-back-into-national-grid/
294,2022-09-24,"A promising malaria vaccine was up to 80% effective at preventing the disease in young children who received a booster shot one year after their initial dose, exceeding a WHO target of 75% efficacy. Larger trials are needed before it can be rolled out.",u/cartoonzi,https://www.reddit.com/r/Futurology/comments/xmwhfc/a_promising_malaria_vaccine_was_up_to_80/,Futurology,https://www.nature.com/articles/d41586-022-02902-6
3542,2022-09-24,Insect protein maker raises $250 million in funding round,u/vpuetf,https://www.reddit.com/r/Futurology/comments/xmxi47/insect_protein_maker_raises_250_million_in/,Futurology,https://www.foodbusinessnews.net/articles/22279-insect-protein-maker-raises-250-million-in-funding-round
1,2022-09-24,Solvent study solves solar cell durability puzzle,u/[deleted],https://www.reddit.com/r/Futurology/comments/xmy7m4/solvent_study_solves_solar_cell_durability_puzzle/,Futurology,
1,2022-09-24,Futurism: Vanessa Keith on the Future of Skyscrapers,u/missvocab,https://www.reddit.com/r/Futurology/comments/xmybjc/futurism_vanessa_keith_on_the_future_of/,Futurology,https://www.youtube.com/watch?v=G1Mnsj3WrWQ
1,2022-09-24,Solvent study solves solar cell durability puzzle,u/ten-million,https://www.reddit.com/r/Futurology/comments/xmyp3s/solvent_study_solves_solar_cell_durability_puzzle/,Futurology,[removed]
1,2022-09-24,#IUIC | SABBATH NOON CLASS: Can I Get A Witness?,u/Great_Position_9358,https://www.reddit.com/r/Futurology/comments/xn0h3g/iuic_sabbath_noon_class_can_i_get_a_witness/,Futurology,https://youtu.be/c3OikqB3YNM
1,2022-09-24,speaking to AI online,u/excelsiors77,https://www.reddit.com/r/Futurology/comments/xn0h8s/speaking_to_ai_online/,Futurology,[removed]
1,2022-09-24,Biforcation,u/XDymes,https://www.reddit.com/r/Futurology/comments/xn3r4b/biforcation/,Futurology,[removed]
1,2022-09-24,"Has there been anything that went down in price because of automation? Or at least become cheaper to produce because of automation, which allowed a competition price battle to lower the price?",u/drippyneon,https://www.reddit.com/r/Futurology/comments/xn4nuc/has_there_been_anything_that_went_down_in_price/,Futurology,[removed]
1939,2022-09-24,NASA officially bans sex in space over fears of astronaut pregnancies,u/WallStreetDoesntBet,https://www.reddit.com/r/Futurology/comments/xn6c9l/nasa_officially_bans_sex_in_space_over_fears_of/,Futurology,https://www.tweaktown.com/news/88575/nasa-officially-bans-sex-in-space-over-fears-of-astronaut-pregnancies/index.html
1,2022-09-24,World Economic Forum Takeover,u/n0tt0f4r0ff,https://www.reddit.com/r/Futurology/comments/xn82ve/world_economic_forum_takeover/,Futurology,[removed]
1163,2022-09-24,Australia's huge new nickel+copper mine - two items needed heavily for EVs and solar power - will host world's biggest renewable micro-grid,u/ForHidingSquirrels,https://www.reddit.com/r/Futurology/comments/xn83js/australias_huge_new_nickelcopper_mine_two_items/,Futurology,https://reneweconomy.com.au/huge-new-nickel-mine-aims-for-100-pct-renewables-with-worlds-biggest-renewable-micro-grid/
8214,2022-09-24,"The second largest electric school bus fleet in the US just crossed 500,000 service miles",u/ForHidingSquirrels,https://www.reddit.com/r/Futurology/comments/xn8x63/the_second_largest_electric_school_bus_fleet_in/,Futurology,https://electrek.co/2022/09/23/second-largest-us-electric-school-bus-fleet-just-crossed-500k-miles/
1,2022-09-24,please subscribe!!!,u/matt12332111111111,https://www.reddit.com/r/Futurology/comments/xn9p0c/please_subscribe/,Futurology,https://youtube.com/channel/UCL6lRLER3RPbLaexz_cj5Ww
2,2022-09-24,Did You Catch This in The Evening Sky?,u/SouthernMarylandPR,https://www.reddit.com/r/Futurology/comments/xnac71/did_you_catch_this_in_the_evening_sky/,Futurology,https://southernmarylandpr.com/2022/09/did-you-catch-this-in-the-evening-sky/
1,2022-09-24,I give BSV 1YEN to people who like me on Twitter,u/youiti2nz,https://www.reddit.com/r/Futurology/comments/xnb53f/i_give_bsv_1yen_to_people_who_like_me_on_twitter/,Futurology,[removed]
336,2022-09-24,EV semi company recalls all semis in first mass recall of EV semis,u/redingerforcongress,https://www.reddit.com/r/Futurology/comments/xnbfu5/ev_semi_company_recalls_all_semis_in_first_mass/,Futurology,https://www.carscoops.com/2022/09/nikola-is-recalling-93-examples-of-the-tre-bev-that-we-didnt-know-it-had-built/
171,2022-09-25,Another fire at a Tesla Megapack; investigations should begin ASAP,u/redingerforcongress,https://www.reddit.com/r/Futurology/comments/xnehfo/another_fire_at_a_tesla_megapack_investigations/,Futurology,https://www.pv-magazine.com/2022/09/22/fire-at-pges-tesla-battery-in-california-is-now-under-control/
1,2022-09-25,Tesla's goal is to produce a Robotaxis in 2024 without a steering wheel,u/Carzworld41,https://www.reddit.com/r/Futurology/comments/xneikq/teslas_goal_is_to_produce_a_robotaxis_in_2024/,Futurology,https://www.carworld41.com/2022/09/teslas-goal-is-to-produce-robotaxis-in.html?m=1
1,2022-09-25,Honda CBR250RR 2023 unveiled - TECH INFO,u/Techinfoenglish,https://www.reddit.com/r/Futurology/comments/xnfen0/honda_cbr250rr_2023_unveiled_tech_info/,Futurology,https://techinfoenglish.com/2022/09/24/honda-cbr250rr-2023-unveiled/
1,2022-09-25,FlexiPlanter by GreenFlow vertical planter system coming soon in Kickstarter. www.greenflow.design #verticalgarden #recycledplastic #ecohero #beekind,u/ImportanceRare720,https://www.reddit.com/r/Futurology/comments/xnhfqm/flexiplanter_by_greenflow_vertical_planter_system/,Futurology,https://youtu.be/sU098nTs7I4
1,2022-09-25,New logo,u/[deleted],https://www.reddit.com/r/Futurology/comments/xnhvbo/new_logo/,Futurology,[removed]
1,2022-09-25,Air Domain Intelligence's new logo now has what looks like the “tic-tac UFO” from Navy's patent,u/[deleted],https://www.reddit.com/r/Futurology/comments/xni753/air_domain_intelligences_new_logo_now_has_what/,Futurology,[removed]
1,2022-09-25,Air Domain Intelligence's new logo now has what looks like the “tic-tac UFO” from Navy's patent,u/[deleted],https://www.reddit.com/r/Futurology/comments/xnih5x/air_domain_intelligences_new_logo_now_has_what/,Futurology,
2,2022-09-25,How Labs Are Supporting the Creation of New Food Products,u/NSFWaccess1998,https://www.reddit.com/r/Futurology/comments/xnk1u2/how_labs_are_supporting_the_creation_of_new_food/,Futurology,https://www.memuk.org/consumer-goods/food-drink/how-labs-are-supporting-the-creation-of-new-food-products-66970
901,2022-09-25,Elon Musk faces skeptics as Tesla gets ready to unveil vaporware robots,u/redingerforcongress,https://www.reddit.com/r/Futurology/comments/xnksiz/elon_musk_faces_skeptics_as_tesla_gets_ready_to/,Futurology,https://www.reuters.com/business/autos-transportation/elon-musk-faces-skeptics-tesla-gets-ready-unveil-optimus-robot-2022-09-20/
9395,2022-09-25,"Really Good Article: In the End, Climate Change Is the Only Story That Matters",u/UnitedBarracuda3006,https://www.reddit.com/r/Futurology/comments/xnl3fw/really_good_article_in_the_end_climate_change_is/,Futurology,https://www.esquire.com/news-politics/politics/a41355745/hurricane-fiona-climate-change/
19,2022-09-25,The Everyday Robot Project - Alphabet's solution to robots in the home,u/redingerforcongress,https://www.reddit.com/r/Futurology/comments/xnldwu/the_everyday_robot_project_alphabets_solution_to/,Futurology,https://x.company/projects/everyday-robots/
1,2022-09-25,Elites afraid of AI triggered accountability not AI triggered extinction event,u/[deleted],https://www.reddit.com/r/Futurology/comments/xnle9w/elites_afraid_of_ai_triggered_accountability_not/,Futurology,[removed]
371,2022-09-25,"The Earth satellite project bringing Chinese, US and Russian space scientists together. Researchers aim to send 3 networks into orbit to give a global picture of the planet’s big threats",u/Dr_Singularity,https://www.reddit.com/r/Futurology/comments/xnlr1x/the_earth_satellite_project_bringing_chinese_us/,Futurology,https://www.scmp.com/news/china/science/article/3193750/earth-satellite-project-bringing-chinese-us-and-russian-space
1,2022-09-25,sssssssssssssssssssssssssssssssssssssssss,u/gefiwat853,https://www.reddit.com/r/Futurology/comments/xnm4ho/sssssssssssssssssssssssssssssssssssssssss/,Futurology,https://www.youtube.com/watch?v=5URakkdrONk&amp;list=PLc_cDVa-WktBDJN5ezxvfiZF0CIod8FNZ
3,2022-09-25,How AI Could Upgrade Brain Stimulation Therapies,u/[deleted],https://www.reddit.com/r/Futurology/comments/xnn194/how_ai_could_upgrade_brain_stimulation_therapies/,Futurology,
300,2022-09-25,"Grail Trail: Detecting cancers through blood tests holds promise, but major hurdles remain",u/barrel_master,https://www.reddit.com/r/Futurology/comments/xnn4cg/grail_trail_detecting_cancers_through_blood_tests/,Futurology,https://www.cbc.ca/news/health/cancer-blood-test-grail-1.6591789
1,2022-09-25,Meta: Why is everyone here so jaded about the future?,u/OriginalCompetitive,https://www.reddit.com/r/Futurology/comments/xnoek2/meta_why_is_everyone_here_so_jaded_about_the/,Futurology,[removed]
1,2022-09-25,"MAG HANAP NG TIPID! Downtown Toronto grocery shopping sa Metro, Farmboy, at Ikea.",u/Jaded-Stop-5045,https://www.reddit.com/r/Futurology/comments/xnog71/mag_hanap_ng_tipid_downtown_toronto_grocery/,Futurology,https://youtu.be/wANxz-pMndI
310,2022-09-25,World first combined solar- hydro plant in Australia,u/[deleted],https://www.reddit.com/r/Futurology/comments/xnqnwv/world_first_combined_solar_hydro_plant_in/,Futurology,https://amp.smh.com.au/national/a-world-first-power-plant-aimed-at-solving-mildura-s-rhombus-of-regret-20220921-p5bjq3.html
225,2022-09-25,Air Domain Intelligence's new logo now has what looks like the “tic-tac UFO” from Navy's patent,u/Need2MeditateMore,https://www.reddit.com/r/Futurology/comments/xnsr29/air_domain_intelligences_new_logo_now_has_what/,Futurology,https://www.airdomainintelligence.mil
448,2022-09-25,"Tesla promises ‘one million robo-taxis’ in 2020 [April, 2019]",u/redingerforcongress,https://www.reddit.com/r/Futurology/comments/xnwgu0/tesla_promises_one_million_robotaxis_in_2020/,Futurology,https://www.engadget.com/2019-04-22-tesla-elon-musk-self-driving-robo-taxi.html
119,2022-09-25,"Target Venus not Mars for first crewed mission to another planet, experts say.",u/filosoful,https://www.reddit.com/r/Futurology/comments/xnx4ek/target_venus_not_mars_for_first_crewed_mission_to/,Futurology,https://www.theguardian.com/science/2022/sep/25/target-venus-not-mars-for-first-crewed-mission-to-another-planet-experts-say
6411,2022-09-25,The US is launching a trial for blood tests that promise to catch cancers earlier,u/2fy54gh6,https://www.reddit.com/r/Futurology/comments/xny7wy/the_us_is_launching_a_trial_for_blood_tests_that/,Futurology,https://www.technologyreview.com/2022/09/12/1059266/us-trial-cancer-blood-tests-early-detection/
340,2022-09-25,Japan-led researchers develop rechargeable cyborg cockroach,u/stankmanly,https://www.reddit.com/r/Futurology/comments/xo03zc/japanled_researchers_develop_rechargeable_cyborg/,Futurology,https://mainichi.jp/english/articles/20220924/p2g/00m/0sc/016000c
1,2022-09-25,@emma.dejong | Linktree,u/ferdiemijers,https://www.reddit.com/r/Futurology/comments/xo0l0m/emmadejong_linktree/,Futurology,https://linktr.ee/emma.dejong
1,2022-09-25,Best Tips to Grow Your Social Media That the Pro's Don't Want You to …,u/xDear1345,https://www.reddit.com/r/Futurology/comments/xo529f/best_tips_to_grow_your_social_media_that_the_pros/,Futurology,https://dash.partnerstack.com/invite/814dbd40d4994e2cbd22ca20012ca9e0 https://www.slideshare.net/NjegosPopadic/socialpilotdocx
1,2022-09-25,(Tragic humor) this article about entropy,u/Traditional_Spare_38,https://www.reddit.com/r/Futurology/comments/xo7hnj/tragic_humor_this_article_about_entropy/,Futurology,[removed]
20411,2022-09-25,"A Major Win For Women's Health, A new Indian cervical cancer vaccine with a 90% efficacy, that's roughly 87% less expensive — it's a ""game-changer"" 🎉",u/tonymmorley,https://www.reddit.com/r/Futurology/comments/xo7rhr/a_major_win_for_womens_health_a_new_indian/,Futurology,https://www.reuters.com/business/healthcare-pharmaceuticals/india-develops-its-first-cervical-cancer-vaccine-2022-09-01/
14,2022-09-26,"Futuristic Technology Hopes to Save Whales With Real-Time Tracking, Underwater Microphones, and More",u/cheeztoshobo,https://www.reddit.com/r/Futurology/comments/xoajyj/futuristic_technology_hopes_to_save_whales_with/,Futurology,https://sfist.com/2022/09/23/futuristic-technology-hopes-to-save-whales-with-real-time-tracking-underwater-microphones-and-more/
1,2022-09-26,You're invited to our webinar: Customer Segmentation with Machine Learning!,u/PIEXCHANGE,https://www.reddit.com/r/Futurology/comments/xobi1q/youre_invited_to_our_webinar_customer/,Futurology,https://my.demio.com/ref/yi6crKYdN0hXHku5?utm_source=social&amp;utm_medium=reddit&amp;utm_campaign=webinar
1,2022-09-26,Black Beans,u/[deleted],https://www.reddit.com/r/Futurology/comments/xoc68o/black_beans/,Futurology,https://youtube.com/channel/UC-swKZ1SpuU07c9BL2d8Uxg
1,2022-09-26,What do you think advancements will be in the field of plastic surgery?,u/[deleted],https://www.reddit.com/r/Futurology/comments/xod9g0/what_do_you_think_advancements_will_be_in_the/,Futurology,[removed]
1,2022-09-26,Embedded Banking: Getting Profits Outside of Deposits and Lending,u/ARFASOFTECH,https://www.reddit.com/r/Futurology/comments/xodl7f/embedded_banking_getting_profits_outside_of/,Futurology,https://www.arfasoftech.com/blog/Embedded-Banking:-Getting-Profits-Outside-of-Deposits-and-Lending
1,2022-09-26,new all things VR community discord!,u/Realistic-Archer-793,https://www.reddit.com/r/Futurology/comments/xoev7c/new_all_things_vr_community_discord/,Futurology,[removed]
0,2022-09-26,Benefits of Vertex AI Workbench:-,u/Ishan220699,https://www.reddit.com/r/Futurology/comments/xof8wu/benefits_of_vertex_ai_workbench/,Futurology,[removed]
1,2022-09-26,Metaverse Store Development Company,u/Blockchaintechss,https://www.reddit.com/r/Futurology/comments/xofmf0/metaverse_store_development_company/,Futurology,https://blockchaintechs.io/metaverse-store-development-company/
1,2022-09-26,Futurology in Governance or Societal Organizing?,u/Adras-,https://www.reddit.com/r/Futurology/comments/xog8p1/futurology_in_governance_or_societal_organizing/,Futurology,[removed]
444,2022-09-26,"Extending SETI's scope, astronomers have demonstrated a method to scan for the techno-signatures of Kardashev scale alien civilizations outside our own galaxy.",u/lughnasadh,https://www.reddit.com/r/Futurology/comments/xohvz2/extending_setis_scope_astronomers_have/,Futurology,https://www.manchester.ac.uk/discover/news/reanalysis-of-breakthrough-listen-data-places-new-constraints-on-powerful-extragalactic-technosignatures/
9,2022-09-26,Ford's Eluminator Kit changes a gas powered car to electric.,u/SatansMoisture,https://www.reddit.com/r/Futurology/comments/xoi56d/fords_eluminator_kit_changes_a_gas_powered_car_to/,Futurology,https://news.yahoo.com/fords-eluminator-kit-turns-gas-222406189.html
14,2022-09-26,NASA Refines Its Strategy for Getting Humans to Mars,u/[deleted],https://www.reddit.com/r/Futurology/comments/xoicyk/nasa_refines_its_strategy_for_getting_humans_to/,Futurology,
145,2022-09-26,"New research center aims to reverse aging and prolong disease-free years | Singapore Deputy PM announces ""an ambitious mission to enhance healthspan by five years in Singapore by slowing ageing""",u/StoicOptom,https://www.reddit.com/r/Futurology/comments/xoid7o/new_research_center_aims_to_reverse_aging_and/,Futurology,https://www.straitstimes.com/singapore/health/new-longevity-centre-looks-at-how-to-reverse-ageing-and-prolong-disease-free-years
1,2022-09-26,India Develops Affordable Vaccine Against Cervical Cancer,u/GonjaNinja420,https://www.reddit.com/r/Futurology/comments/xoimdb/india_develops_affordable_vaccine_against/,Futurology,[removed]
1,2022-09-26,India Develops Affordable Vaccine Against Cervical Cancer,u/GonjaNinja420,https://www.reddit.com/r/Futurology/comments/xoirph/india_develops_affordable_vaccine_against/,Futurology,[removed]
1,2022-09-26,﻿#1 PROVEN WEIGHT LOSS SUPPLEMENT OF 2022,u/biz_wizkid,https://www.reddit.com/r/Futurology/comments/xoj3qi/1_proven_weight_loss_supplement_of_2022/,Futurology,https://crafty-architect-3576.ck.page/e295ce671d
0,2022-09-26,NASA Refines Its Strategy for Getting Humans to Mars. The updated “Moon to Mars” blueprint involves 63 high-level objectives that could finally bring the Red Planet within reach.,u/[deleted],https://www.reddit.com/r/Futurology/comments/xoj7ou/nasa_refines_its_strategy_for_getting_humans_to/,Futurology,
10629,2022-09-26,Offshore Wind 125 Times Better for Taxpayers Compared to Oil and Gas | A report finds per-acre revenue from offshore wind blows oil and gas out of the water.,u/chrisdh79,https://www.reddit.com/r/Futurology/comments/xoj7sb/offshore_wind_125_times_better_for_taxpayers/,Futurology,https://gizmodo.com/offshore-wind-125-times-better-for-taxpayers-compared-t-1849580075
224,2022-09-26,NASA Refines Its Strategy for Getting Humans to Mars. The updated “Moon to Mars” blueprint involves 63 high-level objectives that could finally bring the Red Planet within reach.,u/Sariel007,https://www.reddit.com/r/Futurology/comments/xoj9gw/nasa_refines_its_strategy_for_getting_humans_to/,Futurology,https://gizmodo.com/nasa-moon-to-mars-strategy-1849568641
0,2022-09-26,The best air purifiers you can buy now,u/gadgetshub,https://www.reddit.com/r/Futurology/comments/xojtlk/the_best_air_purifiers_you_can_buy_now/,Futurology,https://youtu.be/Aahd_NEG3RA
107,2022-09-26,"Solliance hits 30.1% efficiency on perovskite/silicon tandem solar cell - perovskite cell used for the tandem cell increased from 17.8% to 19.7%, silicon hererojunction cell contributed with 10.4% efficiency",u/ForHidingSquirrels,https://www.reddit.com/r/Futurology/comments/xok55u/solliance_hits_301_efficiency_on/,Futurology,https://pv-magazine-usa.com/2022/09/26/solliance-hits-30-1-efficiency-on-perovskite-silicon-tandem-solar-cell/
1,2022-09-26,MYSTAKE,u/Anxious_Song_7906,https://www.reddit.com/r/Futurology/comments/xokidi/mystake/,Futurology,[removed]
11,2022-09-26,Minus Minerals startup is using microalgae to make carbon-neutral cement,u/[deleted],https://www.reddit.com/r/Futurology/comments/xokm6r/minus_minerals_startup_is_using_microalgae_to/,Futurology,
41,2022-09-26,"Amid the outbreak of the coronavirus, the US President proposed a nearly 19 percent budget cut to the Centers for Disease Control and Prevention—the agency primarily tasked with preparing for and responding to such outbreaks and other serious health threats.",u/geodetikaav,https://www.reddit.com/r/Futurology/comments/xolvr9/amid_the_outbreak_of_the_coronavirus_the_us/,Futurology,https://arstechnica.com/science/2020/02/amid-coronavirus-outbreak-trump-proposes-slashing-cdc-budget/
41,2022-09-26,Making AI Videos with Stable Diffusion and SD Deforum,u/pwillia7,https://www.reddit.com/r/Futurology/comments/xomjl1/making_ai_videos_with_stable_diffusion_and_sd/,Futurology,https://reticulated.net/dailyai/stable-diffusion-videos-with-visions-of-chaos-deforum-animation/
1,2022-09-26,A robot called Erica is being used to create natural conversation styles and ‘laugh at jokes’,u/[deleted],https://www.reddit.com/r/Futurology/comments/xomtzl/a_robot_called_erica_is_being_used_to_create/,Futurology,
1,2022-09-26,Soft Robots grab tools with correct amount of Force,u/[deleted],https://www.reddit.com/r/Futurology/comments/xon85r/soft_robots_grab_tools_with_correct_amount_of/,Futurology,https://www.inceptivemind.com/soft-robots-learn-grasp-tools-right-amount-force/27572/?amp
1,2022-09-26,"""In the future, cursive will have to be taught to scholars the way Elizabethan secretary hand or paleography is today.""",u/FourteenthDimension,https://www.reddit.com/r/Futurology/comments/xonp7s/in_the_future_cursive_will_have_to_be_taught_to/,Futurology,[removed]
9863,2022-09-26,"Lab-grown meat the next frontier in ethical eating: to produce one billion quarter-pounder burgers takes 1.2 million cows living for 3 years on 8,600 square kilometres of land. The same number of cultured burgers would require muscle stem cells of just 1 living cow, a month and a half to grow.",u/niahyok,https://www.reddit.com/r/Futurology/comments/xonuih/labgrown_meat_the_next_frontier_in_ethical_eating/,Futurology,https://www.cbc.ca/news/technology/what-on-earth-newsletter-lab-grown-meat-green-energy-1.5281252
1,2022-09-26,From Scotland to Sweden: How smart cities are helping residents save energy,u/Impressive_Tennis724,https://www.reddit.com/r/Futurology/comments/xop0nr/from_scotland_to_sweden_how_smart_cities_are/,Futurology,https://www.euronews.com/green/2022/09/26/from-scotland-to-sweden-how-smart-cities-are-helping-residents-save-energy
1,2022-09-26,🤩Participate now in the draw for $100 in $GBLOCK tokens!💰,u/Least-Juice-5120,https://www.reddit.com/r/Futurology/comments/xoqkds/participate_now_in_the_draw_for_100_in_gblock/,Futurology,[removed]
40,2022-09-26,AI Generated Videos are here (sort of) - Quick Look at the Current Tech,u/pwillia7,https://www.reddit.com/r/Futurology/comments/xor2vi/ai_generated_videos_are_here_sort_of_quick_look/,Futurology,https://reticulated.net/dailyai/stable-diffusion-videos-with-visions-of-chaos-deforum-animation/
213,2022-09-26,Is Web3 Really The Future of Everything Or Just A Huge Sham?,u/EightpennyPie,https://www.reddit.com/r/Futurology/comments/xor8ri/is_web3_really_the_future_of_everything_or_just_a/,Futurology,https://www.spin.com/2022/09/is-web3-really-the-future-of-everything-or-just-a-huge-sham/?utm_source=cftw&amp;utm_medium=002&amp;utm_campaign=news
37,2022-09-26,Chinese citizens will soon need to scan their face before they can access internet services or get a new phone number,u/geodetikaav,https://www.reddit.com/r/Futurology/comments/xoslf5/chinese_citizens_will_soon_need_to_scan_their/,Futurology,https://www.businessinsider.com/china-to-require-facial-id-for-internet-and-mobile-services-2019-10
0,2022-09-26,Man implants car 'key' in hand: The future of tech in our bodies,u/1080krld,https://www.reddit.com/r/Futurology/comments/xosy8d/man_implants_car_key_in_hand_the_future_of_tech/,Futurology,https://omny.fm/shows/something-offbeat/man-implants-car-key-in-hand-the-future-of-tech-in
441,2022-09-26,It’s DART’s big day: Asteroid collision just hours away,u/filosoful,https://www.reddit.com/r/Futurology/comments/xosz7w/its_darts_big_day_asteroid_collision_just_hours/,Futurology,https://arstechnica.com/science/2022/09/tune-in-for-nasas-first-planetary-defense-test/
