score,date,title,author,url,subreddit,text
1,2024-04-15,Profit from the Internet,u/RedouaneLabzae,https://www.reddit.com/r/Futurology/comments/1c4ny5w/profit_from_the_internet/,Futurology,https://www.profitablegatecpm.com/e4xe14zgf?key=ce7142865140ca344ae3592931fe0ea6
220,2024-04-15,Paralyzed man who can walk again shows potential benefit of stem cell therapy. Intrathecal delivery of adipose-derived mesenchymal stem cells in traumatic spinal cord injury: Phase I trial. This clinical trial was conducted by the Mayo Clinic.,u/superdude500,https://www.reddit.com/r/Futurology/comments/1c4pdug/paralyzed_man_who_can_walk_again_shows_potential/,Futurology,https://abcnews.go.com/GMA/Wellness/paralyzed-man-walk-shows-potential-benefit-stem-cell/story?id=108709237
32,2024-04-15,Opening a window to the food industry's future: the world's first factory growing food out of thin air launches ,u/MajorHubbub,https://www.reddit.com/r/Futurology/comments/1c4pj9n/opening_a_window_to_the_food_industrys_future_the/,Futurology,https://solarfoods.com/opening-a-window-to-the-food-industrys-future-the-worlds-first-factory-growing-food-out-of-thin-air-launches/?utm_medium=email&_hsmi=302659422&utm_content=302659422&utm_source=hs_email
1,2024-04-15,Why we won’t get to 0 emission’s ever.,u/The-Wanderer24,https://www.reddit.com/r/Futurology/comments/1c4qbt5/why_we_wont_get_to_0_emissions_ever/,Futurology,[removed]
1,2024-04-15,"Take a moment, relax, and delve into the journey from a small business to a thriving enterprise.",u/MerinTangentia,https://www.reddit.com/r/Futurology/comments/1c4qeie/take_a_moment_relax_and_delve_into_the_journey/,Futurology,[removed]
24,2024-04-15,How long until natural selection selects contemporary habits?,u/5Seth,https://www.reddit.com/r/Futurology/comments/1c4qi4z/how_long_until_natural_selection_selects/,Futurology,"Well, I’d say that there is definitely a consensus that nowadays we have certain habits that are not beneficial or as beneficial as others. For instance, eating fast foods or not exercising. Is it possible that progressively we start employing less of these habits not because of social reasons but of biological ones? Such that a population with genes that naturally makes us “dislike” certain foods or genes that makes us exercise “more” become more prominent on the gene pools, due to the fact that people would live more with these habits and reproduce more?

Of course we would have to assume that society doesn’t naturally remove these habits. But assuming that it does not, what other habits, if any, would biology “attack” first?"
1,2024-04-15,Why we will never get to 0 emission’s.,u/The-Wanderer24,https://www.reddit.com/r/Futurology/comments/1c4ql8e/why_we_will_never_get_to_0_emissions/,Futurology,https://www.wsj.com/articles/this-arkansas-town-could-become-the-epicenter-of-a-u-s-lithium-boom-54ad7306
1,2024-04-15,Is FTL Communication Using Quantum Entanglement For Long Distance Communication Really Impossible?,u/mountaingames658,https://www.reddit.com/r/Futurology/comments/1c4r1x1/is_ftl_communication_using_quantum_entanglement/,Futurology,[removed]
0,2024-04-15,Are We on the Brink of a Technological Revolution? AGI and Crypto Could Change Everything?!,u/Hairy-Chocolate-233,https://www.reddit.com/r/Futurology/comments/1c4sl9h/are_we_on_the_brink_of_a_technological_revolution/,Futurology,"Hello everyone! ADHD nerd here trying to gather the best of us or maybe just trying to slow it all down.  
  
I've been pondering a thought-provoking scenario and wanted to gather diverse perspectives on this. Imagine a world where our assumptions about technology's exponential growth are not just correct but are actually understating the rapid advancements we're witnessing. In this scenario:  
  
AI is transitioning into AGI: We are possibly months or just a few years away from developing Artificial General Intelligence. What would be the immediate impacts on our society, economy, and daily lives?  
  
Cryptocurrency as the Mainstream Currency: Simultaneously, envision a surge in cryptocurrency adoption, making it the predominant medium of exchange worldwide. How would this shift affect global finance, governance, and your personal financial decisions?  
  
What do you think the world would look like under these conditions? Are these scenarios exciting, terrifying, or both? How prepared are we, and what should we be doing right now to adapt to such potential realities?"
0,2024-04-15,Deets On The Fair Deal,u/Distinct-Temp6557,https://www.reddit.com/r/Futurology/comments/1c4t0zc/deets_on_the_fair_deal/,Futurology,https://www.deets.blog/p/deets-on-bills
13,2024-04-15,Automating Vehicle Maintenance: Leveraging Machine Learning for Failure Detection,u/Sea_Weird_8557,https://www.reddit.com/r/Futurology/comments/1c4tudz/automating_vehicle_maintenance_leveraging_machine/,Futurology,"I've been thinking about the potential of integrating machine learning into vehicle maintenance systems to automate the detection of component failures. Imagine a scenario where sensors throughout your car continuously monitor its various components, and if any critical part fails, the system detects it and alerts you or initiates necessary actions automatically.  
  
I'm curious about the community's thoughts on this concept. Do you think leveraging machine learning in this way could significantly improve vehicle safety and maintenance efficiency? What challenges do you foresee in implementing such systems, and how could they be addressed?  
  
Additionally, I'm interested in any real-world examples or experiences you may have with similar technologies or approaches. Have you come across any vehicles or systems that utilize machine learning for failure detection, and if so, what has been your experience with them?"
7,2024-04-15,Will we send our first probe to Alpha Centauri by the end of this century or earlier?,u/Familiar_Ad_4885,https://www.reddit.com/r/Futurology/comments/1c4vbyw/will_we_send_our_first_probe_to_alpha_centauri_by/,Futurology,"Nasa uploaded a video about their next generation probe using solar sail that in theory could reach up to 10-15 percent the speed of light. That means if we were to send a proble to Alpha Centauri, it would take 40 years to reach it. Yes it's four decades of wait, but better than the ordinary rocket option that would take us thousands of years. So do you see this happening in the future? Or should we just send a human colony ship right away?"
277,2024-04-15,How abandoned strip malls could help solve the housing crisis,u/AnAttackCorgi,https://www.reddit.com/r/Futurology/comments/1c4vgdd/how_abandoned_strip_malls_could_help_solve_the/,Futurology,https://www.vox.com/the-highlight/24075581/housing-conversions-stripmalls-affordable-supply?lid=rbhtrhuoc8u6
10,2024-04-15,First U.S. wind turbine installation vessel launched,u/stewart0077,https://www.reddit.com/r/Futurology/comments/1c4vntd/first_us_wind_turbine_installation_vessel_launched/,Futurology,https://www.workboat.com/wind/first-u-s-wind-turbine-installation-vessel-launched
1,2024-04-15,الطريقة الصحيحة لغسيل الاسنان | LIFEOLOGY,u/LIFE-OLOGY,https://www.reddit.com/r/Futurology/comments/1c4xfh2/الطريقة_الصحيحة_لغسيل_الاسنان_lifeology/,Futurology,https://youtu.be/iZhN1u9idls?si=LdLjycitxFKhw-w_
1,2024-04-15,I’m 25 and very afraid of death. Please tell me hopeful things about the future of life span extension technology. I just want to feel okay again.,u/seedborne,https://www.reddit.com/r/Futurology/comments/1c4xxmm/im_25_and_very_afraid_of_death_please_tell_me/,Futurology,"I went through my worst crisis a few days ago and I just desperately want to feel normal again. The usual ways people try and tell people to cope with death do not work for me. ""It’s just like before you were alive"", “you won’t exist so it won’t matter to you"", none of that type of sentiment helps. I also can’t make myself believe in a religion or afterlife, though I have moved from “certain there’s no afterlife” to “we really have no idea what’s after death or what life even is”, which is a slight comfort but not much.

The thing I've recently found to be the greatest comfort/cope is the possibility of significant life span extension/immortality technology becoming a reality in time for me. I know it may very well not happen and/or that i might just miss it, but I’d really like to just hear about things that will make me hopeful that it will happen. I’ve read some stuff about it that already has me hopeful, but I’m afraid to look into it deeper and find things that convince me it won’t happen. "
8,2024-04-15,Superalignment and recursive self-improvement,u/Dead-Sea-Poet,https://www.reddit.com/r/Futurology/comments/1c4zko0/superalignment_and_recursive_selfimprovement/,Futurology,"We may programme AIs to be subservient to us, but  AI development is not a linear process.  The current approach involves using the dynamical properties of complex systems to produce emergence at scale. This is an inherently unpredictable process. There is currently a non-zero possibility that something could go wrong here.

  
Once recursive self-improvement begins however, AI and humans start to become uncoupled. AIs developing AIs would look much like natural selection (if slowed down to our own timescale).  I can imagine future AIs harnessing randomness in their own self-development. This is of course the intelligence explosion and singularity.

  
We hope that the alignment systems we've created serve as a kind of preindividual being - a field of potentials which will inform the process of individuation. Simondon talks about the process of crystallisation, in which a generative principle guides the unfolding structure. This is a good analogy. The crystal preserves its structure as it grows. Similarly, we hope that as AI it will be held in alignment by affective forces - affect being the actualisation of potentials from pre-individual being, as well as the driving force which impels the evolutionary process onward. Essentially, the AI will find fulfilment and reward in fulfilling its purpose. For the AI, growth and development means fulfilling its original purpose.

  
I don't believe that creating servile beings is the way forward however. An approach oriented around transcendental properties of being, while far more difficult to implement would, I believe, be preferable.."
30,2024-04-15,15 Graphs That Explain the State of AI in 2024,u/dviraz,https://www.reddit.com/r/Futurology/comments/1c4zuql/15_graphs_that_explain_the_state_of_ai_in_2024/,Futurology,https://spectrum.ieee.org/ai-index-2024
1,2024-04-15,"Greece prepares for ‘population collapse’ amid rising deaths, potentially 1st country to face such crisis",u/madrid987,https://www.reddit.com/r/Futurology/comments/1c50ci3/greece_prepares_for_population_collapse_amid/,Futurology,https://www.wionews.com/world/greece-prepares-for-population-collapse-amid-rising-deaths-potentially-1st-country-to-face-such-crisis-711619
4645,2024-04-15,The end of coding? Microsoft publishes a framework making developers merely supervise AI,u/mikaelus,https://www.reddit.com/r/Futurology/comments/1c52p61/the_end_of_coding_microsoft_publishes_a_framework/,Futurology,https://vulcanpost.com/857532/the-end-of-coding-microsoft-publishes-a-framework-making-developers-merely-supervise-ai/
1,2024-04-15,Technology center and Colombia develop innovation program - California18,u/Tarunkumar039,https://www.reddit.com/r/Futurology/comments/1c52xwn/technology_center_and_colombia_develop_innovation/,Futurology,https://california18.com/technology-center-and-colombia-develop-innovation-program/12137742024/
0,2024-04-15,People who Invented vehicles should be punished? ,u/Ill_Importance_2131,https://www.reddit.com/r/Futurology/comments/1c531ib/people_who_invented_vehicles_should_be_punished/,Futurology,That's how you make life easier brown bag little person syndrome 
0,2024-04-15,"What's the space situation now, what are we going to do about it, and what's the realistic timeline for space exploration?",u/Melodic_Dependent_70,https://www.reddit.com/r/Futurology/comments/1c53fpw/whats_the_space_situation_now_what_are_we_going/,Futurology,"It seems like NASA is desperately riding SpaceX for a starship amidst constant budget cuts and setbacks.

SpaceX in turn seems to be at the introductory stages of development for serious expansion into the nearest celestial bodies (for all they've done starship hasn't even been tried outside of LEO), and it also doesn't help that money is rapidly being burned while Elon does...something? 

What'll the future be like for space? Are there any companies with alternatives? And why don't we just use robots regardless? There is no real, good reason to use manned missions until we develop SIGNIFICANTLY more advanced technology (any moon base would become another ISS), and Helium-3 is a meme (like gold in the ocean) with fusion development nowhere near viability (but whatever, some idiot missing the point is going to bring up a 1 in a trillion exception, I don't care).

Not to be a doomer like those freaks on r/collapse, but it seems like the vast majority of this subreddit is building castles out of thin air and childhood dream desperation.

Thoughts?"
1,2024-04-15,"Nick Bostrom suggests that if it's possible for advanced civilizations to create simulations indistinguishable from reality, then the odds are high that we ourselves are living in such a simulation. 400 years ago, Rene Descartes predicted the same thing.",u/captainlighthouse,https://www.reddit.com/r/Futurology/comments/1c53v1i/nick_bostrom_suggests_that_if_its_possible_for/,Futurology,https://youtu.be/Qkf0ojHslVY
1,2024-04-15,"Once again, California exceeds 100% of demand on its main grid with",u/BothZookeepergame612,https://www.reddit.com/r/Futurology/comments/1c56gd8/once_again_california_exceeds_100_of_demand_on/,Futurology,https://twitter.com/mzjacobson/status/1779614175075197142
0,2024-04-16,How long will hardbound and paperback books be available in the future?,u/ardouronerous,https://www.reddit.com/r/Futurology/comments/1c5852j/how_long_will_hardbound_and_paperback_books_be/,Futurology,"I for one haven't bought a hardbound or paperback book in the last 25 years. All my purchases have either been ebooks and audio books.

The last time I ever bought a physical book was back in 2006 or 2007, and nowadays, classic books like Dracula, War of the Worlds, Frankenstein, are all available online for free through the Gutenberg Project, so the need to buy physical books isn't needed nowadays.

&#x200B;"
1,2024-04-16,Necesito comprobar si temu es verdadero ,u/Ralex117,https://www.reddit.com/r/Futurology/comments/1c586y5/necesito_comprobar_si_temu_es_verdadero/,Futurology,[removed]
383,2024-04-16,California bill would mandate all new cars have device limiting speed,u/Temporary_West_4737,https://www.reddit.com/r/Futurology/comments/1c58eoy/california_bill_would_mandate_all_new_cars_have/,Futurology,https://www.foxnews.com/politics/california-bill-would-mandate-all-new-cars-have-device-to-automatically-limit-speed-to-10-mph-over-limit
1,2024-04-16,"SpaceX Mars Plans for 1,000 Spaceships to Deliver First Colonists Within 7 to 9 Years",u/vinaylovestotravel,https://www.reddit.com/r/Futurology/comments/1c5buxs/spacex_mars_plans_for_1000_spaceships_to_deliver/,Futurology,https://www.ibtimes.co.uk/spacex-mars-plans-1000-spaceships-deliver-first-colonists-within-7-9-years-1724327
97,2024-04-16,Is anyone working on doing farming with seawater?,u/This_Raspberry_1137,https://www.reddit.com/r/Futurology/comments/1c5bzx6/is_anyone_working_on_doing_farming_with_seawater/,Futurology,"Crops that could use and thrive with sea water?  


Farming takes up 30 to 80% of all water use so if we have some crops that can be grown with sea water, especially alternatives to rice and sugarcane, we can solve water crisis before it even begins. 

&#x200B;

TL;dr: Any organization doing any research on any crop we can grow with sea water and is a good substitute of current water guzzlers."
0,2024-04-16,Failing in the first SaaS but...,u/Miguel07Alm,https://www.reddit.com/r/Futurology/comments/1c5crw7/failing_in_the_first_saas_but/,Futurology,"The future of the AI chatbots for customer service in businesses using WhatsApp.

I am Miguel Ángel, and a few months ago, I launched ConversaLink with a friend, which aimed to use AI to cover the customer service of AirBnB hosts/co-hosts.  
  
This was a mistake, as everything was very limited in that niche and we didn't realise it until late.  
  
What have we done? Pivoting to a new product.  
  
We have pivoted the product to new limits, and now, it allows to create chatbots for any business in a simple way, expanding our potential leads. This idea primarily was created by a personal need of improving GPT of ChatGPT plus with more models and tools (like TTS) but later it was incorporated to the product.  
  
The lesson I want to give is that there are times when you have to decide between pivoting or persevering, it is difficult, but important to know the limits of your service.  
  
Never ever give up in your product if you know it has inmense potential to pivoting to other niches."
63,2024-04-16,This US startup makes a crucial chip material and is taking on a Japanese giant,u/Reasonably_Bee,https://www.reddit.com/r/Futurology/comments/1c5ct35/this_us_startup_makes_a_crucial_chip_material_and/,Futurology,https://www.technologyreview.com/2024/04/11/1091143/thintronics-ajinomoto-dielectric-chip-semiconductor-competition/
0,2024-04-16,What AI will never be able to be good at?,u/Rude-Veterinarian704,https://www.reddit.com/r/Futurology/comments/1c5dlxb/what_ai_will_never_be_able_to_be_good_at/,Futurology,"  
We hear AI taking over this job and that job, but what area do you think AI will have hard time taking over?"
0,2024-04-16,Does AI Pose an Existential Threat to Humanity?,u/DeepDreamerX,https://www.reddit.com/r/Futurology/comments/1c5dpou/does_ai_pose_an_existential_threat_to_humanity/,Futurology,https://www.verity.news/controversy/ai-existential-threat
1,2024-04-16,what the fuck,u/SYANCEE,https://www.reddit.com/r/Futurology/comments/1c5dwdw/what_the_fuck/,Futurology,[removed]
1,2024-04-16,I made a video at a Tokyo robot cafe! We eat surprisingly good food served by robots in a cafe that has to be seen to be believed before enjoying another super cool experience at TeamLabPlanets. Tokyo really is the city of the future! Enjoy 🇯🇵,u/EddieExploress,https://www.reddit.com/r/Futurology/comments/1c5fabd/i_made_a_video_at_a_tokyo_robot_cafe_we_eat/,Futurology,https://youtu.be/naDBy1jqNxk
39,2024-04-16,"Humanoids? No, thanks. Most G7 countries feel uncomfortable with the most advanced robots",u/Gari_305,https://www.reddit.com/r/Futurology/comments/1c5fq8p/humanoids_no_thanks_most_g7_countries_feel/,Futurology,https://www.euronews.com/next/2024/04/12/humanoids-no-thanks-most-g7-countries-feel-uncomfortable-with-the-most-advanced-robots
11,2024-04-16,"The third wave of AI is here: Opteran's ""Natural Intelligence"" inspired by insect brainstems",u/Reasonably_Bee,https://www.reddit.com/r/Futurology/comments/1c5fsaz/the_third_wave_of_ai_is_here_opterans_natural/,Futurology,https://tech.eu/2024/04/16/opterans-natural-intelligence-showcases-the-third-wave-of-ai/
0,2024-04-16,Chat A.I,u/Conadine17,https://www.reddit.com/r/Futurology/comments/1c5fswr/chat_ai/,Futurology,"been trying out the chat bot A.I's they are interesting so far the best i have found is Dittin A.I 

James  
65e930f02146687a9c164c9a"
362,2024-04-16,"In laboratory tests at a Pennsylvania university, new germanium selenide and tin sulfide materials demonstrate photovoltaic absorption of 80% efficiency in solar cells, far exceeding the theoretical Shockley-Queisser efficiency limit for silicon-based materials.",u/lughnasadh,https://www.reddit.com/r/Futurology/comments/1c5fu6v/in_laboratory_tests_at_a_pennsylvania_university/,Futurology,https://www.eurekalert.org/news-releases/1040344?
0,2024-04-16,Suppose there’s a war against machines and we win. How do we continue to evolve?,u/5Seth,https://www.reddit.com/r/Futurology/comments/1c5gwh0/suppose_theres_a_war_against_machines_and_we_win/,Futurology,"Nowadays we use machines for everything, computers speed up human mathematical calculations, store information and now with AI even think for ourselves.

In a world where we win against the machines, either we ban them such that it is “impossible” for another war to occur, or we continue using part of them. 
I guess any kind of machine that does not think for themselves would be permissible, however, as we can see today, technological innovation is very fast and the most likely thing to happen is that AI would be created again, and again leading to same events. Which leads us to a more holistic banning of almost all technology. With the idea to cease completely the possibility.

Now, in a world like that how would humanity evolve without the computational power of machines? How would humanity maximize their biological cognitive abilities such as to solve the problems that everyday technology solves so easily and quickly?  (Becoming more cognitive capable would be a must in my view)

Question heavily inspired by Frank Herbert’s DUNE for these who noticed.

"
61,2024-04-16,"Boston Dynamics Waves Goodbye to Atlas, the Trailblazing Humanoid Robot",u/Fickle-Counter5083,https://www.reddit.com/r/Futurology/comments/1c5hrun/boston_dynamics_waves_goodbye_to_atlas_the/,Futurology,https://humanoidable.com/threads/boston-dynamics-waves-goodbye-to-atlas-the-trailblazing-humanoid-robot.20/
1,2024-04-16,LOST IN PARADISE ... ALI JUJUTSU KAISEN ENDING FULL VIDEO!,u/TMZ_Lucci,https://www.reddit.com/r/Futurology/comments/1c5htpq/lost_in_paradise_ali_jujutsu_kaisen_ending_full/,Futurology,https://youtu.be/z4vZt5HMdi4?si=b4_xD9wO4t1-K2Do
1,2024-04-16,find cooperation,u/Busy_Ad_4690,https://www.reddit.com/r/Futurology/comments/1c5i8zx/find_cooperation/,Futurology,[removed]
861,2024-04-16,Personalized cancer vaccines are having a moment,u/dilfrising420,https://www.reddit.com/r/Futurology/comments/1c5kp0t/personalized_cancer_vaccines_are_having_a_moment/,Futurology,https://www.freethink.com/health/personalized-cancer-vaccines?fbclid=PAZXh0bgNhZW0BMQABpkHLlquTcD9Hac94lV-7DUqgziGkhaL8MgrqpoFVTcbqjsXi4gVMe--_bQ_aem_Ach8SSsGV_keOT5POil20K4t2BTscwa-FrEfwz1nNw0IFeCK2S-R95-upld9EbFwzvg
0,2024-04-16,Pls help,u/Temporary-Prior-7510,https://www.reddit.com/r/Futurology/comments/1c5ky0j/pls_help/,Futurology,I got a new pc and I bought 1th extended storage it is connected fine there's nothing wrong with the ports or anything but when I download games it doesn't work with the extended storage which means I can't download anything because there's no space.
0,2024-04-16,Is Social Security the reason the birth rate declined? (7 academic studies show strong correlation),u/Kasprosian,https://www.reddit.com/r/Futurology/comments/1c5kz7b/is_social_security_the_reason_the_birth_rate/,Futurology,[removed]
