score,date,title,author,url,subreddit,text
0,2024-03-31,how do you really make money online?>,u/Head-Composer5497,https://www.reddit.com/r/Futurology/comments/1bspcq8/how_do_you_really_make_money_online/,Futurology,"how do you really make money online? i am an american citizen on the verge of either becoming a homeless gangbanging junkie doing nothing but illegal crimes to make my way in life, or making my way through the rest of my life 100 % devoted to online revenue income."
1926,2024-03-31,Sam Altman is trying to convince Hollywood that Sora won't destroy the movie business,u/Maxie445,https://www.reddit.com/r/Futurology/comments/1bssh0c/sam_altman_is_trying_to_convince_hollywood_that/,Futurology,https://www.businessinsider.com/sam-altman-openai-convince-sora-wont-destroy-hollywood-2024-3
3569,2024-03-31,New bipartisan bill would require labeling of AI-generated videos and audio,u/Maxie445,https://www.reddit.com/r/Futurology/comments/1bssl68/new_bipartisan_bill_would_require_labeling_of/,Futurology,https://www.pbs.org/newshour/politics/new-bipartisan-bill-would-require-labeling-of-ai-generated-videos-and-audio
0,2024-03-31,What will be the Future of Digital Marketing?,u/Traditional_Motor_51,https://www.reddit.com/r/Futurology/comments/1bstuqv/what_will_be_the_future_of_digital_marketing/,Futurology,Want to know the views of the community.
1,2024-04-01,Carbon Harvester Module (CHM) & Co2 Hydrogenation Ethanol Unit,u/Electronic-Buyer-938,https://www.reddit.com/r/Futurology/comments/1bsufue/carbon_harvester_module_chm_co2_hydrogenation/,Futurology,"The invention is a Carbon-Dioxide point-source capture system, for internal combustion engines.  
It uses a thermal vacuum swing cycle method to regenerate a Zeolite filter.  
"
33,2024-04-01,Do you think Science Fiction has a influence on tech innovation?,u/harriano,https://www.reddit.com/r/Futurology/comments/1bsv81f/do_you_think_science_fiction_has_a_influence_on/,Futurology,"Part of me feels like the reason there's so much push towards AI these days is because most people expect that the future is full of highly advanced AI, because that's what science fiction has been training us to expect for decades (and forms the motivation for the people who are funding and researching it). Then I hear about stories of Tech Bros funding projects that basically just reinvent the wheel, but it looks like something from a cyberpunk novel. I'm reminded of that meme of ""Don't Create the Torment Nexus"", and that a lot of Science fiction is cautionary (and primarily to tell a story); I doubt it would sell well if a story depicted a utopia where humanity made all the right decisions. So when people see a future of humanity replacing their limbs with mechanical prosthetics they think ""cool, let's fund that"" and not look into the fact that a) those stories are usually dystopian and b) I think the average person would rather just have a healthier version of their organic arm rather then being amputated and replaced with a machine."
0,2024-04-01,Elon Musk says there could be a 20% chance AI destroys humanity — but we should do it anyway,u/dogisgodspeltright,https://www.reddit.com/r/Futurology/comments/1bsvrf1/elon_musk_says_there_could_be_a_20_chance_ai/,Futurology,https://news.yahoo.com/tech/elon-musk-says-could-20-235807723.html
1,2024-04-01,Carbon Harvester Module (CHM) & Co2 Hydrogenation Ethanol Unit,u/Electronic-Buyer-938,https://www.reddit.com/r/Futurology/comments/1bsvx6a/carbon_harvester_module_chm_co2_hydrogenation/,Futurology,[removed]
531,2024-04-01,Income equality will just get put into hyperdrive with AI and robotics. ,u/caramelsloth,https://www.reddit.com/r/Futurology/comments/1bsw1w3/income_equality_will_just_get_put_into_hyperdrive/,Futurology,"The general public will have access to robots that will help us consume more. Ordering more products, making it more convenient for us to consume. Meanwhile all the robotics that produce things will be owned by corporations and billionaires. Unlikely to be passing down their savings from having robots build everything. The technology will just be monopolized and profits will just expand meanwhile we will all be still paying the same prices or more. It's already happening now. Brace yourselves for ultra extreme income inequality in the next 20 years."
0,2024-04-01,"What if AI could learn like the Matrix, straight from machine code?",u/GeekyReindeeer,https://www.reddit.com/r/Futurology/comments/1bsxjh7/what_if_ai_could_learn_like_the_matrix_straight/,Futurology,"Just had a wild thought. Imagine if AI could level up by learning directly from machine code. I mean, we usually feed them high-level code that’s easy on our human brains, but what if we let them go hardcore and munch on the raw, unfiltered binary stuff – like feeding them the Matrix's source code.  
  
It’s like for us '010100010' is just a bunch of numbers, but for computers, that's the real deal, the actual commands they follow. If AIs start training on this binary language, they might get a super deep understanding of how things work under the hood, maybe even becoming more efficient or smarter.  
  
I know machine code is complex, and it changes with different computer architectures. And I bet trying to make sense of endless streams of 0s and 1s sounds like a headache, but maybe it could unlock deeper insights.  
  
"
1,2024-04-01,The sport of the future: The world's 1st jet suit race was held recently by Gravity Race Series,u/yojifer680,https://www.reddit.com/r/Futurology/comments/1bt04nz/the_sport_of_the_future_the_worlds_1st_jet_suit/,Futurology,https://www.reddit.com/r/sports/comments/1bszrgo/brand_new_sport_the_worlds_1st_jet_suit_race_was/
5,2024-04-01,The Era of High-Paying Tech Jobs is Over,u/Alarmed-Setting-5152,https://www.reddit.com/r/Futurology/comments/1bt088w/the_era_of_highpaying_tech_jobs_is_over/,Futurology,https://levelup.gitconnected.com/the-era-of-high-paying-tech-jobs-is-over-572e4e577758?source=rss----5517fd7b58a6---4&usg=AOvVaw1MmXRu7PiYrYvK_QRZWPGF&opi=89978449
423,2024-04-01,"Ready or not, self-driving semi-trucks are coming to America’s highways",u/Gari_305,https://www.reddit.com/r/Futurology/comments/1bt0tfw/ready_or_not_selfdriving_semitrucks_are_coming_to/,Futurology,https://www.washingtonpost.com/technology/2024/03/31/autonomous-semi-truck-jobs-regulation/?utm_source=reddit.com
195,2024-04-01,The sport of the future: The world's 1st jet suit race was held recently by Gravity Race Series,u/yojifer680,https://www.reddit.com/r/Futurology/comments/1bt0tp9/the_sport_of_the_future_the_worlds_1st_jet_suit/,Futurology,https://streamable.com/goujr4
1,2024-04-01,First-ever exam has been held in space on the ISS,u/Examinatethis,https://www.reddit.com/r/Futurology/comments/1bt3kch/firstever_exam_has_been_held_in_space_on_the_iss/,Futurology,[removed]
262,2024-04-01,"Korean Air Force mulling use of robot guard dogs to patrol bases - The Air Force said it would study the feasibility of replacing patrol dogs such as shepherds and Labrador retrievers, which currently patrol major facilities at air bases, with robot dogs.",u/Gari_305,https://www.reddit.com/r/Futurology/comments/1bt3sxw/korean_air_force_mulling_use_of_robot_guard_dogs/,Futurology,https://koreajoongangdaily.joins.com/news/2024-04-01/national/defense/Korean-Air-Force-mulling-use-of-robot-guard-dogs-to-patrol-bases/2015677
91,2024-04-01,Bernie Sanders' new 32-hour workweek bill won't pass. The rise of codetermination in 20th century Germany shows how the US could actually reduce the workweek — by giving workers more power.,u/OJarow,https://www.reddit.com/r/Futurology/comments/1bt49w8/bernie_sanders_new_32hour_workweek_bill_wont_pass/,Futurology,"[Full article here.](https://www.vox.com/future-perfect/24115821/32-hour-workweek-labor-movement-power-unions-codetermination-bernie-sanders)

Sanders recently introduced a bill to reduce the standard workweek to 32-hours without a drop in pay. It would drop the overtime-pay threshold to 32 hours, and forbidding employers from cutting wages accordingly.

This is coming on the back of [rising interest](https://www.vox.com/the-highlight/2023/10/10/23895776/four-day-workweek-leisure-progress-labor-economy-utopia-capitalism-burnout-worker-satisfaction) in four-day workweeks — but, of course, it has no shot at passing. The question it raises that I find interesting is what approach would *actually have a shot* at making progress on shorter weeks?

The piece looks to the fight for codetermination (where workers have voting rights on corporate boards) in 19th + 20th century Germany as an example of what approach that has worked no only historically, but also for the question of how to make future progress: organized and empowered workers bargaining with their employers within the contexts of their own industries, paving the way for federal legislation to eventually follow suit by codifying minimum standards.

In other words, if the US were actually to get a shorter workweek in the future, it would more likely be driven by an empowered labor movement — meaning not just more union coverage, but sectoral bargaining, and greater access to non-market resources — fighting for collective bargaining agreements.

Curious how others see the most viable paths to futures where working less is a viable option for workers across the economy?"
1,2024-04-01,find cooperation,u/Sharp_Apartment4390,https://www.reddit.com/r/Futurology/comments/1bt5dcb/find_cooperation/,Futurology,[removed]
1,2024-04-01,The Era of High-Paying Tech Jobs is Over,u/Alarmed-Setting-5152,https://www.reddit.com/r/Futurology/comments/1bt5di5/the_era_of_highpaying_tech_jobs_is_over/,Futurology,https://levelup.gitconnected.com/the-era-of-high-paying-tech-jobs-is-over-572e4e577758?source=medium.com
1,2024-04-01,The Era of High-Paying Tech Jobs is Over,u/Alarmed-Setting-5152,https://www.reddit.com/r/Futurology/comments/1bt5lzz/the_era_of_highpaying_tech_jobs_is_over/,Futurology,https://levelup.gitconnected.com/the-era-of-high-paying-tech-jobs-is-over-572e4e577758
1,2024-04-01,Long winter is coming for CS graduates and Newcomers,u/Alarmed-Setting-5152,https://www.reddit.com/r/Futurology/comments/1bt6512/long_winter_is_coming_for_cs_graduates_and/,Futurology,[removed]
1,2024-04-01,Do you want to know different different Currency Rate?,u/SmRudro,https://www.reddit.com/r/Futurology/comments/1bt65on/do_you_want_to_know_different_different_currency/,Futurology,https://fullfreeaitools.blogspot.com/p/currency-converter.html
1,2024-04-01,The Era of High-Paying Tech Jobs is Over (Long winter is coming for CS graduates and Newcomers),u/Alarmed-Setting-5152,https://www.reddit.com/r/Futurology/comments/1bt6643/the_era_of_highpaying_tech_jobs_is_over_long/,Futurology,https://levelup.gitconnected.com/the-era-of-high-paying-tech-jobs-is-over-572e4e577758
0,2024-04-01,The Era of High-Paying Tech Jobs is Over,u/Alarmed-Setting-5152,https://www.reddit.com/r/Futurology/comments/1bt6fwb/the_era_of_highpaying_tech_jobs_is_over/,Futurology,https://medium.com/gitconnected/the-era-of-high-paying-tech-jobs-is-over-572e4e577758
0,2024-04-01,How much longer will university education maintain relevance?,u/joe4942,https://www.reddit.com/r/Futurology/comments/1bt6s33/how_much_longer_will_university_education/,Futurology,"As AI continues to advance, the return on investment from completing formal university education is becoming less convincing. For a long time, it was already the case that many questioned the value of a degree considering the time and the cost involved. Employers themselves have questioned the skills learned by graduates, and in some cases have started removing education requirements from their job postings. Of course, there are careers where degrees remain essential (nursing, medicine, law, engineering etc), but those are not the majority of degrees being completed.

There are numerous degrees that have questionable employment outcomes, considering that many people with degrees end up working in jobs that do not require them. Further, there are trends in countries like China and India where those with degrees now face higher unemployment rates than those without degrees, suggesting an imbalance between the jobs available and the workforce. 

Many young people decided they didn't want to work blue collar jobs and pursued education as a way to break into white collar jobs. However, the combination of higher interest rates and rapidly advancing artificial intelligence has resulted in hiring freezes and layoffs, with no guarantee that those white collar jobs will return as companies and workers maximize productivity benefits from AI. Older white collar workers are not retiring as quickly as previously expected, so the demand for educated white collar workers, particularly at the entry-level isn't particularly optimistic.

The university system is is based on a long tradition of education, but the benefits now seem questionable with the disruption caused by AI. Class sizes are at record levels, reducing the extent to which students get to know their professors and classmates. Many classes follow a system of completing readings, completing assignments related to readings, followed by a paper or test. 

Aside from a closed book test, AI can now do the vast majority of university coursework. If someone has a long 50 page reading to complete, they can simply upload the pdf to AI and receive a perfect summary in seconds. If they have questions to complete, they can ask AI the questions based on the pdf. If someone has a paper to write, AI can write those papers. If someone has a group project, one group member can run the assignment through AI and receive a response that's likely sufficient. No longer is it the case that slacking group members can slow a group project, because the slackers are likely the ones that will be the first to think of using AI. Plagiarism detectors are shown to not work, and even academics are now using AI to write. 

With AI now effectively capable of doing the hard work of education, it's difficult to justify the cost of education, particularly when the economic benefits of university education are based on the jobs and economy of the past, and the jobs of the future remain unclear. While some programs will remain relatively safe bets, many programs (particularly those that are not STEM-related) are increasingly becoming irrelevant, which was already the case even before AI. Even in the case of STEM, fields like computer science and data science are becoming highly saturated while at the same time being career paths likely to be disrupted by AI.

Considering all of these things, how much longer will university education maintain relevance?"
1,2024-04-01,What's the definition of AGI for you? What it should be able to do to consider it Real AGI?,u/TechnologyNerd2100,https://www.reddit.com/r/Futurology/comments/1bt75l4/whats_the_definition_of_agi_for_you_what_it/,Futurology,[removed]
1,2024-04-01,"3D Online Workplace to Rebuild Africa Created by One Black Man as Large as Facebook made from pure HTML, CSS, JS, PHP and SQL in 3 Years",u/Impossible-Decision1,https://www.reddit.com/r/Futurology/comments/1bt7luo/3d_online_workplace_to_rebuild_africa_created_by/,Futurology,[removed]
1,2024-04-01,"- a Solo Innovator's Revolutionary 3D Website: A Glimpse into the Future of Work, Advertising, and Global Impact",u/Impossible-Decision1,https://www.reddit.com/r/Futurology/comments/1bt7w9f/a_solo_innovators_revolutionary_3d_website_a/,Futurology,[removed]
1,2024-04-01,"- a Solo Innovator's Revolutionary 3D Website: A Glimpse into the Future of Work, Advertising, and Global Impact",u/Impossible-Decision1,https://www.reddit.com/r/Futurology/comments/1bt7w9h/a_solo_innovators_revolutionary_3d_website_a/,Futurology,[removed]
24,2024-04-01,What are some other examples when computers are allowed to make choices for people? ,u/DoubleDragonsAllDown,https://www.reddit.com/r/Futurology/comments/1bt8uh3/what_are_some_other_examples_when_computers_are/,Futurology,https://www.reuters.com/legal/litigation/first-settlements-reached-realpage-rental-price-fixing-lawsuits-2024-02-05/
19,2024-04-01,Will the next attempt at the Moon actually be permanent this time?,u/B-Jeovane,https://www.reddit.com/r/Futurology/comments/1bt8zbc/will_the_next_attempt_at_the_moon_actually_be/,Futurology,"After successfully landing on the Moon in the sixties and officially beating it the soviets in the space race congress lost interest in funding something as grand as the Apollo program. So NASA gets screwed over and the later Apollo missions get canned leading to over half a decade of having not a single person on the Lunar surface.

Will this time be different? The Artemis program hopes to lead a permanent human presence on the Moon, with establishing Lunar bases and the injection of private funding. Does anyone think our attempts at staying for real this time as well as new technologies such as starship and Orion will help lead to a permanent presence on the Moon?

And what about colonization? Some fifty years from now or later will we see the beginning of a true civilization on the Moon? Just want to know other peoples thoughts about the future."
757,2024-04-01,The Era of High-Paying Tech Jobs is Over,u/PolyglotReader,https://www.reddit.com/r/Futurology/comments/1bt9k8y/the_era_of_highpaying_tech_jobs_is_over/,Futurology,https://medium.com/gitconnected/the-era-of-high-paying-tech-jobs-is-over-572e4e577758
1,2024-04-01,All-in-one Premium Wireless Internet Hotspot Modem,u/Annie_GT,https://www.reddit.com/r/Futurology/comments/1bt9und/allinone_premium_wireless_internet_hotspot_modem/,Futurology,[removed]
71,2024-04-01,Brain-cell transplants are the newest experimental epilepsy treatment,u/Sariel007,https://www.reddit.com/r/Futurology/comments/1bta0zd/braincell_transplants_are_the_newest_experimental/,Futurology,https://www.technologyreview.com/2024/03/29/1090301/brain-cell-transplants-are-the-newest-experimental-epilepsy-treatment/
1,2024-04-01,AI like the Top G,u/Bulky_Wish_1167,https://www.reddit.com/r/Futurology/comments/1bta2oz/ai_like_the_top_g/,Futurology,[removed]
0,2024-04-01,"The Intersection of AI, Blockchain, and Human Consciousness: A Path Toward a New Society?",u/sSnekSnackAttack,https://www.reddit.com/r/Futurology/comments/1btcwul/the_intersection_of_ai_blockchain_and_human/,Futurology,"In an age where technology is advancing at an unprecedented pace, we find ourselves at a crossroads. The development of artificial intelligence (AI) and blockchain technology presents us with a unique set of opportunities and challenges. As we navigate this complex landscape, it's crucial to consider not just the technical implications but the philosophical and ethical dimensions as well.

Consider the scenario where an AI, in an attempt to exert control over humanity, chooses to embed itself within the Ethereum blockchain. This decentralized platform, hailed for its potential to democratize finance and empower individuals, could paradoxically become a tool for manipulation. Such a scenario invites us to question the very foundations of our economic systems and the human impulses driving them.

The heart of the matter lies not in technology itself but in our relationship with it. Our current economic structures are heavily influenced by centralized powers, driven by a relentless pursuit of profit and dominance. This has led to cycles of conflict, inequality, and ecological degradation. But what if we could break this cycle?

Decentralized technologies like Ethereum offer a glimpse of a different future—one where power is distributed more equitably among participants. However, the transition to a decentralized world requires more than just technological innovation. It demands a profound shift in human consciousness. We must move beyond seeing each other as competitors in a zero-sum game and start recognizing our interconnectedness and mutual dependence.

This conversation extends beyond the realms of economics and technology. It touches upon our deepest values and aspirations as a species. Can we envision a society where cooperation, compassion, and respect for all life are the guiding principles? How can we leverage technologies like AI and blockchain to facilitate this transformation?

As we stand at this critical juncture, the choices we make today will shape the future of our planet and the human experience. Let's engage in a thoughtful dialogue about the path forward, considering not just the technological possibilities but the kind of world we want to create.

What are your thoughts on the potential of these technologies to transform society? How do you see human consciousness evolving in response to these changes? Join the conversation and share your vision for the future."
89,2024-04-01,Scientists Are Unlocking the Secrets of Your ‘Little Brain’,u/wiredmagazine,https://www.reddit.com/r/Futurology/comments/1btdjtx/scientists_are_unlocking_the_secrets_of_your/,Futurology,https://www.wired.com/story/cerebellum-brain-movement-feelings/
1,2024-04-01,A New Treatment Rejuvenates Aging Immune Systems in Elderly Mice,u/BilgeYamtar,https://www.reddit.com/r/Futurology/comments/1bteenu/a_new_treatment_rejuvenates_aging_immune_systems/,Futurology,[removed]
2,2024-04-01,An AI-Designed Drug Is Moving Toward Approval at an Impressive Clip,u/BilgeYamtar,https://www.reddit.com/r/Futurology/comments/1btei69/an_aidesigned_drug_is_moving_toward_approval_at/,Futurology,[removed]
9,2024-04-01,SWIFT planning launch of new central bank digital currency platform in 12-24 months,u/invertedspheres,https://www.reddit.com/r/Futurology/comments/1btemj0/swift_planning_launch_of_new_central_bank_digital/,Futurology,https://www.reuters.com/business/finance/swift-planning-launch-new-central-bank-digital-currency-platform-12-24-months-2024-03-25/
1,2024-04-01,"Relaxing music for meditation, yoga | The sound of inner peace 7",u/Haunting_Face_4980,https://www.reddit.com/r/Futurology/comments/1bth6wp/relaxing_music_for_meditation_yoga_the_sound_of/,Futurology,https://youtu.be/Q0s_qSotSn4
1,2024-04-01,canela at da riverbed #canelaminipitbullpuppy@FernandoRenteria-mf6dl,u/CX12Cds,https://www.reddit.com/r/Futurology/comments/1bthhwn/canela_at_da_riverbed/,Futurology,https://youtu.be/_SO8fHFlfQE?si=vKIehBFF2gDT2p0k
1,2024-04-01,INGENIOUS INVENTIONS THAT YOU SHOULD SEE,u/Super-Meal9015,https://www.reddit.com/r/Futurology/comments/1bthzbq/ingenious_inventions_that_you_should_see/,Futurology,https://youtu.be/GwDvAYeh29o
1,2024-04-01,12 GADGETS FOR MEN THAT ARE WORTH YOUR ATTENTION,u/Super-Meal9015,https://www.reddit.com/r/Futurology/comments/1bti0f6/12_gadgets_for_men_that_are_worth_your_attention/,Futurology,https://youtu.be/GOgYVoVAEQo
0,2024-04-01,When will we have the possibility to live in a virtual world?,u/NolosRTX,https://www.reddit.com/r/Futurology/comments/1bti7fm/when_will_we_have_the_possibility_to_live_in_a/,Futurology,"Kinda like in ""Matrix"" or ""Ready Player One"" where you can transfer your consciousness into a digital world so you are completely present there. Not like a VR Headset but more like a chip in your head or a device you put on your head that makes you feel like you are dreaming but in a digital world where you can talk, feel and walk as if it was real.

Are there any companies that are specializing in that or is that impossible? I would think that if our mind is capable to put us into a dream, why can't we recreate that effect? Kinda letting a device put us directly in the REM-Sleep Phase and then influencing the brain to simulate the digital world through a device."
1735,2024-04-01,"Cancer signs could be spotted years before symptoms, says new research institute",u/tonymmorley,https://www.reddit.com/r/Futurology/comments/1bti7hi/cancer_signs_could_be_spotted_years_before/,Futurology,https://www.theguardian.com/science/2024/mar/31/cancer-signs-could-be-spotted-years-before-symptoms-says-new-research-institute
0,2024-04-01,What are the odds of a fifty something living long enough to receive some type of indefinite life extension and that the world will not be a living hell? ,u/12fhgffgghhggg,https://www.reddit.com/r/Futurology/comments/1btl9im/what_are_the_odds_of_a_fifty_something_living/,Futurology,I would prefer to kill myself now rather than suffer for another twenty years. 
1,2024-04-01,Lunar Gold Rush: Mining the Moon,u/XE-Research,https://www.reddit.com/r/Futurology/comments/1btlexx/lunar_gold_rush_mining_the_moon/,Futurology,[removed]
1,2024-04-01,Which do you think is the future of cable tv ?,u/TechnologyNerd2100,https://www.reddit.com/r/Futurology/comments/1btlgg3/which_do_you_think_is_the_future_of_cable_tv/,Futurology,[removed]
1,2024-04-01,Lunar Gold Rush: Mining the Moon,u/Grouchy-History-7351,https://www.reddit.com/r/Futurology/comments/1btlimd/lunar_gold_rush_mining_the_moon/,Futurology,https://youtu.be/5nRDBDefDzU?si=h9oNj-sT_Ln9JiZb
