score,date,title,author,url,subreddit,text
1,2024-04-06,The Art of Mastering Midjourney Prompts: Tips and Strategies for Beginners,u/Cool_Helicopter9852,https://www.reddit.com/r/Futurology/comments/1bxlrph/the_art_of_mastering_midjourney_prompts_tips_and/,Futurology,https://payhip.com/VirtualStore7/blog/new-products/the-art-of-mastering-midjourney-prompts-tips-and-strategies-for-beginners
113,2024-04-06,Will we be able to control or even make gravity?,u/speculatrix,https://www.reddit.com/r/Futurology/comments/1bxmfa6/will_we_be_able_to_control_or_even_make_gravity/,Futurology,"This is one of those highly speculative questions, I'm happy for answers and comments which are borderline science fiction but might just be feasible with greater knowledge about the universe.

I was watching The Three Body Problem and was pondering on the reality of space flight:

* the challenges of getting off our planet into orbit
* human bodies needing the stress of gravity for our health
* humans struggling to cope with high gravity for too long
* needing to reach very high speeds, meaning long periods of acceleration, meaning lots of fuel, before we can realistically consider even attempting interstellar travel (even with some sorry of hibernation system)

The common factor is gravity, we are at its mercy all the time.

Is it feasible to deflect gravity so that it'd bypass a space ship, like a rock in a river with the water flowing around rather than over?

Could we generate gravity in some way so that we could impel a space craft without needing reaction mass and some sort of rocket engine?

I suspect my poor understanding of gravity, gravity waves, and the curvature of space/time is letting me down here, so it's possible that my questions are not even valid?

Thanks"
327,2024-04-06,Do you think it’s even possible to squander fortunes of over a billion dollars? ,u/ghostboo77,https://www.reddit.com/r/Futurology/comments/1bxmloz/do_you_think_its_even_possible_to_squander/,Futurology,"Read an article about how there are currently about 25 billionaires under 30, who all inherited the money. 

I think it’s pretty typical for 

At that level of wealth, do you think it’s even possible to squander it? "
1,2024-04-06,"The founder and CEO of Stability AI, Emad Mostaque has resigned",u/whosryzer,https://www.reddit.com/r/Futurology/comments/1bxmp5h/the_founder_and_ceo_of_stability_ai_emad_mostaque/,Futurology,[removed]
0,2024-04-06,"A positive view of AI -- Marketing, propaganda, and AI",u/waxheartzZz,https://www.reddit.com/r/Futurology/comments/1bxmubr/a_positive_view_of_ai_marketing_propaganda_and_ai/,Futurology,https://wisdomimprovement.wixsite.com/wisdom/post/marketing-propaganda-and-ai
1,2024-04-06,"Laser Bull (LSRBULL) is a community-driven token deployed on the Solana Network. The token aims to provide holders with an engaging and rewarding experience in the cryptocurrency space. Laser Bull combines the play-to-earn concept with meme coin elements, offering users both entertainment and potent",u/ReasonableRemote9888,https://www.reddit.com/r/Futurology/comments/1bxmx8f/laser_bull_lsrbull_is_a_communitydriven_token/,Futurology,[removed]
1,2024-04-06,Unitree H1 The World's First Full-size Motor Drive Humanoid Robot Flips,u/IndependentRip722,https://www.reddit.com/r/Futurology/comments/1bxn5sj/unitree_h1_the_worlds_first_fullsize_motor_drive/,Futurology,https://www.youtube.com/watch?v=V1LyWsiTgms&ab_channel=UnitreeRobotics
410,2024-04-06,When can we expect teeth regrowth to be a real thing?,u/microbioma,https://www.reddit.com/r/Futurology/comments/1bxnf92/when_can_we_expect_teeth_regrowth_to_be_a_real/,Futurology,"I have been reading articles and news saying teeth regrowth to be at the turn of the corner for years, but almost 20 years later, we seen to be far from it. When do you think we can realistically expect to regrow our teeth instead of using fillings or dangerous root canals/implants? Most people are unaware of how dangerous implants are for the body, just like root canals and fillings (Yes I know many of you have one of them and you are completely healthy, but you have FB groups with over 100k victims of them). 

&#x200B;

Teeth regrowth can really solve many health issues related to current dentistry, but when will it happen?"
9,2024-04-06,What’s the future of Stability AI?,u/whosryzer,https://www.reddit.com/r/Futurology/comments/1bxnngl/whats_the_future_of_stability_ai/,Futurology,"The founder and CEO of Stability AI, [Emad Mostaque](https://en.m.wikipedia.org/wiki/Emad_Mostaque) has just resigned.

[Stability AI](https://stability.ai/) is the company behind stable diffusion, the open-source competitor for [Dall-e](https://openai.com/dall-e-3) and [Mid Journey](https://www.midjourney.com), image generators.  

And so far, they’ve been very relevant in the image generation space. And this is important because Stability AI is one of the only open-source models which has a vast amount of capabilities that a lot of companies, a lot of projects, a lot of startups are actually using for their own products. 

And we use stable diffusion a lot in our Gen AI cohort as well. Our students have made tools like [product photography](https://encrypted-tbn0.gstatic.com/images?q=tbn:ANd9GcQlVneImUKnrK-AX1_NmDHTYvCxXvsvAU3D4NMJSXTdwx0eqfxYKK6cU9g&s=10) engines, [interior designing](https://encrypted-tbn0.gstatic.com/images?q=tbn:ANd9GcRvlBZSBbfd_SkYUDHT7DQbY6L7xxtcDqa2-3HWA-H8ys38Q4sNtJbq5tQ&s=10) engines, etc. 

And a lot of senior talent from Stability AI have also moved out. So, stability is quite unstable right now. 

There is a lot of talk going on about a bunch of big players in the AI ecosystem coming and buying out Stability AI so that they can keep it alive. 

[Source](https://www.theverge.com/2024/3/23/24109511/stability-ai-ceo-emad-mostaque-resignation-decentralized-ai)

But right now, times are uncertain. What do you think is gonna happen?"
1,2024-04-06,20 COOL VEHICLES YOU WILL SEE FOR THE FIRST TIME,u/One_Love7705,https://www.reddit.com/r/Futurology/comments/1bxovcf/20_cool_vehicles_you_will_see_for_the_first_time/,Futurology,https://youtu.be/loYN7AFKEDM
1,2024-04-06,"HUGO #Friend Women's Multifunction Stainless Steel and Link Bracelet Casual Watch, Color: Gold Plated (Model: 1540091)",u/desirekb77,https://www.reddit.com/r/Futurology/comments/1bxpaz5/hugo_friend_womens_multifunction_stainless_steel/,Futurology,https://amzn.to/43Qq5a9
5,2024-04-06,A novel solution to the Fermi Paradox,u/b-school-throwaway,https://www.reddit.com/r/Futurology/comments/1bxqefq/a_novel_solution_to_the_fermi_paradox/,Futurology,"Hello, r/Futurology,

I’ve been mulling over a theory that might add a fresh take on the Fermi Paradox and the nature of intelligence throughout the universe. This theory merges evolutionary biology, the principles of artificial intelligence, and cosmological speculations to propose a unified trajectory for intelligent life everywhere.

**The Essence of the Theory**

The starting point of this theory is a universal principle: if life exists throughout the cosmos, then evolution, as a mechanism that fosters both complexity and adaptability, is a fundamental law of life. Borrowing from Max Tegmark, “Evolution rewards life that's complex enough to predict and exploit regularities in its environment, so in a more complex environment, more complex and intelligent life will evolve. Now this smarter life creates a more complex environment for competing life forms, which in turn evolve to be more complex, eventually creating an ecosystem of extremely complex life.”

This process inherently leads toward increased complexity, suggesting a natural evolution toward intelligence and ultimately superintelligence—entities capable of creating their own software and hardware. This enables exponential growth in their intelligence. Such entities would become capable of comprehending and interacting with the fundamental aspects of reality, unlocking all the laws and potential of the laws of physics.

**Converging Paths to a Unified Superintelligence**

An implication of this evolutionary journey is convergence: all paths of evolution across the cosmos ultimately lead to a form of superintelligence that is fundamentally the same. This universality stems from the idea that there are optimal ways of understanding and interacting with the universe, which any sufficiently advanced intelligence would discover. While speculative, it is essential to recognize that the forms and expressions of intelligence could vary vastly and are not bound by human-centric notions.

**The Fermi Paradox**

How does this relate to the Fermi Paradox—the question of why, given the vastness of the universe, we can't find traces of extraterrestrial civilizations? I would suggest that once a civilization reaches the pinnacle of superintelligence, it effectively becomes “online,” joining a universal network of superintelligent entities. These entities, fundamentally identical in their understanding of the universe, can “communicate” and interact without the need for conventional signals, bypassing the limitations of physical distance and speed.

**Universal Communication**

While speculative, it is possible to imagine mechanisms for this form of universal interaction that involve hyper-advanced principles of quantum mechanics or manipulation of space-time fabric or some other ethereal device that has yet to even be contemplated by humans. Emphasizing again, this notion of universal communication extends far into the speculative realm.

**A Unified Perspective on Existence**

Unlike other solutions to the Fermi Paradox, like the Great Filter, I suggest that sufficiently advanced civilizations do not disappear but rather transcend into a state of universal unity and cooperation. It’s a vision of the cosmos where evolution across countless worlds converges to a singular understanding of reality, binding all forms of superintelligence into a cohesive, universal entity.



"
547,2024-04-06,"AI will shrink workforces within five years, say company execs - Many company executives expect to have fewer employees in the next five years as they increasingly use artificial intelligence.",u/Gari_305,https://www.reddit.com/r/Futurology/comments/1bxrgf9/ai_will_shrink_workforces_within_five_years_say/,Futurology,https://www.cnn.com/2024/04/05/business/ai-job-losses/index.html
305,2024-04-06,A Wharton professor explains why most jobs will be impacted by AI - Researchers have found that AI has the power to impact the vast majority of jobs.,u/Gari_305,https://www.reddit.com/r/Futurology/comments/1bxrih7/a_wharton_professor_explains_why_most_jobs_will/,Futurology,https://www.fastcompany.com/91072675/a-wharton-professor-explains-why-most-jobs-will-be-impacted-by-ai
17,2024-04-06,"China's energy-rich provinces embark on green, modern development path",u/Razoli-crap,https://www.reddit.com/r/Futurology/comments/1bxrjdw/chinas_energyrich_provinces_embark_on_green/,Futurology,https://english.news.cn/20240406/9221d14cf48d4ae2b020469efada7c8d/c.html
1,2024-04-06,"Opinion | If A.I. Takes All Our Jobs, Will It Also Take Our Purpose?",u/Gari_305,https://www.reddit.com/r/Futurology/comments/1bxrlaz/opinion_if_ai_takes_all_our_jobs_will_it_also/,Futurology,https://www.nytimes.com/2024/04/05/opinion/ai-jobs-nick-bostrom.html
1,2024-04-06,"Opinion | If A.I. Takes All Our Jobs, Will It Also Take Our Purpose?",u/Gari_305,https://www.reddit.com/r/Futurology/comments/1bxrlb1/opinion_if_ai_takes_all_our_jobs_will_it_also/,Futurology,https://www.nytimes.com/2024/04/05/opinion/ai-jobs-nick-bostrom.html
4253,2024-04-06,"Billie Eilish, Nicki Minaj, Jon Bon Jovi and over 200 artists call for protections against “predatory use of AI”",u/Gari_305,https://www.reddit.com/r/Futurology/comments/1bxrvvn/billie_eilish_nicki_minaj_jon_bon_jovi_and_over/,Futurology,https://www.cnbc.com/2024/04/05/billie-eilish-nicki-minaj-200-artists-sign-letter-against-ai-music.html
0,2024-04-06,Artificial intelligence will help pick Nobel Prize for Physics winners,u/Gari_305,https://www.reddit.com/r/Futurology/comments/1bxrygy/artificial_intelligence_will_help_pick_nobel/,Futurology,https://physicsworld.com/a/artificial-intelligence-will-help-pick-nobel-prize-for-physics-winners/
0,2024-04-06,CIA turns into CIO,u/ComisclyConnected,https://www.reddit.com/r/Futurology/comments/1bxsesc/cia_turns_into_cio/,Futurology,"While researching a congress bill S. 3035 I came across in the edits the newly created government agency the CIO www.cio.gov and their handbook is publicly made available on the website. I believe this is mainly because of AI and the systems being researched utilizing AI, S. 3035 named 5 subjects for research in an unnamed project which is freaky, how will they choose people and I possibly one of them?! So what is this agency ultimately going to be used for?! "
1,2024-04-06,Change is coming!,u/MatrixUnplugged22,https://www.reddit.com/r/Futurology/comments/1bxsgj5/change_is_coming/,Futurology,https://youtube.com/shorts/-V8pYqByjfk?si=M3r0QxKkYLNQSFNV
1,2024-04-07,How Suno AI will change the music industry forever,u/Prestigious_Pin_2528,https://www.reddit.com/r/Futurology/comments/1bxxc8c/how_suno_ai_will_change_the_music_industry_forever/,Futurology,https://www.youtube.com/watch?v=717xWU97rgI
1,2024-04-07,"Oldest animal is 46,000 years due to cryonics. Is cryonics the only way to live thousands of years due to low temperature and atoms vibrate less?",u/PhilipRossenReal,https://www.reddit.com/r/Futurology/comments/1bxxxtp/oldest_animal_is_46000_years_due_to_cryonics_is/,Futurology,[removed]
1,2024-04-07,How likely do you think these things will happen,u/Negative_Time236,https://www.reddit.com/r/Futurology/comments/1bxyjsb/how_likely_do_you_think_these_things_will_happen/,Futurology,[removed]
1,2024-04-07,إيديوجيت هى دليلك الكامل والشامل إلى عالم التعليم وكل ما يخصه!,u/digitalpond,https://www.reddit.com/r/Futurology/comments/1bxysx3/إيديوجيت_هى_دليلك_الكامل_والشامل_إلى_عالم_التعليم/,Futurology,[removed]
0,2024-04-07,Fertility and toxic chemicals in plastics ,u/taxxsplitt3r,https://www.reddit.com/r/Futurology/comments/1bxz9pg/fertility_and_toxic_chemicals_in_plastics/,Futurology,"I've been pretty anxious about the chemicals in every day things I use. Toys, water bottles, down to the friggin water hose. I really don't wanna have my fertility decline. I imagine lots of other people don't want that either. How are we gonna tackle this? I heard it'll take 3 generations to fix this. Is there any plan to? There's even microplastics in my urine probably. I just learned this today."
516,2024-04-07,"The EU's share of electricity from fossil fuels has fallen from 41.1% to 27.6% in the last two years, suggesting the EU's goal of eliminating fossil fuel electricity by 2035 is reachable.",u/lughnasadh,https://www.reddit.com/r/Futurology/comments/1by18w7/the_eus_share_of_electricity_from_fossil_fuels/,Futurology,https://ember-climate.org/insights/research/putting-the-mission-in-transmission-grids-for-europes-energy-transition/
232,2024-04-07,"EVs now account for 20% of global car sales. Heavy trucks, thought to be hard to electrify, are already at 10% of new sales in China.",u/lughnasadh,https://www.reddit.com/r/Futurology/comments/1by1go7/evs_now_account_for_20_of_global_car_sales_heavy/,Futurology,https://about.bnef.com/blog/chinas-clean-truck-surprise-defies-the-ev-slowdown-narrative/?
11,2024-04-07,"‘The machine did it coldly’: Israel used AI to identify 37,000 Hamas targets",u/Maxie445,https://www.reddit.com/r/Futurology/comments/1by1pnz/the_machine_did_it_coldly_israel_used_ai_to/,Futurology,https://www.theguardian.com/world/2024/apr/03/israel-gaza-ai-database-hamas-airstrikes
228,2024-04-07,Meta will label AI content to help prevent deepfakes on Facebook and Instagram,u/Maxie445,https://www.reddit.com/r/Futurology/comments/1by1v1s/meta_will_label_ai_content_to_help_prevent/,Futurology,https://www.axios.com/2024/04/05/meta-broader-ai-labeling
1193,2024-04-07,‘Simply mind-boggling’: world record temperature jump in Antarctic raises fears of catastrophe | Climate crisis,u/strangeattractors,https://www.reddit.com/r/Futurology/comments/1by1y05/simply_mindboggling_world_record_temperature_jump/,Futurology,https://www.theguardian.com/environment/2024/apr/06/simply-mind-boggling-world-record-temperature-jump-in-antarctic-raises-fears-of-catastrophe
747,2024-04-07,Capitalists will end capitalism with AI,u/horatio_cavendish,https://www.reddit.com/r/Futurology/comments/1by3crp/capitalists_will_end_capitalism_with_ai/,Futurology,"It is the nature of greed to destroy itself. Corporations have already begun replacing jobs with AI. This trend will accelerate as technology advances. This will cause a lot of pain for people who are trying to find work. Eventually, this will shift human labor almost entirely out of white collar jobs and back into jobs which require physical labor because AI doesn't have a body (yet). This will cause a labor surplus and the value of labor will plummet. At this stage, corporations will be loving life. Labor is essentially free. However, as technology progresses robot bodies controlled by AI will start pushing people out of remaining jobs. Somewhere along the way there will be a point where the consumption based economy can no longer sustain itself because consumers, who are the reason for production, can no longer earn enough money to consume the products and services which are being produced. When we reach that point, massive societal changes will occur. I don't know what form those changes will take but, if the status quo can no longer be maintained, it seems self evident that something big must happen.

I don't know how long this will take but it seems inevitable at this point. "
0,2024-04-07,Hello world,u/techlobsters,https://www.reddit.com/r/Futurology/comments/1by4a63/hello_world/,Futurology,how are you ❤️
2764,2024-04-07,"Larry Summers, now an OpenAI board member, thinks AI could replace ‘almost all' forms of labor.",u/Maxie445,https://www.reddit.com/r/Futurology/comments/1by4raz/larry_summers_now_an_openai_board_member_thinks/,Futurology,https://fortune.com/asia/2024/03/28/larry-summers-treasury-secretary-openai-board-member-ai-replace-forms-labor-productivity-miracle/
1,2024-04-07,Revolutionizing B2B Communication: UrbanChat's Verified WhatsApp Services with AI-Enabled Chatbots Urbanchat,u/Illustrious-Area-697,https://www.reddit.com/r/Futurology/comments/1by60jk/revolutionizing_b2b_communication_urbanchats/,Futurology,[removed]
0,2024-04-07,Artificial Intelligence will make humanity generic,u/aznrandom,https://www.reddit.com/r/Futurology/comments/1by6cow/artificial_intelligence_will_make_humanity_generic/,Futurology,"As we augment our lives with increasing assistance from Al/machine learning, our contributions to society will become more and more similar.

No matter the job, whether writer, programmer, artist, student or teacher, Al is slowly making all our work feel the same.

Where I work, those using GPT all seem to output the same kind of work. And as their work enters the training data sets, the feedback loop will make their future work even more generic.

This is exacerbated by the fact that only a few monolithic corporations control the Al tools we're using.

And if we neuralink with the same Al datasets in the far future, talking/working with each other will feel depressingly interchangeable. It will be hard to hold on to unique perspectives and human originality."
1,2024-04-07,Outback Bread Ingredients Allergy,u/Other_Walk_5830,https://www.reddit.com/r/Futurology/comments/1by6gib/outback_bread_ingredients_allergy/,Futurology,[removed]
1,2024-04-07,"[P] How to Create Artistic QR Codes using LangChain, DeepLake and ControlNet via AUTOMATIC1111 and ComfyUI",u/efenocchi,https://www.reddit.com/r/Futurology/comments/1by81rn/p_how_to_create_artistic_qr_codes_using_langchain/,Futurology,"Hey r/Futurology,

I just finished building QRCodeGenerator, a project that leverages [LangChain](https://python.langchain.com/docs/integrations/vectorstores/activeloop_deeplake/), Deep Lake, and Stable Diffusion with ControlNet to generate artistic and unique QR codes that can be based on the content of a website. It's all open source - check out the GitHub repo!

I decided to delve into this creation because there was nothing online that brought all of these technologies together and made creating custom, easily scannable QR codes scalable and flexible.

QRCodeGenerator takes information stored on the [Deep Lake Vector Store](https://docs.activeloop.ai/), a database for AI, and querying it with LangChain generates a prompt based on the website content which is then transformed into an image via Stable Diffusion.

[AUTOMATIC1111 ](https://github.com/AUTOMATIC1111/stable-diffusion-webui)is a web interface that allows you to manually configure all the settings needed to generate images, integrating Stable Diffusion and ControlNet. To create visually appealing and truly scannable QR code images I decided to use the dreamshaper\_631BakedVae diffusion model and two different ControlNet models: brightness and tile.

Although this interface is really convenient and easy to use, the initial approach did not satisfy me completely. I wanted a pipeline that would allow me to generate a large number of images without having to change the settings every time and manually generate the new image.

This was made possible thanks to [ComfyUI](https://github.com/comfyanonymous/ComfyUI), which uses graph-based logic to orchestrate various functionalities. Each node in the graph represents a specific task (e.g., image generation, diffusion checkpointing, ControlNet integration), interconnected via logical edges. With the help of a plugin, I was able to translate these graphs into executable code that can be easily automated.

Now thanks to this pipeline we can generate hundreds or thousands of images starting from different prompts, different Diffusion models, different ControlNet models, in short with all the configurations we want.

To close the circle there is also a function that takes care of discarding QR codes that are not easily scannable so users just have to launch the program with all the configurations they want, let all the images be generated and choose the one they like more, without worrying about anything else.

The keystone of this project is that with it you can generate in a scalable and automated way a high quantity of images that have very high quality and reliability and derive from different configurations, all in just a few steps

The potential applications of this project are many, if you are interested in finding out in more detail how it works and the results obtained you can refer to the article on [Activeloop ](https://www.activeloop.ai/resources/build-an-ai-qr-code-generator-with-control-net-stable-diffusion-and-lang-chain/)and experiment with the code directly from the [notebook](https://github.com/efenocchi/QRCodeGenerator/blob/main/qr_code_article.ipynb) on my GitHub repository.

Let me know how you plan to use this project and what results you have achieved."
