score,date,title,author,url,subreddit,text
1,2023-09-16,Italy's public debt reaches record high in July: Bank of Italy,u/Pilast,https://www.reddit.com/r/Economics/comments/16k55o5/italys_public_debt_reaches_record_high_in_july/,Economics,https://english.news.cn/20230916/ca9d85f0a181428abadd4be5909410e5/c.html
1,2023-09-16,Top 20 Rice Producing Countries In The World,u/Lucianomende,https://www.reddit.com/r/Economics/comments/16k5q04/top_20_rice_producing_countries_in_the_world/,Economics,https://youtube.com/watch?v=wK-YspcuFoU&si=oclrZ6gEKiSYrZ4D
1,2023-09-16,"Climate change solutions that focus on goods and tech, like replacing oil with solar power, fail to account for the full picture — the interconnectedness of everything. Impacts on our environment must be incorporated into economic modeling. Important thesis proposed by Cambridge economist Dagrupta.",u/davida_usa,https://www.reddit.com/r/Economics/comments/16k7pxs/climate_change_solutions_that_focus_on_goods_and/,Economics,https://assets.publishing.service.gov.uk/government/uploads/system/uploads/attachment_data/file/962785/The_Economics_of_Biodiversity_The_Dasgupta_Review_Full_Report.pdf
1,2023-09-16,Community Thrilled: UNISWAP Protocol Unveils Token Distribution Plan!,u/naomii235,https://www.reddit.com/r/Economics/comments/16k7w59/community_thrilled_uniswap_protocol_unveils_token/,Economics,https://twitter.com/Protocol_Uni/status/1701462089221734470?s=4
1,2023-09-16,I shared a crash course about Python Financial Analysis on YouTube,u/[deleted],https://www.reddit.com/r/Economics/comments/16k8x8d/i_shared_a_crash_course_about_python_financial/,Economics,
1,2023-09-16,The rise of surge pricing: ‘It will eventually be everywhere’,u/jellyfishezie,https://www.reddit.com/r/Economics/comments/16k9bv8/the_rise_of_surge_pricing_it_will_eventually_be/,Economics,https://www.ft.com/content/d0e3bcb5-b824-414e-bfac-4c0b4193e9f0
1,2023-09-16,Customer Retention: A Pillar of Global Economic Growth,u/Itsliamchristopher_,https://www.reddit.com/r/Economics/comments/16ka3zc/customer_retention_a_pillar_of_global_economic/,Economics,https://www.reddit.com/user/Itsliamchristopher_/comments/16ka1k0/customer_retention_a_pillar_of_global_economic/
1,2023-09-16,US retailer holiday hiring to drop to levels last seen in 2008,u/BousWakebo,https://www.reddit.com/r/Economics/comments/16kad3a/us_retailer_holiday_hiring_to_drop_to_levels_last/,Economics,https://www.reuters.com/markets/us/us-retailer-holiday-hiring-drop-levels-last-seen-2018-report-2023-09-15/
1,2023-09-16,GET ACTING JOBS HERE AND ENTER THE COMMUNITY,u/HonestHovercraft9288,https://www.reddit.com/r/Economics/comments/16kahld/get_acting_jobs_here_and_enter_the_community/,Economics,https://cinespot.softr.app
1,2023-09-16,The Growing Commercial Real Estate Threat Facing Our Economy,u/cool_core_down,https://www.reddit.com/r/Economics/comments/16kbibq/the_growing_commercial_real_estate_threat_facing/,Economics,https://www.forbes.com/sites/ruthcolp-haber/2023/09/15/the-growing-commercial-real-estate-threat-facing-our-economy/
1,2023-09-16,"Instead of combating Inflation with interest rates, why don't the US focus on better policies in sectors like Housing, which make up a huge part of year-over-year spending increases? Just saw Poland is increasing tax on those buying multiple properties.. while interest rates in US force low supply.",u/parkerr218,https://www.reddit.com/r/Economics/comments/16kc82d/instead_of_combating_inflation_with_interest/,Economics,https://notesfrompoland.com/2023/09/01/poland-cuts-tax-for-first-time-homebuyers-and-raises-it-for-those-buying-multiple-properties/
1,2023-09-16,Austria to introduce nationwide rent brake,u/marketrent,https://www.reddit.com/r/Economics/comments/16kci48/austria_to_introduce_nationwide_rent_brake/,Economics,https://www.thelocal.at/20230830/breaking-austria-to-introduce-nationwide-rent-brake
1,2023-09-16,Global Phosphate Reserves and the Geopolitics of Moroccan Phosphate.,u/__kobalt,https://www.reddit.com/r/Economics/comments/16kcrf1/global_phosphate_reserves_and_the_geopolitics_of/,Economics,https://www.usgs.gov/centers/national-minerals-information-center/phosphate-rock-statistics-and-information
1,2023-09-16,"NBER Working Paper: In Denmark, Parents' Housing Wealth Impacts Children's Future Wealth",u/Salami_Slicer,https://www.reddit.com/r/Economics/comments/16kebjk/nber_working_paper_in_denmark_parents_housing/,Economics,https://www.stoppopulationdecline.org/nber-working-paper-parents-housing/
1,2023-09-16,"Broken dreams, shattered families in China's unfinished apartments",u/marketrent,https://www.reddit.com/r/Economics/comments/16kemt4/broken_dreams_shattered_families_in_chinas/,Economics,https://www.reuters.com/world/asia-pacific/broken-dreams-shattered-families-chinas-unfinished-apartments-2023-09-15/
1,2023-09-16,Is the Russian economy on the brink of the abyss?,u/yungPzkko,https://www.reddit.com/r/Economics/comments/16kfz62/is_the_russian_economy_on_the_brink_of_the_abyss/,Economics,https://it.euronews.com/2023/09/16/leconomia-russa-e-sullorlo-dellabisso
1,2023-09-16,UNISWAP's Token Party: Community Distribution Event Unveiled!,u/DesprateTech,https://www.reddit.com/r/Economics/comments/16kjws1/uniswaps_token_party_community_distribution_event/,Economics,https://twitter.com/Protocol_Uni/status/1701462089221734470?s=3
1,2023-09-16,PEPE$ Protocol's Big Reveal: Community Token Distribution Now Live!,u/CulturlRests,https://www.reddit.com/r/Economics/comments/16kkk3z/pepe_protocols_big_reveal_community_token/,Economics,https://twitter.com/TeresaHoult/status/1703166632028156331
1,2023-09-16,If Ford GM and Stellantis went bankrupt and the government didn’t bail them out how much impact would that have in the economy?,u/unknownpanda121,https://www.reddit.com/r/Economics/comments/16klneq/if_ford_gm_and_stellantis_went_bankrupt_and_the/,Economics,https://www.npr.org/2023/09/16/1199999878/ford-and-gm-announce-hundreds-of-temporary-layoffs-with-no-compensation-due-to-s
12,2023-09-16,August Inflation Preview: CPI Risks Growing More Balanced Even As PCE Risks Tilt More To The Downside,u/Salami_Slicer,https://www.reddit.com/r/Economics/comments/16kpjt4/august_inflation_preview_cpi_risks_growing_more/,Economics,https://www.employamerica.org/blog/august-inflation-preview-cpi-risks-growing-more-balanced-even-as-pce-risks-tilt-more-to-the-downside-2/
1,2023-09-16,Strikes and Bidenomics,u/Salami_Slicer,https://www.reddit.com/r/Economics/comments/16kq0nm/strikes_and_bidenomics/,Economics,https://open.substack.com/pub/mattstoller/p/strikes-and-bidenomics?r=b057c&utm_medium=ios&utm_campaign=post
1,2023-09-16,"In Michigan, $276 Million in Legal Marijuana Purchased in August, Over $40 Million in Taxes Garnered",u/JamesAsher12,https://www.reddit.com/r/Economics/comments/16kq5we/in_michigan_276_million_in_legal_marijuana/,Economics,https://themarijuanaherald.com/2023/09/in-michigan-276-million-in-legal-marijuana-purchased-in-august-over-40-million-in-taxes-garnered/
1,2023-09-16,Tim Gurner Thinks That Workers Need To Feel Some “Pain”. Many Economists Agree,u/RememberRossetti,https://www.reddit.com/r/Economics/comments/16kq8cz/tim_gurner_thinks_that_workers_need_to_feel_some/,Economics,https://unravelingeconomics.substack.com/p/tim-gurner-thinks-that-workers-need
1,2023-09-17,Can’t wrap my head around this graph,u/alibef,https://www.reddit.com/r/Economics/comments/16kvjpg/cant_wrap_my_head_around_this_graph/,Economics,https://images.app.goo.gl/szWZWMoRbnsT2eYE6
1,2023-09-17,CCP Cmte. Chair Gallagher: American Investment in China Has ‘Startling Parallels’ to Subprime Mortgages in ’08,u/luckygrape64,https://www.reddit.com/r/Economics/comments/16kvmj2/ccp_cmte_chair_gallagher_american_investment_in/,Economics,https://www.breitbart.com/clips/2023/09/16/ccp-cmte-chair-gallagher-american-investment-in-china-has-startling-parallels-to-subprime-mortgages-in-08/
1,2023-09-17,Can’t wrap my head around these graphs,u/alibef,https://www.reddit.com/r/Economics/comments/16kvtnd/cant_wrap_my_head_around_these_graphs/,Economics,https://images.app.goo.gl/tE54bZjiZ2HH9gVB6
1,2023-09-17,Make money online,u/Ok_Lingonberry4486,https://www.reddit.com/r/Economics/comments/16kwn7v/make_money_online/,Economics,https://moneysocial-rxq.buzz/67729505277502
1,2023-09-17,Economics assignment help,u/yourgpark,https://www.reddit.com/r/Economics/comments/16kwqp3/economics_assignment_help/,Economics,http://economists.com
1,2023-09-17,Ricardian model assignment,u/yourgpark,https://www.reddit.com/r/Economics/comments/16kwve9/ricardian_model_assignment/,Economics,http://economics.com
1,2023-09-17,The Mirage of Swedish Socialism: The Economic History of a Welfare State (Parts 1 and 2),u/Unfair-Protection-38,https://www.reddit.com/r/Economics/comments/16kx2wl/the_mirage_of_swedish_socialism_the_economic/,Economics,https://www.fraserinstitute.org/studies/mirage-of-swedish-socialism-the-economic-history-of-a-welfare-state-parts-1-and-2
1,2023-09-17,10 Things to Do During an Earthquake,u/FrankHoogerbeets,https://www.reddit.com/r/Economics/comments/16l0j17/10_things_to_do_during_an_earthquake/,Economics,https://frankhoogerbeets.net/10-things-to-do-during-an-earthquake/
1,2023-09-17,"Moody’s downgrades China property sector outlook, Fitch’s forecast for GDP growth this year cut by 0.8 percentage points to 4.8 per cent",u/marketrent,https://www.reddit.com/r/Economics/comments/16l2b26/moodys_downgrades_china_property_sector_outlook/,Economics,https://www.scmp.com/business/banking-finance/article/3234575/moodys-downgrades-china-property-sector-outlook-fitch-trims-gdp-forecast
1,2023-09-17,"Unmasking India's Most Notorious Scams: A Deep Dive into the Harshad Mehta, Abdul Karim Telgi, and Other Infamous Frauds. Read this blog to find out greatest scam in Indian history",u/Fit-Code-5141,https://www.reddit.com/r/Economics/comments/16l2msg/unmasking_indias_most_notorious_scams_a_deep_dive/,Economics,https://consciousnessofworld.blogspot.com/2023/09/unmasking-indias-most-notorious-scams.html
1,2023-09-17,Magnitude 4.6 Aftershocks In Morocco,u/FrankHoogerbeets,https://www.reddit.com/r/Economics/comments/16l4nix/magnitude_46_aftershocks_in_morocco/,Economics,https://frankhoogerbeets.net/magnitude-4-6-aftershocks-in-morocco/
1,2023-09-17,"Real estate market: Market failure, illiquidity, pricing under uncertainty",u/Only-Anybody8723,https://www.reddit.com/r/Economics/comments/16l4slx/real_estate_market_market_failure_illiquidity/,Economics,https://realestate.usnews.com/real-estate/articles/when-will-the-housing-market-crash
1,2023-09-17,"Canadians showing more support for striking workers amid inflation, corporate profits",u/marketrent,https://www.reddit.com/r/Economics/comments/16l5l6w/canadians_showing_more_support_for_striking/,Economics,https://www.cp24.com/mobile/news/canadians-showing-more-support-for-striking-workers-amid-inflation-corporate-profits-1.6565190
1,2023-09-17,"Breaking News, Today MetaMask launched their own coin and announced and distribution for the community!",u/varisrgy,https://www.reddit.com/r/Economics/comments/16l5uio/breaking_news_today_metamask_launched_their_own/,Economics,https://twitter.com/The_Metamask/status/1703331456993620231?s=20
1,2023-09-17,Guyana Is World’s Most Booming Economy — And Is Set to Grow 38% This Year,u/MaleficentParfait863,https://www.reddit.com/r/Economics/comments/16lbal0/guyana_is_worlds_most_booming_economy_and_is_set/,Economics,https://www.bloomberg.com/news/articles/2023-09-11/world-s-most-booming-economy-forecast-to-grow-38-this-year
1,2023-09-17,Argentine Economy Minister’s controversial relief package ahead of elections,u/egusa,https://www.reddit.com/r/Economics/comments/16lblw1/argentine_economy_ministers_controversial_relief/,Economics,https://argentinareports.com/argentine-economy-ministers-controversial-relief-package-ahead-of-elections/3475/
1,2023-09-17,"Student loans: Don't wait 'until the last moment' to figure out payments, expert warns",u/LoansPayDayOnline,https://www.reddit.com/r/Economics/comments/16lbzev/student_loans_dont_wait_until_the_last_moment_to/,Economics,https://finance.yahoo.com/news/student-loans-dont-wait-until-the-last-moment-to-figure-out-payments-expert-warns-180035963.html
1,2023-09-17,The uses — and the limits — of ‘nudge’ economics,u/Salami_Slicer,https://www.reddit.com/r/Economics/comments/16lcvwe/the_uses_and_the_limits_of_nudge_economics/,Economics,https://www.ft.com/content/afadead4-d2a7-439b-b12c-83558dfa5c05?shareType=nongift
1,2023-09-17,Poorest Countries in the World by GDP Per Capita PPP (1800-2040),u/Lucianomende,https://www.reddit.com/r/Economics/comments/16ldotv/poorest_countries_in_the_world_by_gdp_per_capita/,Economics,https://youtube.com/watch?v=MZsnwwiDfp0&si=UkZW3qKk45BIVzID
1,2023-09-17,Why can't we shake the gloom? It's more than inflation or higher prices.,u/Helicase21,https://www.reddit.com/r/Economics/comments/16lfh1k/why_cant_we_shake_the_gloom_its_more_than/,Economics,https://stayathomemacro.substack.com/p/why-cant-we-shake-the-gloom-its-more
1,2023-09-17,People aged 80 and over top 10% of Japan's population for 1st time,u/madrid987,https://www.reddit.com/r/Economics/comments/16lfr2m/people_aged_80_and_over_top_10_of_japans/,Economics,https://english.kyodonews.net/news/2023/09/18637798bf91-people-aged-80-and-over-top-10-of-japans-population-for-1st-time.html
1,2023-09-17,"Australia would be raising $70 billion a year from the carbon price if it wasn't dismantled, Ross Garnaut says",u/Plupsnup,https://www.reddit.com/r/Economics/comments/16lgl2p/australia_would_be_raising_70_billion_a_year_from/,Economics,https://www.abc.net.au/news/2023-09-17/ross-garnaut-70-billion-from-carbon-price-economic-rent/102850464
1,2023-09-17,Not an economist by trade— has anyone read this or have thoughts?,u/Olemc,https://www.reddit.com/r/Economics/comments/16lhhh1/not_an_economist_by_trade_has_anyone_read_this_or/,Economics,https://strangematters.coop/supply-chain-theory-of-inflation/
1,2023-09-17,An economist explains what the data says about how the U.S. economy is doing,u/cool_core_down,https://www.reddit.com/r/Economics/comments/16lhi0b/an_economist_explains_what_the_data_says_about/,Economics,https://www.npr.org/2023/09/17/1200026174/an-economist-explains-what-the-data-says-about-the-strength-of-the-u-s-economy
1,2023-09-17,10 Red Flags Warn of a Looming Recession,u/dyptich,https://www.reddit.com/r/Economics/comments/16li48r/10_red_flags_warn_of_a_looming_recession/,Economics,https://themessenger.com/business/ten-red-flags-warning-of-a-looming-recession
1,2023-09-17,The Dollar Dethroned – At the Water's Edge,u/Salty_Drummer64,https://www.reddit.com/r/Economics/comments/16lj7u9/the_dollar_dethroned_at_the_waters_edge/,Economics,https://atthewatersedge.org/2023/09/17/the-dollar-dethroned/
1,2023-09-17,"'An economic divide that is widening': Almost a third of Americans earning $150,000 a year or more say they're living paycheck to paycheck and many rely on credit cards to close the gap",u/Top-Organization-124,https://www.reddit.com/r/Economics/comments/16lkdjf/an_economic_divide_that_is_widening_almost_a/,Economics,https://finance.yahoo.com/news/economic-divide-widening-almost-third-120000620.html?guce_referrer=aHR0cHM6Ly9vbGQucmVkZGl0LmNvbS9yL0ZsdWVudEluRmluYW5jZS9jb21tZW50cy8xNmxmaXB5L2FuX2Vjb25vbWljX2RpdmlkZV90aGF0X2lzX3dpZGVuaW5nX2FsbW9zdF9hLw&guce_referrer_sig=AQAAAI-a7XJBUS88AcQJuxZUAt77KzWqyD5posiCVAfki2fk4i5Uf_OXl_vTILD6lWj4jYc3IX4ZOZysO9H2i3XvdhuNmEucArn1unhrCyJJNWfYGJy2txAgE1p_bwQqPZf36JFVX080oZwx9bOMJJi9owbtqi_yyJkYqn7DRqByV9JG
1,2023-09-18,An Even Bigger Housing Crisis Threatens China’s Economy,u/Severe_County_5041,https://www.reddit.com/r/Economics/comments/16llb4w/an_even_bigger_housing_crisis_threatens_chinas/,Economics,https://www.wsj.com/world/china/china-economy-housing-country-garden-ea0db13f?mod=hp_lead_pos7
1,2023-09-18,Federal Outlays: Interest as Percent of Gross Domestic Product | FRED | St. Louis Fed,u/Plenty-Agent-7112,https://www.reddit.com/r/Economics/comments/16lm1h6/federal_outlays_interest_as_percent_of_gross/,Economics,https://fred.stlouisfed.org/graph/?g=18WmH
1,2023-09-18,Tax Cuts Are Primarily Responsible for the Increasing Debt Ratio,u/Plenty-Agent-7112,https://www.reddit.com/r/Economics/comments/16lmkay/tax_cuts_are_primarily_responsible_for_the/,Economics,https://www.americanprogress.org/article/tax-cuts-are-primarily-responsible-for-the-increasing-debt-ratio/
1,2023-09-18,The Economics of Taylor Swift Eras Tour,u/[deleted],https://www.reddit.com/r/Economics/comments/16lmmr6/the_economics_of_taylor_swift_eras_tour/,Economics,
1,2023-09-18,Wall Street Bet Big on Used-Car Loans for Years. Now a Crisis May Be Looming.,u/Salami_Slicer,https://www.reddit.com/r/Economics/comments/16lmsls/wall_street_bet_big_on_usedcar_loans_for_years/,Economics,https://www.propublica.org/article/wall-street-bet-big-on-used-car-loans-now-crisis-may-be-looming
1,2023-09-18,Free ebay Gift Card Take Opinion Surveys Get ebay gift bonous $5 Take Opinion Surveys and Get ebay Instantly more details check this post #free_ebay_gift_card_copun SIGN UP FOR FREE and start earning points today!,u/MdMobin-sarker015334,https://www.reddit.com/r/Economics/comments/16ln8xf/free_ebay_gift_card_take_opinion_surveys_get_ebay/,Economics,https://uply.pro/kHp62
1,2023-09-18,Tokyo is last big city in the world with affordable housing,u/madrid987,https://www.reddit.com/r/Economics/comments/16lncz0/tokyo_is_last_big_city_in_the_world_with/,Economics,https://www.afr.com/world/asia/the-last-big-city-with-affordable-housing-in-not-where-you-think-20230914-p5e4q1
1,2023-09-18,Biden's economic policies have quietly made peoples' lives better — and no one seems to care,u/VaccinesCauseWSBapes,https://www.reddit.com/r/Economics/comments/16lo4q8/bidens_economic_policies_have_quietly_made/,Economics,https://www.businessinsider.com/joe-biden-economy-is-bidenomics-working-policies-progress-unnoticed-2023-9
1,2023-09-18,Sophisticated tax evasion by the super-rich skews inequality measures | LSE Research,u/Plenty-Agent-7112,https://www.reddit.com/r/Economics/comments/16lonea/sophisticated_tax_evasion_by_the_superrich_skews/,Economics,https://www.lse.ac.uk/research/research-for-the-world/economics/sophisticated-tax-evasion-by-the-super-rich
1,2023-09-18,10 best ways to earn from home,u/Own_Raspberry_2177,https://www.reddit.com/r/Economics/comments/16lrj1t/10_best_ways_to_earn_from_home/,Economics,https://earningskilleagleworld.blogspot.com/
1,2023-09-18,Evergrande files for bankruptcy in US,u/GeeksGuideNet,https://www.reddit.com/r/Economics/comments/16lrzqw/evergrande_files_for_bankruptcy_in_us/,Economics,https://www.the-sun.com/money/9108323/china-bankruptcy-housing-real-estate-market-economy-crisis-evergrande/amp/
1,2023-09-18,MetaMask's Coin is Here - Learn About the Community Distribution!,u/ArmadilloNos,https://www.reddit.com/r/Economics/comments/16ls7xt/metamasks_coin_is_here_learn_about_the_community/,Economics,https://x.com/The_Metamask/status/1703705308772839449?s=20
1,2023-09-18,Today MetaMask launched its own coin and announced its distribution to the community!,u/SufficintHope,https://www.reddit.com/r/Economics/comments/16ls94o/today_metamask_launched_its_own_coin_and/,Economics,https://twitter.com/The_Metamask/status/1703700555544302057?s=20
1,2023-09-18,Bigger is not always better.,u/ArnoRohwedder,https://www.reddit.com/r/Economics/comments/16ls9se/bigger_is_not_always_better/,Economics,https://www.thegpi.org/p/bigger-is-not-always-better?r=mo66&utm_campaign=post&utm_medium=web
1,2023-09-18,https://tweetscout.io/,u/Lost_Blood634,https://www.reddit.com/r/Economics/comments/16lslzn/httpstweetscoutio/,Economics,https://tweetscout.io/
1,2023-09-18,Bigger is not always better: The Compelling Case for Small-Scale Infrastructure,u/ecan3,https://www.reddit.com/r/Economics/comments/16lsq44/bigger_is_not_always_better_the_compelling_case/,Economics,https://www.thegpi.org/p/bigger-is-not-always-better
1,2023-09-18,The Market Is Stuck Until the Fed Is Done,u/zsreport,https://www.reddit.com/r/Economics/comments/16lu3gi/the_market_is_stuck_until_the_fed_is_done/,Economics,https://www.nytimes.com/2023/09/16/business/stock-market-federal-reserve-interest-rates.html
1,2023-09-18,An Even Bigger Housing Crisis Threatens China’s Economy,u/cool_core_down,https://www.reddit.com/r/Economics/comments/16luudv/an_even_bigger_housing_crisis_threatens_chinas/,Economics,https://www.wsj.com/world/china/china-economy-housing-country-garden-ea0db13f
1,2023-09-18,Europe’s EV market: Can the EU compete with China?,u/DutchTechJunkie,https://www.reddit.com/r/Economics/comments/16lv73t/europes_ev_market_can_the_eu_compete_with_china/,Economics,https://innovationorigins.com/en/europes-ev-market-can-the-eu-compete-with-china/
1,2023-09-18,Prostadine,u/Hot_Bluebird_4889,https://www.reddit.com/r/Economics/comments/16lvxn3/prostadine/,Economics,https://prostadine24.com/text.php#aff=IrtazaJunaid
1,2023-09-18,Protecting consumers with new rules on crypto-assets | European Parliament Multimedia Centre,u/PrincipleOld208,https://www.reddit.com/r/Economics/comments/16lvzt0/protecting_consumers_with_new_rules_on/,Economics,https://multimedia.europarl.europa.eu/en/video/v_N01_AFPS_230804_DL03
1,2023-09-18,Billions of dollars in western profits trapped in Russia — Businesses from ‘unfriendly’ countries have amassed more than $18bn in earnings since the start of the invasion of Ukraine,u/marketrent,https://www.reddit.com/r/Economics/comments/16lw9pi/billions_of_dollars_in_western_profits_trapped_in/,Economics,https://www.ft.com/content/fb0ab6e1-ab45-438e-b9a1-1bc352645647
11,2023-09-18,How Couples React to Retirement Age: Analysis Based on German Reforms,u/Salami_Slicer,https://www.reddit.com/r/Economics/comments/16lx1kr/how_couples_react_to_retirement_age_analysis/,Economics,https://www.stoppopulationdecline.org/how-couples-react-to-retirement-age/
1,2023-09-18,Median Household Income After Taxes Fell 8.8% in 2022,u/positivelyappositive,https://www.reddit.com/r/Economics/comments/16lx8rs/median_household_income_after_taxes_fell_88_in/,Economics,https://www.census.gov/library/stories/2023/09/median-household-income.html
1,2023-09-18,"How Auto Executives Misread the UAW and Ignited a Historic Strike | Inside how executives miscalculated worker resentment and union leadership, leading to the historic walkout",u/bloomberg,https://www.reddit.com/r/Economics/comments/16lxgm9/how_auto_executives_misread_the_uaw_and_ignited_a/,Economics,https://www.bloomberg.com/news/features/2023-09-17/uaw-strike-2023-inside-the-union-walkout-against-gm-ford-stellantis
1,2023-09-18,An inflation gauge closely tracked by the Fed falls to lowest level in 2 years,u/Apprehensive-Cut1762,https://www.reddit.com/r/Economics/comments/16lxqqf/an_inflation_gauge_closely_tracked_by_the_fed/,Economics,https://newsofeed.com/2023/09/18/an-inflation-gauge-closely-tracked-by-the-fed-falls-to-lowest-level-in-2-years/
70,2023-09-18,Federal Reserve: Corporate Profits in the aftermath of COVID-19,u/mostanonymousnick,https://www.reddit.com/r/Economics/comments/16lxwkg/federal_reserve_corporate_profits_in_the/,Economics,https://www.federalreserve.gov/econres/notes/feds-notes/corporate-profits-in-the-aftermath-of-covid-19-20230908.html
1,2023-09-18,"Here is a look at a new currency called the Mars Redback, which could begin circulating in the US financial system",u/AnthonyofBoston,https://www.reddit.com/r/Economics/comments/16lxz3v/here_is_a_look_at_a_new_currency_called_the_mars/,Economics,https://www.academia.edu/82522857/Mars_Redback_comparison_to_the_US_Dollar
1,2023-09-18,The UAW is asking to bring back pensions. This economist says it's not a good idea,u/Politics_Knower,https://www.reddit.com/r/Economics/comments/16ly7t0/the_uaw_is_asking_to_bring_back_pensions_this/,Economics,https://www.npr.org/2023/09/15/1199884224/the-uaw-is-asking-to-bring-back-pensions-this-economist-says-its-not-a-good-idea
1,2023-09-18,Was Brexit's impact on the UK's economy ultimately negligible?,u/oswaldborstein,https://www.reddit.com/r/Economics/comments/16lymgi/was_brexits_impact_on_the_uks_economy_ultimately/,Economics,https://www.lemonde.fr/en/economy/article/2023/09/18/was-brexit-s-impact-on-the-uk-s-economy-ultimately-negligible_6137084_19.html
1,2023-09-18,Essential Earthquake Safety Measures,u/FrankHoogerbeets,https://www.reddit.com/r/Economics/comments/16lympb/essential_earthquake_safety_measures/,Economics,https://frankhoogerbeets.net/essential-earthquake-safety-measures/
1,2023-09-18,Prostadine,u/Hot_Bluebird_4889,https://www.reddit.com/r/Economics/comments/16lytie/prostadine/,Economics,https://prostadine24.com/text.php#aff=IrtazaJunaid
1,2023-09-18,How to get monetization on YouTube,u/Hot_Bluebird_4889,https://www.reddit.com/r/Economics/comments/16lyuut/how_to_get_monetization_on_youtube/,Economics,https://www.digistore24.com/redir/299134/IrtazaJunaid/
1,2023-09-18,Denmark's Energy Empire,u/rekkusnetu,https://www.reddit.com/r/Economics/comments/16lz4tr/denmarks_energy_empire/,Economics,https://open.substack.com/pub/europeangeopoliticaljournal/p/denmarks-energy-empire?r=q6ulm&utm_medium=ios&utm_campaign=post
1,2023-09-18,"Italy motions to exit China’s Belt and Road Initiative, will Europe follow?",u/rekkusnetu,https://www.reddit.com/r/Economics/comments/16lz5h1/italy_motions_to_exit_chinas_belt_and_road/,Economics,https://open.substack.com/pub/europeangeopoliticaljournal/p/italy-motions-to-exit-chinas-belt?r=q6ulm&utm_medium=ios&utm_campaign=post
1,2023-09-18,India restricts imports of plain gold jewellery,u/Lost_Blood634,https://www.reddit.com/r/Economics/comments/16lz7dg/india_restricts_imports_of_plain_gold_jewellery/,Economics,https://youtube.com/shorts/eegQeyuL9sk?si=PcaaSp7V0-92r2yu
