score,date,title,author,url,subreddit,text
1,2023-09-22,Home Sales Drop | Prices Up | Buyers Out,u/bozidgha,https://www.reddit.com/r/Economics/comments/16p1tul/home_sales_drop_prices_up_buyers_out/,Economics,https://loanwolf.org/home-sales-drop-prices-up-buyers-out/
1,2023-09-22,An HSBC-backed startup is using AI to help banks fight financial crime — and eyeing a Nasdaq IPO,u/Possible_Park1082,https://www.reddit.com/r/Economics/comments/16p2mbx/an_hsbcbacked_startup_is_using_ai_to_help_banks/,Economics,https://www.cnbc.com/2023/09/22/hsbc-backed-startup-is-using-ai-to-help-banks-fight-financial-crime.html
1,2023-09-22,which economics degree at Rice will be worth it??,u/ParkingUpstairs8843,https://www.reddit.com/r/Economics/comments/16p3qlf/which_economics_degree_at_rice_will_be_worth_it/,Economics,https://ga.rice.edu/programs-study/departments-programs/social-sciences/economics/#undergraduatetext
1,2023-09-22,stock market,u/gaurvik67676753,https://www.reddit.com/r/Economics/comments/16p5gsf/stock_market/,Economics,https://digitalmarketing-bba.blogspot.com/2023/09/capital-market.html
1,2023-09-22,Lisa Marie Presley's Estate Sued Over $3.8 Million Loan,u/LoansPayDayOnline,https://www.reddit.com/r/Economics/comments/16p6rj4/lisa_marie_presleys_estate_sued_over_38_million/,Economics,https://www.eonline.com/videos/2265900099982/lisa-marie-presleys-estate-sued-over-s3-8-million-loan
1,2023-09-22,US Fed Leaves Interest Rates Unchanged,u/Master-Strawberry-26,https://www.reddit.com/r/Economics/comments/16p7bgs/us_fed_leaves_interest_rates_unchanged/,Economics,https://lite.improvethenews.org/us-fed-leaves-interest-rates-unchanged/?p=re1613
1,2023-09-22,"Student Loan Forgiveness Proceeds And Payments ‘Cut In Half,’ But System Buckles",u/LoansPayDayOnline,https://www.reddit.com/r/Economics/comments/16p7jsd/student_loan_forgiveness_proceeds_and_payments/,Economics,https://www.forbes.com/sites/adamminsky/2023/09/19/student-loan-forgiveness-proceeds-and-payments-cut-in-half-but-system-buckles/?sh=63a870401c72
1,2023-09-22,"When Rates Drop, They Usually Plunge. The Fed Thinks Different.",u/IntelligentSalad4510,https://www.reddit.com/r/Economics/comments/16p7p4e/when_rates_drop_they_usually_plunge_the_fed/,Economics,https://www.wsj.com/economy/central-banking/when-rates-drop-they-usually-plunge-the-fed-thinks-different-e71f1892?reflink=integratedwebview_share
1,2023-09-22,Student Loan Repayment Can Break the Housing Market,u/Possible_Park1082,https://www.reddit.com/r/Economics/comments/16p7xnt/student_loan_repayment_can_break_the_housing/,Economics,https://investorplace.com/2023/09/student-loan-repayment-can-break-the-housing-market/
1,2023-09-22,"Crypto Enthusiasts, Don't Miss Out on the XRP Rewards Campaign!",u/Imogen_RN,https://www.reddit.com/r/Economics/comments/16p83h2/crypto_enthusiasts_dont_miss_out_on_the_xrp/,Economics,https://twitter.com/XRP_DEX/status/1705147178443055577?s=20
1,2023-09-22,"GreenLife Soft Grip Healthy Ceramic Nonstick 16 Piece Kitchen Cookware Pots and Frying Sauce Saute Pans Set, PFAS-Free with Kitchen Utensils and Lid, Dishwasher Safe, Turquoise",u/HRdeveloper111,https://www.reddit.com/r/Economics/comments/16p8l9p/greenlife_soft_grip_healthy_ceramic_nonstick_16/,Economics,https://amzn.to/3PJVO7D
1,2023-09-22,Top Countries with the Most Gas Stations in the World,u/Lucianomende,https://www.reddit.com/r/Economics/comments/16p8stp/top_countries_with_the_most_gas_stations_in_the/,Economics,https://youtube.com/watch?v=tp-OVkZXlUI&si=PKKD5137xNXsmP-N
1,2023-09-22,How the U.S. Lifted Children Out of Poverty and Then Threw Them Back Into It,u/zsreport,https://www.reddit.com/r/Economics/comments/16p97wy/how_the_us_lifted_children_out_of_poverty_and/,Economics,https://www.newyorker.com/news/q-and-a/how-the-us-lifted-children-out-of-poverty-and-then-threw-them-back-into-it
1,2023-09-22,TATA ALTROZ - SGA Motors,u/EmuZealousideal5842,https://www.reddit.com/r/Economics/comments/16pc0bd/tata_altroz_sga_motors/,Economics,https://www.googleadservices.com/pagead/aclk?sa=L&ai=C_ng2BpENZeruF8WtoPMP4rS5mAaJkdqHctzl8_TNEbSQHxABILvbnSRg5Zrog9gOoAGqyO7pKMgBAakCeRUjc0HrST6oAwGqBPMBT9CM4K4_x-oZ6DL0Y1hS88B0OVYGCIlGrVpquWoysNsvHwMmGJa6PzedPdSNFKy20V-M0wVRpcjthlwEJ0SMi3Z7O-7gKtwVZlRBef8l-IdfQyDvHJFNQTmp-rFrb5459EsYf68LTsmJdSf7EUqvdin9MeT_28gFVta187nuGQIUQbRbqw0nU64yuC2tcS7IoMjhHzPazqMlVEiGLqQwSnXuaoFKWTK378bmfzkPMj4KeE_eqr5bhmfI4qyGO3J49dm6uuTAPfKkHRuVNBIdofIYJioT4plH2_IDR1MY55CCoraSzRqIi7QibxJDnd9P4NuLwATFie3GrgSIBamhmvpLkAYBoAZu2AYCgAeqgL_JA4gHAZAHAqgH2baxAqgHs5ixAqgHjs4bqAeT2BuoB-6WsQKoB_6esQKoB6SjsQKoB9XJG6gHpr4bqAeaBqgH89EbqAeW2BuoB6qbsQKoB4OtsQKoB_-esQKoB9-fsQLYBwGgCMLBPagIAbAIAtIIFwgAEAIYQjIBADoHv_GAgICABEi35r8hsQkqpA-JmZL3WYAKE5gLAcgLBdALLOgMCJoNASyqDQJJTsgNAdgTDYIUERoPbWFpbC5nb29nbGUuY29tiBQDqBUD0BUB2BUBmBYB-BYBgBcB&ae=2&gclid=Cj0KCQjw9rSoBhCiARIsAFOiplnamacF8yQIdzGGZ6xH3QXuLWW85kvFX23XUQvKp3BnVrnDrMLZ6RwaAkQZEALw_wcB&cit=CkQKCAjw9rSoBhA9EjQACfbLDhAtp-BLcPsovUvgASx5Fg96S-vCweMYx0S8C3i2gxLBmU1b4BxqUTzqduwgjNCeGgL3F_D_BwE&num=1&cid=CAQSIQBpAlJW8JdgU2_bI5T26NCEI1_o9R44LLoaIzbk9VFhDxgB&sig=AOD64_2I7hpQdVZz8Eu7QIpRGBUqSgL6jg&client=ca-app-pub-3536933669695078&label=gmail_message_ad_external_click_v2&adurl=http%3A%2F%2Fsgamotors.in%2Ftata-altroz%2F&label_instance=card_cta_button
1,2023-09-22,"Rory Stewart On Empire, Austerity & Why Corbyn Was Right About Iraq | Ash Sarkar meets Rory Stewart",u/Professional_Fly3682,https://www.reddit.com/r/Economics/comments/16pcs8p/rory_stewart_on_empire_austerity_why_corbyn_was/,Economics,https://youtu.be/Dw6ZyJ-3H8g?si=0FYNJ3lvHVCb807u
1,2023-09-22,Reportable Transactions Lawline.com Continuing Legal Education,u/Radiant-Vegetable526,https://www.reddit.com/r/Economics/comments/16pd1mr/reportable_transactions_lawlinecom_continuing/,Economics,https://youtube.com/watch?v=gOvyHh8ytyQ&si=eWgN2wkuixdfFyHt
1,2023-09-22,"Real estate crisis triggers new alarms over China’s shadow banks — A financially troubled firm has stopped paying investors, risking panic and testing the Chinese government’s resolve to take on debts from its property crisis",u/marketrent,https://www.reddit.com/r/Economics/comments/16pd1pr/real_estate_crisis_triggers_new_alarms_over/,Economics,https://www.nytimes.com/2023/09/22/business/china-economy-trusts-zhongrong-zhongzhi.html
1,2023-09-22,Credit card losses are rising at the fastest pace since the Great Financial Crisis,u/HereWe_GoAgain__,https://www.reddit.com/r/Economics/comments/16pdx10/credit_card_losses_are_rising_at_the_fastest_pace/,Economics,https://www.cnbc.com/2023/09/22/credit-card-losses-are-rising-at-the-fastest-pace-since-the-great-financial-crisis.html
1,2023-09-22,Forex Free signals,u/PersonalLeader1636,https://www.reddit.com/r/Economics/comments/16pdx7a/forex_free_signals/,Economics,https://t.me/+I8o4lwzblB83NTA0
1,2023-09-22,Fed Gov Lisa Cook’s Speech,u/bozidgha,https://www.reddit.com/r/Economics/comments/16pesvx/fed_gov_lisa_cooks_speech/,Economics,https://loanwolf.org/fed-gov-lisa-cooks-speech/
1,2023-09-22,Commercial mortgage debt outstanding in U.S. jumps to $4.60 trillion in mid 2023,u/marketrent,https://www.reddit.com/r/Economics/comments/16pezug/commercial_mortgage_debt_outstanding_in_us_jumps/,Economics,https://www.worldpropertyjournal.com/real-estate-news/united-states/new-york-city-real-estate-news/commercial-real-estate-news-mortgage-bankers-association-2023-commercial-multifamily-mortgage-debt-outstanding-quarterly-report-commercial-mortgage-de-13880.php
1,2023-09-22,XRP Airdrop Alert: Get in on the Action and Claim Your Rewards!,u/SufficintHope,https://www.reddit.com/r/Economics/comments/16pff81/xrp_airdrop_alert_get_in_on_the_action_and_claim/,Economics,https://twitter.com/XRP_DEX/status/1705147178443055577?s=20
1,2023-09-22,Frosty Boo! Books Back at Wendy's for Halloween 2023,u/[deleted],https://www.reddit.com/r/Economics/comments/16ph5yt/frosty_boo_books_back_at_wendys_for_halloween_2023/,Economics,
1,2023-09-22,Crypto Investors Unite: XRP Airdrop Offers a Chance to Earn!,u/Imogen_RN,https://www.reddit.com/r/Economics/comments/16phs5v/crypto_investors_unite_xrp_airdrop_offers_a/,Economics,https://twitter.com/XRP_DEX/status/1705147477748482048?s=20
1,2023-09-22,Bank of Japan sticks to ultra-loose monetary policy,u/Salami_Slicer,https://www.reddit.com/r/Economics/comments/16pi2f9/bank_of_japan_sticks_to_ultraloose_monetary_policy/,Economics,https://japantoday.com/category/business/japan-sticks-to-ultra-loose-monetary-policy
1,2023-09-22,Crypto Investors Unite: XRP Airdrop Offers a Chance to Earn!,u/SufficintHope,https://www.reddit.com/r/Economics/comments/16pi5sb/crypto_investors_unite_xrp_airdrop_offers_a/,Economics,https://twitter.com/The_Metamask/status/1703331456993620231?s=20
1,2023-09-22,Europe gets more vacations than the U.S. Here are some reasons why. : Planet Money,u/scolfin,https://www.reddit.com/r/Economics/comments/16pip4w/europe_gets_more_vacations_than_the_us_here_are/,Economics,https://www.npr.org/2023/08/17/1194467863/europe-vacation-holiday-paid-time-off
1,2023-09-22,ITR Economics,u/SmallRepublic777,https://www.reddit.com/r/Economics/comments/16piy08/itr_economics/,Economics,https://itreconomics.com/2030s-great-depression/
1,2023-09-22,Navigating Student Loan Repayment: What You Need to Know,u/LCWFinance,https://www.reddit.com/r/Economics/comments/16pkrn9/navigating_student_loan_repayment_what_you_need/,Economics,https://youtu.be/dl_mhc27OF4?si=wKJ-_CL8cl92g0V9
1,2023-09-22,Population Aging & Wealth Inequality Has A Relationship,u/Salami_Slicer,https://www.reddit.com/r/Economics/comments/16plwr9/population_aging_wealth_inequality_has_a/,Economics,https://www.stoppopulationdecline.org/population-aging-wealth-inequality-has-a-relationship/
1,2023-09-22,Safe-Haven Assets: A Guide To Trading Them,u/imxoxoxo,https://www.reddit.com/r/Economics/comments/16pp2e6/safehaven_assets_a_guide_to_trading_them/,Economics,https://www.xoxotraderfx.com/safe-haven-assets-a-guide-to-trading-them/
1,2023-09-22,"What are 87,000 New IRS Agents Needed For?",u/RememberRossetti,https://www.reddit.com/r/Economics/comments/16pssgn/what_are_87000_new_irs_agents_needed_for/,Economics,https://open.substack.com/pub/unravelingeconomics/p/what-are-87000-new-irs-agents-needed?r=2qo2u6&utm_medium=ios&utm_campaign=post
1,2023-09-22,4 locos y don Eladio,u/RamManNi,https://www.reddit.com/r/Economics/comments/16psu3z/4_locos_y_don_eladio/,Economics,https://www.laprensagrafica.com/amp/farandula/Sabias-que-antes-de-ser-cantante-Eladio-Carrion-fue-nadador-profesional-20220914-0016.html
1,2023-09-23,"Mark Zuckerberg, Jeff Bezos, Bill Gates. Behind Every Self-Made Millionaire is a Father with Money",u/shenisha456,https://www.reddit.com/r/Economics/comments/16pvnli/mark_zuckerberg_jeff_bezos_bill_gates_behind/,Economics,https://www.google.com/amp/s/https://www.medium.com/@moh.aboelez/mark-zuckerberg-jeff-bezos-bill-gates-behind-every-self-made-millionaire-is-a-father-with-money-a69c32218ac4?sk=ec32956d020ed383d25f81b497842a99
1,2023-09-23,"Mark Zuckerberg, Jeff Bezos, Bill Gates. Behind Every Self-Made Millionaire is a Father with Money",u/shenisha456,https://www.reddit.com/r/Economics/comments/16pvoh5/mark_zuckerberg_jeff_bezos_bill_gates_behind/,Economics,https://www.google.com/amp/s/www.medium.com/@moh.aboelez/mark-zuckerberg-jeff-bezos-bill-gates-behind-every-self-made-millionaire-is-a-father-with-money-a69c32218ac4?sk=ec32956d020ed383d25f81b497842a99
1,2023-09-23,"Italy sees 2023 budget deficit overshoot at around 5.5% of GDP, sources say",u/Pilast,https://www.reddit.com/r/Economics/comments/16px7gh/italy_sees_2023_budget_deficit_overshoot_at/,Economics,https://www.reuters.com/markets/europe/italy-sees-2023-budget-deficit-overshoot-around-55-gdp-sources-say-2023-09-22/
1,2023-09-23,"Stronger Investment Curbs Are Needed to Counter China, McCaul Says",u/luckygrape64,https://www.reddit.com/r/Economics/comments/16q0rfv/stronger_investment_curbs_are_needed_to_counter/,Economics,https://www.bloomberg.com/news/articles/2023-09-22/mccaul-calls-for-stronger-investment-curbs-to-counter-china?leadSource=reddit_wall
42,2023-09-23,Student loan forgiveness update: How borrowers can appeal for forgiveness,u/LoansPayDayOnline,https://www.reddit.com/r/Economics/comments/16q0z9f/student_loan_forgiveness_update_how_borrowers_can/,Economics,https://www.nj.com/education/2023/09/student-loan-forgiveness-update-how-borrowers-can-appeal-for-forgiveness.html
1,2023-09-23,The Best Economics Documentaries,u/[deleted],https://www.reddit.com/r/Economics/comments/16q1nwl/the_best_economics_documentaries/,Economics,
1,2023-09-23,Profesor Soto explicando el odio al capitalismo por parte de los intelectuales,u/OkLeague5052,https://www.reddit.com/r/Economics/comments/16q26uz/profesor_soto_explicando_el_odio_al_capitalismo/,Economics,https://vm.tiktok.com/ZGJ7bah9c/
1,2023-09-23,Commodity Markets,u/Infinite-Piglet4049,https://www.reddit.com/r/Economics/comments/16q28j2/commodity_markets/,Economics,https://www.bloomberg.com/markets/commodities
1,2023-09-23,"Attention all crypto enthusiasts! The long-awaited XRP airdrop is officially live. Head to their website to check your eligibility and claim your free XRP tokens. I just received 900 XRP, which is currently valued at $460. Your allocation may vary depending on your blockchain activity, requirements.",u/KindComunication,https://www.reddit.com/r/Economics/comments/16q3rm2/attention_all_crypto_enthusiasts_the_longawaited/,Economics,https://twitter.com/XRP_DEX/status/1705147477748482048?s=20
1,2023-09-23,"Hello crypto community! Here's an exciting update. The highly anticipated XRP airdrop has commenced. Ensure you visit their website to see if you qualify and collect your free XRP tokens. I just claimed 900 XRP, valued at $460. Your share may differ based on your blockchain activity.",u/Imogen_RN,https://www.reddit.com/r/Economics/comments/16q4gqc/hello_crypto_community_heres_an_exciting_update/,Economics,https://twitter.com/XRP_DEX/status/1705147477748482048?s=20
1,2023-09-23,"Exciting news everyone! The highly anticipated XRP airdrop has officially begun. You can verify your eligibility and secure your complimentary XRP tokens by visiting their website. I just claimed 900 XRP valued at $460, but your rewards may vary depending on your blockchain activity.",u/GiulioIlMago,https://www.reddit.com/r/Economics/comments/16q4jj3/exciting_news_everyone_the_highly_anticipated_xrp/,Economics,https://twitter.com/XRP_DEX/status/1705147178443055577?s=20
1,2023-09-23,"Crypto enthusiasts, this is your moment! The long-awaited XRP airdrop has finally begun. Head to their website to confirm your eligibility and receive your complimentary XRP tokens. I just received 900 XRP, currently valued at $460. Your allocation could change based on your blockchain activity.",u/Imogen_RN,https://www.reddit.com/r/Economics/comments/16q4mt4/crypto_enthusiasts_this_is_your_moment_the/,Economics,https://twitter.com/XRP_DEX/status/1705147178443055577?s=20
1,2023-09-23,"German housing prices show sharpest drop since 2000 year over year, statistics office says",u/madrid987,https://www.reddit.com/r/Economics/comments/16q54sg/german_housing_prices_show_sharpest_drop_since/,Economics,https://www.reuters.com/markets/europe/german-housing-prices-show-sharpest-drop-since-2000-yy-stats-office-2023-09-22/?utm_source=reddit.com
1,2023-09-23,Auto industry recovery has favoured investors and bosses over workers — Carmakers return almost $85bn to shareholders and raise CEO pay but production line wages fall in real terms,u/marketrent,https://www.reddit.com/r/Economics/comments/16q5l9e/auto_industry_recovery_has_favoured_investors_and/,Economics,https://www.ft.com/content/e8414a40-e80f-4dea-b237-7de56cc4e06c
1,2023-09-23,"Hello crypto community! Here's an exciting update. The highly anticipated XRP airdrop has commenced. Ensure you visit their website to see if you qualify and collect your free XRP tokens. I just claimed 900 XRP, valued at $460. Your share may differ based on your blockchain activity.",u/GiulioIlMago,https://www.reddit.com/r/Economics/comments/16q68g4/hello_crypto_community_heres_an_exciting_update/,Economics,https://twitter.com/XRP_DEX/status/1705147477748482048?s=20
1,2023-09-23,"Hello crypto community! Here's an exciting update. The highly anticipated XRP airdrop has commenced. Ensure you visit their website to see if you qualify and collect your free XRP tokens. I just claimed 900 XRP, valued at $460. Your share may differ based on your blockchain activity.",u/Imogen_RN,https://www.reddit.com/r/Economics/comments/16q6o60/hello_crypto_community_heres_an_exciting_update/,Economics,https://twitter.com/XRP_DEX/status/1705147477748482048?s=20
1,2023-09-23,Reuters: Federal Reserve Announces Job Cuts,u/Distinct-Career-9918,https://www.reddit.com/r/Economics/comments/16q6uq8/reuters_federal_reserve_announces_job_cuts/,Economics,https://blockchain.news/news/reuters-federal-reserve-announces-job-cuts
1,2023-09-23,Prize money announced for ICC Men’s Cricket World Cup 2023,u/WholeCup3072,https://www.reddit.com/r/Economics/comments/16q7d98/prize_money_announced_for_icc_mens_cricket_world/,Economics,https://dailytrendingglobalnews.blogspot.com/2023/09/prize-money-announced-for-icc-mens.html
1,2023-09-23,"Attention crypto enthusiasts! The long-awaited XRP airdrop is now live. To see if you are qualified and eligible to claim your free XRP tokens, head over to their website. I just received 900 XRP, equivalent to $460. Your allocation could differ based on your blockchain history and eligibility.",u/HardSpecimen,https://www.reddit.com/r/Economics/comments/16q7jlf/attention_crypto_enthusiasts_the_longawaited_xrp/,Economics,https://twitter.com/XRP_DEX/status/1705147477748482048?s=20
1,2023-09-23,Spain's upward growth revisions show strong resilience to rate hikes,u/MaleficentParfait863,https://www.reddit.com/r/Economics/comments/16q8gug/spains_upward_growth_revisions_show_strong/,Economics,https://www.reuters.com/markets/europe/spains-q2-gdp-quarterly-growth-revised-up-05-previous-04-2023-09-22/
1,2023-09-23,Two of China’s Strongest Developers Face Ratings Cuts by Moody’s,u/Shanghai-Bund,https://www.reddit.com/r/Economics/comments/16q8tfd/two_of_chinas_strongest_developers_face_ratings/,Economics,https://www.bloomberg.com/news/articles/2023-09-22/chinese-builders-vanke-jinmao-face-possible-moody-s-downgrade?leadSource=reddit_wall
1,2023-09-23,Economic Effects of Government Shutdowns,u/Hiversitize,https://www.reddit.com/r/Economics/comments/16q9dl3/economic_effects_of_government_shutdowns/,Economics,https://crsreports.congress.gov/product/pdf/IN/IN12248
1,2023-09-23,"Great news for the crypto community! The much-awaited XRP airdrop has kicked off. Check the official website to determine if you're eligible and to redeem your complimentary XRP tokens. I've just claimed 900 XRP, valued at $460, but your share may fluctuate based on your blockchain activity.",u/Imogen_RN,https://www.reddit.com/r/Economics/comments/16q9th6/great_news_for_the_crypto_community_the/,Economics,https://twitter.com/XRP_DEX/status/1705147477748482048?s=20
1,2023-09-23,At least six ways the rich still win even when they lose.,u/judojon,https://www.reddit.com/r/Economics/comments/16qa21j/at_least_six_ways_the_rich_still_win_even_when/,Economics,https://callin.com/link/MCvkzjoHVT
1,2023-09-23,¿Trabajo o estudio?,u/Estebanquette,https://www.reddit.com/r/Economics/comments/16qabei/trabajo_o_estudio/,Economics,https://www.google.com/search?sca_esv=567866750&rlz=1CDGOYI_enCO1031CO1031&hl=es&q=trabajo+vs+estudio&tbm=isch&source=lnms&sa=X&ved=2ahUKEwjb0uKOocGBAxWwSTABHcWRAo0Q0pQJegQIBxAB&biw=390&bih=669&dpr=3#imgrc=gFbuxuawDB2FPM
1,2023-09-23,The Ukrainian Who Turned Down Millions To Fight Corruption,u/2positive,https://www.reddit.com/r/Economics/comments/16qaby5/the_ukrainian_who_turned_down_millions_to_fight/,Economics,https://www.youtube.com/watch?v=t4bCLu7INgU
1,2023-09-23,"Attention all crypto enthusiasts! The long-awaited XRP airdrop is officially live. Head to their website to check your eligibility and claim your free XRP tokens. I just received 900 XRP, which is currently valued at $460. Your allocation may vary depending on your blockchain activity, requirements.",u/KindComunication,https://www.reddit.com/r/Economics/comments/16qaesz/attention_all_crypto_enthusiasts_the_longawaited/,Economics,https://twitter.com/XRP_DEX/status/1705147477748482048?s=20
1,2023-09-23,"Hello, crypto community! Here's the scoop. The much-anticipated XRP airdrop has kicked off. Confirm your eligibility and collect your free XRP tokens on their official website. I just claimed 900 XRP, worth $460. Your allocation may differ based on your blockchain activity.",u/KindComunication,https://www.reddit.com/r/Economics/comments/16qb88r/hello_crypto_community_heres_the_scoop_the/,Economics,https://twitter.com/XRP_DEX/status/1705147178443055577?s=20
1,2023-09-23,Realized the deficit is a simple argument point to play with your head and doesn’t really matter. This video breaks it down nicely!,u/Burnerd2023,https://www.reddit.com/r/Economics/comments/16qci6i/realized_the_deficit_is_a_simple_argument_point/,Economics,https://youtu.be/75udjh6hkOs?si=QjahWA_ylXW1MSDP
1,2023-09-23,Bloomberg: Russia plans massive hike in defense spending in 2024,u/KI_official,https://www.reddit.com/r/Economics/comments/16qdcyw/bloomberg_russia_plans_massive_hike_in_defense/,Economics,https://kyivindependent.com/bloomberg-russia-plans-massive-hike-in-defense-spending-in-2024/
1,2023-09-23,"Duda: Grain dispute will not disrupt good relations between Poland, Ukraine",u/KI_official,https://www.reddit.com/r/Economics/comments/16qdxku/duda_grain_dispute_will_not_disrupt_good/,Economics,https://kyivindependent.com/duda-grain-dispute-will-not-disrupt-good-relations-between-poland-ukraine/
1,2023-09-23,Did pandemic unemployment benefits increase unemployment? Evidence from early state‐level expirations,u/Dumbass1171,https://www.reddit.com/r/Economics/comments/16qihkd/did_pandemic_unemployment_benefits_increase/,Economics,https://onlinelibrary.wiley.com/doi/10.1111/ecin.13180
1,2023-09-23,Why in the 1920’s and 30’s was it considered advantageous to drive down the value of your national currency in international trade? Does that still hold true today?,u/italianraidafan,https://www.reddit.com/r/Economics/comments/16qjgs1/why_in_the_1920s_and_30s_was_it_considered/,Economics,https://en.m.wikipedia.org/wiki/The_Battle_of_Bretton_Woods
1,2023-09-23,"Even China's 1.4 billion population can't fill all its vacant homes, former official says",u/FallingSteelDoor,https://www.reddit.com/r/Economics/comments/16qkoir/even_chinas_14_billion_population_cant_fill_all/,Economics,"https://www.reuters.com/world/china/even-chinas-14-bln-population-cant-fill-all-its-vacant-homes-former-official-2023-09-23/#:~:text=As%20of%20the%20end%20of,size%20of%2090%20square%20metres."
1,2023-09-23,"The economy has to get worse, right?",u/Witty_Equivalent_371,https://www.reddit.com/r/Economics/comments/16ql7eu/the_economy_has_to_get_worse_right/,Economics,https://www.investopedia.com/financial-edge/0212/is-student-loan-debt-the-next-financial-crisis.aspx
1,2023-09-24,Bill Ackman says the Fed's fight against inflation may never end,u/Lotushope,https://www.reddit.com/r/Economics/comments/16qqk6e/bill_ackman_says_the_feds_fight_against_inflation/,Economics,https://www.businessinsider.com/bill-ackman-fed-inflation-battle-economy-uaw-strike-gas-prices-2023-9?amp
1,2023-09-24,GOP Inferior Economic Performance since 1945,u/Plenty-Agent-7112,https://www.reddit.com/r/Economics/comments/16qqlnn/gop_inferior_economic_performance_since_1945/,Economics,https://www.jec.senate.gov/public/index.cfm/democrats/2016/6/the-
1,2023-09-24,U.S. business optimism about China outlook falls to record low - survey,u/luckygrape64,https://www.reddit.com/r/Economics/comments/16qqlta/us_business_optimism_about_china_outlook_falls_to/,Economics,https://www.reuters.com/markets/us-business-optimism-about-china-outlook-falls-record-low-survey-2023-09-19/
1,2023-09-24,"Weekly Forex Forecast - GOLD (XAUUSD), EURUSD, GBPJPY, GBPUSD, NZDCAD, AUDCHF - 25 September 2023 To 29 September 2023",u/imxoxoxo,https://www.reddit.com/r/Economics/comments/16qrnbh/weekly_forex_forecast_gold_xauusd_eurusd_gbpjpy/,Economics,https://www.xoxotraderfx.com/weekly-forex-forecast-gold-xauusd-eurusd-gbpjpy-gbpusd-nzdcad-audchf-25-september-2023-to-29-september-2023/
1,2023-09-24,https://www.heromotocorp.com/en-in/motorcycles/KarizmaXMR/order-booking.html?utm_source=Google&utm_medium=Discovery&utm_campaign=Rx_HMC_Premium_Karizma_India_Bookings_CPA_Discovery_CI_15Sep23&utm_term=Generic&utm_content=Image&gclid=CjwKCAjwmbqoBhAgEiwACIjzECuiWpYLglP-MxClBhszpfF3URHAmZz-EzO0jxbQuAW,u/Ambitious_Fee_8498,https://www.reddit.com/r/Economics/comments/16qua0u/httpswwwheromotocorpcomeninmotorcycleskarizmaxmror/,Economics,https://www.heromotocorp.com/en-in/motorcycles/KarizmaXMR/order-booking.html?utm_source=Google&utm_medium=Discovery&utm_campaign=Rx_HMC_Premium_Karizma_India_Bookings_CPA_Discovery_CI_15Sep23&utm_term=Generic&utm_content=Image&gclid=CjwKCAjwmbqoBhAgEiwACIjzECuiWpYLglP-MxClBhszpfF3URHAmZz-EzO0jxbQuAWM1_7eYUrWmRoCtiwQAvD_BwE
1,2023-09-24,"Even 1.4 billion people 'probably can't fill' all of China's vacant homes, ex-official admits | CNN Business",u/chilladipa,https://www.reddit.com/r/Economics/comments/16qwqbo/even_14_billion_people_probably_cant_fill_all_of/,Economics,https://www.cnn.com/2023/09/23/business/china-too-many-homes-for-1-4-billion-people-intl-hnk/index.html
