score,date,title,author,url,subreddit,text
1,2023-08-31,Planilha de Controle Financeiro,u/Successful-Bend-7220,https://www.reddit.com/r/Economics/comments/166tgx0/planilha_de_controle_financeiro/,Economics,https://youtube.com/watch?v=AxaYt5qn6VQ&si=eKL7fQ6auagniCfE
1,2023-08-31,"“Core Services” Inflation Jumps to 2nd Worst since 1985, “Non-Housing Services” Are Red Hot. Fed’s Job Far from Done - WolfStreet.com",u/tulipunaneradiaator,https://www.reddit.com/r/Economics/comments/166ul3l/core_services_inflation_jumps_to_2nd_worst_since/,Economics,https://wolfstreet.com/2023/08/31/core-services-inflation-jumps-to-2nd-worst-since-1990-non-housing-services-are-red-hot-feds-job-far-from-done/
1,2023-09-01,Arkansas Medical Cannabis Sales Set To Surpass Last Year’s Record Of $270M,u/WilliamBlack97AI,https://www.reddit.com/r/Economics/comments/1670760/arkansas_medical_cannabis_sales_set_to_surpass/,Economics,https://hightimes.com/news/arkansas-medical-cannabis-sales-set-to-surpass-last-years-record-of-270m/
1,2023-09-01,"PepsiCo, Mars declared ‘international war sponsors’ in Ukraine",u/LIGA_net,https://www.reddit.com/r/Economics/comments/1671xq0/pepsico_mars_declared_international_war_sponsors/,Economics,https://biz.liga.net/en/all/all/novosti/ukraina-vnesla-pepsico-i-mars-v-spisok-mejdunarodnyh-sponsorov-voyny
1,2023-09-01,"US stocks still face hard landing risks, Bank of America says",u/niki_sun,https://www.reddit.com/r/Economics/comments/1672i1v/us_stocks_still_face_hard_landing_risks_bank_of/,Economics,https://theedgemalaysia.com/node/680977
1,2023-09-01,Fed's preferred inflation measure edges higher in July,u/GetEdgeful,https://www.reddit.com/r/Economics/comments/1674hc0/feds_preferred_inflation_measure_edges_higher_in/,Economics,https://finance.yahoo.com/news/feds-preferred-inflation-measure-edges-higher-in-july-131802939.html
1,2023-09-01,US Core PCE inflation edges higher to 4.2% as expected,u/predictany007,https://www.reddit.com/r/Economics/comments/1674i8j/us_core_pce_inflation_edges_higher_to_42_as/,Economics,https://www.fxstreet.com/news/us-core-pce-inflation-preview-federal-reserve-preferred-price-indicator-set-to-remain-above-target-202308310636
1,2023-09-01,"August jobs report: US economy adds 187,000 jobs in August, unemployment rate unexpectedly rises to 3.8%",u/AptitudeSky,https://www.reddit.com/r/Economics/comments/1675xl3/august_jobs_report_us_economy_adds_187000_jobs_in/,Economics,https://finance.yahoo.com/news/august-jobs-report-us-economy-adds-187000-jobs-in-august-unemployment-rate-unexpectedly-rises-to-38-155705306.html
1,2023-09-01,‘Really bad economics’: Nobel laureate Joseph Stiglitz explains where the Fed went wrong on inflation,u/predictany007,https://www.reddit.com/r/Economics/comments/1676blj/really_bad_economics_nobel_laureate_joseph/,Economics,https://www.cnbc.com/2023/09/01/bad-economics-stiglitz-explains-how-the-fed-went-wrong-on-inflation.html
1,2023-09-01,"Canada economy slows sharply, supporting rate pause - BNN Bloomberg",u/league-throwawayy,https://www.reddit.com/r/Economics/comments/1676l2q/canada_economy_slows_sharply_supporting_rate/,Economics,https://www.bnnbloomberg.ca/economy-pulled-back-in-q2-revises-q1-growth-lower-statcan-1.1966119
1,2023-09-01,Canada Feels Like a House of Cards Waiting to Collapse,u/Inevitable_Bar_1338,https://www.reddit.com/r/Economics/comments/1678k5m/canada_feels_like_a_house_of_cards_waiting_to/,Economics,https://jacobin.com/2023/08/canada-inflation-housing-liberals-austerity-economy
1,2023-09-01,Argentina: Emergency Liquidity Support Through Chinese Central Bank Swap Line and Qatari SDR Loan,u/Public-Painting-4723,https://www.reddit.com/r/Economics/comments/1678miw/argentina_emergency_liquidity_support_through/,Economics,https://som.yale.edu/story/2023/argentina-emergency-liquidity-support-through-chinese-central-bank-swap-line-and-qatari
1,2023-09-01,Why Putin Is Worried About Russia’s Volatile Ruble,u/Salami_Slicer,https://www.reddit.com/r/Economics/comments/1679yta/why_putin_is_worried_about_russias_volatile_ruble/,Economics,https://www.bloomberg.com/news/articles/2023-09-01/why-putin-is-worried-about-russia-s-volatile-ruble-usd-rub
1,2023-09-01,"Macro equation setting up for recession, warns David Rosenberg",u/joe4942,https://www.reddit.com/r/Economics/comments/167ackr/macro_equation_setting_up_for_recession_warns/,Economics,https://www.cnbc.com/video/2023/08/31/macro-equation-setting-up-for-recession-warns-david-rosenberg.html
1,2023-09-01,Bright Spot: India's GDP Grew By 7.8% In April-June Quarter,u/Life-Tough-Place-23,https://www.reddit.com/r/Economics/comments/167agg4/bright_spot_indias_gdp_grew_by_78_in_apriljune/,Economics,https://thegeopolitica.com/bright-spot-indias-gdp-grew-by-7-8-in-april-june-quarter/
1,2023-09-01,China And Xi Jinping Do Not Want You To Know Just How Bad Things Are Getting For Their Economy,u/_Steve_Zissou_,https://www.reddit.com/r/Economics/comments/167aj27/china_and_xi_jinping_do_not_want_you_to_know_just/,Economics,https://finance.yahoo.com/news/china-xi-jinping-not-want-172749726.html?soc_src=social-sh&soc_trk=tw&tsrc=twtr
1,2023-09-01,"Stock Market Will Collapse, Big Companies Will Either Gone Or Lost Minimum 70-80% Value",u/AscensionJoying,https://www.reddit.com/r/Economics/comments/167axlw/stock_market_will_collapse_big_companies_will/,Economics,https://ascensionjoy.com/08/2023/stock-market-will-collapse-big-companies-will-either-gone-or-lost-minimum-70-80-value/
1,2023-09-01,Canada's economy unexpectedly shrinks; central bank likely to hold rates,u/RainbowCrown71,https://www.reddit.com/r/Economics/comments/167b1kx/canadas_economy_unexpectedly_shrinks_central_bank/,Economics,https://www.reuters.com/markets/canadian-economy-unexpectedly-contracts-q2-ahead-rate-decision-2023-09-01/
1,2023-09-01,"Unemployment rate unexpectedly rose to 3.8% in August as payrolls increased by 187,000",u/predictany007,https://www.reddit.com/r/Economics/comments/167b2k5/unemployment_rate_unexpectedly_rose_to_38_in/,Economics,https://www.cnbc.com/2023/09/01/jobs-report-august-2023.html
22,2023-09-01,Japan’s GDP Bump Is Real but Fragile,u/MaleficentParfait863,https://www.reddit.com/r/Economics/comments/167cwix/japans_gdp_bump_is_real_but_fragile/,Economics,https://foreignpolicy.com/2023/08/30/japan-gdp-economy-growth-bump-exports-tourism-china/
1,2023-09-01,"Reading Essentials of Economics McGraw Hill 12e for undergrad. Ch1 begins by saying the ""working class"" (their parentheses) has so many luxuries like TV. It's already biased toward American exceptionalism, capitalism, and the boot-straps narrative--are most economic textbooks like this?",u/olliebear_undercover,https://www.reddit.com/r/Economics/comments/167dbbq/reading_essentials_of_economics_mcgraw_hill_12e/,Economics,https://www.mheducation.com/highered/product/9781264122103?cid=ppc%7CHE%7CPDP_Students_Dynamic%7CGoogle%7C&gad=1&gclid=EAIaIQobChMImtG9iPaJgQMVL87CBB0n5wdSEAAYASAAEgKbcPD_BwE
1,2023-09-01,Fed's Mester: 'Job market is still strong' despite higher unemployment,u/AptitudeSky,https://www.reddit.com/r/Economics/comments/167dklt/feds_mester_job_market_is_still_strong_despite/,Economics,https://finance.yahoo.com/news/feds-mester-job-market-is-still-strong-despite-higher-unemployment-160848377.html
1,2023-09-01,"Student loan interest to resume, inching closer to end of loan payment pause",u/LoansPayDayOnline,https://www.reddit.com/r/Economics/comments/167edon/student_loan_interest_to_resume_inching_closer_to/,Economics,https://abcnews.go.com/Politics/student-loan-interest-resume-inching-closer-end-loan/story?id=102797773
1,2023-09-01,Paying 💲💲5💲💲,u/Cicibabee,https://www.reddit.com/r/Economics/comments/167efmu/paying_5/,Economics,https://shein.top/osye04p
1,2023-09-01,Tracking the Global Economies on one page,u/WorldMarketWindow,https://www.reddit.com/r/Economics/comments/167ema9/tracking_the_global_economies_on_one_page/,Economics,http://www.worldmarketwindow.com
1,2023-09-01,"Department of Labor announces proposal to restore, extend overtime protections for 3.6 million low-paid salaried workers",u/Eastcoastpal,https://www.reddit.com/r/Economics/comments/167h8a7/department_of_labor_announces_proposal_to_restore/,Economics,https://www.dol.gov/newsroom/releases/whd/whd20230830
1,2023-09-01,How real estate unaffordability is being propped up — A latticework of government demand-side policies are seemingly tailor-made to hold the line on unaffordably high housing prices,u/marketrent,https://www.reddit.com/r/Economics/comments/167iars/how_real_estate_unaffordability_is_being_propped/,Economics,https://nationalpost.com/opinion/great-canadian-housing-bailout-how-real-estate-unaffordability-is-propped-up
1,2023-09-01,"UK economy bounced back from Covid, ONS revisions reveal | Financial Times",u/EastLondonIrish,https://www.reddit.com/r/Economics/comments/167intk/uk_economy_bounced_back_from_covid_ons_revisions/,Economics,https://www.ft.com/content/50386cc2-003b-4af1-946b-cf3243da810f
1,2023-09-01,"UK economy bounced back from Covid, ONS revisions reveal",u/gs_nwi,https://www.reddit.com/r/Economics/comments/167k8nw/uk_economy_bounced_back_from_covid_ons_revisions/,Economics,https://www.ft.com/content/50386cc2-003b-4af1-946b-cf3243da810f
1,2023-09-01,"""I am house poor because of rising interest rates. A year ago, I had a comfortable life. Now I can’t afford to feed by kids."" Please, help Canadians through these rough times!",u/StarFlower0429,https://www.reddit.com/r/Economics/comments/167ml1h/i_am_house_poor_because_of_rising_interest_rates/,Economics,https://www.change.org/p/ask-canada-s-central-bank-to-stop-raising-interest-rates-further?redirect=false
1,2023-09-01,NBER Working Paper: Trouble in Farm Succession in the U.S,u/MysteriousResearcher,https://www.reddit.com/r/Economics/comments/167o7ml/nber_working_paper_trouble_in_farm_succession_in/,Economics,https://www.stoppopulationdecline.org/nber-farm-succession/
1,2023-09-01,Saudi Arabia’s Aramco Reportedly Considering $50 Billion Stock Sale—It Would Make It The Largest In History,u/Salami_Slicer,https://www.reddit.com/r/Economics/comments/167ofqa/saudi_arabias_aramco_reportedly_considering_50/,Economics,https://www.forbes.com/sites/willskipworth/2023/09/01/saudi-arabias-aramco-reportedly-considering-50-billion-stock-sale-it-would-make-it-the-largest-in-history/?sh=3f1e572186c1
1,2023-09-01,"Biden hails strength of economy as US adds 187,000 jobs in August",u/Barch3,https://www.reddit.com/r/Economics/comments/167qq4w/biden_hails_strength_of_economy_as_us_adds_187000/,Economics,https://www.theguardian.com/business/2023/sep/01/us-jobs-report-august-2023-inflation
1,2023-09-01,"Biden hails strength of economy as US adds 187,000 jobs in August",u/Barch3,https://www.reddit.com/r/Economics/comments/167qqnr/biden_hails_strength_of_economy_as_us_adds_187000/,Economics,https://www.theguardian.com/business/2023/sep/01/us-jobs-report-august-2023-inflation
1,2023-09-02,From war bunker to penthouse to market flop: how Germany's property boom ended,u/Pilast,https://www.reddit.com/r/Economics/comments/167uctt/from_war_bunker_to_penthouse_to_market_flop_how/,Economics,https://www.reuters.com/markets/europe/war-bunker-penthouse-market-flop-how-germanys-property-boom-ended-2023-09-01/
1,2023-09-02,"US employers added a solid 187,000 jobs in August in sign of a still-resilient labor market - Austin Daily Herald",u/free-form_curiosity,https://www.reddit.com/r/Economics/comments/167wz4d/us_employers_added_a_solid_187000_jobs_in_august/,Economics,https://www.austindailyherald.com/2023/09/us-employers-added-a-solid-187000-jobs-in-august-in-sign-of-a-still-resilient-labor-market/?utm_source=ground.news&utm_medium=referral
1,2023-09-02,https://www.autobest.co.in/stock-cars,u/Narrow-Spend-4813,https://www.reddit.com/r/Economics/comments/167ytyj/httpswwwautobestcoinstockcars/,Economics,https://www.autobest.co.in/stock-cars
1,2023-09-02,Chaos In The UK Market: Recession Bell Is Ringing Following Significant Drops in Factory Output and House Prices,u/Life-Tough-Place-23,https://www.reddit.com/r/Economics/comments/1680zht/chaos_in_the_uk_market_recession_bell_is_ringing/,Economics,https://thegeopolitica.com/chaos-in-the-uk-market-recession-bell-is-ringing-following-significant-drops-in-factory-output-and-house-prices/
1,2023-09-02,"Canadians work almost as much as Americans, yet produce far less. Why?",u/GirlsLoveFSAs,https://www.reddit.com/r/Economics/comments/1682rqh/canadians_work_almost_as_much_as_americans_yet/,Economics,https://www.theglobeandmail.com/business/commentary/article-a-labour-day-puzzle-canadians-work-more-than-europeans-yet-produce/
1,2023-09-02,Canadian dollar posts biggest loss in 1 month as economy shrinks,u/GirlsLoveFSAs,https://www.reddit.com/r/Economics/comments/1683i87/canadian_dollar_posts_biggest_loss_in_1_month_as/,Economics,https://ca.finance.yahoo.com/news/canadian-dollar-posts-biggest-loss-185837506.html
1,2023-09-02,Will Italy squander its €200bn opportunity?,u/Pilast,https://www.reddit.com/r/Economics/comments/1684ngh/will_italy_squander_its_200bn_opportunity/,Economics,https://www.ft.com/content/37f968ec-1b5d-4d97-a42f-c4b9324a7428
1,2023-09-02,5 Questions on US Government Debt and Interest Rate,u/pepperymotion,https://www.reddit.com/r/Economics/comments/1684xc7/5_questions_on_us_government_debt_and_interest/,Economics,https://www.nasdaq.com/articles/5-questions-on-us-government-debt-and-interest-rate
1,2023-09-02,The Staggering Economic Impact of Taylor Swift’s Eras Tour,u/jellyfishezie,https://www.reddit.com/r/Economics/comments/1685ttb/the_staggering_economic_impact_of_taylor_swifts/,Economics,https://time.com/6307420/taylor-swift-eras-tour-money-economy/?utm_source=join1440&utm_medium=email&utm_placement=newsletter
1,2023-09-02,Azl_services: I will create 2d or 3d custom unique nft art collection for your project for $5 on fiverr.com,u/InitiativeCute9550,https://www.reddit.com/r/Economics/comments/1686knb/azl_services_i_will_create_2d_or_3d_custom_unique/,Economics,https://www.fiverr.com/s/VL976z
1,2023-09-02,Novo Nordisk briefly eclipses LVMH as Europe’s most valuable company,u/jellyfishezie,https://www.reddit.com/r/Economics/comments/1686uxm/novo_nordisk_briefly_eclipses_lvmh_as_europes/,Economics,https://www.ft.com/content/97e89e94-38cb-4a22-9a17-c110e39958bc
1,2023-09-02,Mexico’s Economic Growth Revised Lower From Early Estimate,u/MaleficentParfait863,https://www.reddit.com/r/Economics/comments/1687h6v/mexicos_economic_growth_revised_lower_from_early/,Economics,https://www.bloomberg.com/news/articles/2023-08-29/mexico-s-economic-growth-revised-lower-from-preliminary-estimate
1,2023-09-02,Hong Kong Study: Boost in Fertility Intentions as Dads Step Up,u/Salami_Slicer,https://www.reddit.com/r/Economics/comments/16883hu/hong_kong_study_boost_in_fertility_intentions_as/,Economics,https://www.stoppopulationdecline.org/hong-kong-study-fathers-helping-out-increase-fertility-intentions/
1,2023-09-02,China looking to car sales as it seeks to get economy back on track,u/Salami_Slicer,https://www.reddit.com/r/Economics/comments/1688e8x/china_looking_to_car_sales_as_it_seeks_to_get/,Economics,https://www.scmp.com/news/china/article/3233212/china-looking-car-sales-it-seeks-get-faltering-economy-back-track
1,2023-09-02,Why The Future Doesn’t Need Us,u/Plenty-Agent-7112,https://www.reddit.com/r/Economics/comments/1688mrs/why_the_future_doesnt_need_us/,Economics,https://i.imgur.com/sDw1Jre.jpeg
1,2023-09-02,Why The Future Doesn’t Need Us,u/Plenty-Agent-7112,https://www.reddit.com/r/Economics/comments/1688o49/why_the_future_doesnt_need_us/,Economics,https://archive.ph/TH9cs
1,2023-09-02,Instability Hits India's Cryptocurrency Industry,u/Neelesh15,https://www.reddit.com/r/Economics/comments/1688xnn/instability_hits_indias_cryptocurrency_industry/,Economics,https://www.coingabbar.com/en/crypto-currency-news/indias-cryptocurrency-market-grew-shaky-exchanges-made-layoffs
1,2023-09-02,Jobs or Inflation: Which Will Cool Quicker?,u/KBindesboell,https://www.reddit.com/r/Economics/comments/168amzi/jobs_or_inflation_which_will_cool_quicker/,Economics,https://www.wsj.com/economy/jobs-or-inflation-which-will-cool-quicker-9b4219b7
1,2023-09-02,http://verifiedplaza.com,u/verifiedplaza,https://www.reddit.com/r/Economics/comments/168g6fv/httpverifiedplazacom/,Economics,http://verifiedplaza.com
346,2023-09-02,"Moody's lifts 2023 U.S. growth forecast, cuts China's for 2024",u/Terrapins1990,https://www.reddit.com/r/Economics/comments/168g86d/moodys_lifts_2023_us_growth_forecast_cuts_chinas/,Economics,https://www.yahoo.com/finance/news/moodys-lifts-2023-u-growth-164057686.html
1,2023-09-02,The Self-centered Political Economy of Peter Thiel,u/RememberRossetti,https://www.reddit.com/r/Economics/comments/168iu5z/the_selfcentered_political_economy_of_peter_thiel/,Economics,https://unravelingeconomics.substack.com/p/the-self-centered-political-economy?utm_medium=reader2
1,2023-09-02,"GraphGate: Larry Summers, The Center-left, and the Confused Narrative Around Inflation",u/RememberRossetti,https://www.reddit.com/r/Economics/comments/168ivrh/graphgate_larry_summers_the_centerleft_and_the/,Economics,https://unravelingeconomics.substack.com/p/graphgate-larry-summers-the-center?utm_medium=reader2
1,2023-09-02,Germany: The return of the 'sick man' of Europe?,u/NitroLada,https://www.reddit.com/r/Economics/comments/168jkeq/germany_the_return_of_the_sick_man_of_europe/,Economics,https://www.dw.com/en/germany-economy-weakens-2023/a-66403943
1,2023-09-02,Germany expected to be only major economy not to grow this year,u/NitroLada,https://www.reddit.com/r/Economics/comments/168jld3/germany_expected_to_be_only_major_economy_not_to/,Economics,https://www.euronews.com/2023/07/30/germany-expected-to-be-only-major-economy-not-to-grow-this-year
1,2023-09-02,6 reasons Australian productivity has gone backwards,u/NitroLada,https://www.reddit.com/r/Economics/comments/168joa8/6_reasons_australian_productivity_has_gone/,Economics,https://indaily.com.au/news/analysis/2023/06/26/6-reasons-australian-productivity-has-gone-backwards/
1,2023-09-02,Did you see this?,u/wowgood7979,https://www.reddit.com/r/Economics/comments/168lhdz/did_you_see_this/,Economics,https://www.youtube.com/watch?v=x2xijhGAvfU&list=PLHMzws_XcBOrf4IvsKl6doRNojB_qG77M&index=141
1,2023-09-02,Resilient U.S. Economy Defies Expectations,u/Severe_County_5041,https://www.reddit.com/r/Economics/comments/168ltlp/resilient_us_economy_defies_expectations/,Economics,https://www.wsj.com/economy/resilient-u-s-economy-defies-expectations-85be69f3?mod=hp_lead_pos3
1,2023-09-02,Trying to make sense of the UK’s sudden economic correction — Another run on the national statistics rollercoaster,u/marketrent,https://www.reddit.com/r/Economics/comments/168mn45/trying_to_make_sense_of_the_uks_sudden_economic/,Economics,https://www.ft.com/content/7b95e3d9-c5a1-42d5-84a8-921c9088ca1c
1,2023-09-03,Your Evening Briefing: China’s Economic Problems Have Flipped the Narrative,u/koukouvagia777,https://www.reddit.com/r/Economics/comments/168ng7c/your_evening_briefing_chinas_economic_problems/,Economics,https://www.bloomberg.com/news/newsletters/2023-09-01/bloomberg-evening-briefing-china-s-troubled-economy-has-flipped-the-narrative
248,2023-09-03,German government anticipates huge windfall with legalization of cannabis,u/WilliamBlack97AI,https://www.reddit.com/r/Economics/comments/168pz90/german_government_anticipates_huge_windfall_with/,Economics,https://english.elpais.com/international/2023-09-01/german-government-anticipates-huge-windfall-with-legalization-of-cannabis.html
1,2023-09-03,"Italy's economy shrinks in latest quarter, casting shadow over outlook",u/Pilast,https://www.reddit.com/r/Economics/comments/168qnzl/italys_economy_shrinks_in_latest_quarter_casting/,Economics,https://www.reuters.com/markets/europe/italys-economy-shrinks-by-04-q2-casting-shadow-over-outlook-2023-09-01/
1,2023-09-03,What are the Best-Selling Car Brands in the World?,u/Narrow-Spend-4813,https://www.reddit.com/r/Economics/comments/168u6jj/what_are_the_bestselling_car_brands_in_the_world/,Economics,https://youtube.com/shorts/yS7OdivGQf8?si=o2V5VSZrohQ6_4jO
1,2023-09-03,Why is PPP so weird?,u/Hellenic_Fish,https://www.reddit.com/r/Economics/comments/168vyra/why_is_ppp_so_weird/,Economics,https://data.worldbank.org/indicator/NY.GDP.PCAP.PP.CD?locations=GR
1,2023-09-03,"The Information Revolution is proceeding on a track similar to the early decades of the Industrial Revolution, Acemoglu and Johnson say",u/Penguin4512,https://www.reddit.com/r/Economics/comments/168z8xi/the_information_revolution_is_proceeding_on_a/,Economics,https://www.imf.org/-/media/Files/Publications/Fandd/Article/2023/September/Book-reviews-Prakash-Loungani.ashx
1,2023-09-03,Diamond Prices Are in Free Fall in One Key Corner of the Market,u/mostly-sun,https://www.reddit.com/r/Economics/comments/168zm4t/diamond_prices_are_in_free_fall_in_one_key_corner/,Economics,https://finance.yahoo.com/news/lab-grown-gems-crashing-prices-091002828.html
1,2023-09-03,"Proyecto de Nación 2024 - 2030 - Foro ""Rescate del campo y autosuficienc...",u/Otherwise-Reply-1098,https://www.reddit.com/r/Economics/comments/1691ls3/proyecto_de_nación_2024_2030_foro_rescate_del/,Economics,https://youtube.com/live/LOGF8XvyZ6U?si=Q8_Ey2qFpd_1hvte
24,2023-09-03,Beijing has made itself ‘uninvestable’ for US firms,u/davinci-code,https://www.reddit.com/r/Economics/comments/16924e7/beijing_has_made_itself_uninvestable_for_us_firms/,Economics,https://www.guardianmag.us/2023/09/beijing-has-made-itself-uninvestable.html?m=1
1,2023-09-03,Check out my economics Substack - and don't forget to subscribe,u/ActuaryElectronic823,https://www.reddit.com/r/Economics/comments/1692wu3/check_out_my_economics_substack_and_dont_forget/,Economics,https://substack.com/@theeconrave?utm_source=user-menu
1,2023-09-03,Check out my Economics Substack and don't forget to subscribe,u/ActuaryElectronic823,https://www.reddit.com/r/Economics/comments/1692z6f/check_out_my_economics_substack_and_dont_forget/,Economics,https://substack.com/@theeconrave?utm_source=user-menu
1,2023-09-03,The Canada Conundrum,u/PicoRascar,https://www.reddit.com/r/Economics/comments/1693khi/the_canada_conundrum/,Economics,https://archive.ph/20230903152341/https://www.ft.com/content/67e97cc4-6ab0-4e78-b4a8-7c97b8e52ada
1,2023-09-03,please loan me money for my business and i’ll give it back with 30% of the profits,u/primrossete,https://www.reddit.com/r/Economics/comments/1694v8o/please_loan_me_money_for_my_business_and_ill_give/,Economics,https://drive.google.com/file/d/1VMBlKV8g7EKrKe_ed0KylVB0nrgxh6LJ/view?usp=drivesdk
1,2023-09-03,"Italy did not get expected results from China Belt and Road deal, foreign minister says",u/dect60,https://www.reddit.com/r/Economics/comments/1694wnp/italy_did_not_get_expected_results_from_china/,Economics,https://www.reuters.com/world/italy-fm-belt-road-china-deal-did-not-bring-expected-results-2023-09-02/
1,2023-09-03,Why isn’t Canada an economic giant?,u/MaleficentParfait863,https://www.reddit.com/r/Economics/comments/1696f2j/why_isnt_canada_an_economic_giant/,Economics,https://www.ft.com/content/67e97cc4-6ab0-4e78-b4a8-7c97b8e52ada
1,2023-09-03,"Oregon Marijuana Stores Sold $81 Million in August, Marijuana Taxes Reach $1 Billion Since 2016",u/JamesAsher12,https://www.reddit.com/r/Economics/comments/1696wv5/oregon_marijuana_stores_sold_81_million_in_august/,Economics,https://themarijuanaherald.com/2023/09/oregon-marijuana-stores-sold-81-million-in-august-marijuana-taxes-reach-1-billion-since-2016/
1,2023-09-03,"Russia may recruit foreigners, migrant workers for Ukraine combat",u/marketrent,https://www.reddit.com/r/Economics/comments/1697b1w/russia_may_recruit_foreigners_migrant_workers_for/,Economics,https://tvpworld.com/72459646/russia-may-recruit-foreigners-migrant-workers-for-ukraine-combat-uk
1,2023-09-03,How the ‘urban doom loop’ could pose the next economic threat,u/dust4ngel,https://www.reddit.com/r/Economics/comments/1699ict/how_the_urban_doom_loop_could_pose_the_next/,Economics,https://www.washingtonpost.com/business/2023/08/28/commercial-real-estate-economy-urban-doom-loop/
1,2023-09-03,in this excel sheet i wrote all the key words and things that an economist should khow and if you know them alread you have GOD rank in economics,u/yassine-efounder,https://www.reddit.com/r/Economics/comments/1699nbk/in_this_excel_sheet_i_wrote_all_the_key_words_and/,Economics,https://1drv.ms/x/s!AtcjBM8KiqgUmz4PzTLONSS6rpIU?e=pj2RlH&nav=MTVfezAwMDAwMDAwLTAwMDEtMDAwMC0wMDAwLTAwMDAwMDAwMDAwMH0
1,2023-09-03,"TOO MANY PEOPLE HAVE JOBS ""When you hear 'the economy is bad' you should be asking: “bad for who?”""",u/naxh94,https://www.reddit.com/r/Economics/comments/169exhu/too_many_people_have_jobs_when_you_hear_the/,Economics,https://www.instagram.com/reel/CrMMDOlAma3/?utm_source=ig_web_button_share_sheet&igshid=MzRlODBiNWFlZA==
1,2023-09-03,"TOO MANY PEOPLE HAVE JOBS ""When you hear “the economy is bad” you should be asking: “bad for who?”""",u/naxh94,https://www.reddit.com/r/Economics/comments/169ez7v/too_many_people_have_jobs_when_you_hear_the/,Economics,https://www.instagram.com/reel/CrMMDOlAma3/?utm_source=ig_web_button_share_sheet&igshid=MzRlODBiNWFlZA==
1,2023-09-03,Escort Ad: Hit me up 2724474835 Massages New York Escorts Memphis Escorts Out-Call Stripper,u/Turbulent_Path_8159,https://www.reddit.com/r/Economics/comments/169f63b/escort_ad_hit_me_up_2724474835_massages_new_york/,Economics,https://www.kittyads.com/t-52765
