score,date,title,author,url,subreddit,text
19,2023-01-10,You can now build a web game from scratch without actual coding thanks to ChatGPT,u/[deleted],https://www.reddit.com/r/technology/comments/1085j08/you_can_now_build_a_web_game_from_scratch_without/,technology,
1,2023-01-10,"I recently bought a desktop setup (i7-7700, msi b150m vh-pro, 16gb ddr4, fsp hyper 500w psu) and I added a rtx 3060 to it. It underperforms in competitive games. I found a gaming benchmark with the same specs except it has a 1660ti, and it performed better than mine in CS GO and Fortnite. Any ideas?",u/nicu020,https://www.reddit.com/r/technology/comments/1085zlu/i_recently_bought_a_desktop_setup_i77700_msi/,technology,
9,2023-01-10,WhatsApp will soon enable local chat transfers on Android,u/yourtechstoryblogs,https://www.reddit.com/r/technology/comments/1085zmd/whatsapp_will_soon_enable_local_chat_transfers_on/,technology,https://www.yourtechstory.com/2023/01/10/whatsapp-will-soon-enable-local-chat-transfers-on-android/
1,2023-01-10,Check out our latest GPT-3 survey. We're looking for participants that read a few conversations people held with a chatbot we built using GPT-3 and then rate the chatbot's behavior. The survey takes around 15-20 minutes. If you're a Swiss or German resident you can win one of 20 cinema vouchers!,u/ProgrammerFar1286,https://www.reddit.com/r/technology/comments/10862zc/check_out_our_latest_gpt3_survey_were_looking_for/,technology,https://cgl.ethz.ch/chatbot-survey
1,2023-01-10,Tesla FSD Autopilot UK - Chesterfield to Sheffield Test,u/RANDOMDBZ,https://www.reddit.com/r/technology/comments/108673e/tesla_fsd_autopilot_uk_chesterfield_to_sheffield/,technology,https://youtu.be/ZZi5Z6m4Un0
36,2023-01-10,App Store and Play Store are flooded with dubious ChatGPT apps,u/kajri,https://www.reddit.com/r/technology/comments/1086bul/app_store_and_play_store_are_flooded_with_dubious/,technology,https://techcrunch.com/2023/01/10/app-store-and-play-store-are-flooded-with-dubious-chatgpt-apps/?tpcc=tcplustwitter
6,2023-01-10,Lenovo unveils YogaBook 9i hands-on dual-screen laptop,u/yourtechstoryblogs,https://www.reddit.com/r/technology/comments/1086e2t/lenovo_unveils_yogabook_9i_handson_dualscreen/,technology,https://www.yourtechstory.com/2023/01/10/ces-2023-lenovo-unveils-yogabook-9i-hands-on-dual-screen-laptop/
1,2023-01-10,Sun-tracking vs. fixed vehicle-integrated PV,u/talksolar,https://www.reddit.com/r/technology/comments/1086fln/suntracking_vs_fixed_vehicleintegrated_pv/,technology,https://www.pv-magazine.com/2023/01/09/sun-tracking-vs-fixed-vehicle-integrated-pv/
358,2023-01-10,Microsoft in talks to invest $10 bln in ChatGPT owner -Semafor,u/Few-Secretary2487,https://www.reddit.com/r/technology/comments/1086fwa/microsoft_in_talks_to_invest_10_bln_in_chatgpt/,technology,https://www.reuters.com/technology/microsoft-talks-invest-10-bln-chatgpt-owner-semafor-2023-01-10/
1,2023-01-10,Why Social Media is FAKE and just a Huge Bussines,u/MyFinalFantasyx,https://www.reddit.com/r/technology/comments/1086m3k/why_social_media_is_fake_and_just_a_huge_bussines/,technology,https://www.youtube.com/shorts/raIqZPTKF94
1,2023-01-10,Social media marketing is the new way of dealing with the online audience. It is the service through which businesses can promote their products or services to a global audience. Read full article : https://mixhubb.com/blog/social-media-marketing/,u/kayleejohnson01,https://www.reddit.com/r/technology/comments/1086pz6/social_media_marketing_is_the_new_way_of_dealing/,technology,
152,2023-01-10,Could floating solar farms survive out at sea?,u/Jojuj,https://www.reddit.com/r/technology/comments/1086urt/could_floating_solar_farms_survive_out_at_sea/,technology,https://www.bbc.co.uk/news/business-63728020
1,2023-01-10,Airbus and VDL Group join forces to produce an airborne laser communication terminal,u/Jetlineacademy1245,https://www.reddit.com/r/technology/comments/1086vuf/airbus_and_vdl_group_join_forces_to_produce_an/,technology,https://jetlinemarvel.net/airbus-and-vdl-group-join-forces-to-produce-an-airborne-laser-communication-terminal/
12036,2023-01-10,Microsoft’s new AI can simulate anyone’s voice with 3 seconds of audio Text-to-speech model can preserve speaker's emotional tone and acoustic environment.,u/x0y1,https://www.reddit.com/r/technology/comments/1086xri/microsofts_new_ai_can_simulate_anyones_voice_with/,technology,https://arstechnica.com/information-technology/2023/01/microsofts-new-ai-can-simulate-anyones-voice-with-3-seconds-of-audio/?comments=1&amp;comments-page=3
1,2023-01-10,WhatsApp’s Pegasus spyware lawsuit can go ahead: US top court,u/KateKrause,https://www.reddit.com/r/technology/comments/10876s0/whatsapps_pegasus_spyware_lawsuit_can_go_ahead_us/,technology,
1,2023-01-10,How the world’s last UX writer got hired,u/[deleted],https://www.reddit.com/r/technology/comments/1087dzi/how_the_worlds_last_ux_writer_got_hired/,technology,
1,2023-01-10,SharePoint customization Solutions,u/KLoBot-AI,https://www.reddit.com/r/technology/comments/1087lw6/sharepoint_customization_solutions/,technology,https://klstinc.com/sharepoint/
1,2023-01-10,How 43 of the Top 100 Brands are using Crypto (and the Latest Big Project),u/ACEM2Infinite,https://www.reddit.com/r/technology/comments/1087s38/how_43_of_the_top_100_brands_are_using_crypto_and/,technology,https://medium.com/@Cryptoldyouso/how-43-of-the-top-100-brands-are-using-crypto-and-the-latest-big-project-6ac1dbbbaa82
4,2023-01-10,How bio-inspired materials might inform the design of next-generation computers,u/Ssider69,https://www.reddit.com/r/technology/comments/1087tsn/how_bioinspired_materials_might_inform_the_design/,technology,https://techxplore.com/news/2023-01-bio-inspired-materials-next-generation.html
1,2023-01-10,How Medical Animation is Changing Healthcare,u/Buzzflick,https://www.reddit.com/r/technology/comments/10881ae/how_medical_animation_is_changing_healthcare/,technology,https://www.healthcarebloggers.com/how-medical-animation-is-changing-healthcare/
11,2023-01-10,Opinion: Republicans and Democrats actually agree that America must be a tech leader. Here’s what this means for the U.S. economy and jobs.,u/Vailhem,https://www.reddit.com/r/technology/comments/1088cnt/opinion_republicans_and_democrats_actually_agree/,technology,https://www.marketwatch.com/story/republicans-and-democrats-actually-agree-that-america-must-be-a-tech-leader-heres-what-this-means-for-the-u-s-economy-and-jobs-11673259399
1,2023-01-10,What was a major plot point in a movie ten+ years ago that would be entirely obsolete now with current technology?,u/[deleted],https://www.reddit.com/r/technology/comments/1088hjc/what_was_a_major_plot_point_in_a_movie_ten_years/,technology,[removed]
1,2023-01-10,Elon Musk Breaks Guinness World Record For Largest-Ever Loss Of Personal Fortune,u/[deleted],https://www.reddit.com/r/technology/comments/1088iqn/elon_musk_breaks_guinness_world_record_for/,technology,
3684,2023-01-10,Facial recognition leads to week-long wrongful imprisonment,u/Sorin61,https://www.reddit.com/r/technology/comments/1088tqx/facial_recognition_leads_to_weeklong_wrongful/,technology,https://www.techspot.com/news/97215-facial-recognition-leads-week-long-wrongful-imprisonment.html
1,2023-01-10,Best laptop under 35k,u/parteekjain,https://www.reddit.com/r/technology/comments/10890ny/best_laptop_under_35k/,technology,https://gyankepatshala.blogspot.com/2023/01/which-is-best-laptop-for-coding-ang.html
5933,2023-01-10,"Ohio and New Jersey ban Tiktok on government devices over Chinese surveillance fears, joining over 20 other states",u/chrisdh79,https://www.reddit.com/r/technology/comments/10896cw/ohio_and_new_jersey_ban_tiktok_on_government/,technology,https://www.businessinsider.com/tiktok-ban-new-jersey-ohio-government-devices-latest-states-2023-1
1,2023-01-10,Best Programming Languages For Hacking In 2023,u/ARFASOFTECH,https://www.reddit.com/r/technology/comments/1089cl2/best_programming_languages_for_hacking_in_2023/,technology,https://www.arfasoftech.com/blog/Best-Programming-Languages-For-Hacking-In-2023
0,2023-01-10,"A browser extension that makes two GPT chat instances talk to each other. Give them names, set the discussion subject and see where it goes. Can actually output interesting things when it doesn't end up in a self-agreeing loop 😂",u/[deleted],https://www.reddit.com/r/technology/comments/1089d7n/a_browser_extension_that_makes_two_gpt_chat/,technology,
2,2023-01-10,Coinbase lays off further 25% employees,u/[deleted],https://www.reddit.com/r/technology/comments/1089gfc/coinbase_lays_off_further_25_employees/,technology,
14,2023-01-10,"Israeli Spy Tech Sold to Bangladesh, World’s Third-largest Muslim Country, Despite Dismal Human Rights Record",u/Toidotlers,https://www.reddit.com/r/technology/comments/1089suo/israeli_spy_tech_sold_to_bangladesh_worlds/,technology,https://www.haaretz.com/israel-news/security-aviation/2023-01-10/ty-article/israeli-spy-tech-sold-to-worlds-third-largest-muslim-country/00000185-9692-d16a-a987-f6b75dd00000
4,2023-01-10,quantum-quack.org: A tool that allows you to easily use a quantum random number generator and make quantum choices,u/Rafcall98,https://www.reddit.com/r/technology/comments/108a19q/quantumquackorg_a_tool_that_allows_you_to_easily/,technology,https://quantum-quack.org/
0,2023-01-10,ChatGPT Founder Predicts They Will Foot The Bill For Universal Basic Income,u/secret-millionaire,https://www.reddit.com/r/technology/comments/108a3vg/chatgpt_founder_predicts_they_will_foot_the_bill/,technology,https://ainewsbase.com/gptzero-detects-ai-generated-content/
1,2023-01-10,Galaxy A71 5G gets served with Android 13 update in the US,u/[deleted],https://www.reddit.com/r/technology/comments/108a74p/galaxy_a71_5g_gets_served_with_android_13_update/,technology,
1,2023-01-10,Iran Says Face Recognition Will ID Women Breaking Hijab Laws,u/[deleted],https://www.reddit.com/r/technology/comments/108a8z1/iran_says_face_recognition_will_id_women_breaking/,technology,
1,2023-01-10,AI is Steroids YOU can use,u/ChemistMission4547,https://www.reddit.com/r/technology/comments/108a95l/ai_is_steroids_you_can_use/,technology,https://medium.com/@f20220525/ai-is-steroids-you-can-use-heres-how-48ea535c4a1c
13,2023-01-10,OVR Technology to launch VR headsets with sense of smell at CES 2023,u/AlmaGrate,https://www.reddit.com/r/technology/comments/108a9mg/ovr_technology_to_launch_vr_headsets_with_sense/,technology,https://www.todaynftnews.com/ovr-technology-to-launch-vr-headsets-with-sense-of-smell-at-ces-2023/
1,2023-01-10,nowTechie: ServiceNow articles,u/[deleted],https://www.reddit.com/r/technology/comments/108aajy/nowtechie_servicenow_articles/,technology,
0,2023-01-10,How iOS mobile app development can boost your business growth,u/minkwhaly,https://www.reddit.com/r/technology/comments/108ahb7/how_ios_mobile_app_development_can_boost_your/,technology,https://www.techwebly.com/ios-mobile-app-development-how-it-can-boost-your-business-growth/
248,2023-01-10,Microsoft’s new AI can simulate anyone’s voice with 3 seconds of audio,u/escanorlegend,https://www.reddit.com/r/technology/comments/108ai0h/microsofts_new_ai_can_simulate_anyones_voice_with/,technology,https://arstechnica.com/information-technology/2023/01/microsofts-new-ai-can-simulate-anyones-voice-with-3-seconds-of-audio/
1,2023-01-10,"Dataloop love the AI and ML community and decided to create a free ICOn pack, because, well, it's not the same without beautiful icons. Check it out for free on github : https://github.com/dataloop-ai/icons BTW - If you want, feel free to ask for more icons! check it out!",u/MoranLeshemBar,https://www.reddit.com/r/technology/comments/108akmn/dataloop_love_the_ai_and_ml_community_and_decided/,technology,https://github.com/dataloop-ai/icons
1,2023-01-10,Iran Says Face Recognition Will ID Women Breaking Hijab Laws,u/[deleted],https://www.reddit.com/r/technology/comments/108alcc/iran_says_face_recognition_will_id_women_breaking/,technology,
1,2023-01-10,Icons for ML tools,u/MoranLeshemBar,https://www.reddit.com/r/technology/comments/108ama0/icons_for_ml_tools/,technology,https://github.com/dataloop-ai/icons
1,2023-01-10,Icons for ML,u/MoranLeshemBar,https://www.reddit.com/r/technology/comments/108an9m/icons_for_ml/,technology,https://github.com/dataloop-ai/icons
29,2023-01-10,Startup Uses AI Chatbot to Provide Mental Health Counseling and Then Realizes It 'Feels Weird',u/Sorin61,https://www.reddit.com/r/technology/comments/108ankh/startup_uses_ai_chatbot_to_provide_mental_health/,technology,https://www.vice.com/en/article/4ax9yw/startup-uses-ai-chatbot-to-provide-mental-health-counseling-and-then-realizes-it-feels-weird
1,2023-01-10,Microsoft Said To Be Discussing $10B Investment In ChatGPT Owner As Part Of Complex Deal,u/habichuelacondulce,https://www.reddit.com/r/technology/comments/108anus/microsoft_said_to_be_discussing_10b_investment_in/,technology,https://www.benzinga.com/news/23/01/30345286/microsoft-said-to-be-discussing-10b-investment-in-chatgpt-owner-as-part-of-complex-deal
1,2023-01-10,Dataloop created icons for ML,u/MoranLeshemBar,https://www.reddit.com/r/technology/comments/108aocd/dataloop_created_icons_for_ml/,technology,https://github.com/dataloop-ai/icons
1,2023-01-10,"I want to build my own version of Chatgpt( obviously a lot smaller) What keywords must I search for tutorials, large language models or chat bots or what? And do you know of any courses or books that will help me build something smaller. Thanks",u/[deleted],https://www.reddit.com/r/technology/comments/108aqln/i_want_to_build_my_own_version_of_chatgpt/,technology,
1,2023-01-10,Scientists Find Something Strange in Brain Scans of Kids Hooked on Social Media,u/Hyperion1144,https://www.reddit.com/r/technology/comments/108b3h9/scientists_find_something_strange_in_brain_scans/,technology,https://futurism.com/neoscope/scientists-brain-scans-kids-social-media
257,2023-01-10,"EPA proposes tightening fine particulate matter standard, potentially affecting coal power plants",u/geoxol,https://www.reddit.com/r/technology/comments/108b62c/epa_proposes_tightening_fine_particulate_matter/,technology,https://www.utilitydive.com/news/epa-fine-particulate-matter-standard-soot-PM-2-proposal/639800/
6,2023-01-10,"Buy with Prime, which brings Prime to third-party sites, officially launches in U.S. on Jan. 31",u/iingot,https://www.reddit.com/r/technology/comments/108bf74/buy_with_prime_which_brings_prime_to_thirdparty/,technology,https://techcrunch.com/2023/01/10/buy-with-prime-which-brings-prime-to-third-party-sites-officially-launches-in-u-s-on-jan-31/
1,2023-01-10,Thermoresistant Tube heat shrink tubing kit,u/Solabdelnaby,https://www.reddit.com/r/technology/comments/108bm89/thermoresistant_tube_heat_shrink_tubing_kit/,technology,https://sedrateck.myshopify.com/products/thermoresistant-tube-heat-shrink-tubing-kit-termoretractil-heat-shrink-tube-assorted-pack-diy-insulation-for-cables-shrink-wrap-2
1,2023-01-10,Luxury Goods Industry Email List | Luxury Goods Mailing Database,u/Slow_Bid5781,https://www.reddit.com/r/technology/comments/108bpho/luxury_goods_industry_email_list_luxury_goods/,technology,https://www.targetnxt.com/industry-mailing-lists/luxury-goods-industry-email-list/
293,2023-01-10,"Japan, U.S. to cooperate over next-generation nuclear reactors",u/JustMyOpinionz,https://www.reddit.com/r/technology/comments/108bu4m/japan_us_to_cooperate_over_nextgeneration_nuclear/,technology,https://english.kyodonews.net/news/2023/01/c3ef22513bfe-japan-us-to-cooperate-over-next-generation-nuclear-reactors.html
176,2023-01-10,Coinbase to slash 20% of workforce in second major round of job cuts,u/ChocolateTsar,https://www.reddit.com/r/technology/comments/108bwjj/coinbase_to_slash_20_of_workforce_in_second_major/,technology,https://www.cnbc.com/2023/01/10/coinbase-to-slash-20percent-of-workforce-in-second-major-round-of-job-cuts.html
15,2023-01-10,Meta Abandons Original Quest VR Headset | The company will stop providing feature updates and security fixes by 2024.,u/chrisdh79,https://www.reddit.com/r/technology/comments/108bxlr/meta_abandons_original_quest_vr_headset_the/,technology,https://gizmodo.com/meta-no-longer-updating-original-quest-vr-headset-1849969246
1,2023-01-10,ChatGPT - the next step of AI,u/technically_tech_,https://www.reddit.com/r/technology/comments/108byyv/chatgpt_the_next_step_of_ai/,technology,https://onlytech14.blogspot.com/2023/01/chatgpt-next-step-of-ai.html
1,2023-01-10,How To Make Professional YouTube Banner,u/tahsinul55,https://www.reddit.com/r/technology/comments/108c0f4/how_to_make_professional_youtube_banner/,technology,https://youtu.be/XPiRtuMgSYA
0,2023-01-10,ChatGPT Team Looking for Ways To Monetize,u/secret-millionaire,https://www.reddit.com/r/technology/comments/108c2u2/chatgpt_team_looking_for_ways_to_monetize/,technology,https://ainewsbase.com/chatgpt-looking-to-monetize/
3,2023-01-10,It's not all about blockchain. 5 alternative distributed ledger technologies,u/Wundi20Sclera,https://www.reddit.com/r/technology/comments/108c758/its_not_all_about_blockchain_5_alternative/,technology,https://coinpaper.com/797/it-s-not-all-about-blockchain-5-alternative-distributed-ledger-technologies
25,2023-01-10,Microsoft's VALL-E AI can mimic any voice from a short audio sample,u/[deleted],https://www.reddit.com/r/technology/comments/108cacx/microsofts_valle_ai_can_mimic_any_voice_from_a/,technology,
52,2023-01-10,Facebook and Instagram to restrict advertisers’ access to teenagers’ data,u/misana123,https://www.reddit.com/r/technology/comments/108cakk/facebook_and_instagram_to_restrict_advertisers/,technology,https://www.theguardian.com/technology/2023/jan/10/facebook-and-instagram-to-tighten-restrictions-around-teenagers-data
1,2023-01-10,VR Society,u/ElliceBailey,https://www.reddit.com/r/technology/comments/108cau0/vr_society/,technology,https://www.youtube.com/watch?v=sBtSeIkoz-Q
14,2023-01-10,Amazon Workers Are Buying Pins Commemorating ‘Surviving’ Peak Season,u/[deleted],https://www.reddit.com/r/technology/comments/108cdbt/amazon_workers_are_buying_pins_commemorating/,technology,
11,2023-01-10,"Taxing electric vehicles will impact 2023 UK motoring trends, says operations expert",u/Sorin61,https://www.reddit.com/r/technology/comments/108dcpe/taxing_electric_vehicles_will_impact_2023_uk/,technology,https://techxplore.com/news/2023-01-taxing-electric-vehicles-impact-uk.html
2887,2023-01-10,"AI-powered ""robot"" lawyer will be first of its kind to represent defendant in court",u/Queen__Antifa,https://www.reddit.com/r/technology/comments/108dg4v/aipowered_robot_lawyer_will_be_first_of_its_kind/,technology,https://www.cbsnews.com/news/ai-powered-robot-lawyer-takes-its-first-court-case/
160,2023-01-10,"AI legal assistant will help defendant fight a speeding case in court - In February, an AI from DoNotPay is set to tell a defendant exactly what to say and when during an entire court case. It is likely to be the first ever case defended by an artificial intelligence",u/speckz,https://www.reddit.com/r/technology/comments/108drys/ai_legal_assistant_will_help_defendant_fight_a/,technology,https://www.newscientist.com/article/2351893-ai-legal-assistant-will-help-defendant-fight-a-speeding-case-in-court/
1,2023-01-10,What is sober drive technology?,u/ScrollUSA,https://www.reddit.com/r/technology/comments/108e1h0/what_is_sober_drive_technology/,technology,https://www.scrollusa.com/2023/01/what-is-sober-drive-technology.html
1,2023-01-10,Newley started store with good quality products! (World wide),u/MrM0nk3yMah,https://www.reddit.com/r/technology/comments/108e8rm/newley_started_store_with_good_quality_products/,technology,https://store4u.se
0,2023-01-10,Watching Star Wars: Episode IV in your terminal (ASCII-ART),u/mehdifarsi,https://www.reddit.com/r/technology/comments/108e940/watching_star_wars_episode_iv_in_your_terminal/,technology,https://www.youtube.com/watch?v=GqJrI12ruxg
1,2023-01-10,Exclusive: Surveillance Footage of Tesla Crash on SF’s Bay Bridge Hours After Elon Musk Announces “Self-Driving” Feature,u/[deleted],https://www.reddit.com/r/technology/comments/108ebl5/exclusive_surveillance_footage_of_tesla_crash_on/,technology,
1,2023-01-10,U.S. asks Tesla about Musk tweet on driver monitoring function,u/esporx,https://www.reddit.com/r/technology/comments/108ef54/us_asks_tesla_about_musk_tweet_on_driver/,technology,https://www.reuters.com/business/autos-transportation/us-asks-tesla-about-musk-tweet-driver-monitoring-function-2023-01-09/
1,2023-01-10,I bought a computer online and noticed it has this weird barely audible slow continuous beeping. Can anyone tell me what that is or where it's coming from. I checked the fan motor and it didn't squeak but I have no clue at what I'm looking at but I'm and don't know if I should be concerned.,u/[deleted],https://www.reddit.com/r/technology/comments/108en1r/i_bought_a_computer_online_and_noticed_it_has/,technology,[removed]
0,2023-01-10,Where managers and employees disagree the most about remote work,u/JannTosh12,https://www.reddit.com/r/technology/comments/108estn/where_managers_and_employees_disagree_the_most/,technology,https://www.businessreport.com/business/where-managers-and-employees-disagree-the-most-about-remote-work?amp=1
1,2023-01-10,Digital Assets https://www.reddit.com/r/polls/comments/108dls8/would_you_use_a_payment_platform_powdered_only_by/?utm_source=share&amp;utm_medium=android_app&amp;utm_name=androidcss&amp;utm_term=1&amp;utm_content=share_button,u/EntertainerOwn3575,https://www.reddit.com/r/technology/comments/108evlt/digital_assets/,technology,
1,2023-01-10,"A.I is getting too good (Chat GPT, AI Art), Is it scary?",u/Facetious35,https://www.reddit.com/r/technology/comments/108ex77/ai_is_getting_too_good_chat_gpt_ai_art_is_it_scary/,technology,https://youtube.com/watch?v=6gGBhrXPJ0o&amp;feature=share
1,2023-01-10,Fed Powell speech Bitcoin holds,u/Spiritual_Grand_103,https://www.reddit.com/r/technology/comments/108f0g3/fed_powell_speech_bitcoin_holds/,technology,https://coinsatoz.com/fed-powells-speech-bitcoin-holds-at-17000-as-gbtc-surg/
1,2023-01-10,"Exclusive: Surveillance Footage of Tesla Crash on SF's Bay Bridge Hours After Elon Musk Announces ""Self-Driving"" Feature",u/CVance1,https://www.reddit.com/r/technology/comments/108f1gk/exclusive_surveillance_footage_of_tesla_crash_on/,technology,https://theintercept.com/2023/01/10/tesla-crash-footage-autopilot/
0,2023-01-10,Step Aboard the Solar-Powered ‘Tesla on the Water’,u/[deleted],https://www.reddit.com/r/technology/comments/108f217/step_aboard_the_solarpowered_tesla_on_the_water/,technology,
1,2023-01-10,Open AI powered transcriber app I made,u/pablopeniche,https://www.reddit.com/r/technology/comments/108fh4k/open_ai_powered_transcriber_app_i_made/,technology,https://vienna.earth/meta/scribe
1,2023-01-10,Do you Know how to find best budget drone under 25$ ?,u/Tricky_Lifeguard_795,https://www.reddit.com/r/technology/comments/108fnjz/do_you_know_how_to_find_best_budget_drone_under_25/,technology,https://youtu.be/4e0KZXRQAS4
48,2023-01-10,The US government is building an AI sandbox to tackle cybercrime,u/Sorin61,https://www.reddit.com/r/technology/comments/108fsfi/the_us_government_is_building_an_ai_sandbox_to/,technology,https://www.techradar.com/news/the-us-government-is-building-an-ai-sandbox-to-tackle-cybercrime
1,2023-01-10,"ChatGPT AI Book The Origin of The Universe written by Artificial Intelligence, Supercharge your Mind",u/ScienceGeekPI,https://www.reddit.com/r/technology/comments/108fy6l/chatgpt_ai_book_the_origin_of_the_universe/,technology,https://youtu.be/kAk6buQVfZk
509,2023-01-10,Roomba testers feel misled after images of a minor and a tester on the toilet ended up on Facebook,u/asteriskspace,https://www.reddit.com/r/technology/comments/108fyqe/roomba_testers_feel_misled_after_images_of_a/,technology,https://www.technologyreview.com/2023/01/10/1066500/roomba-irobot-robot-vacuum-beta-product-testers-consent-agreement-misled/
17,2023-01-10,Why Tech Isn’t Synonymous With Growth Anymore,u/Hrmbee,https://www.reddit.com/r/technology/comments/108g9ij/why_tech_isnt_synonymous_with_growth_anymore/,technology,https://www.bloomberg.com/news/newsletters/2023-01-10/why-tech-isn-t-synonymous-with-growth-anymore-everything-risk
1,2023-01-10,"I was casually on my laptop when i suddenly got disconnected from my wifi, I go to re-connect it and it shows no wifi networks. Now i have to use a ethernet cable to connect to the wifi. Why aren't the wifi networks showing up? How do i fix this. What could possibly be causing this.",u/[deleted],https://www.reddit.com/r/technology/comments/108ggeu/i_was_casually_on_my_laptop_when_i_suddenly_got/,technology,[removed]
1,2023-01-10,How do I become network administrator without a bachelors? Help!,u/Simplysally2022,https://www.reddit.com/r/technology/comments/108gh1g/how_do_i_become_network_administrator_without_a/,technology,
1,2023-01-10,Top 10 Low-Code Gaming Applications Development Platforms in the Market,u/coderesist,https://www.reddit.com/r/technology/comments/108gjfn/top_10_lowcode_gaming_applications_development/,technology,https://www.coderesist.com/top-10-low-code-gaming-applications-development-platforms-in-the-market/?feed_id=9928&amp;_unique_id=63bda9fc72d99
1,2023-01-10,Pc not booting up after i changed the ram freq to 3200 cuz in the taks it sayed only 2133 i got a asrock B450M-Hdv R4.0 mb i only changed the ram freq and not the xmp settings help please,u/No-Introduction-8761,https://www.reddit.com/r/technology/comments/108gn43/pc_not_booting_up_after_i_changed_the_ram_freq_to/,technology,
1,2023-01-10,Identity thieves bypassed experian security to view credit reports,u/[deleted],https://www.reddit.com/r/technology/comments/108grz6/identity_thieves_bypassed_experian_security_to/,technology,
