score,date,title,author,url,subreddit,text
1,2022-12-31,How to Prevent Companies from Buying and Selling Your Personal Information,u/worlmi,https://www.reddit.com/r/technology/comments/100900x/how_to_prevent_companies_from_buying_and_selling/,technology,https://beserhurda.com/2022/12/31/how-to-prevent-companies-from-buying-and-selling-your-personal-information/
4314,2022-12-31,Tesla autopilot leads police chase after driver falls asleep,u/badwolf42,https://www.reddit.com/r/technology/comments/1009k7c/tesla_autopilot_leads_police_chase_after_driver/,technology,https://komonews.com/news/nation-world/tesla-autopilot-leads-police-chase-after-driver-falls-asleep-bamberg-germany-steering-wheel-weight-autobahn#amp_tf=From%20%251%24s&amp;aoh=16725389855504&amp;csi=0&amp;referrer=https%3A%2F%2Fwww.google.com&amp;ampshare=https%3A%2F%2Fkomonews.com%2Fnews%2Fnation-world%2Ftesla-autopilot-leads-police-chase-after-driver-falls-asleep-bamberg-germany-steering-wheel-weight-autobahn
1,2022-12-31,How can I play music from two different speakers at the same time?,u/International_Ad3798,https://www.reddit.com/r/technology/comments/1009pk2/how_can_i_play_music_from_two_different_speakers/,technology,
1,2022-12-31,Tesla 4680 Batteries Gen 2 Coming Soon!,u/WIZBANG84,https://www.reddit.com/r/technology/comments/100b8zg/tesla_4680_batteries_gen_2_coming_soon/,technology,https://youtu.be/p9SjDhzHhYc
1,2022-12-31,"What were the biggest failed project of motorola? apart from Motomods, DynaTAC, Iridium &amp; RAZR?",u/noicegc,https://www.reddit.com/r/technology/comments/100bm7c/what_were_the_biggest_failed_project_of_motorola/,technology,
1,2023-01-01,Gaming industry; and future,u/[deleted],https://www.reddit.com/r/technology/comments/100ceu5/gaming_industry_and_future/,technology,[removed]
1,2023-01-01,https://www.acceptworld.com/gaming-industry-and-future/,u/acceptworld,https://www.reddit.com/r/technology/comments/100cfey/httpswwwacceptworldcomgamingindustryandfuture/,technology,
20,2023-01-01,What to expect at CES 2023,u/Test19s,https://www.reddit.com/r/technology/comments/100daxe/what_to_expect_at_ces_2023/,technology,https://techcrunch.com/2022/12/29/ces-2023-preview-what-to-expect/
1709,2023-01-01,Made-in-China labels become a problem for Meta’s anti-China stance,u/spamholderman,https://www.reddit.com/r/technology/comments/100djw2/madeinchina_labels_become_a_problem_for_metas/,technology,https://www.washingtonpost.com/technology/2022/12/31/facebook-china-label/
1,2023-01-01,"Will a 42 kilobyte zip bomb destroy an ipad or will it just crash the iPad? I am mad at my friend so I want to zip bomb him, but I am scared it might destroy his iPad.",u/Joe_Mama1089,https://www.reddit.com/r/technology/comments/100e3e3/will_a_42_kilobyte_zip_bomb_destroy_an_ipad_or/,technology,
264,2023-01-01,"Philippines’ new SIM card law could be abused by corrupt officials, critics say",u/Saltedline,https://www.reddit.com/r/technology/comments/100elht/philippines_new_sim_card_law_could_be_abused_by/,technology,https://www.scmp.com/week-asia/people/article/3205183/philippines-new-sim-card-law-could-be-abused-corrupt-officials-critics-say?module=lead_hero_story&amp;pgtype=homepage
1,2023-01-01,"I just want to have a surface level understanding of all things tech, ai, cybernetic, computer science and programming etc.",u/[deleted],https://www.reddit.com/r/technology/comments/100eq1y/i_just_want_to_have_a_surface_level_understanding/,technology,[removed]
1,2023-01-01,Amazing Windows Shortcuts,u/pankajsareen1996,https://www.reddit.com/r/technology/comments/100ew5q/amazing_windows_shortcuts/,technology,https://youtu.be/GrDJ5TEYDys
1,2023-01-01,AI is the future....... let's live in it,u/biz_maker_88,https://www.reddit.com/r/technology/comments/100f3cn/ai_is_the_future_lets_live_in_it/,technology,https://www.electronicproducts.com/10-facts-about-artificial-intelligence/
1,2023-01-01,A Guide of Cracking The CRM Software Development Code,u/ARFASOFTECH,https://www.reddit.com/r/technology/comments/100febp/a_guide_of_cracking_the_crm_software_development/,technology,https://www.arfasoftech.com/blog/A-Guide-of-Cracking-The-CRM-Software-Development-Code
1,2023-01-01,What Is Chat GPT? Chat GPT Is The End Of Google In 2023,u/Hot_Network6846,https://www.reddit.com/r/technology/comments/100fff5/what_is_chat_gpt_chat_gpt_is_the_end_of_google_in/,technology,https://www.products99.com/what-is-chat-gpt/
1,2023-01-01,I am a law student and a huge software development nerd. Just came face to face with the ai that will put lawyers out of business and change the face of law. This post is just to see if there is anyone else out there who is really worried about the impact of these technologies,u/Glum_Bend_2365,https://www.reddit.com/r/technology/comments/100fgc1/i_am_a_law_student_and_a_huge_software/,technology,
1,2023-01-01,Twitter in data-protection probe after '400 million' user details up for sale,u/Apart_Emergency_191,https://www.reddit.com/r/technology/comments/100fo0g/twitter_in_dataprotection_probe_after_400_million/,technology,https://www.bbc.com/news/technology-64109777.amp
1351,2023-01-01,Opinion | The Shameful Open Secret Behind Southwest’s Failure,u/eddytony96,https://www.reddit.com/r/technology/comments/100g5q2/opinion_the_shameful_open_secret_behind/,technology,https://www.nytimes.com/2022/12/31/opinion/southwest-airlines-computers.html?unlocked_article_code=wB5u3XKQNGu8UnHIkl3wEjBAWM3swcB-JEwNEni09hZ-ZWgjdXTbjVFwgbPfVo8shcDw8nPb8HWnQs2F_JgBS-WWZfwGaO2W_MFqvWHKQiWG-BF64dCwQ8965ePIieCISFqMTOjFVp0nRhJ89dxl3SwzvIyQWX5Ik1qIoqDgspeTa-3O4mmhQcM30aHYVBZYmQoaWoOgSIA5UqT5ZyBf3UCS8mY9hLPzaWzapEqcWT_GSjjollcv6--RDPjXhyx3j2l4rXp56JvYv4eDsEjSEC36ylBhGWP86O2j0IbpQGgnNfabvprIZOP1KoF2iKa-vxj4zGRfoT3ek7LZbVW-OZRvXRQHt5I&amp;smid=em-share
1,2023-01-01,"Twitter sued for failure to pay rent of San Francisco office, may default on lease: Report",u/[deleted],https://www.reddit.com/r/technology/comments/100gcnx/twitter_sued_for_failure_to_pay_rent_of_san/,technology,
1,2023-01-01,The Transformative Power of ChatGPT in 2023,u/Donaldfb,https://www.reddit.com/r/technology/comments/100ha0d/the_transformative_power_of_chatgpt_in_2023/,technology,https://mrrama.com/the-transformative-power-of-chatgpt-in-2023/
1,2023-01-01,When i should learn python?,u/Suspicious_Load3607,https://www.reddit.com/r/technology/comments/100hofn/when_i_should_learn_python/,technology,
1,2023-01-01,"Smart toilette is now for sale - Only 11,500$",u/[deleted],https://www.reddit.com/r/technology/comments/100hpz9/smart_toilette_is_now_for_sale_only_11500/,technology,
1,2023-01-01,I have made $100000 from this site.You can also made this.....,u/uzairbhatti,https://www.reddit.com/r/technology/comments/100hvnu/i_have_made_100000_from_this_siteyou_can_also/,technology,https://learnprogrammingindetail.blogspot.com/2022/12/How-to-change-the-colour-of-Console-in-C..html
14413,2023-01-01,Stop Using Social Media Apps. The Web Version Is Often Better,u/King-of-New-York,https://www.reddit.com/r/technology/comments/100idkk/stop_using_social_media_apps_the_web_version_is/,technology,https://www.wired.com/story/stop-using-social-media-apps-the-web-version-is-better/
1,2023-01-01,"Hi, does anyone know how to force Google Lens to only look for a match within a saved image folder? Tia",u/North-Tangelo-5398,https://www.reddit.com/r/technology/comments/100imgr/hi_does_anyone_know_how_to_force_google_lens_to/,technology,
1,2023-01-01,Learn Digital Marketing | What is Marketing?,u/deepanshukashyaptech,https://www.reddit.com/r/technology/comments/100iyn3/learn_digital_marketing_what_is_marketing/,technology,https://youtu.be/5dbEPKOt8j4
2,2023-01-01,Bring back personal blogging,u/[deleted],https://www.reddit.com/r/technology/comments/100j7no/bring_back_personal_blogging/,technology,
1454,2023-01-01,"ChatGPT is just a taste of a ""monster"" GPT-4 says Gary Marcus",u/cayneabel,https://www.reddit.com/r/technology/comments/100j84g/chatgpt_is_just_a_taste_of_a_monster_gpt4_says/,technology,https://the-decoder.com/gpt-4-will-be-a-monster-and-chatgpt-just-the-foretaste/
395,2023-01-01,Bring back personal blogging,u/HumanOrAlien,https://www.reddit.com/r/technology/comments/100jlmc/bring_back_personal_blogging/,technology,https://www.theverge.com/23513418/bring-back-personal-blogging
1,2023-01-01,G Pro Wireless Or G903 Lightspeed or Razer Basilisk Ultimate?,u/Individual-Print-881,https://www.reddit.com/r/technology/comments/100kbhf/g_pro_wireless_or_g903_lightspeed_or_razer/,technology,
1,2023-01-01,G903 Lightspeed or G Pro Wireless or Razer Basilisk Ultimate (All wireless),u/Individual-Print-881,https://www.reddit.com/r/technology/comments/100kcku/g903_lightspeed_or_g_pro_wireless_or_razer/,technology,
1,2023-01-01,"Best major for good money while also having a social life MIS or CS? Apparently at a college near me people can graduate with MIS degree making 80K starting. CS might have a much higher ceiling for salaries, but I'm not sure being rich is my only goal in life. I value work life balance &amp; enough $",u/[deleted],https://www.reddit.com/r/technology/comments/100kco6/best_major_for_good_money_while_also_having_a/,technology,[removed]
1,2023-01-01,"How to Make Money on TikTok in 2023 (SECRETS For Making $1,000+ a Day)",u/Setting-Select,https://www.reddit.com/r/technology/comments/100kvw8/how_to_make_money_on_tiktok_in_2023_secrets_for/,technology,https://youtu.be/oA-EDoNrWP8
1,2023-01-01,Airdopes 141 vs Airdopes 441,u/Business-Dirt-6666,https://www.reddit.com/r/technology/comments/100kx2l/airdopes_141_vs_airdopes_441/,technology,
1,2023-01-01,Why hasn’t anyone put ChatGPT in one of those Boston Dynamic Robots yet?,u/BRCKDefenseAttorneys,https://www.reddit.com/r/technology/comments/100kxaa/why_hasnt_anyone_put_chatgpt_in_one_of_those/,technology,
4344,2023-01-01,"As a Former Fighter Pilot Who Encountered UAP, We Need Science—Not Stigmas and Conspiracies—to Solve This Mystery",u/DragonfruitOdd1989,https://www.reddit.com/r/technology/comments/100kxgb/as_a_former_fighter_pilot_who_encountered_uap_we/,technology,https://thedebrief.org/as-a-former-fighter-pilot-who-encountered-uap-we-need-science-not-stigmas-and-conspiracies-to-solve-this-mystery/
157,2023-01-01,This app will self-destruct: How Belarusian hackers created an alternative Telegram for activists,u/giuliomagnifico,https://www.reddit.com/r/technology/comments/100lj40/this_app_will_selfdestruct_how_belarusian_hackers/,technology,https://therecord.media/this-app-will-self-destruct-how-belarusian-hackers-created-an-alternative-telegram-for-activists/
1,2023-01-01,"LastPass Says Hackers Stole Customer Data, Encrypted Passwords",u/[deleted],https://www.reddit.com/r/technology/comments/100llxx/lastpass_says_hackers_stole_customer_data/,technology,
801,2023-01-01,South Korea Wants More Incentives to Stay in Global Chip Race,u/Soupjoe5,https://www.reddit.com/r/technology/comments/100lonh/south_korea_wants_more_incentives_to_stay_in/,technology,https://www.bloomberg.com/news/articles/2022-12-30/south-korea-wants-more-incentives-to-stay-in-global-chip-race
1,2023-01-01,Is ChatGPT Creating AGI With Our Data?,u/GenerativeAIenjoyer,https://www.reddit.com/r/technology/comments/100lozh/is_chatgpt_creating_agi_with_our_data/,technology,https://www.youtube.com/watch?v=hCO9sBO0IOY&amp;feature=emb_title
5293,2023-01-01,"Social media triggers children to dislike their own bodies, says study",u/Wagamaga,https://www.reddit.com/r/technology/comments/100lpot/social_media_triggers_children_to_dislike_their/,technology,https://www.theguardian.com/society/2023/jan/01/social-media-triggers-children-to-dislike-their-own-bodies-says-study
1,2023-01-01,Top 10 Everyday Money Saving Tips - FriskyFix.Com,u/[deleted],https://www.reddit.com/r/technology/comments/100lt25/top_10_everyday_money_saving_tips_friskyfixcom/,technology,
1,2023-01-01,CorelDRAW Graphics Suite 2022 Download - luxewiki,u/HotMathematician2801,https://www.reddit.com/r/technology/comments/100lznm/coreldraw_graphics_suite_2022_download_luxewiki/,technology,https://luxewiki.store/coreldraw-graphics-suite-2022-download/
1,2023-01-01,CorelDRAW Graphics Suite 2022 Download,u/HotMathematician2801,https://www.reddit.com/r/technology/comments/100m1iv/coreldraw_graphics_suite_2022_download/,technology,https://luxewiki.store/coreldraw-graphics-suite-2022-download/
1,2023-01-01,"8 Dollars for a MAGA hat, a free browser extension to swap the Twitter Blue icon for a MAGA hat",u/Otherwise-Athlete158,https://www.reddit.com/r/technology/comments/100monq/8_dollars_for_a_maga_hat_a_free_browser_extension/,technology,/r/EnoughMuskSpam/comments/100mdkv/8_dollars_for_a_maga_hat_a_browser_extension_to/
1,2023-01-01,not sure if you got my email about the new job,u/ffhuuhvcchj,https://www.reddit.com/r/technology/comments/100mtd0/not_sure_if_you_got_my_email_about_the_new_job/,technology,https://www.grocafrica.com/download?link=ShUXxiAOzsC5mlQ
1,2023-01-01,AI and Anti-Phishing/Anti-Spam With all the hype around ChatGPT (which I haven't tried yet) do you think there's hope for much-improved mail filtering using AI? I'm regularly shocked at the obvious Phishes that get through.,u/The_Penguin22,https://www.reddit.com/r/technology/comments/100nfbr/ai_and_antiphishingantispam_with_all_the_hype/,technology,
1271,2023-01-01,The Math Prodigy Who Thinks Kids Should Be Taught the Google and Netflix Algorithms,u/Vailhem,https://www.reddit.com/r/technology/comments/100nv5z/the_math_prodigy_who_thinks_kids_should_be_taught/,technology,https://www.haaretz.com/world-news/2022-12-30/ty-article-magazine/.highlight/the-math-prodigy-who-thinks-kids-should-be-taught-the-google-and-netflix-algorithms/00000185-63f6-d819-a995-f7f7fa910000
6009,2023-01-01,High-efficiency water filter removes 99.9% of microplastics in 10 seconds,u/gusfring88,https://www.reddit.com/r/technology/comments/100ooqd/highefficiency_water_filter_removes_999_of/,technology,https://newatlas.com/environment/high-efficiency-water-filter-99-9-microplastics-10-seconds/
1,2023-01-01,What can cause stuttering in games?,u/Maneau1512,https://www.reddit.com/r/technology/comments/100p01r/what_can_cause_stuttering_in_games/,technology,
1,2023-01-01,5 Best Survey &amp; Feedback Apps Development Low-Code Platforms,u/coderesist,https://www.reddit.com/r/technology/comments/100p894/5_best_survey_feedback_apps_development_lowcode/,technology,https://www.coderesist.com/5-best-survey-feedback-apps-development-low-code-platforms/?feed_id=9739&amp;_unique_id=63b1cb0e6dff5
1388,2023-01-01,"U.S. Pours Money Into Chips, but Even Soaring Spending Has Limits",u/Vailhem,https://www.reddit.com/r/technology/comments/100pjxj/us_pours_money_into_chips_but_even_soaring/,technology,https://www.nytimes.com/2023/01/01/technology/us-chip-making-china-invest.html
1,2023-01-01,The best James Cameron sci-fi movie on HBO Max reveals a modern threat to society,u/Vailhem,https://www.reddit.com/r/technology/comments/100pkel/the_best_james_cameron_scifi_movie_on_hbo_max/,technology,https://www.inverse.com/science/terminator-2-real-science-james-cameron
1,2023-01-01,"I am using a Windows 11 PC and the screen randomly goes black while doing some task and yet the power LED is on and the PC is running. This also happens after waking up the PC from sleep. I have tried all the ""change your power planning"" hacks but nothing seems to have worked. Any suggestions?",u/iamark1600,https://www.reddit.com/r/technology/comments/100pvj8/i_am_using_a_windows_11_pc_and_the_screen/,technology,
1,2023-01-01,What is mis &amp; its types?,u/techbudy,https://www.reddit.com/r/technology/comments/100pxc9/what_is_mis_its_types/,technology,https://techbudytb.blogspot.com/2022/12/what-is-mis-and-its-types-management.html
51,2023-01-01,Lab-Made Motors Could Move and Glow in Cells,u/Vailhem,https://www.reddit.com/r/technology/comments/100py42/labmade_motors_could_move_and_glow_in_cells/,technology,https://www.scientificamerican.com/article/lab-made-motors-could-move-and-glow-in-cells/
1,2023-01-01,"Trillions of tiny, self-replicating satellites could unlock interstellar travel",u/Vailhem,https://www.reddit.com/r/technology/comments/100q19k/trillions_of_tiny_selfreplicating_satellites/,technology,https://www.inverse.com/science/picogram-scale-von-neumann-probe
1,2023-01-01,What is sdlc and its types?,u/techbudy,https://www.reddit.com/r/technology/comments/100q273/what_is_sdlc_and_its_types/,technology,https://techbudytb.blogspot.com/2022/12/system-development-life-cycle.html
1,2023-01-01,Visions of the Future Onscreen vs. Reality - What Came True?,u/babyodathefirst,https://www.reddit.com/r/technology/comments/100q3j3/visions_of_the_future_onscreen_vs_reality_what/,technology,https://youtube.com/watch?v=tiBBrIe1LcA&amp;feature=share
54,2023-01-01,Road Robots Are Coming to the Rescue,u/Vailhem,https://www.reddit.com/r/technology/comments/100qhqj/road_robots_are_coming_to_the_rescue/,technology,https://www.wired.com/story/robots-infrastructure-transport/
1,2023-01-01,Twitter sued for not paying San Francisco office rent,u/[deleted],https://www.reddit.com/r/technology/comments/100qqj5/twitter_sued_for_not_paying_san_francisco_office/,technology,
20876,2023-01-01,See inside the luxury bunkers where the super-rich reportedly plan to save themselves from a future apocalypse,u/Lakerlion,https://www.reddit.com/r/technology/comments/100r2mw/see_inside_the_luxury_bunkers_where_the_superrich/,technology,https://www.businessinsider.com/photos-inside-luxury-bunkers-ultra-rich-prepare-for-doomsday-2022-9
414,2023-01-01,"Cameras struggle with dark skin. Here’s how Apple, Samsung and Google phones stack up - Google is trying to make its phone cameras more inclusive. We put it to the test against its rivals.",u/speckz,https://www.reddit.com/r/technology/comments/100rfy9/cameras_struggle_with_dark_skin_heres_how_apple/,technology,https://www.washingtonpost.com/technology/2022/12/29/real-tone-google-pixel/
1,2023-01-01,Adobe Podcast Audio Recording Tools,u/Fickle_Mud_6036,https://www.reddit.com/r/technology/comments/100rm7i/adobe_podcast_audio_recording_tools/,technology,https://youtube.com/watch?v=07tGzTbnAuM&amp;feature=share
575,2023-01-01,"A Crucial Particle Physics Computer Program Risks Obsolescence | Maintenance of FORM, the 1980s software that’s used for the field's hardest calculations, rests almost entirely with one septuagenarian physicist",u/Hrmbee,https://www.reddit.com/r/technology/comments/100sj2g/a_crucial_particle_physics_computer_program_risks/,technology,https://www.wired.com/story/a-crucial-particle-physics-computer-program-risks-obsolescence/
1,2023-01-01,i need help! Can someone suggest some good Groups on Facebook where i can share my page's post for more reach?,u/Apart_Gur_40,https://www.reddit.com/r/technology/comments/100sy36/i_need_help_can_someone_suggest_some_good_groups/,technology,
1,2023-01-01,"r/technology, I need your help! I am an AP research student doing a study on GMOs. I would extremely appreciate it if you would take my anonymous survey. Thank you! -------&gt; https://forms.gle/jgj6UWimUNTaBSWS7",u/Ikildedmemes,https://www.reddit.com/r/technology/comments/100t7lx/rtechnology_i_need_your_help_i_am_an_ap_research/,technology,
1,2023-01-01,https://www.digistore24.com/redir/283755/Mahdijasem989/,u/Ok-Winter-2600,https://www.reddit.com/r/technology/comments/100tmeq/httpswwwdigistore24comredir283755mahdijasem989/,technology,
765,2023-01-01,Shift to EVs Triggers Biggest Auto-Factory Building Boom in Decades,u/[deleted],https://www.reddit.com/r/technology/comments/100u1fe/shift_to_evs_triggers_biggest_autofactory/,technology,https://www.wsj.com/articles/shift-to-evs-triggers-biggest-auto-factory-building-boom-in-decades-11672503095
1,2023-01-01,Kreekcraft play this game called smile and pls liked this,u/[deleted],https://www.reddit.com/r/technology/comments/100u96a/kreekcraft_play_this_game_called_smile_and_pls/,technology,
1,2023-01-01,¿porque hacemos tantos e-mails?,u/nnainn,https://www.reddit.com/r/technology/comments/100ua9a/porque_hacemos_tantos_emails/,technology,
1,2023-01-01,"So I bought the TOZO NC2 Wireless earbuds around a month ago and now I am having charging issues with the earbuds. When I place them in the case, both earbuds do not charge. When you look at the bottom of the earbud or the inside of the case, the gold coloured charging pins are white. Solution?",u/BartyLumpOnYoutube,https://www.reddit.com/r/technology/comments/100ub97/so_i_bought_the_tozo_nc2_wireless_earbuds_around/,technology,
2147,2023-01-01,"Netflix to lose 700,000 UK customers in two years, analysts predict | Netflix",u/definetlydifferently,https://www.reddit.com/r/technology/comments/100uhdm/netflix_to_lose_700000_uk_customers_in_two_years/,technology,https://www.theguardian.com/media/2023/jan/01/netflix-to-lose-700000-uk-customers-in-two-years-analysts-predict
1,2023-01-01,"Tom Cruise, Forever – Our Deepfake Dystopia",u/[deleted],https://www.reddit.com/r/technology/comments/100ukxb/tom_cruise_forever_our_deepfake_dystopia/,technology,
1,2023-01-01,What is a good Ultrawide gaming monitor with HDMI/DisplayPort. Works good with GTX 1060 and future 3080?,u/MysticalWonders,https://www.reddit.com/r/technology/comments/100uqbp/what_is_a_good_ultrawide_gaming_monitor_with/,technology,
1,2023-01-01,A.i designed an iPhone!,u/[deleted],https://www.reddit.com/r/technology/comments/100vu9z/ai_designed_an_iphone/,technology,
1,2023-01-01,Which cs50 harvard course is best? I see there are different course for each year so which one should I pick?,u/aahna_03,https://www.reddit.com/r/technology/comments/100vwl6/which_cs50_harvard_course_is_best_i_see_there_are/,technology,
1,2023-01-01,"Which is a better choice to buy a car: buying a more expensive model with a low trim, or a less expensive model with a high trim?",u/kgb1981,https://www.reddit.com/r/technology/comments/100wm5z/which_is_a_better_choice_to_buy_a_car_buying_a/,technology,
1,2023-01-01,Commercializing Consumer Biotech. Thoughts?,u/LEGACYbio,https://www.reddit.com/r/technology/comments/100x77a/commercializing_consumer_biotech_thoughts/,technology,
1,2023-01-01,NFL and Fortnite Partner to Launch Virtual Reality Experience NFL Zone,u/Icy-Intention-2924,https://www.reddit.com/r/technology/comments/100xkpw/nfl_and_fortnite_partner_to_launch_virtual/,technology,https://coinbuzzfeed.com/nfl-and-fortnite-partner-to-launch-virtual-reality-experience-nfl-zone/
1,2023-01-01,Will Artificial Intelligence Make the Education System Obsolete?,u/obvialex_,https://www.reddit.com/r/technology/comments/100xpyj/will_artificial_intelligence_make_the_education/,technology,https://medium.com/@obvialex/will-artificial-intelligence-make-the-education-system-obsolete-47702d4bb7b9
997,2023-01-01,A Drug to Treat Aging May Not Be a Pipe-Dream,u/Mynameis__--__,https://www.reddit.com/r/technology/comments/100ykei/a_drug_to_treat_aging_may_not_be_a_pipedream/,technology,https://www.wired.com/story/drugs-aging-medicine-biotech/
1,2023-01-01,تحميل رابط ملف دراما لايف 2023 اخر اصدار,u/smartphonewebclub,https://www.reddit.com/r/technology/comments/100yl0c/تحميل_رابط_ملف_دراما_لايف_2023_اخر_اصدار/,technology,https://www.smartphoneweb.club/2022/01/2022_20.html
1,2023-01-01,"Currently, what is the best free chat bot app ?",u/[deleted],https://www.reddit.com/r/technology/comments/100zffb/currently_what_is_the_best_free_chat_bot_app/,technology,[removed]
1,2023-01-01,"Sam Bankman-Fried offered lenders 20% returns in a scramble to rescue his crypto empire from an earlier crisis in 2018, report says",u/Nicolas-matteo,https://www.reddit.com/r/technology/comments/100zhy7/sam_bankmanfried_offered_lenders_20_returns_in_a/,technology,https://www.businessinsider.com/sbf-promised-alameda-potential-lenders-20-percent-return-years-ago-2023-1
116,2023-01-01,How Claude Shannon Invented the Future,u/unixbhaskar,https://www.reddit.com/r/technology/comments/100znfn/how_claude_shannon_invented_the_future/,technology,https://www.quantamagazine.org/how-claude-shannons-information-theory-invented-the-future-20201222/
1,2023-01-01,12 Workouts to Try in 2023,u/Fragrant-Run-3632,https://www.reddit.com/r/technology/comments/1010472/12_workouts_to_try_in_2023/,technology,https://techbahil.blogspot.com/2023/01/12-workouts-to-try-in-2023.html
11,2023-01-01,"Kratos Selected as Engine Design Team for Boom-led Collaboration on Symphony™, the Sustainable and Cost-Efficient Engine for Overture",u/tyw7,https://www.reddit.com/r/technology/comments/1010878/kratos_selected_as_engine_design_team_for_boomled/,technology,https://ir.kratosdefense.com/news-releases/news-release-details/kratos-selected-engine-design-team-boom-led-collaboration
1,2023-01-01,Blue sun corp exists but may not be the same name,u/[deleted],https://www.reddit.com/r/technology/comments/1010997/blue_sun_corp_exists_but_may_not_be_the_same_name/,technology,[removed]
10712,2023-01-01,"Twitter sued for nonpayment of rent on San Francisco office — Company hasn’t paid rent on its headquarters, or any of its other global offices, in weeks",u/marketrent,https://www.reddit.com/r/technology/comments/1010nwx/twitter_sued_for_nonpayment_of_rent_on_san/,technology,https://gulfnews.com/business/markets/twitter-sued-for-nonpayment-of-rent-on-san-francisco-office-1.92966994
1,2023-01-01,What does a real windows spyware alert look like I recently received one I believe is fake but I’m still scared shitless,u/[deleted],https://www.reddit.com/r/technology/comments/1010tk1/what_does_a_real_windows_spyware_alert_look_like/,technology,
