score,date,title,author,url,subreddit,text
1,2023-01-05,"CES 2023: Biggest Announcements from Samsung Electronics TV featuring Neo QLED, Micro LED and OLED lineup",u/BlogColumns,https://www.reddit.com/r/technology/comments/1040t0z/ces_2023_biggest_announcements_from_samsung/,technology,https://www.blogcolumns.com/ces-2023-biggest-announcements-from-samsung-electronics-tv-featuring-neo-qled-micro-led-and-oled-lineup/
1,2023-01-05,👉 $AITX publishes the results of its 2022 Workforce Diversity Survey,u/finnie_alert,https://www.reddit.com/r/technology/comments/1040we1/aitx_publishes_the_results_of_its_2022_workforce/,technology,/user/finnie_alert/comments/1040qlp/aitx_publishes_the_results_of_its_2022_workforce/
1,2023-01-05,OvuRelief Menstrual Relief Pad,u/Lmafolol3,https://www.reddit.com/r/technology/comments/10410bx/ovurelief_menstrual_relief_pad/,technology,https://ovurelief.com/products/menstrual-relief-pad
234,2023-01-05,FTC Proposes Ban on Worker Non-Compete Clauses,u/Sorin61,https://www.reddit.com/r/technology/comments/10415ud/ftc_proposes_ban_on_worker_noncompete_clauses/,technology,https://www.vice.com/en/article/88qjjz/ftc-proposes-ban-on-worker-non-compete-clauses
880,2023-01-05,Chinese researchers claim to have found a way to break online encryption using quantum computers with just 372 qubits,u/sibti,https://www.reddit.com/r/technology/comments/104182w/chinese_researchers_claim_to_have_found_a_way_to/,technology,https://www.ft.com/content/b15680c0-cf31-448d-9eb6-b30426c29b8b
2,2023-01-05,Afeela Is a New EV from Sony and Honda Coming to the U.S. in 2026,u/[deleted],https://www.reddit.com/r/technology/comments/1041oze/afeela_is_a_new_ev_from_sony_and_honda_coming_to/,technology,
21933,2023-01-05,"Investors conclude that Tesla is a carmaker, not a tech firm",u/Vucea,https://www.reddit.com/r/technology/comments/1041r8k/investors_conclude_that_tesla_is_a_carmaker_not_a/,technology,https://www.economist.com/business/2023/01/04/investors-conclude-that-tesla-is-a-carmaker-not-a-tech-firm
1,2023-01-05,"CES 2023: announcements, new features, the largest tech fair opens today - AG4Tech",u/[deleted],https://www.reddit.com/r/technology/comments/1041v8k/ces_2023_announcements_new_features_the_largest/,technology,https://ag4tech.com/ces-2023-announcements/
8,2023-01-05,Foxconn’s biggest Chinese rival wins premium iPhone contract,u/[deleted],https://www.reddit.com/r/technology/comments/1042419/foxconns_biggest_chinese_rival_wins_premium/,technology,https://www.ft.com/content/975f0979-5d09-4e36-944d-44901477d762
1,2023-01-05,Bankruptcy judge rules Celsius Network owns users’ interest-bearing crypto accounts,u/habichuelacondulce,https://www.reddit.com/r/technology/comments/1042aje/bankruptcy_judge_rules_celsius_network_owns_users/,technology,https://techcrunch.com/2023/01/04/bankruptcy-judge-rules-celsius-network-owns-users-interest-bearing-crypto-accounts/?guccounter=1&amp;guce_referrer=aHR0cHM6Ly93d3cuZ29vZ2xlLmNvbS8&amp;guce_referrer_sig=AQAAAJh6GFqGllVjtSbDzKZZ0RfQ395nMNoTdBTzUwjbhB9lgWty5zewGVbGxi5nTBJjfUXax1ys6bAue0bT3Xl-LOZKuFql7qB1fbfZdb9yJHjR0mtGA9e5Ji90oI4e6YPCCHoH1Eb2viQL1NzssBvIE7M5UAupXxoXlNCfmi71OdEU
1,2023-01-05,Motion Graphics Program to Use,u/Buzzflick,https://www.reddit.com/r/technology/comments/1042he8/motion_graphics_program_to_use/,technology,https://www.scoopearth.com/motion-graphics-program-to-use/
1,2023-01-05,"When police infiltrated the EncroChat phone system in 2020, they hit an intelligence gold mine. But subsequent legal challenges have spread across Europe.",u/[deleted],https://www.reddit.com/r/technology/comments/1042jli/when_police_infiltrated_the_encrochat_phone/,technology,
209,2023-01-05,"Cops Hacked Thousands of Phones. Was It Legal? When police infiltrated the EncroChat phone system in 2020, they hit an intelligence gold mine. But subsequent legal challenges have spread across Europe.",u/glawgii,https://www.reddit.com/r/technology/comments/1042kf2/cops_hacked_thousands_of_phones_was_it_legal_when/,technology,https://www.wired.com/story/encrochat-phone-police-hacking-encryption-drugs/
0,2023-01-05,Check it out,u/Sensitive_Age_2284,https://www.reddit.com/r/technology/comments/1042knn/check_it_out/,technology,https://youtu.be/36J4e_lBi7w
1,2023-01-05,Hackers leak email addresses tied to 235 million Twitter accounts,u/habichuelacondulce,https://www.reddit.com/r/technology/comments/1042q1e/hackers_leak_email_addresses_tied_to_235_million/,technology,https://www.washingtonpost.com/technology/2023/01/04/witter-leak-emails-handles/
33,2023-01-05,WhatsApp adds official proxy support to help users circumvent internet blocks,u/asteriskspace,https://www.reddit.com/r/technology/comments/1042qeb/whatsapp_adds_official_proxy_support_to_help/,technology,https://www.theverge.com/2023/1/5/23540307/whatsapp-official-proxy-support-internet-blocks-bans
1,2023-01-05,I have serious problems with Palo Alto Prisma service. Does anyone else?,u/Brilliant-Evening962,https://www.reddit.com/r/technology/comments/1042yfm/i_have_serious_problems_with_palo_alto_prisma/,technology,
1,2023-01-05,Bright Eye: Mobile AI platform,u/[deleted],https://www.reddit.com/r/technology/comments/10431oh/bright_eye_mobile_ai_platform/,technology,[removed]
1,2023-01-05,"Bright Eye: Mobile AI platform. We’re working on democratizing AI access to mobile users by offering a variety of AI devices, like image generation, code generation, image captioning for free. Check us out.",u/SonnyDoge22,https://www.reddit.com/r/technology/comments/10434ke/bright_eye_mobile_ai_platform_were_working_on/,technology,https://apps.apple.com/us/app/bright-eye/id1593932475
1,2023-01-05,A US judge rules that the crypto deposits in bankrupt crypto lender Celsius Network's yield-bearing accounts belong to Celsius and not individual holders,u/avotoastiee,https://www.reddit.com/r/technology/comments/1043g4k/a_us_judge_rules_that_the_crypto_deposits_in/,technology,https://www.axios.com/2023/01/04/celsius-bankruptcy-earn-accounts
1,2023-01-05,"NY AG files lawsuit against Alex Mashinsky, alleging he hid Celsius’ 'dire financial condition'",u/habichuelacondulce,https://www.reddit.com/r/technology/comments/1043nmx/ny_ag_files_lawsuit_against_alex_mashinsky/,technology,https://cointelegraph.com/news/ny-ag-files-lawsuit-against-alex-mashinsky-alleging-he-hid-celsius-dire-financial-condition
1,2023-01-05,"Sony and Honda just announced their new electric car brand, Afeela",u/[deleted],https://www.reddit.com/r/technology/comments/1043ty9/sony_and_honda_just_announced_their_new_electric/,technology,
1295,2023-01-05,A Breach at LastPass Has Password Lessons for Us All,u/-protonsandneutrons-,https://www.reddit.com/r/technology/comments/1044a4o/a_breach_at_lastpass_has_password_lessons_for_us/,technology,https://www.nytimes.com/2023/01/05/technology/personaltech/lastpass-breach-password-safety.html
1,2023-01-05,DevOps Vs. Platform,u/[deleted],https://www.reddit.com/r/technology/comments/1044cfn/devops_vs_platform/,technology,[removed]
1,2023-01-05,Biden Signs Quantum Computing Cybersecurity Act,u/[deleted],https://www.reddit.com/r/technology/comments/1044hyp/biden_signs_quantum_computing_cybersecurity_act/,technology,
9,2023-01-05,Data Protection Commission announces conclusion of two inquiries into Meta Ireland | 400 million fine,u/brieberbuder,https://www.reddit.com/r/technology/comments/1044j3d/data_protection_commission_announces_conclusion/,technology,https://dataprotection.ie/en/news-media/data-protection-commission-announces-conclusion-two-inquiries-meta-ireland
162,2023-01-05,AI legal assistant will help defendant fight a speeding case in court,u/Sorin61,https://www.reddit.com/r/technology/comments/1044w1l/ai_legal_assistant_will_help_defendant_fight_a/,technology,https://www.newscientist.com/article/2351893-ai-legal-assistant-will-help-defendant-fight-a-speeding-case-in-court/?utm_source=rakuten&amp;utm_medium=affiliate&amp;utm_campaign=2116208:Skimlinks.com&amp;utm_content=10&amp;ranMID=47192&amp;ranEAID=TnL5HPStwNw&amp;ranSiteID=TnL5HPStwNw-cd1KOMyvGZiSeTTqjbqr.Q
3,2023-01-05,A new futuristic concept car is designed to foster personal connection,u/[deleted],https://www.reddit.com/r/technology/comments/1044yzs/a_new_futuristic_concept_car_is_designed_to/,technology,
1,2023-01-05,Recommendation needed,u/[deleted],https://www.reddit.com/r/technology/comments/10450vi/recommendation_needed/,technology,[removed]
2,2023-01-05,Microsoft Bing With ChatGPT Reportedly Launching In March,u/myfortunecookies,https://www.reddit.com/r/technology/comments/10457ub/microsoft_bing_with_chatgpt_reportedly_launching/,technology,/r/ChatGPT/comments/1043gj5/microsoft_bing_with_chatgpt_reportedly_launching/
2775,2023-01-05,Over 300 Bethesda workers form Microsoft's first union,u/redhatGizmo,https://www.reddit.com/r/technology/comments/10458ng/over_300_bethesda_workers_form_microsofts_first/,technology,https://www.windowscentral.com/gaming/xbox/over-300-bethesda-workers-form-microsofts-first-union
1,2023-01-05,When can we expect a Qubit (quantum) computer for consumers?,u/[deleted],https://www.reddit.com/r/technology/comments/10459yd/when_can_we_expect_a_qubit_quantum_computer_for/,technology,[removed]
35,2023-01-05,"Web hackers vs. the auto industry: critical vulnerabilities in Ferrari, BMW, Rolls Royce, Porsche, and more",u/WhooisWhoo,https://www.reddit.com/r/technology/comments/1045a5y/web_hackers_vs_the_auto_industry_critical/,technology,https://samcurry.net/web-hackers-vs-the-auto-industry/
8,2023-01-05,"Try 'Riffusion,' an AI model that composes music by visualizing it",u/fchung,https://www.reddit.com/r/technology/comments/1045ae2/try_riffusion_an_ai_model_that_composes_music_by/,technology,https://techcrunch.com/2022/12/15/try-riffusion-an-ai-model-that-composes-music-by-visualizing-it/
1,2023-01-05,The Wharfedale Diamond 12.4: A Comprehensive Review,u/Unable_Speaker1918,https://www.reddit.com/r/technology/comments/1045ej8/the_wharfedale_diamond_124_a_comprehensive_review/,technology,https://amazingsound.ml/?p=343
1,2023-01-05,ALcHeMy CrYpTo CyPhA!!! WE SEE ALL / Share this now!,u/Figz1975,https://www.reddit.com/r/technology/comments/1045hb9/alchemy_crypto_cypha_we_see_all_share_this_now/,technology,https://youtu.be/IY9VUQ9N6sY
1,2023-01-05,OnePlus released the OnePlus 11 5G &amp; Buds Pro 2. - AG4Tech,u/[deleted],https://www.reddit.com/r/technology/comments/1045kh5/oneplus_released_the_oneplus_11_5g_buds_pro_2/,technology,https://ag4tech.com/oneplus-11-5g-buds-pro-2/
1,2023-01-05,How to build a low-code app without the need for extensive training,u/coderesist,https://www.reddit.com/r/technology/comments/1045lka/how_to_build_a_lowcode_app_without_the_need_for/,technology,https://www.coderesist.com/how-to-build-a-low-code-app-without-the-need-for-extensive-training/?feed_id=9823&amp;_unique_id=63b71184b8340
0,2023-01-05,These are the technology trends that will shape our lives in 2023,u/eleanor_james,https://www.reddit.com/r/technology/comments/1045o8h/these_are_the_technology_trends_that_will_shape/,technology,https://edition.cnn.com/2023/01/05/world/technology-trends-2023-spc-scn-intl/index.html
1,2023-01-05,"Samsung A52s not working with Vodafone Sim, but working with every other one?",u/jojo049,https://www.reddit.com/r/technology/comments/1045p0g/samsung_a52s_not_working_with_vodafone_sim_but/,technology,
31500,2023-01-05,Massive Google billboard ad tells Apple to fix 'pixelated' photos and videos in texts between iPhones and Androids,u/777fer,https://www.reddit.com/r/technology/comments/1045tef/massive_google_billboard_ad_tells_apple_to_fix/,technology,https://businessinsider.com/google-tells-apple-fix-pixelated-photos-videos-iphone-android-texts-2023-1
0,2023-01-05,2023 to ‘reset’ valuations in cloud infrastructure,u/CrankyBear,https://www.reddit.com/r/technology/comments/1045wc4/2023_to_reset_valuations_in_cloud_infrastructure/,technology,https://www.silverliningsinfo.com/apps-services/2023-reset-valuations-cloud-infrastructure
1,2023-01-05,Perspective | Twitter said it fixed ‘verification.’ So I impersonated a senator (again).,u/CrankyBear,https://www.reddit.com/r/technology/comments/1045xxp/perspective_twitter_said_it_fixed_verification_so/,technology,https://www.washingtonpost.com/technology/2023/01/05/twitter-blue-verification/
1,2023-01-05,4 Benefits Of Using A Twitter Scraping Tool,u/webscrapinginfo,https://www.reddit.com/r/technology/comments/1045zgg/4_benefits_of_using_a_twitter_scraping_tool/,technology,https://morioh.com/p/ac45829a8511?f=62611cb68157c0168623e035
303,2023-01-05,"Nearly every app children use in the classroom is exposing their personal information to third parties and tech giants, according to a new study.",u/GaryOaksAlcoholism,https://www.reddit.com/r/technology/comments/1046b3o/nearly_every_app_children_use_in_the_classroom_is/,technology,https://thenationaldesk.com/news/americas-news-now/majority-of-apps-used-in-schools-expose-personal-student-data-study-shows-apple-google-public-kids
2388,2023-01-05,Mercedes-Benz will build a $1 billion EV fast-charging network in the US,u/Sorin61,https://www.reddit.com/r/technology/comments/1046n3o/mercedesbenz_will_build_a_1_billion_ev/,technology,https://arstechnica.com/cars/2023/01/mercedes-benz-to-build-an-ev-fast-charging-network-starting-in-the-us/
1,2023-01-05,this one is crazy https://amzn.to/3GHZDFM,u/Due-Parfait-1351,https://www.reddit.com/r/technology/comments/10476xq/this_one_is_crazy_httpsamznto3ghzdfm/,technology,
1,2023-01-05,Which technique is suitable for high variance and low bias models?,u/PriyankaLanka,https://www.reddit.com/r/technology/comments/1047dx2/which_technique_is_suitable_for_high_variance_and/,technology,
1,2023-01-05,What are your thoughts about the new Lenovo-Motorola Think Phone aimed to acquire corporate market share? Do you think it will replace corporate iphones?,u/[deleted],https://www.reddit.com/r/technology/comments/1047zd0/what_are_your_thoughts_about_the_new/,technology,
1,2023-01-05,5 things you didn't know GPS could do | It's not just keeping you from getting lost.,u/MortWellian,https://www.reddit.com/r/technology/comments/10484ox/5_things_you_didnt_know_gps_could_do_its_not_just/,technology,https://bigthink.com/hard-science/gps/
6,2023-01-05,Qualcomm just announced the iPhone 14's biggest feature is coming to Android,u/PuzzleheadedHeat4409,https://www.reddit.com/r/technology/comments/1048j4p/qualcomm_just_announced_the_iphone_14s_biggest/,technology,https://www.androidheadlines.com/2023/01/qualcomm-just-announced-the-iphone-14s-biggest-feature-is-coming-to-android.html
9,2023-01-05,"Federal agencies have decided to bypass warrant requirements by purchasing location data directly from data brokers, rather than engage with the constitutional parameters established by the Supreme Court",u/_m3r1u5_,https://www.reddit.com/r/technology/comments/1048ke4/federal_agencies_have_decided_to_bypass_warrant/,technology,https://www.techdirt.com/2023/01/05/government-continues-to-rely-on-private-contractors-to-bypass-privacy-protections/
1476,2023-01-05,ChatGPT Creator OpenAI Is in Talks for Tender Offer That Would Value It at $29 Billion - WSJ,u/Plopfish,https://www.reddit.com/r/technology/comments/1048w07/chatgpt_creator_openai_is_in_talks_for_tender/,technology,https://www.wsj.com/articles/chatgpt-creator-openai-is-in-talks-for-tender-offer-that-would-value-it-at-29-billion-11672949279?mod=Searchresults_pos1&amp;page=1
10956,2023-01-05,"California's pay transparency law, which requires employers to disclose salaries on job listings, went into effect this week, revealing some Big Tech salaries",u/iingot,https://www.reddit.com/r/technology/comments/10497xg/californias_pay_transparency_law_which_requires/,technology,https://www.cnbc.com/2023/01/05/heres-how-much-top-tech-jobs-in-california-pay-according-to-job-ads.html
1371,2023-01-05,Ford More Than Doubles Electric Vehicle Sales as It Chases Tesla,u/Additional-Two-7312,https://www.reddit.com/r/technology/comments/1049bdd/ford_more_than_doubles_electric_vehicle_sales_as/,technology,https://www.bloomberg.com/news/articles/2023-01-05/ford-more-than-doubles-electric-vehicle-sales-as-it-chases-tesla?srnd=technology-vp
0,2023-01-05,"Amazon's Ring announces its first dashboard camera, the Ring Car Cam, with inside and outside recording, after a two-year delay, shipping in February for $250",u/[deleted],https://www.reddit.com/r/technology/comments/1049g0f/amazons_ring_announces_its_first_dashboard_camera/,technology,
1,2023-01-05,"I made a video using only AI, please give me your thoughts https://www.youtube.com/watch?v=gqjsNQMaqyc&amp;t=23s",u/Common_Country2683,https://www.reddit.com/r/technology/comments/1049jz7/i_made_a_video_using_only_ai_please_give_me_your/,technology,https://www.youtube.com/watch?v=gqjsNQMaqyc&amp;t=23s
1,2023-01-05,"I created a video using only AI and nothing else, everything was automatic",u/Common_Country2683,https://www.reddit.com/r/technology/comments/1049let/i_created_a_video_using_only_ai_and_nothing_else/,technology,https://www.youtube.com/watch?v=gqjsNQMaqyc&amp;t=23s
0,2023-01-05,"10/10 Times-This small group of people rewrite what is means to be a performer. 98/100 Rotten Tomatoes-When people connect through an online forum and are influenced, classics come back to life. 8/10 TechMag-Where technology meets with AI and the individuals who created it make art.",u/[deleted],https://www.reddit.com/r/technology/comments/1049qw0/1010_timesthis_small_group_of_people_rewrite_what/,technology,
0,2023-01-05,How TikTok’s Addictive Anti-Aesthetic Conquered Culture,u/Wagamaga,https://www.reddit.com/r/technology/comments/1049tua/how_tiktoks_addictive_antiaesthetic_conquered/,technology,https://www.govtech.com/products/how-tiktoks-addictive-anti-aesthetic-conquered-culture
1,2023-01-05,Bonk token signs another chance for Solana ecosystem,u/Spiritual_Grand_103,https://www.reddit.com/r/technology/comments/1049y2k/bonk_token_signs_another_chance_for_solana/,technology,https://coinsatoz.com/bonk-token-signs-another-chance-for-solana-ecosystem/
102,2023-01-05,Game companies post absurdly broad salary ranges to 'comply' with new pay transparency laws,u/getBusyChild,https://www.reddit.com/r/technology/comments/104a9c9/game_companies_post_absurdly_broad_salary_ranges/,technology,https://www.pcgamer.com/game-companies-post-absurdly-broad-salary-ranges-to-comply-with-new-transparency-laws/
1,2023-01-05,Roycompro.com -Royal Computing Products,u/Roycompro11,https://www.reddit.com/r/technology/comments/104al1p/roycomprocom_royal_computing_products/,technology,http://roycompro.com/
10,2023-01-05,Dawn of Solid-State Quantum Networks – The Holy Grail of Quantum Information Sciences,u/Vailhem,https://www.reddit.com/r/technology/comments/104axjn/dawn_of_solidstate_quantum_networks_the_holy/,technology,https://scitechdaily.com/dawn-of-solid-state-quantum-networks-the-holy-grail-of-quantum-information-sciences/
5685,2023-01-05,Delta to provide free Wi-Fi on most U.S. flights starting next month,u/blood_bag,https://www.reddit.com/r/technology/comments/104aywr/delta_to_provide_free_wifi_on_most_us_flights/,technology,https://www.cbsnews.com/news/delta-free-wifi-us-flights-february-2023/
1,2023-01-05,"Tesla isn't Apple, Elon Musk isn't Steve Jobs, and its cars aren't the next iPhone",u/[deleted],https://www.reddit.com/r/technology/comments/104b22u/tesla_isnt_apple_elon_musk_isnt_steve_jobs_and/,technology,
1,2023-01-05,MARLEY JEANIUS - Where were you all this time? - official VIDEO! #marleyJEANIUS #krenglish,u/Pure-Replacement-989,https://www.reddit.com/r/technology/comments/104bloc/marley_jeanius_where_were_you_all_this_time/,technology,https://youtu.be/oKj6btZUoeE
1,2023-01-05,Pictory Ai Discount 20% Coupon Code,u/jipeanu,https://www.reddit.com/r/technology/comments/104bo22/pictory_ai_discount_20_coupon_code/,technology,https://www.youtube.com/watch?v=MqF31afgyXQ
6,2023-01-05,"Behind the Scenes at the Encyclopedia Britannica of Memes | Fifteen years in, KnowYourMeme has made a name for itself by applying academic rigor to the silliest stuff online",u/MortWellian,https://www.reddit.com/r/technology/comments/104c2aw/behind_the_scenes_at_the_encyclopedia_britannica/,technology,https://www.wsj.com/articles/know-your-meme-11672867333
1,2023-01-05,How to start on tech sales?,u/Mean_Ad_6773,https://www.reddit.com/r/technology/comments/104c7hf/how_to_start_on_tech_sales/,technology,
1221,2023-01-05,"Saudi Arabia jails two Wikipedia staff in ‘bid to control content’ - Administrators jailed for 32 years, and eight years, as activists warn of ploy to infiltrate website",u/Albion_Tourgee,https://www.reddit.com/r/technology/comments/104cbpi/saudi_arabia_jails_two_wikipedia_staff_in_bid_to/,technology,https://www.theguardian.com/technology/2023/jan/05/saudi-arabia-jails-two-wikipedia-staff-in-bid-to-control-content
107,2023-01-05,Amazon layoffs reflect 'change in mindset for the company',u/chiquisea,https://www.reddit.com/r/technology/comments/104cs06/amazon_layoffs_reflect_change_in_mindset_for_the/,technology,https://kuow.org/stories/amazon-layoffs-reflect-change-in-mindset-for-the-company
32,2023-01-05,"ChatGPT can do a corporate lobbyist's job, (preprint) study determines",u/marketrent,https://www.reddit.com/r/technology/comments/104cxcg/chatgpt_can_do_a_corporate_lobbyists_job_preprint/,technology,https://www.vice.com/en/article/3admm8/chatgpt-can-do-a-corporate-lobbyists-job-study-determines
12,2023-01-05,FTC intends to ban noncompete clauses that bind 30 million US workers,u/[deleted],https://www.reddit.com/r/technology/comments/104dtc2/ftc_intends_to_ban_noncompete_clauses_that_bind/,technology,
3,2023-01-05,Lyn Alden: Bitcoin’s Energy Usage Isn’t a Problem. Here’s Why.,u/ewesirnaym,https://www.reddit.com/r/technology/comments/104ears/lyn_alden_bitcoins_energy_usage_isnt_a_problem/,technology,https://www.lynalden.com/bitcoin-energy/
112,2023-01-05,Sun-powered water splitter produces unprecedented levels of green energy,u/Hypx,https://www.reddit.com/r/technology/comments/104engv/sunpowered_water_splitter_produces_unprecedented/,technology,https://www.science.org/content/article/sun-powered-water-splitter-produces-unprecedented-levels-green-energy
41,2023-01-05,Exclusive: FTX's former top lawyer aided U.S. authorities in Bankman-Fried case,u/Nicolas-matteo,https://www.reddit.com/r/technology/comments/104eqtp/exclusive_ftxs_former_top_lawyer_aided_us/,technology,https://www.reuters.com/business/finance/ftxs-former-top-lawyer-aided-us-authorities-bankman-fried-case-2023-01-05/
1,2023-01-05,Lyn Alden: Bitcoin’s Energy Usage Isn’t a Problem. Here’s Why.,u/arcrad,https://www.reddit.com/r/technology/comments/104erwr/lyn_alden_bitcoins_energy_usage_isnt_a_problem/,technology,https://www.lynalden.com/bitcoin-energy/?v
1,2023-01-05,"Twitter hacked, 200 million user email addresses leaked, researcher says",u/Additional-Two-7312,https://www.reddit.com/r/technology/comments/104f46h/twitter_hacked_200_million_user_email_addresses/,technology,https://www.reuters.com/technology/twitter-hacked-200-million-user-email-addresses-leaked-researcher-says-2023-01-05/
11,2023-01-05,TSMC claims to be right on track with 3nm chip production during fab expansion announcement,u/Vailhem,https://www.reddit.com/r/technology/comments/104f5ap/tsmc_claims_to_be_right_on_track_with_3nm_chip/,technology,https://www.notebookcheck.net/TSMC-claims-to-be-right-on-track-with-3nm-chip-production-during-fab-expansion-announcement.678504.0.html
8,2023-01-05,WSJ News Exclusive | ChatGPT Creator in Investor Talks at $29 Billion Valuation,u/Buck-Nasty,https://www.reddit.com/r/technology/comments/104gouw/wsj_news_exclusive_chatgpt_creator_in_investor/,technology,https://www.wsj.com/articles/chatgpt-creator-openai-is-in-talks-for-tender-offer-that-would-value-it-at-29-billion-11672949279
1,2023-01-05,"Why does this sub hate Tesla so much? This sub should be about the excitement of technology and learning, not just bashing some company who's stock is down.",u/daryaddddd,https://www.reddit.com/r/technology/comments/104gvf7/why_does_this_sub_hate_tesla_so_much_this_sub/,technology,
675,2023-01-05,CES 2023: Ram electric pickup joins crowded field next year,u/besselfunctions,https://www.reddit.com/r/technology/comments/104gzn1/ces_2023_ram_electric_pickup_joins_crowded_field/,technology,https://apnews.com/article/technology-consumer-electronics-show-business-e07cf8b5210b86eb1e98a4f679b4fd68
1,2023-01-05,Trump Facebook ban could be reversed in the coming weeks,u/[deleted],https://www.reddit.com/r/technology/comments/104h1kv/trump_facebook_ban_could_be_reversed_in_the/,technology,
1,2023-01-05,The Future of Crowdjustice Starts Small at Ujuj,u/Ujuj_Buildr,https://www.reddit.com/r/technology/comments/104h27k/the_future_of_crowdjustice_starts_small_at_ujuj/,technology,
1,2023-01-05,call of duty to warzone,u/Remarkable-Ad5277,https://www.reddit.com/r/technology/comments/104h49z/call_of_duty_to_warzone/,technology,https://shrinke.me/syj0nNhp
1,2023-01-05,Facebook parent Meta fined €390-million in latest European privacy crackdown,u/jeffsmith202,https://www.reddit.com/r/technology/comments/104h7k5/facebook_parent_meta_fined_390million_in_latest/,technology,https://www.theglobeandmail.com/business/technology/article-irish-regulators-fine-facebook-parent-meta-390-million-in-latest/
64,2023-01-05,Shifting Toward Software-Defined Vehicles,u/Chipdoc,https://www.reddit.com/r/technology/comments/104hcdl/shifting_toward_softwaredefined_vehicles/,technology,https://semiengineering.com/shifting-toward-software-defined-vehicles/
