score,date,title,author,url,subreddit,text
162,2023-01-14,"Bill Gates says being rich can 'easily make you out of touch,' but he wouldn't ban others from becoming billionaires",u/Lakerlion,https://www.reddit.com/r/technology/comments/10bxvjx/bill_gates_says_being_rich_can_easily_make_you/,technology,https://www.businessinsider.com/bill-gates-being-rich-can-make-you-out-of-touch-2023-1
1,2023-01-14,"Is there interest in a tech platform that provides direct access to opposing view on topics such as politics, tech, social issues, and philosophy? An example of such a site is https://steelreads.com",u/West-Selection9891,https://www.reddit.com/r/technology/comments/10bxzxe/is_there_interest_in_a_tech_platform_that/,technology,
1,2023-01-14,How many of you people think about creating your own product? How many of you think about creating your own product? Why are you not creating something? Is it because you don't have a good idea? You don't have the skillset? You don't even know how to get started? Provide your thoughts below.,u/Big_Mark_9528,https://www.reddit.com/r/technology/comments/10by6ze/how_many_of_you_people_think_about_creating_your/,technology,
1,2023-01-14,Why UX/UI Designers Should Use Mood Boards in Their Work?,u/[deleted],https://www.reddit.com/r/technology/comments/10byjr8/why_uxui_designers_should_use_mood_boards_in/,technology,
1,2023-01-14,The top 5 mouse for playing Valorant like a pro,u/[deleted],https://www.reddit.com/r/technology/comments/10byllf/the_top_5_mouse_for_playing_valorant_like_a_pro/,technology,
1,2023-01-14,"Republican lawmakers push for crypto regulation with new panel: The Subcommittee on Digital Assets, Financial Technology and Inclusion is supposed to provide “clear rules of the road” for federal regulators.",u/[deleted],https://www.reddit.com/r/technology/comments/10byrz2/republican_lawmakers_push_for_crypto_regulation/,technology,
1,2023-01-14,Grayscale submits a brief ETF lawsuit against sec,u/Spiritual_Grand_103,https://www.reddit.com/r/technology/comments/10bz3ur/grayscale_submits_a_brief_etf_lawsuit_against_sec/,technology,https://coinsatoz.com/grayscale-submits-a-brief-in-the-etf-lawsuit-against-the-sec/
1,2023-01-14,2023 Samsung galaxy s23 ultra Review,u/irtazaali193,https://www.reddit.com/r/technology/comments/10bz5se/2023_samsung_galaxy_s23_ultra_review/,technology,https://www.apnewspk.com/2023/01/2023-samsung-galaxy-s23-ultra-review.html
1,2023-01-14,2023 Lenovo yoga book 9i review,u/irtazaali193,https://www.reddit.com/r/technology/comments/10bzamm/2023_lenovo_yoga_book_9i_review/,technology,https://www.apnewspk.com/2023/01/2023-lenovo-yoga-book-9i-review.html
1,2023-01-14,Whenever I press my F key my S and Q key bug out,u/nigasinmybutthole12,https://www.reddit.com/r/technology/comments/10bzbr6/whenever_i_press_my_f_key_my_s_and_q_key_bug_out/,technology,
1,2023-01-14,Custom Bedtime Stories For Kids- Nightly Narratives,u/Swimming_Wrongdoer74,https://www.reddit.com/r/technology/comments/10bzc8x/custom_bedtime_stories_for_kids_nightly_narratives/,technology,http://nightlynarratives.com
15,2023-01-14,Will Floating Point 8 Solve AI/ML Overhead?,u/yourbasicgeek,https://www.reddit.com/r/technology/comments/10bzimr/will_floating_point_8_solve_aiml_overhead/,technology,https://semiengineering.com/will-floating-point-8-solve-ai-ml-overhead/
1,2023-01-14,What’s the lowest resolution display and refresh rate you could live with?,u/Impressive-Fee-2339,https://www.reddit.com/r/technology/comments/10c067i/whats_the_lowest_resolution_display_and_refresh/,technology,
109,2023-01-14,Switzerland’s largest ‘open air’ solar farm planned at Bern Airport,u/Majnum,https://www.reddit.com/r/technology/comments/10c1kmi/switzerlands_largest_open_air_solar_farm_planned/,technology,https://www.swissinfo.ch/eng/business/switzerland-s-largest--open-air--solar-farm-planned-at-bern-airport/48202614
1,2023-01-14,BE FINANCIALLY INDEPENDENT,u/vladimir1g,https://www.reddit.com/r/technology/comments/10c1krc/be_financially_independent/,technology,https://vocal.media/confessions/be-financially-independent
1,2023-01-14,Logitech G PRO Gaming Headset | SlankIT,u/Legitimate-Welcome34,https://www.reddit.com/r/technology/comments/10c2p94/logitech_g_pro_gaming_headset_slankit/,technology,https://slankit.com/Logitech-G-Pro-Gaming-Headset
14,2023-01-14,Smart devices may only work for two years - Which? - BBC News,u/dalvrin,https://www.reddit.com/r/technology/comments/10c2qej/smart_devices_may_only_work_for_two_years_which/,technology,https://www.bbc.com/news/technology-64249388
48,2023-01-14,China’s AI Implementation Is Edging Ahead Of The US,u/dalvrin,https://www.reddit.com/r/technology/comments/10c2rot/chinas_ai_implementation_is_edging_ahead_of_the_us/,technology,https://www.forbes.com/sites/craigsmith/2023/01/14/chinas-ai-implementation-is-edging-ahead-of-the-us/?sh=1dac6a462dfb
1,2023-01-14,Logitech G430 Gaming Headset Review | SlankIT,u/Legitimate-Welcome34,https://www.reddit.com/r/technology/comments/10c2sfc/logitech_g430_gaming_headset_review_slankit/,technology,https://slankit.com/Logitech-G430-Gaming-Headset-Review
1,2023-01-14,Logitech G433 Gaming Headset Review | SlankIT,u/Legitimate-Welcome34,https://www.reddit.com/r/technology/comments/10c2tth/logitech_g433_gaming_headset_review_slankit/,technology,https://slankit.com/Logitech-G433-Gaming-Headset-Review%C2%A0
1,2023-01-14,Logitech G933 WIRELESS Gaming Headset Review | SlankIT,u/Legitimate-Welcome34,https://www.reddit.com/r/technology/comments/10c2wfx/logitech_g933_wireless_gaming_headset_review/,technology,https://slankit.com/Logitech-G933-Wireless-Gaming-Headset-Review
1,2023-01-14,Beats Ep Review | SlankIT,u/Legitimate-Welcome34,https://www.reddit.com/r/technology/comments/10c32eb/beats_ep_review_slankit/,technology,https://slankit.com/Beats-EP-Review
1,2023-01-14,Logitech G432 Gaming Headset Review | SlankIT,u/Legitimate-Welcome34,https://www.reddit.com/r/technology/comments/10c33gr/logitech_g432_gaming_headset_review_slankit/,technology,
1,2023-01-14,Bose Soundsport Earbuds Review | SlankIT,u/Legitimate-Welcome34,https://www.reddit.com/r/technology/comments/10c34yi/bose_soundsport_earbuds_review_slankit/,technology,https://slankit.com/Bose-SoundSport-Earbuds-Review
1,2023-01-14,Best Audio-Technica Open Ear Headphones | SlankIT,u/Legitimate-Welcome34,https://www.reddit.com/r/technology/comments/10c36fd/best_audiotechnica_open_ear_headphones_slankit/,technology,https://slankit.com/Best-Audio-Technica-Open-Ear-Headphones
1,2023-01-14,Best Sony Wired Headphones | SlankIT,u/Legitimate-Welcome34,https://www.reddit.com/r/technology/comments/10c37k1/best_sony_wired_headphones_slankit/,technology,https://slankit.com/Best-Sony-Wired-Headphones
1,2023-01-14,Bose QC 35 II Review | SlankIT,u/Legitimate-Welcome34,https://www.reddit.com/r/technology/comments/10c38l5/bose_qc_35_ii_review_slankit/,technology,https://slankit.com/BOSE-QC-35-II-REVIEW
1,2023-01-14,Best Sony Earphones | SlankIT,u/Legitimate-Welcome34,https://www.reddit.com/r/technology/comments/10c39lw/best_sony_earphones_slankit/,technology,https://slankit.com/Best-SONY-Earphones
1556,2023-01-14,"Class Action Filed Against Stability AI, Midjourney, and DeviantArt for DMCA Violations, Right of Publicity Violations, Unlawful Competition, Breach of TOS",u/Mront,https://www.reddit.com/r/technology/comments/10c3hkj/class_action_filed_against_stability_ai/,technology,https://www.prnewswire.com/news-releases/class-action-filed-against-stability-ai-midjourney-and-deviantart-for-dmca-violations-right-of-publicity-violations-unlawful-competition-breach-of-tos-301721869.html
1,2023-01-14,First time user here! What does the community know about Clear (skip the line) ? Is it safe to give them your biometrics?,u/MarbleMan007,https://www.reddit.com/r/technology/comments/10c3osh/first_time_user_here_what_does_the_community_know/,technology,
1,2023-01-14,"Can a VPN hide my activity like sites I visit and video game activity? My parents use the xfinity app to track what I'm doing like watching youtube or being on discord. It also checks how long I've been gaming. Like it would say Tencent Games - 1 hour. If I use a VPN, will it not show that?",u/bingbongfunkimonke,https://www.reddit.com/r/technology/comments/10c47k2/can_a_vpn_hide_my_activity_like_sites_i_visit_and/,technology,
0,2023-01-14,Computers that power self-driving cars could be a huge driver of global carbon emissions,u/Ssider69,https://www.reddit.com/r/technology/comments/10c48yu/computers_that_power_selfdriving_cars_could_be_a/,technology,https://techxplore.com/news/2023-01-power-self-driving-cars-huge-driver.html
1,2023-01-14,#videos curtos cash,u/Key_Selection7818,https://www.reddit.com/r/technology/comments/10c4ooo/videos_curtos_cash/,technology,
1,2023-01-14,"in 1977; the Big Ear radio observatory picked up an unexplained, foreign signal from deep space- and ever since that day, the transmission, more commonly known as the Wow! Signal. has become a staple for alien enthusiasts and advocates that we are not alone. But what was the signal?",u/[deleted],https://www.reddit.com/r/technology/comments/10c4wib/in_1977_the_big_ear_radio_observatory_picked_up/,technology,
1,2023-01-14,"Tech firms, crypto companies, Goldman Sachs announce major layoffs",u/[deleted],https://www.reddit.com/r/technology/comments/10c52i4/tech_firms_crypto_companies_goldman_sachs/,technology,
1,2023-01-14,Something like black toolbar appears on top of my iphone screen periodically. I am scared that maybe its some virus and that somebody is tracking my device.Pls write me if you know what is happening.,u/[deleted],https://www.reddit.com/r/technology/comments/10c52p9/something_like_black_toolbar_appears_on_top_of_my/,technology,
1,2023-01-14,"Brother printer LC406 issue.refilled the original cartridges with aftermarket ink, then back into the printer, but the printer shows me"" Unable to detect ink volume"" , despite keeping the same chip that is on the original cartridges. I couldn't find any find chip resetter for the LC406 model.Thanks!",u/PieceCreative9899,https://www.reddit.com/r/technology/comments/10c531h/brother_printer_lc406_issuerefilled_the_original/,technology,
1,2023-01-14,How to search effectively on google: For Every One,u/CreepyDifference8930,https://www.reddit.com/r/technology/comments/10c54t5/how_to_search_effectively_on_google_for_every_one/,technology,https://binaryguru01.blogspot.com/2023/01/how-to-search-effectively-on-google-for.html
1,2023-01-14,How to search effectively on google: For Every One,u/CreepyDifference8930,https://www.reddit.com/r/technology/comments/10c553e/how_to_search_effectively_on_google_for_every_one/,technology,https://binaryguru01.blogspot.com/2023/01/how-to-search-effectively-on-google-for.html
1,2023-01-14,Twitter third-party app 'suspe,u/[deleted],https://www.reddit.com/r/technology/comments/10c5h0l/twitter_thirdparty_app_suspe/,technology,
1,2023-01-14,"3rd-party Twitter app ‘suspensions are intentional,’ still no public communication",u/CubingSoda,https://www.reddit.com/r/technology/comments/10c5hlh/3rdparty_twitter_app_suspensions_are_intentional/,technology,https://9to5google.com/2023/01/14/twitter-third-party-app-intentional-block/
1,2023-01-14,Do RF detectors find hidden AirPods?,u/[deleted],https://www.reddit.com/r/technology/comments/10c5n6e/do_rf_detectors_find_hidden_airpods/,technology,[removed]
140,2023-01-14,Apple Is Working on Adding Touch Screens to Macs in Major Turnabout,u/Isaiahinc1,https://www.reddit.com/r/technology/comments/10c5npw/apple_is_working_on_adding_touch_screens_to_macs/,technology,https://www.bloomberg.com/news/articles/2023-01-11/apple-working-on-adding-touch-screens-to-macs-in-major-turnabout
1,2023-01-14,"Twiter,",u/Defiant-Name-5518,https://www.reddit.com/r/technology/comments/10c5xir/twiter/,technology,https://twitter.com/rakhshinda2022/status/1614420397419630592?s=20&amp;t=71Wf3kuUcLTGUZDgDWl9Jg
1,2023-01-14,"SweatTent: The portable, powerful, anywhere sauna: 3 minute setup, 200°F, sweat anywhere. Start your sauna routine &amp; take control of your health today. Support this project: https://sweattent.kckb.st/36e33000 Learn more: https://youtu.be/qW7zhsDxJ0s",u/tm033rm,https://www.reddit.com/r/technology/comments/10c634c/sweattent_the_portable_powerful_anywhere_sauna_3/,technology,
1,2023-01-14,"Musk's Twitter Intentionally Suspended Tweetbot, Third-Party Apps, Messages Show",u/[deleted],https://www.reddit.com/r/technology/comments/10c64qi/musks_twitter_intentionally_suspended_tweetbot/,technology,
2,2023-01-14,We Should All Be Very Nervous About the Online Safety Bill,u/causeapp,https://www.reddit.com/r/technology/comments/10c6jym/we_should_all_be_very_nervous_about_the_online/,technology,https://www.cause.cx/post/we-should-all-be-very-nervous-about-the-online-safety-bill
20,2023-01-14,What is with Google sign in prompts on nearly every webpage?,u/Chemical-School3024,https://www.reddit.com/r/technology/comments/10c6yau/what_is_with_google_sign_in_prompts_on_nearly/,technology,
1,2023-01-14,what are some best live video chatting apps for iOS?,u/iosmacapps,https://www.reddit.com/r/technology/comments/10c6ysw/what_are_some_best_live_video_chatting_apps_for/,technology,/r/ios17ipa/comments/10c6xh1/what_are_some_best_live_video_chatting_apps_for/
1,2023-01-14,"Only for iPhone Users, not for Android",u/iosmacapps,https://www.reddit.com/r/technology/comments/10c70nd/only_for_iphone_users_not_for_android/,technology,https://iosmacapps.com/
7,2023-01-14,‘People crying in office’: Amazon India employee describes scene amid layoffs,u/[deleted],https://www.reddit.com/r/technology/comments/10c72fg/people_crying_in_office_amazon_india_employee/,technology,
0,2023-01-14,"Let's remember Martin Luther King Jr. through his ""I have a dream"" speech in Color [AI tech]",u/Perception_Medium,https://www.reddit.com/r/technology/comments/10c7aum/lets_remember_martin_luther_king_jr_through_his_i/,technology,https://www.youtube.com/watch?v=GkmaSkrHMv0
4,2023-01-14,"AI-Developed, Synthetic DNA is About to Revolutionize Drug Production and Gene Therapy",u/digitalgoldnow,https://www.reddit.com/r/technology/comments/10c7chy/aideveloped_synthetic_dna_is_about_to/,technology,https://ainewsbase.com/ai-developed-synthetic-dna-could-soon-revolutionize-drug-production-and-gene-therapy/
1,2023-01-14,"My phone randomly broke, I didn’t drop it at all, it just got super hot and then hasn’t turned on or charged since. I need the serial number to take it to the Apple Store, but it’s in the phone. I have no other accounts linked to my Apple ID, UBreakIFix said they can’t fix it… i dunno what to do.",u/randomgenericuser345,https://www.reddit.com/r/technology/comments/10c7gwt/my_phone_randomly_broke_i_didnt_drop_it_at_all_it/,technology,
1,2023-01-14,The Mozilla Parasite Feeds On Firefox's Zombie Corpse,u/[deleted],https://www.reddit.com/r/technology/comments/10c7lwe/the_mozilla_parasite_feeds_on_firefoxs_zombie/,technology,https://telegra.ph/The-Mozilla-Parasite-Feeds-On-Firefoxs-Zombie-Corpse-01-15
226,2023-01-14,"Essay | Without Consciousness, AIs Will Be Sociopaths",u/themimeofthemollies,https://www.reddit.com/r/technology/comments/10c7uju/essay_without_consciousness_ais_will_be_sociopaths/,technology,https://www.wsj.com/articles/without-consciousness-ais-will-be-sociopaths-11673619880
40,2023-01-14,Microsoft Reportedly Closing In On $10 Billion Investment Into ChatGPT Creator OpenAI,u/FenrirIII,https://www.reddit.com/r/technology/comments/10c7wbo/microsoft_reportedly_closing_in_on_10_billion/,technology,https://www.forbes.com/sites/dereksaul/2023/01/10/microsoft-reportedly-closing-in-on-10-billion-investment-into-chatgpt-creator-openai/?utm_campaign=socialflowForbesMainLI&amp;utm_medium=social&amp;utm_source=ForbesMainLinkedIn
1,2023-01-14,Created Google Emails without VPN - I've made a couple of Gmail accounts at home without a VPN. Is there a chance that Google could block me? What are the official policies regarding this? Thank you,u/RareContrarian,https://www.reddit.com/r/technology/comments/10c825n/created_google_emails_without_vpn_ive_made_a/,technology,
1,2023-01-14,Social Media’s Broken Value System,u/[deleted],https://www.reddit.com/r/technology/comments/10c83wd/social_medias_broken_value_system/,technology,
1,2023-01-14,Long Live Mozilla!,u/[deleted],https://www.reddit.com/r/technology/comments/10c841a/long_live_mozilla/,technology,https://telegra.ph/Long-Live-Mozilla-01-15
1,2023-01-14,Social Media’s Broken Value System,u/[deleted],https://www.reddit.com/r/technology/comments/10c852d/social_medias_broken_value_system/,technology,
1,2023-01-14,Social Media’s Broken Value System,u/[deleted],https://www.reddit.com/r/technology/comments/10c880y/social_medias_broken_value_system/,technology,
464,2023-01-14,Microsoft vacating Seattle area leases,u/BachthovenIB,https://www.reddit.com/r/technology/comments/10c8c6t/microsoft_vacating_seattle_area_leases/,technology,https://www.seattletimes.com/business/facebook-microsoft-pulling-out-of-more-seattle-area-offices/?amp=1
1,2023-01-14,Amazon prime drones coming soon?,u/ResponsibilityNo914,https://www.reddit.com/r/technology/comments/10c8cq6/amazon_prime_drones_coming_soon/,technology,https://youtu.be/OIgChvKy9CQ
1,2023-01-14,Andrew Tate 33 Luxury Cars Seized by Romanian authorities |,u/Jack__77,https://www.reddit.com/r/technology/comments/10c8jpp/andrew_tate_33_luxury_cars_seized_by_romanian/,technology,https://thetimelapseinfo.co.uk/thetimelapse
95,2023-01-14,Bosch to invest $1 billion in EV parts factory in China,u/[deleted],https://www.reddit.com/r/technology/comments/10c8jxh/bosch_to_invest_1_billion_in_ev_parts_factory_in/,technology,https://www.cnn.com/2023/01/13/business/bosch-china-hnk-intl/index.html
1,2023-01-14,Power of Open Ai- ChatGPT,u/Techs_talks,https://www.reddit.com/r/technology/comments/10c8tf5/power_of_open_ai_chatgpt/,technology,
1,2023-01-14,Social Media’s Broken Value System,u/[deleted],https://www.reddit.com/r/technology/comments/10c93c2/social_medias_broken_value_system/,technology,
6071,2023-01-14,"Sam Bankman-Fried's secret 'backdoor' discovered, FTX lawyer says",u/Ssider69,https://www.reddit.com/r/technology/comments/10c9824/sam_bankmanfrieds_secret_backdoor_discovered_ftx/,technology,https://news.yahoo.com/sam-bankman-frieds-trading-firm-131659237.html
0,2023-01-14,Social Media's Broken Value System,u/[deleted],https://www.reddit.com/r/technology/comments/10c9a1m/social_medias_broken_value_system/,technology,
1,2023-01-14,If you work online or use your computer a lot you have to check out this product. I am a college student and I bought this and I just have to share it find it at www.attachmenttech.com,u/Frankie_George,https://www.reddit.com/r/technology/comments/10ca28q/if_you_work_online_or_use_your_computer_a_lot_you/,technology,
0,2023-01-14,These new gaming headphones slap,u/Strategy-Secure,https://www.reddit.com/r/technology/comments/10ca3w9/these_new_gaming_headphones_slap/,technology,http://AlegionHeadphones.com
1,2023-01-14,"Fone Bose vendido na China, é confiável?",u/D_Rohling,https://www.reddit.com/r/technology/comments/10cab7q/fone_bose_vendido_na_china_é_confiável/,technology,https://youtube.com/watch?v=kN_ZFCdeesw&amp;feature=share
1,2023-01-14,Viral AI-Written Article Busted as Plagiarized,u/[deleted],https://www.reddit.com/r/technology/comments/10caelc/viral_aiwritten_article_busted_as_plagiarized/,technology,
8,2023-01-15,How machine learning can help alleviate the U.S. labor shortage,u/Sorin61,https://www.reddit.com/r/technology/comments/10cbbes/how_machine_learning_can_help_alleviate_the_us/,technology,https://venturebeat.com/ai/how-machine-learning-can-help-alleviate-the-u-s-labor-shortage/
1,2023-01-15,Musk on trial for “funding secured” tweet—experts predict he’s going to lose,u/nacorom,https://www.reddit.com/r/technology/comments/10cbe4k/musk_on_trial_for_funding_secured_tweetexperts/,technology,https://arstechnica.com/tech-policy/2023/01/musk-on-trial-for-funding-secured-tweet-experts-predict-hes-going-to-lose/
12,2023-01-15,Heidegger warned of how technology imposes a particular order on reality. What would he make of AI-produced culture?,u/[deleted],https://www.reddit.com/r/technology/comments/10ccb1v/heidegger_warned_of_how_technology_imposes_a/,technology,
1,2023-01-15,YouTube technology,u/Mother-Owl-6468,https://www.reddit.com/r/technology/comments/10cckaw/youtube_technology/,technology,https://www.youtube.com/@Alphathriller
1168,2023-01-15,"NSA asks Congress to let it get on with that warrantless data harvesting, again",u/Sorin61,https://www.reddit.com/r/technology/comments/10cct5u/nsa_asks_congress_to_let_it_get_on_with_that/,technology,https://www.theregister.com/2023/01/14/in_brief_security/
49995,2023-01-15,Wyoming wants to phase out sales of EVs by 2035 to “ensure the stability” of the oil &amp; gas industry,u/utkarsh_aryan,https://www.reddit.com/r/technology/comments/10cdg44/wyoming_wants_to_phase_out_sales_of_evs_by_2035/,technology,https://www.teslarati.com/wyoming-phase-out-evs-2035/
546,2023-01-15,Scientists find way to heal scars left behind by heart attacks,u/Sorin61,https://www.reddit.com/r/technology/comments/10cdxx2/scientists_find_way_to_heal_scars_left_behind_by/,technology,https://medicalxpress.com/news/2023-01-scientists-scars-left-heart.html
1,2023-01-15,The Future of AI: How Artificial Intelligence Will Changing the World,u/johnkoubeck,https://www.reddit.com/r/technology/comments/10cepj6/the_future_of_ai_how_artificial_intelligence_will/,technology,https://viralspaceshare.com/the-future-of-ai-how-artificial-intelligence-will-changing-the-world
8,2023-01-15,Amazon’s New Home Internet Service Is One Step Closer to Becoming a Reality,u/Vailhem,https://www.reddit.com/r/technology/comments/10cevz8/amazons_new_home_internet_service_is_one_step/,technology,https://www.cordcuttersnews.com/amazons-new-home-internet-service-is-one-step-closer-to-becoming-a-reality/
13,2023-01-15,A Bayesian machine based on memristors,u/Vailhem,https://www.reddit.com/r/technology/comments/10cf4lb/a_bayesian_machine_based_on_memristors/,technology,https://techxplore.com/news/2023-01-bayesian-machine-based-memristors.html
14,2023-01-15,Twitter's laid-off workers cannot pursue claims via class-action lawsuit —judge,u/ihavestrings,https://www.reddit.com/r/technology/comments/10cfduh/twitters_laidoff_workers_cannot_pursue_claims_via/,technology,https://www.gmanetwork.com/news/money/companies/857467/twitter-s-laid-off-workers-cannot-pursue-claims-via-class-action-lawsuit-judge/story/
1,2023-01-15,How to Generate New Business Opportunities in 2023?,u/SOS-Shieldonsystems,https://www.reddit.com/r/technology/comments/10cfj1r/how_to_generate_new_business_opportunities_in_2023/,technology,
1,2023-01-15,Life-Changing Business Opportunities To Try in 2023?,u/SOS-Shieldonsystems,https://www.reddit.com/r/technology/comments/10cfk55/lifechanging_business_opportunities_to_try_in_2023/,technology,
81,2023-01-15,Apple’s Exodus From Outsourcing Continues With Plans to Drop Broadcom Chips,u/Vailhem,https://www.reddit.com/r/technology/comments/10cft29/apples_exodus_from_outsourcing_continues_with/,technology,https://www.allaboutcircuits.com/news/apples-exodus-from-outsourcing-continues-with-plans-to-drop-broadcom-chips/
1,2023-01-15,Is there a way to track blue tooth devices if they’re far away? They’re stolen &amp; I have the law involved &amp; know where the Thief’s frequently go.,u/AnawniMowse,https://www.reddit.com/r/technology/comments/10cfuz9/is_there_a_way_to_track_blue_tooth_devices_if/,technology,
1,2023-01-15,Refurbished Laptop Available on Smart EMI'S,u/kharido_first,https://www.reddit.com/r/technology/comments/10cggtp/refurbished_laptop_available_on_smart_emis/,technology,
30,2023-01-15,"After a slow start, SpaceX’s Falcon Heavy rocket is about to hit its stride",u/marketrent,https://www.reddit.com/r/technology/comments/10cgj1h/after_a_slow_start_spacexs_falcon_heavy_rocket_is/,technology,https://arstechnica.com/science/2023/01/the-first-of-five-falcon-heavy-launches-this-year-could-take-flight-today/
1,2023-01-15,"Wow, cool..!!",u/Peglegtech,https://www.reddit.com/r/technology/comments/10cgwxa/wow_cool/,technology,https://www.facebook.com/groups/retrocomputers/permalink/6386271951402632/?sfnsn=scwspmo&amp;ref=share
480,2023-01-15,"We’ve filed a law­suit chal­leng­ing Sta­ble Dif­fu­sion, a 21st-cen­tury col­lage tool that vio­lates the rights of artists.",u/Mandelmus100,https://www.reddit.com/r/technology/comments/10ch1dy/weve_filed_a_lawsuit_challenging_stable_diffusion/,technology,https://stablediffusionlitigation.com/
1,2023-01-15,Questo TABLET ANDROID è SPETTACOLARE,u/MaxPellezZz,https://www.reddit.com/r/technology/comments/10ch3hh/questo_tablet_android_è_spettacolare/,technology,https://youtube.com/watch?v=swhzpqiUwDg&amp;feature=shares
1,2023-01-15,Companies that had their ipo in 2007: Hottest IPOs,u/AyaanBilal99,https://www.reddit.com/r/technology/comments/10ch5f9/companies_that_had_their_ipo_in_2007_hottest_ipos/,technology,https://androidnews-jp.com/companies-that-had-their-ipo-in-2007-hottest-ipos/
1,2023-01-15,Upsolver sql 25m: Upsolver raises $25M for no-code data lake,u/AyaanBilal99,https://www.reddit.com/r/technology/comments/10ch5qw/upsolver_sql_25m_upsolver_raises_25m_for_nocode/,technology,https://androidnews-jp.com/upsolver-sql-25m-upsolver-raises-25m-for-no-code-data-lake-platform/
1,2023-01-15,Cyber Security VS Software Engineering: Tug of War!,u/ARFASOFTECH,https://www.reddit.com/r/technology/comments/10chr5i/cyber_security_vs_software_engineering_tug_of_war/,technology,https://www.arfasoftech.com/blog/Cyber-Security-VS-Software-Engineering:-Tug-of-War!
