score,date,title,author,url,subreddit,text
95,2024-05-31,The Key to 6G: Penn Engineers Unlock the Next Generation of Wireless Communications,u/Hashirama4AP,https://www.reddit.com/r/Futurology/comments/1d5bty6/the_key_to_6g_penn_engineers_unlock_the_next/,Futurology,https://scitechdaily.com/the-key-to-6g-penn-engineers-unlock-the-next-generation-of-wireless-communications/
1,2024-05-31,"Is it becoming more easier to break a law and get canned in the U.S. and around the world? A sign of authoritarianism for the future?
",u/M3629,https://www.reddit.com/r/Futurology/comments/1d5cb0a/is_it_becoming_more_easier_to_break_a_law_and_get/,Futurology,[removed]
0,2024-05-31,Is it becoming more easier to break a law and get canned in the U.S. and around the world? A sign of authoritarianism for the future?,u/Opening-Mode1833,https://www.reddit.com/r/Futurology/comments/1d5chgj/is_it_becoming_more_easier_to_break_a_law_and_get/,Futurology,"I feel like there’s too many laws being created in our society, to where it’s becoming harder and harder to live life normally without breaking any one of them, then you risk getting thrown into jail or prison. And if you are, not only you lose everything pretty much, but it’s incredibly hard to get back into this society financially in this already failing economy. Thats why I’m linking this to authoritarianism, because the government is creating so many damn laws in all aspects of life, it’s a sign that authoritarianism is taking over for future generations? What do you think?"
1,2024-05-31,Think You Know Dogs? Can You Pass the IMPOSSIBLE The Quiz? 99% Fail!,u/gavosag468,https://www.reddit.com/r/Futurology/comments/1d5dq4l/think_you_know_dogs_can_you_pass_the_impossible/,Futurology,[removed]
7,2024-06-01,Artefact of the Future - The Hospitality Industry,u/Wonderful-Bread5084,https://www.reddit.com/r/Futurology/comments/1d5ftoz/artefact_of_the_future_the_hospitality_industry/,Futurology,"What do you think are some current issues in the hospitality industry? It can be for hotels, airlines, cruises, etc.  and what do you think are some potential future technologies that can solve these issues? (eg. sustainability, privacy concerns, etc.) They can be ongoing inventions or something completely fictional! 

I can only think of futuristic solutions for other industries - for example, a bioreactor for lab-grown, customisable nutrition-rich food tailored to individual dietary needs and sustainable practices for food technology. I feel that it's difficult to incorporate the idea of technology in the hospitality industry due to the issue of human touch. Understood that currently there are many innovations such as robots, contactless technologies, AR VR, but I want to know if there are innovations/ideas that are apart from these commonplace ones that we see today. Let me know your thoughts! :D"
2598,2024-06-01,"Godfather of AI says there's an expert consensus AI will soon exceed human intelligence. There's also a ""significant chance"" that AI will take control. ",u/katxwoods,https://www.reddit.com/r/Futurology/comments/1d5gycf/godfather_of_ai_says_theres_an_expert_consensus/,Futurology,https://futurism.com/the-byte/godfather-ai-exceed-human-intelligence
10,2024-06-01,"Imagining a Next-Gen City (Part 1 - Architecture, Urban Design, Education, Government)",u/InspiredMonkey77,https://www.reddit.com/r/Futurology/comments/1d5htf9/imagining_a_nextgen_city_part_1_architecture/,Futurology,"What's up guys

I've traveled all over the US and have lived in quite a few cities, including Denver, Miami, and several mid-sized cities throughout Louisiana and East Tennessee. 

I was always amazed by cities growing up. I love the architecture, the sense of community, the food, the energy, the feeling of being part of something bigger than myself.

But the more time I spend in cities, the more I feel like our cities and the communities they're home to are crumbling.

Corporate control and corrupt politicians have made life in the city highly unaffordable. Car-centric design has littered our communities with asphalt, unwalkable streets, and parking lots. New architecture - office buildings and residential alike - has been designed to maximize profits rather than for the enjoyment and use of the people.

It's upsetting to me that we've lost so much of what made American cities and life in the West so great in the past. 

&#x200B;

So, imagine if we had a chance to reinvent our cities and society as a whole. No politics, no BS, just a fresh start, with all of the technology we have today. What changes could we make to create a better life for ourselves and our next generations? Here's some of my ideas. I hope you enjoy.

&#x200B;

**Architecture, Construction, and Urban Design:**

\-  Plan the City Ahead of Time as a Digital Model

Let's build a digital model of our next-gen city, based around a state-of-the-art public transportation system, with a clear architectural style. Future residents can propose design changes online.

\- Create the Most Livable and Community-Oriented Neighborhoods We Can Imagine

Within our neighborhoods, we'll have walking and bike paths, parks, trees for shade, lighting at night, local businesses and eateries on the ground level, filtered water stations and clean, nice restrooms set throughout. We'll rid our public spaces of advertisements, parking lots, and loud cars and replace it with art, eateries, local business, and effective public transportation.

\- Create Better Homes, Apartments, and Complexes

We'll have local business on the ground level of our buildings, a set minimum of restaurant spots built in each neighborhood. Condos and apartments will be equipped with water filtration systems, better air filtration systems, humidity control, zone-specific HVAC control, better sound proofing, and temp-control mattresses in bedroom to improve sleep. The complexes will be designed harmoniously with their surrounding environment in mind - No more balconies overlooking a 4-lane highway. Complexes will have community-spaces (pool deck, garden, gym, community balconies), and larger complexes will have redundant spaces, each assigned to different floors / sections of the complex, so that residents see the same people more and are able to foster community more easily. (It's hard in big complexes - there's so many people)

\- Sustainability, Construction, and Decentralization

We could manufacture many of our buildings in a modular fashion outside of the city, for final assembly within the city to minimize construction noise and time. Our current cities are constantly under construction, it's a drag. Construction tools could be redesigned to make less noise, and we can allocate more resources / labor to each project to complete faster. We'll utilize sustainable building materials like CLT where feasible. We can even design architecture to be disassembled and recycled at the end of its life. Disassembly, material sorting, and recycling will be much easier to accomplish down the line with AI. One of our best defenses against tyranny and outside forces is decentralization - Equipping each neighborhood with solar, and creating redundant water systems, online communication systems, etc will create a strong, resilient city.

&#x200B;

**A New Education System**

\- One Completely Free Education System

Let's quit putting children in $100s of thousands in debt over education and create one, singular education system that equips both children and returning adults with all of the tools they need to succeed in society. We'll have a core curriculum and then a multitude of different areas that students can pursue based on their passion and current job market conditions. We'll utilize video teaching (like people are doing on YouTube now) and AI simulations to drastically increase retention and course quality. Again we'll teach the basics, like math, scientific method, geography, language and rhetoric, but we'll also teach essentials like how to cook, how to exercise and take care of your body, how to build relationships, how to open a business, how to operate our city's political system, the basics of modern society - basic housing construction, water systems, electricity, our public transportation network. And then once kids start to branch out into their niche, we'll offer courses on specific careers, like construction, urban design, culinary arts, music, engineering, etc. Real, practical, skills all for free in one system.

\- Real-Time Job Market Analytics, and Enhanced Student Report Card

We'll tap employers / local businesses into our education system for the sole purpose of making job-market data available to students in real time. Businesses and employers will post their labor needs into the system, and students / parents can make educational path decisions based on real-time data. As students progress and expand their knowledge, their progress will be automatically compiled into an advanced and details student 'report card' which details their expertise, interests, and knowledge rather than pinning them up against other classmates in a GPA system. This will allow employers and parents a much better understanding into student's strengths, passions, and progress.

&#x200B;

**A (Much) Better Political System**

There's a long list of issues with our current political system - only two parties, corporate control, federal overreach, money laundering, massive corruption and human rights violations around the globe. Let's scrap it entirely and create a reddit-like 'community forum' for our city where once every 2-4 years during a limited working-hours political holiday, we come together to discuss policy, issues within our community, new developments and plans, and how we would like to allot our tax money. We'll have a highly secure voting system and make decisions for our community within our community. We can still elect officials, as well as management and development companies for projects and managed systems. These contractors and companies can bid for the communities' business within the forum and we can vote there. Something else we could do is scrap IPO's and instead buy out systems that arise within our community like uber or airbnb and turn them into community assets the same as we've done with education, public transportation, etc. We'll elect / re-elect a management team and these services will become dirt cheap for everyone, instead of being bought out by investors and turned to shit to maximize profits.

&#x200B;

Hope y'all enjoyed. Feel free to pick this apart, lol, or add your own ideas!  I have a whole journal full of this stuff so if you guys liked it, I'll post some more soon."
167,2024-06-01,Some long-duration energy storage systems now cheaper than Lithium says BNEF,u/Economy-Fee5830,https://www.reddit.com/r/Futurology/comments/1d5jelw/some_longduration_energy_storage_systems_now/,Futurology,https://www.pv-magazine.com/2024/05/31/long-duration-energy-storage-poised-to-outcompete-lithium-ion-batteries/
2856,2024-06-01,Microsoft being investigated over new ‘Recall’ AI feature that tracks your every PC move,u/Maxie445,https://www.reddit.com/r/Futurology/comments/1d5jhcw/microsoft_being_investigated_over_new_recall_ai/,Futurology,https://mashable.com/article/microsoft-recall-ai-feature-uk-investigation
1,2024-06-01,Share market daily levels for intraday trading,u/vedubhai_09808,https://www.reddit.com/r/Futurology/comments/1d5ji3l/share_market_daily_levels_for_intraday_trading/,Futurology,https://finniftyview.com/
632,2024-06-01,"Humanity has no strong protection against AI, experts warn | Ahead of second safety conference, tech companies accused of having little understanding of how their systems actually work",u/Maxie445,https://www.reddit.com/r/Futurology/comments/1d5jmyo/humanity_has_no_strong_protection_against_ai/,Futurology,https://www.thetimes.co.uk/article/world-has-no-strong-protections-against-ai-experts-warns-mwb9q6f77
390,2024-06-01,"George Lucas Thinks Artificial Intelligence in Filmmaking Is 'Inevitable' ""It's like saying, 'I don't believe these cars are gunna work. Let's just stick with the horses.' """,u/LifeCool69,https://www.reddit.com/r/Futurology/comments/1d5jwpd/george_lucas_thinks_artificial_intelligence_in/,Futurology,https://www.ign.com/articles/george-lucas-thinks-artificial-intelligence-in-filmmaking-is-inevitable
37,2024-06-01,Last five years of work,u/VitruvianSpyder,https://www.reddit.com/r/Futurology/comments/1d5lot8/last_five_years_of_work/,Futurology,https://www.palladiummag.com/2024/05/17/my-last-five-years-of-work/
0,2024-06-01,Alien Hypothesis ,u/excogitatorisz,https://www.reddit.com/r/Futurology/comments/1d5mksn/alien_hypothesis/,Futurology,"Perhaps the aliens we see on internet, books and Television are real, they have  traveled back through time to us from the future. Because  time travel might be mature and developed by then.



They could be super-advanced intelligent creatures created by humans as an advanced product of AI or perhaps the combination of future human and advanced technology , as we are too frail, and future humans might wish to discard our organic bodies, so that's why they look like that. "
784,2024-06-01,"Why cultivated, or lab-grown meat, is not only safe, and ethical, but also a smart way to create protein",u/__The__Anomaly__,https://www.reddit.com/r/Futurology/comments/1d5p4ha/why_cultivated_or_labgrown_meat_is_not_only_safe/,Futurology,https://www.thestar.com/opinion/contributors/why-cultivated-or-lab-grown-meat-is-not-only-safe-and-ethical-but-also-a/article_e1132b94-17b6-11ef-bc72-2b4e80d02788.html
1,2024-06-01,Why do so many people doubt that spatial technology will be the future?,u/Cool_Mouse_4779,https://www.reddit.com/r/Futurology/comments/1d5p8l9/why_do_so_many_people_doubt_that_spatial/,Futurology,[removed]
2,2024-06-01,One Life Materialism,u/sanduskythrowaway600,https://www.reddit.com/r/Futurology/comments/1d5q6g4/one_life_materialism/,Futurology,https://voyagerslog.substack.com/p/one-life-materialism
3286,2024-06-01,"The US is to spend $480 million on a Palantir AI tool to identify terrorists in the Middle East, which so far has been used in a military conflict where 80% of the dead are civilians.",u/lughnasadh,https://www.reddit.com/r/Futurology/comments/1d5qjkt/the_us_is_to_spend_480_million_on_a_palantir_ai/,Futurology,https://defensescoop.com/2024/05/29/palantir-480-million-army-contract-maven-smart-system-artificial-intelligence/?
1,2024-06-01,Why do so many people doubt that spatial technology will be a big thing in the future?,u/Cool_Mouse_4779,https://www.reddit.com/r/Futurology/comments/1d5ruci/why_do_so_many_people_doubt_that_spatial/,Futurology,[removed]
0,2024-06-01,Fear of the downfall of humanity or are we evolving?,u/L4v3n,https://www.reddit.com/r/Futurology/comments/1d5tbpk/fear_of_the_downfall_of_humanity_or_are_we/,Futurology,"I am not sure if this is the right forum to share my thoughts on the future. I apologize if posted it in the wrong subs.

I do not hate women, but my thoughts could be disliked by them. Also, please, I would like to discourage misogynists and misandrists from keeping their hate comments, suggesting you keep the debate civilized. I am not going to speak in favor of men or women, but in the context of the whole humanity.

For the past few days, I have been thinking about a matter -- ""the upcoming downfall of humanity."" This made me feel sad and fearful. How horrible would the future be, or is it a step forward from human civilization? Are we evolving? Is it good?

I have been wondering why the birth rate of the world has been reduced by more than half compared to the present. In the 1950s, it was about 38 per thousand, and now, in 2023, it is like 17 per thousand. Isn't it something to think about? I remember back in our school days, we were taught the consequences of population growth and the need to reduce it, and now boom, here we are what we wanted! This is not something that we wanted to reduce population growth; instead, it happened naturally and due to the necessity created by the interaction of human dynamics with the environment.

Why is this happening? What caused the birth rate to drop significantly? Is this because we no longer, as the majority of the population, depend on agriculture? Is this because women are more educated? Or is it due to the side effects of the internet and technology?

To keep it short, I do not want to start it with the agricultural revolution. Let's directly jump to our era.

In the age of science and technology, educated women have a strong role in determining family size. Mostly, they don't want to engage in normal household chores and want to get busy in the office. Compared to the past, most women were housewives, and basic needs were cheap, so making babies was not an issue. But it's different now. The competition is getting higher, with both men and women fighting for the same job. If you have to make a baby, you have to think a lot about whether you can provide a good future for your child. Since we are living in an expensive era where health care and education are pretty expensive, that seems unbearable for ordinary people.

Secondly, women are doing well in their education and jobs; their standards have risen. So, they also prefer their partner to be of equal or higher status than them. Because of the higher status of women, the chance of getting a partner of their choice is hard to find. Similarly, in the case of men, they are hardly finding women below their status. So, lower-status men and higher-status women are both unhappy finding suitable partners, which implicitly means a lower birth rate.

Thirdly, the heavy use of social media made the world a small town. Women are approached by 100s and 1000s of men, which makes it overwhelming for them to choose the appropriate partner, whereas men have a significantly lower probability of finding their partner. People from different parts of the world are connected despite their ethnicity, race, religion, etc., which is a good thing. I see that the future seems to be a mix of all these people reaching the equilibrium of human dynamics, perishing both men and women who are at their extremities (who didn't find a suitable partner for them).

Finally (to keep it short), the next problem is the AI. Nowadays, there is a heavy use of AI. People want things easy and quick without much effort. Industries are developing human-like AI sex robots to satisfy the sexual needs of people. What I see is that the coming generation seems to be more indoors, with fewer human interactions. They would want to satisfy their needs easily without struggling or putting in much effort to find real human beings.

Are these problems really the consequences of the evolution of human beings? Does really nature wanted this the ""Downfall of the humanity?"" Sorry, the post is very lengthy, and I don't want to think of other issues that could be causes for the downfall.

Thanks for reading!

PS: I would like to apologize. It is not intentional to attack any gender. And sorry for the poor choice of words if I used them."
0,2024-06-01,“AI Ruined My Year” - Robert Miles AI Safety,u/-LsDmThC-,https://www.reddit.com/r/Futurology/comments/1d5tiyn/ai_ruined_my_year_robert_miles_ai_safety/,Futurology,https://youtu.be/2ziuPUeewK0?si=hmeKBnS5W6aamntF
211,2024-06-01,"Burj Khalifa designer to use gravity to turn skyscrapers into batteries | The 10-year agreement is expected to result in multi-GWh of long-duration Energy Vault GESS deployments to contribute to the SADC region’s energy storage needs, which are estimated to be 25 GW/125 GWh by 2035.",u/chrisdh79,https://www.reddit.com/r/Futurology/comments/1d5vfzo/burj_khalifa_designer_to_use_gravity_to_turn/,Futurology,https://interestingengineering.com/energy/burj-khalifa-skyscrapers-to-store-energy
1,2024-06-01,Hi guys!,u/poz1tiv4ik000,https://www.reddit.com/r/Futurology/comments/1d5xv7c/hi_guys/,Futurology,[removed]
1,2024-06-01,Jeff Bezos Spent $42 Million To Build A Massive Clock That Will Outlast Humanity -,u/Delicious-Tip3191,https://www.reddit.com/r/Futurology/comments/1d5y2xu/jeff_bezos_spent_42_million_to_build_a_massive/,Futurology,https://sciinsider.com/2024/05/22/jeff-bezos-spent-42-million-to-build-a-massive-clock-that-will-outlast-humanity/
1,2024-06-01,Downtownfamilypharmcy trusty Online Pharmacy for Health Care,u/familypharmacy123,https://www.reddit.com/r/Futurology/comments/1d5ydeh/downtownfamilypharmcy_trusty_online_pharmacy_for/,Futurology,https://downtownfamilypharmcy.com
1,2024-06-01,What are your Predictions for Technological Advancements from Now Until The Beginning of The 22nd Century? (2100),u/karmaenthusiast_,https://www.reddit.com/r/Futurology/comments/1d5zgjx/what_are_your_predictions_for_technological/,Futurology,[removed]
4,2024-06-01,Future of crime ?,u/emptyboxes20,https://www.reddit.com/r/Futurology/comments/1d606o9/future_of_crime/,Futurology,https://web.musc.edu/about/news-center/2018/05/03/the-ecstasy-of-ptsd-relief
1,2024-06-01,Modern Cars are a ‘privacy nightmare’ and you can not opt out of data collection.,u/NecessaryCelery2,https://www.reddit.com/r/Futurology/comments/1d60tcu/modern_cars_are_a_privacy_nightmare_and_you_can/,Futurology,https://www.youtube.com/watch?v=7kUJhWUm3JA
1,2024-06-01,"Buy coke powder online, a-pvp, pump it up powder, white girl, JWH-018. Research chemicals, bath salts, herbal incense and pain medication products",u/No-Dealer-7279,https://www.reddit.com/r/Futurology/comments/1d62pyf/buy_coke_powder_online_apvp_pump_it_up_powder/,Futurology,[removed]
2,2024-06-01,The topic of artificial intelligence (AI),u/Chicflarescom,https://www.reddit.com/r/Futurology/comments/1d64kkm/the_topic_of_artificial_intelligence_ai/,Futurology,http://www.dailytrendidea.com/2024/05/the-topic-of-artificial-intelligence-ai.html
1,2024-06-02,Can we use 100% of all energy on the planet? Kardashev Scale,u/Popular_Basis7791,https://www.reddit.com/r/Futurology/comments/1d652jy/can_we_use_100_of_all_energy_on_the_planet/,Futurology,[removed]
852,2024-06-02,"Big tech has distracted world from existential risk of AI, says top scientist",u/Maxie445,https://www.reddit.com/r/Futurology/comments/1d654jn/big_tech_has_distracted_world_from_existential/,Futurology,https://www.theguardian.com/technology/article/2024/may/25/big-tech-existential-risk-ai-scientist-max-tegmark-regulations
3543,2024-06-02,GPT-4 outsmarts Wall Street: AI predicts earnings better than human analysts,u/Maxie445,https://www.reddit.com/r/Futurology/comments/1d67ibz/gpt4_outsmarts_wall_street_ai_predicts_earnings/,Futurology,https://www.businesstoday.in/technology/news/story/gpt-4-outsmarts-wall-street-ai-predicts-earnings-better-than-human-analysts-431062-2024-05-27
78,2024-06-02,"1X’s Eve humanoid robot masters task chaining, nears autonomous work",u/katxwoods,https://www.reddit.com/r/Futurology/comments/1d67nvx/1xs_eve_humanoid_robot_masters_task_chaining/,Futurology,https://interestingengineering.com/innovation/1x-robotics-voice-task-sequencing
41,2024-06-02,Researchers looking at brain-gene editing techniques to cutomise your body via AI neurotechnology.,u/CollateralJustice,https://www.reddit.com/r/Futurology/comments/1d682mq/researchers_looking_at_braingene_editing/,Futurology,"In the same way we can inject medicine to deactivate the uterine sensitization-associated gene-1 (USAG-1) protein which suppresses tooth growth, blocking USAG-1's interaction with other proteins encourages bone morphogenetic protein (BMP) signaling which triggers new bone to generate.

Using a new type of neuro implant we attach to the brain that can activate / deactivate certain specific regulating gene functions in the human brain. This effectively lets the user control aspects of the body that can be customised to their preference including hair and eye colour. Although we are still 60-70 years away from human trials. "
662,2024-06-02,Sam Altman Says OpenAI Doesn’t Fully Understand How GPT Works Despite Rapid Progress,u/katxwoods,https://www.reddit.com/r/Futurology/comments/1d6834x/sam_altman_says_openai_doesnt_fully_understand/,Futurology,https://observer.com/2024/05/sam-altman-openai-gpt-ai-for-good-conference/
1,2024-06-02,Early Adopters Of Gen AI In Law,u/craw77jean,https://www.reddit.com/r/Futurology/comments/1d69dax/early_adopters_of_gen_ai_in_law/,Futurology,https://www.forbes.com/sites/tomdavenport/2024/06/01/early-adopters-of-gen-ai-in-law/?sh=27ede9ed113f
30186,2024-06-02,"CEOs could easily be replaced with AI, experts argue",u/katxwoods,https://www.reddit.com/r/Futurology/comments/1d69x8v/ceos_could_easily_be_replaced_with_ai_experts/,Futurology,https://futurism.com/the-byte/ceos-easily-replaced-with-ai
0,2024-06-02,"The probability of existence of Martian, documents from CIA",u/Raptor-777,https://www.reddit.com/r/Futurology/comments/1d6a95w/the_probability_of_existence_of_martian_documents/,Futurology,https://www.cia.gov/readingroom/docs/CIA-RDP96-00788R001900760001-9.pdf
1,2024-06-02,How the US is destroying young people’s future,u/WombatWandersWild,https://www.reddit.com/r/Futurology/comments/1d6ad0p/how_the_us_is_destroying_young_peoples_future/,Futurology,https://youtu.be/qEJ4hkpQW8E?si=YYNMjHuI7QatYWyz
1,2024-06-02,First AI film from the AI's perspective,u/Jeremy_f,https://www.reddit.com/r/Futurology/comments/1d6azc5/first_ai_film_from_the_ais_perspective/,Futurology,https://youtu.be/3wce08znlxw
0,2024-06-02,New social media app,u/Nairobianke,https://www.reddit.com/r/Futurology/comments/1d6b47p/new_social_media_app/,Futurology,http://www.tazamah.com
0,2024-06-02,AI Upsampling?,u/SolaraOne,https://www.reddit.com/r/Futurology/comments/1d6cb36/ai_upsampling/,Futurology,https://www.pixelcut.ai/image-upscaler
