score,date,title,author,url,subreddit,text
0,2024-06-22,I Have Asked Chatgpt the Future of Humanity if AI Does Everything.... ,u/Soft_And_Cuddly,https://www.reddit.com/r/Futurology/comments/1dlrnlf/i_have_asked_chatgpt_the_future_of_humanity_if_ai/,Futurology,"### Question
If in 15 years nearly all expertise becomes open and free to everyone, what would that mean for humanity? What would it mean for people who are and want to pursue any careers, given that there won't be almost any? What would it mean for man's search for the meaning to stay alive? How would this affect the economy, political and geopolitical situations, and the multipolar world? What would people, in reality, do, and what should they do to find purpose in life? Which sectors would become essential, akin to today's IT, medical, and engineering fields?

### Answer

The scenario where nearly all expertise is open and free to everyone within 15 years presents a profound transformation for humanity, touching on numerous aspects of society, economy, politics, and individual purpose. Here is a detailed examination:

#### Impact on Humanity
Access to universal expertise would democratize knowledge, leading to unprecedented levels of education and skill acquisition globally. This would likely result in a highly educated populace capable of engaging in complex problem-solving and innovative thinking. However, it could also create a paradox of abundance, where the value of expertise diminishes due to its ubiquity.

#### Career Pursuit and Employment
As expertise becomes widespread, traditional career paths might dissolve, particularly those based on specialized knowledge that was once scarce and highly valued. This would lead to a shift from conventional employment structures to more fluid and dynamic forms of work. People might increasingly pursue careers that involve creativity, emotional intelligence, and complex human interactions—areas where machine intelligence and raw expertise might fall short.

1. **Adaptation and Resilience**: Individuals will need to become more adaptable, continuously learning and evolving as the landscape of work changes. The emphasis will shift from mastering a specific domain to developing a diverse skill set and a robust intellectual foundation.

2. **Focus on Unique Human Abilities**: Careers might focus more on uniquely human attributes such as empathy, creativity, and ethical reasoning. Professions like artists, therapists, and ethical consultants could see a rise in importance.

#### Search for Meaning
With the decline of traditional career paths, the search for meaning in life will likely intensify. People may turn towards more intrinsic motivations, such as personal fulfillment, community involvement, and contributing to societal well-being.

1. **Existential Questions**: The quest for meaning may become a central theme in human life, leading to a renaissance in philosophical and spiritual exploration. People might seek purpose in relationships, self-improvement, and contributing to the greater good.

2. **Community and Collaboration**: Collective endeavors and community-based projects could gain prominence, providing a sense of belonging and shared purpose.

#### Economic Impact
The economy would undergo significant transformation as automation and open expertise reduce the need for traditional labor. This could lead to a post-scarcity economy, where basic needs are easily met, and the focus shifts to the distribution of wealth and resources.

1. **Universal Basic Income (UBI)**: To address potential unemployment, concepts like UBI might become essential, providing financial security and allowing individuals to pursue their passions and interests without the pressure of economic survival.

2. **Shift to Value Creation**: The economy might pivot towards creating value through innovation, creativity, and sustainability rather than mere production and consumption.

#### Political and Geopolitical Situations
Politically, the widespread availability of expertise could empower citizens, fostering greater participation in democratic processes and reducing the power disparity between governments and the populace.

1. **Decentralization of Power**: With informed and educated citizens, political power could become more decentralized, promoting transparency and accountability in governance.

2. **Global Cooperation**: Geopolitically, the world could move towards greater cooperation, as knowledge-sharing transcends borders and fosters a sense of global community. However, this could also lead to new forms of competition, particularly in technological and ideological domains.

#### Essential Sectors
As traditional roles evolve, certain sectors will become increasingly essential:

1. **Technology and Automation**: Maintaining and advancing technology, particularly in AI, robotics, and cybersecurity, will remain crucial.
   
2. **Healthcare**: Despite advancements, human health and well-being will always require attention, especially with an aging population.

3. **Environmental Sustainability**: Addressing climate change and environmental degradation will be paramount, requiring expertise in renewable energy, conservation, and sustainable development.

4. **Education and Lifelong Learning**: As expertise becomes free, the role of educators will shift towards guiding and mentoring, helping individuals navigate the vast sea of available knowledge.

5. **Ethics and Governance**: As technology and knowledge advance, the need for ethical oversight and governance will grow, ensuring that advancements benefit humanity as a whole.

#### Conclusion
In this envisioned future, humanity faces both challenges and opportunities. The democratization of expertise could lead to a more equitable and informed society, yet it will also demand profound adjustments in how individuals find purpose and how societies function. Embracing adaptability, creativity, and a focus on human values will be essential in navigating this transformative era."
0,2024-06-22,Microplastics detected in human penises for the first time,u/thorium43,https://www.reddit.com/r/Futurology/comments/1dlsj2w/microplastics_detected_in_human_penises_for_the/,Futurology,https://edition.cnn.com/2024/06/19/health/microplastics-human-penises-study-scli-intl-scn-wellness/index.html
1,2024-06-22,Chronicles From The Future: Every Prediction Made In 3906 By A Time Traveler,u/FrequentWriter8053,https://www.reddit.com/r/Futurology/comments/1dltoay/chronicles_from_the_future_every_prediction_made/,Futurology,https://medium.com/@PinkHatHacker/3906-time-traveler-eefb78799413?sk=c7d0242b0383c0c8b907a29936fddeb8
5,2024-06-22,Chronicles From The Future: Every Prediction Made In 3906 By A Time Traveler,u/Large-Grade4222,https://www.reddit.com/r/Futurology/comments/1dltp8b/chronicles_from_the_future_every_prediction_made/,Futurology,https://medium.com/@PinkHatHacker/3906-time-traveler-eefb78799413?sk=c7d0242b0383c0c8b907a29936fddeb8
1,2024-06-22,"627वें कबीर साहेब प्रकट महोत्सव पर सतलोक आश्रम, धनाना धाम (हरियाणा) सीधा प्रसारण | Sant Rampal Ji",u/Pranayban,https://www.reddit.com/r/Futurology/comments/1dluc5p/627व_कबर_सहब_परकट_महतसव_पर_सतलक_आशरम_धनन_धम_हरयण/,Futurology,https://www.youtube.com/live/ATVp44ykUb8?si=AjDJZoeNtIGK6vRO
0,2024-06-22,AI Snapchat New Filter Transforms Real Time,u/Careless_Dirt4667,https://www.reddit.com/r/Futurology/comments/1dluybd/ai_snapchat_new_filter_transforms_real_time/,Futurology,https://tiktokcelebrities.com/ai-snapchat-new-filter-transforms-real-time/
0,2024-06-22,AI Set to Revolutionize the Sex Doll Industry,u/nowadayswow,https://www.reddit.com/r/Futurology/comments/1dlx9ny/ai_set_to_revolutionize_the_sex_doll_industry/,Futurology,https://www.worldopress.com/post/ai-set-to-revolutionize-the-sex-doll-industry
1,2024-06-22,"AI, Jobs and the Future",u/Little-Ad4304,https://www.reddit.com/r/Futurology/comments/1dly90u/ai_jobs_and_the_future/,Futurology,[removed]
2604,2024-06-22,Cloud geoengineering could push heatwaves from US to Europe,u/SportsGod3,https://www.reddit.com/r/Futurology/comments/1dlypty/cloud_geoengineering_could_push_heatwaves_from_us/,Futurology,https://www.newscientist.com/article/2436377-cloud-geoengineering-could-push-heatwaves-from-us-to-europe/
0,2024-06-22,Some Thoughts on AI Alignment: Using AI to Control AI,u/dicklesworth,https://www.reddit.com/r/Futurology/comments/1dlz200/some_thoughts_on_ai_alignment_using_ai_to_control/,Futurology,https://github.com/Dicklesworthstone/some_thoughts_on_ai_alignment
1,2024-06-22,ChickenBoy2020,u/Super-Range2149,https://www.reddit.com/r/Futurology/comments/1dlz88w/chickenboy2020/,Futurology,https://youtube.com/@warrior19292?si=IGW7S9hxet1ywztY
1,2024-06-22,"Researchers at an English University say they have uncovered fundamental new rules about immune system function that could enable a ‘unified healer army’ of T cells, that could repair injured muscle, make fat cells respond better to insulin, and regrow hair follicles.",u/lughnasadh,https://www.reddit.com/r/Futurology/comments/1dlzmnk/researchers_at_an_english_university_say_they/,Futurology,https://www.eurekalert.org/news-releases/1048109?
843,2024-06-22,"Researchers at an English university say they have uncovered fundamental new rules about immune system function that could enable a ‘unified healer army’ of T cells, that could repair injured muscle, make fat cells respond better to insulin, and regrow hair follicles.",u/lughnasadh,https://www.reddit.com/r/Futurology/comments/1dlznbz/researchers_at_an_english_university_say_they/,Futurology,https://www.eurekalert.org/news-releases/1048109?
1,2024-06-22,"The Indian Air Force received its first batch of five Dassault Rafale fighter jets in July 2020, part of a $8.7 billion deal for 36 jets from France. These advanced multi-role aircraft enhance India's military capabilities with superior avionics, stealth, and weaponry, boosting the IAF's operational",u/[deleted],https://www.reddit.com/r/Futurology/comments/1dm085n/the_indian_air_force_received_its_first_batch_of/,Futurology,
0,2024-06-22,Chronicles From The Future: Every Prediction Made In 3906 By A Time Traveler,u/Large-Grade4222,https://www.reddit.com/r/Futurology/comments/1dm4nov/chronicles_from_the_future_every_prediction_made/,Futurology,https://medium.com/@PinkHatHacker/3906-time-traveler-eefb78799413
1,2024-06-22,UOG GPA Calculator - University Of Gujrat SGPA & CGPA,u/hanzalazaheer,https://www.reddit.com/r/Futurology/comments/1dm5gxl/uog_gpa_calculator_university_of_gujrat_sgpa_cgpa/,Futurology,https://gpaguru.com/uog-gpa-calculator-university-of-gujrat/
1,2024-06-22,A 17 yo fashion design student shocks the world by defeating AI in an advanced math contest,u/AIholics,https://www.reddit.com/r/Futurology/comments/1dm66w3/a_17_yo_fashion_design_student_shocks_the_world/,Futurology,https://aiholics.com/teenager-shocks-china-by-defeating-ai-in-math-contest/
1,2024-06-22,CitiBus Flying Drone Car of the Future,u/HellBProductions,https://www.reddit.com/r/Futurology/comments/1dm6846/citibus_flying_drone_car_of_the_future/,Futurology,https://youtube.com/shorts/9Z42tg3RY68?feature=share
1,2024-06-22,Future Humanoid Robots,u/HellBProductions,https://www.reddit.com/r/Futurology/comments/1dm6g1l/future_humanoid_robots/,Futurology,https://youtube.com/shorts/P2aJc-9z-L0?feature=share
2,2024-06-22,AI Gone Wrong: TikTok Pulls New Tool After Controversy Over Hitler Content,u/Careless_Dirt4667,https://www.reddit.com/r/Futurology/comments/1dm79dg/ai_gone_wrong_tiktok_pulls_new_tool_after/,Futurology,https://tiktokcelebrities.com/tiktok-pulls-new-tool-after-controversy-over-hitler-content/
3,2024-06-22,AI Gone Wrong: TikTok Pulls New Tool After Controversy Over Hitler Content,u/Careless_Dirt4667,https://www.reddit.com/r/Futurology/comments/1dm79l6/ai_gone_wrong_tiktok_pulls_new_tool_after/,Futurology,https://tiktokcelebrities.com/tiktok-pulls-new-tool-after-controversy-over-hitler-content/
0,2024-06-22,The STARS are not real ,u/Remote_Cherry6023,https://www.reddit.com/r/Futurology/comments/1dm81so/the_stars_are_not_real/,Futurology,"Ok .hear me out ..for as long as I can remember every time I go outside I look to the sky . Over the last couple of years the stars are different .  They will move into place if you catch them at the right time .. they communicate with each other and typically there is one ""main"" star that you can see rotating and scannning the area .  I live in Austin Texas , it's city stars .  Do I think every star is fake .. no but the city stars are . "
1,2024-06-22,Automatic Ironing Machine for household use,u/Big_Preference_9471,https://www.reddit.com/r/Futurology/comments/1dm9vy1/automatic_ironing_machine_for_household_use/,Futurology,[removed]
853,2024-06-22,"AI is exhausting the power grid. Tech firms are seeking a miracle solution. - As power needs of AI push emissions up and put big tech in a bind, companies put their faith in elusive — some say improbable — technologies.",u/Gari_305,https://www.reddit.com/r/Futurology/comments/1dma84o/ai_is_exhausting_the_power_grid_tech_firms_are/,Futurology,https://www.washingtonpost.com/business/2024/06/21/artificial-intelligence-nuclear-fusion-climate/
1,2024-06-22,SoftBank CEO talks up artificial super intelligence ambitions,u/Gari_305,https://www.reddit.com/r/Futurology/comments/1dmab92/softbank_ceo_talks_up_artificial_super/,Futurology,https://www.reuters.com/technology/artificial-intelligence/softbank-ceo-talks-up-firms-ai-ambitions-2024-06-21/
721,2024-06-22,"SoftBank CEO says AI that is 10,000 times smarter than humans will come out in 10 years",u/Maxie445,https://www.reddit.com/r/Futurology/comments/1dmcpja/softbank_ceo_says_ai_that_is_10000_times_smarter/,Futurology,https://www.cnbc.com/2024/06/21/softbank-ceo-predicts-ai-that-is-10000-times-smarter-than-humans-.html
135,2024-06-22,A Timeline of All the Recent Accusations Leveled at OpenAI and Sam Altman,u/Maxie445,https://www.reddit.com/r/Futurology/comments/1dmcvt0/a_timeline_of_all_the_recent_accusations_leveled/,Futurology,https://time.com/6986711/openai-sam-altman-accusations-controversies-timeline/
9689,2024-06-23,"Writer Alarmed When Company Fires His 60-Person Team, Replaces Them All With AI",u/katxwoods,https://www.reddit.com/r/Futurology/comments/1dmest0/writer_alarmed_when_company_fires_his_60person/,Futurology,https://futurism.com/the-byte/company-replaces-writers-ai
1,2024-06-23,ত্রিগুণের রহস্য কি? জানুন শ্রীমদ্ভগবদ গীতার গুপ্ত জ্ঞান... EPISODE 09,u/Pranayban,https://www.reddit.com/r/Futurology/comments/1dmev5e/তরগণর_রহসয_ক_জনন_শরমদভগবদ_গতর_গপত_জঞন_episode_09/,Futurology,https://youtu.be/BlfNIvTmPt8?si=0cAMaT81KyrC48et
303,2024-06-23,Anime waifus helped fund the world's first fully high-temperature superconducting tokamak device. Genshin Impact developer MiHoYo invested $65 million into Energy Singularity back in 2022.,u/Objective_Law5013,https://www.reddit.com/r/Futurology/comments/1dmevky/anime_waifus_helped_fund_the_worlds_first_fully/,Futurology,https://www.windowscentral.com/gaming/just-fyi-your-genshin-impact-pulls-are-funding-a-tokamak-nuclear-fusion-reactor-and-it-has-now-been-ignited
0,2024-06-23,Technology keeps humanity going.,u/Zestyclose_Army_607,https://www.reddit.com/r/Futurology/comments/1dmgdd8/technology_keeps_humanity_going/,Futurology,"Brand new to the sub (and maybe slightly stupid) let me explain my theory-

1. Technology was created to reduce human carbon footprint (less paper due to email/advertising, use car less due to staying on phone for hours on end, social media keeps us busy from using earth’s only resources, etc)

2. Technology and AI also helps us gain a further understanding of outer planets, the earth itself, knowledge of others, etc.

3. Earth’s resources are the only resources we have as of today, it WILL run out eventually. Technology/electricity is infinite (as far as we know).

4.technology and Ai was created to help us reduce resources being used in order to give us time to figure out where our resources will come from/ where we will move to. We are a ticking time bomb, and further research/creation of technology is only helping the human species continue for survival, as we are slowing down the usage of earths resources

This might sound absolutely crazy, tell me what you think, also might be obvious? Idk (Slightly tipsy writing this so if I didn’t explain thoroughly please ask questions). 

"
1,2024-06-23,Signal - Angular 18 -  Interview Questions - New Feature,u/kyprogramming,https://www.reddit.com/r/Futurology/comments/1dmgedy/signal_angular_18_interview_questions_new_feature/,Futurology,https://youtu.be/QNF-JLuZJtM
1,2024-06-23,The Synergy of Ancient Wisdom and Modern Technology,u/Only_Dinner,https://www.reddit.com/r/Futurology/comments/1dmh0uc/the_synergy_of_ancient_wisdom_and_modern/,Futurology,https://youtu.be/kPugAC_r6Lo?si=mynxhkAU63vPEsQy
47,2024-06-23,"As AI advances rapidly, which abilities will be more important for humans?",u/MethodWorth4635,https://www.reddit.com/r/Futurology/comments/1dmialr/as_ai_advances_rapidly_which_abilities_will_be/,Futurology,"
Will it be social skills, math and science skills, programming skills, or what else?"
0,2024-06-23,Share your ai with me,u/Ehisnovaking,https://www.reddit.com/r/Futurology/comments/1dmiw46/share_your_ai_with_me/,Futurology,"Share your AI’s with me.

Hi, I was sent by my boss to study ai. Since I'm the ai guy at my place of work I was given the task to get and study as many as I can to find to see how they can be used for the business. S I came here to ask. I need bots in every possible category but the ones that I use are-
Chat ai: Poe ai

Internet search bot: Poe ai 

Ai art: tensor art

Music ai generator: suno 

Photoshopping: adobe photoshop ai 

Coding: honestly none, still looking for one I understand 

Animation: used to use dream machine but it got blocked in my nation

Typing/writing: Grammarly (I'm dyslexic so can't spell well) 

I'll also love ai that is not listed in this category. Thank you for your possible help and have a great day 👋🏾"
0,2024-06-23,"Which Is more easily replaceable,  screenwriter or songwriter/beatmaker?",u/Hot-Pair3798,https://www.reddit.com/r/Futurology/comments/1dmixgp/which_is_more_easily_replaceable_screenwriter_or/,Futurology,as title.
457,2024-06-23,New study suggests plastic recycling facilities may be significant source of microplastics pollution released into water systems,u/mymooh,https://www.reddit.com/r/Futurology/comments/1dmk09y/new_study_suggests_plastic_recycling_facilities/,Futurology,https://www.sciencedirect.com/science/article/pii/S2772416623000803
1,2024-06-23,Russia's Iron Man Exoskeleton Amour Suit,u/HellBProductions,https://www.reddit.com/r/Futurology/comments/1dmkbs7/russias_iron_man_exoskeleton_amour_suit/,Futurology,https://youtube.com/shorts/waCFI863O9E?feature=share
0,2024-06-23,Hybrid fusion generators are already obsolete prove me wrong,u/TinFoilHat_69,https://www.reddit.com/r/Futurology/comments/1dmlxud/hybrid_fusion_generators_are_already_obsolete/,Futurology,"Helion is a US company designing and building fusion devices that are normally contained in one process. They have pioneered a process to make the generation and reaction process in manner that allows these devices to be contained and controlled in separate systems.
They pretty much are engineering fusion reactors and fusion generators. Helium 3 seems to be the most important component in their equations any insight besides what chat gpt has misguided users about already.

AI Response :

Hybrid fusion devices, which combine aspects of both fusion and fission reactions, present an interesting approach to energy generation. These devices aim to harness the benefits of both processes to create a more efficient and potentially safer energy source. Let's delve into the comparison of a hybrid fusion device versus a design that splits the hybrid concept into separate reactors and generators.

### Hybrid Fusion Devices

**Advantages:**
1. **Fuel Efficiency:** Fusion can help to ""burn"" long-lived nuclear waste from fission reactors, reducing the amount of radioactive waste and converting it into less harmful forms.
2. **Energy Output:** Fusion reactions can potentially provide a high energy yield, which can complement the energy produced by fission.
3. **Reduced Waste:** Fusion produces less long-lived radioactive waste compared to fission alone.

**Challenges:**
1. **Technical Complexity:** Combining fusion and fission in a single device increases the engineering complexity, making it challenging to design, build, and maintain.
2. **Stability and Control:** Managing both fusion and fission reactions simultaneously requires advanced control mechanisms to ensure stability and safety.
3. **Cost:** The development and construction of such complex devices can be significantly more expensive compared to conventional reactors.

### Splitting the Hybrid into Reactor and Generator

This design involves having separate systems where one is dedicated to generating the required conditions for fusion, and the other is a conventional fission reactor that benefits from the fusion-generated neutrons or energy.

**Advantages:**
1. **Modularity:** Separating the fusion and fission components allows for more modular designs, where each part can be optimized independently.
2. **Simplified Engineering:** It simplifies the engineering and operational challenges since each system can be developed and managed independently.
3. **Flexibility:** This separation allows for more flexible integration into existing energy infrastructure, making it easier to upgrade or replace components.

**Challenges:**
1. **Efficiency Loss:** Energy losses can occur during the transfer of energy or neutrons between the fusion and fission systems.
2. **Integration Complexity:** Even though the systems are separate, their integration requires precise coordination to ensure they function synergistically.
3. **Infrastructure Requirements:** Separate systems may require more physical space and infrastructure, potentially increasing the overall footprint and logistical requirements.

### Conclusion

Both approaches have their merits and challenges. Hybrid fusion devices can potentially offer high efficiency and reduced waste but come with significant technical and financial hurdles. On the other hand, splitting the hybrid concept into separate reactors and generators may provide more flexibility and simplified engineering but might suffer from efficiency losses and integration challenges.

Ultimately, the choice between these approaches would depend on specific goals, available technology, and resources. Continued research and development in both areas will be crucial to determining the most viable path forward for sustainable and efficient nuclear energy."
8,2024-06-23,"Robots, AI and birth rate",u/Glxblt76,https://www.reddit.com/r/Futurology/comments/1dmsqyv/robots_ai_and_birth_rate/,Futurology,"I am hesitant to think that the entire workforce is going to be fired as we make headways with AI and robotics. Actually, those two things come in very handy: Population is ageing due to low birth rates, and robotics/AI is getting better and closer to general-purpose. The ageing of population is going to create more and more labor shortages, combined with conservatives viewing immigrants as a scapegoat and leading their governments to crack down on immigration, from countries in which birth rates are also collapsing anyways and will want to keep their youth.

Thus, we'll have more incentives to fund robotics research and finally production and scaling. The ever declining working age population will migrate into positions where they assist robots and AI in their repetitive tasks and intervene whenever there is a problem that cannot be solved by automation or on-site learning. This will result in the price of robots declining, their proficiency increasing, while human working age population is faded out from the workforce by simple retirement. Perhaps this is the smooth transition into post-scarcity right there. Perhaps the low birth rates will be the key to minimise the suffering during that transition."
1,2024-06-23,Research,u/Legitimate-Scale-710,https://www.reddit.com/r/Futurology/comments/1dmwt3n/research/,Futurology,[removed]
1,2024-06-23,Discover How AI is Changing the World: Beginner-Friendly Videos on Future Innovations!,u/Capable-Help5706,https://www.reddit.com/r/Futurology/comments/1dmx3ui/discover_how_ai_is_changing_the_world/,Futurology,[removed]
11,2024-06-23,KlapAI and allegedly Disney hacked by Anti AI group NULLBULGE,u/Emergency-Lawyer-431,https://www.reddit.com/r/Futurology/comments/1dmzi5l/klapai_and_allegedly_disney_hacked_by_anti_ai/,Futurology,https://web.archive.org/web/20240616013240/https://nullbulge.co/
