score,date,title,author,url,subreddit,text
1,2023-04-30,ŠKODA Auto India (Official Website) - Simply Clever,u/Narrow-Spend-4813,https://www.reddit.com/r/Economics/comments/1348x70/škoda_auto_india_official_website_simply_clever/,Economics,https://www.skoda-auto.co.in/
0,2023-04-30,"Ron Paul says the US declared bankruptcy in 1971, is that true?",u/OnlyUSPolitics,https://www.reddit.com/r/Economics/comments/13493zd/ron_paul_says_the_us_declared_bankruptcy_in_1971/,Economics,https://www.reddit.com/r/ronpaul/comments/132cx8s/ron_paul_on_ukraine_biden_and_rfk_jr/
14,2023-04-30,Decelerating GDP Growth Adds to Signals of Growing Recession Risks,u/[deleted],https://www.reddit.com/r/Economics/comments/134amrn/decelerating_gdp_growth_adds_to_signals_of/,Economics,
150,2023-04-30,First Republic Talks Extend Into Night After Banks Place Bids,u/mattfromseattle,https://www.reddit.com/r/Economics/comments/134b98k/first_republic_talks_extend_into_night_after/,Economics,https://www.bloomberg.com/news/articles/2023-04-29/fdic-asks-jpmorgan-pnc-for-final-first-republic-bids-due-sunday?srnd=premium
1,2023-04-30,"Me ayudan a hacer conocer mi página web, es muy útil e interesante.",u/JHRFN,https://www.reddit.com/r/Economics/comments/134bp7b/me_ayudan_a_hacer_conocer_mi_página_web_es_muy/,Economics,https://www.youtube.com/@Geniusoftheeconomicsolution
19,2023-05-01,What the latest GDP report says about the strength of the U.S. economy,u/cool_core_down,https://www.reddit.com/r/Economics/comments/134c6qj/what_the_latest_gdp_report_says_about_the/,Economics,https://www.pbs.org/newshour/show/what-the-latest-gdp-report-says-about-the-strength-of-the-u-s-economy
22,2023-05-01,China Locks Information on the Country Inside a Black Box,u/Uncleniles,https://www.reddit.com/r/Economics/comments/134dozg/china_locks_information_on_the_country_inside_a/,Economics,https://www.wsj.com/articles/china-locks-information-on-the-country-inside-a-black-box-9c039928?mod=hp_lead_pos3
1,2023-05-01,"At 73%, Millennials Are the Most Likely Generation to Live Paycheck to Paycheck",u/14159548210,https://www.reddit.com/r/Economics/comments/134du87/at_73_millennials_are_the_most_likely_generation/,Economics,https://seekingalpha.com/pr/19310427-73-percent-millennials-are-likely-generation-to-live-paycheck-to-paycheck?hasComeFromMpArticle=false
1,2023-05-01,Larry Summers and the Economy,u/stocks223344,https://www.reddit.com/r/Economics/comments/134duaw/larry_summers_and_the_economy/,Economics,http://dlvr.it/Smrbw6
97,2023-05-01,"Big banks including JPMorgan Chase, Bank of America asked for final bids on First Republic.",u/Ben_aid,https://www.reddit.com/r/Economics/comments/134dufw/big_banks_including_jpmorgan_chase_bank_of/,Economics,https://www.cnbc.com/2023/04/29/first-republic-frc-jpmorgan-chase-bank-of-america-asked-for-bids.html
1,2023-05-01,FDIC Criticizes Signature Bank’s Poor Management,u/MelancholyCo,https://www.reddit.com/r/Economics/comments/134eyqk/fdic_criticizes_signature_banks_poor_management/,Economics,https://news.coincu.com/?p=184646
1,2023-05-01,HKMA First Targets In 2023: Stablecoins Linked To Value Of Legal Currencies,u/MelancholyCo,https://www.reddit.com/r/Economics/comments/134f3h9/hkma_first_targets_in_2023_stablecoins_linked_to/,Economics,https://news.coincu.com/?p=184686
1,2023-05-01,DCG’s $630 Million Debt Under Scrutiny In Genesis Bankruptcy Mediation,u/MelancholyCo,https://www.reddit.com/r/Economics/comments/134fhzn/dcgs_630_million_debt_under_scrutiny_in_genesis/,Economics,https://news.coincu.com/?p=184839
185,2023-05-01,"First Republic seized by California regulator, JPMorgan to assume all deposits",u/DictatorDoge,https://www.reddit.com/r/Economics/comments/134g2sh/first_republic_seized_by_california_regulator/,Economics,https://www.cnbc.com/2023/05/01/first-republic-bank-failure.html
22,2023-05-01,"Munger Warns Banks Stuck with Commercial Property Debt, FT Says",u/cool_core_down,https://www.reddit.com/r/Economics/comments/134h4m6/munger_warns_banks_stuck_with_commercial_property/,Economics,https://finance.yahoo.com/news/munger-warns-banks-stuck-commercial-121413394.html
358,2023-05-01,Has the housing market bottomed? Economist: ‘Our short answer is Yes. But…’,u/Vivid_Impression2508,https://www.reddit.com/r/Economics/comments/134jqu3/has_the_housing_market_bottomed_economist_our/,Economics,https://www.aol.com/housing-market-bottomed-yes-economist-164859163.html
5433,2023-05-01,First Republic Becomes Second-Largest Ever US Bank Failure,u/TinyTornado7,https://www.reddit.com/r/Economics/comments/134l2q5/first_republic_becomes_secondlargest_ever_us_bank/,Economics,https://www.bloomberg.com/news/articles/2023-05-01/first-republic-ranks-as-second-largest-ever-us-bank-failure
145,2023-05-01,Office Politics Are Just as Toxic in the Work-From-Home Era,u/TinyTornado7,https://www.reddit.com/r/Economics/comments/134l45z/office_politics_are_just_as_toxic_in_the/,Economics,https://www.bloomberg.com/news/articles/2023-04-26/sucking-up-spreading-rumors-are-most-hated-in-office-politics-survey?srnd=premium
17,2023-05-01,Women CEOs (Finally) Outnumber Those Named John,u/TinyTornado7,https://www.reddit.com/r/Economics/comments/134l4jy/women_ceos_finally_outnumber_those_named_john/,Economics,https://www.bloomberg.com/news/newsletters/2023-04-25/women-ceos-at-big-companies-finally-outnumber-those-named-john?srnd=premium
112,2023-05-01,‘Beggars belief’: Reserve Bank apologises for underpaying staff,u/marketrent,https://www.reddit.com/r/Economics/comments/134lapi/beggars_belief_reserve_bank_apologises_for/,Economics,https://www.afr.com/policy/economy/beggars-belief-reserve-bank-apologises-for-underpaying-staff-20230417-p5d125
1,2023-05-01,JPMorgan to acquire troubled First Republic Bank,u/[deleted],https://www.reddit.com/r/Economics/comments/134m6zo/jpmorgan_to_acquire_troubled_first_republic_bank/,Economics,
28,2023-05-01,The Remote Work Revolution: Impact on Real Estate Values and the Urban Environment,u/marketrent,https://www.reddit.com/r/Economics/comments/134mh27/the_remote_work_revolution_impact_on_real_estate/,Economics,https://www.nber.org/system/files/working_papers/w30662/w30662.pdf
6,2023-05-01,Next Financial Turbelence,u/stocks223344,https://www.reddit.com/r/Economics/comments/134mr5d/next_financial_turbelence/,Economics,http://reut.rs/3oXmgQk
0,2023-05-01,How Unions Can Create Jobs,u/[deleted],https://www.reddit.com/r/Economics/comments/134ofbp/how_unions_can_create_jobs/,Economics,
3,2023-05-01,What is the global impact of Chile nationalizing its lithium reserves?,u/burgerpattym,https://www.reddit.com/r/Economics/comments/134ofq6/what_is_the_global_impact_of_chile_nationalizing/,Economics,https://youtu.be/mpaTpsVoI7c
1,2023-05-01,FDIC Seizes First Republic Bank then sells it to JPMorgan Chase,u/Fresh_Low_6979,https://www.reddit.com/r/Economics/comments/134pc0a/fdic_seizes_first_republic_bank_then_sells_it_to/,Economics,https://www.blackswanstreet.com/p/first-republic-bank-failure-jpmorgan-chase
101,2023-05-01,Charlie Munger: US banks are ‘full of’ bad commercial property loans,u/EbolaaPancakes,https://www.reddit.com/r/Economics/comments/134qrak/charlie_munger_us_banks_are_full_of_bad/,Economics,https://www.ft.com/content/da9f8230-2eb1-49c5-b63a-f1507936d01b
89,2023-05-01,The Kingdom Of Bhutan Has Been Quietly Mining Bitcoin For Years,u/Spare-Dingo-531,https://www.reddit.com/r/Economics/comments/134qs5d/the_kingdom_of_bhutan_has_been_quietly_mining/,Economics,https://www.forbes.com/sites/iainmartin/2023/04/30/bhutan-bitcoin-mining-crypto/?sh=32b40b481f1b
1,2023-05-01,"PNC, JPM Putting in Final Bids for First Republic in FDIC Auction",u/GETTR-wenwu,https://www.reddit.com/r/Economics/comments/134qxn9/pnc_jpm_putting_in_final_bids_for_first_republic/,Economics,https://www.newsmax.com/finance/streettalk/pnc-banks-auctiion/2023/04/30/id/1118038/
498,2023-05-01,Kroger-Albertsons merger will harm grocery store worker wages: Workers stand to lose over $300 million annually,u/sillychillly,https://www.reddit.com/r/Economics/comments/134rzy0/krogeralbertsons_merger_will_harm_grocery_store/,Economics,https://www.epi.org/publication/kroger-albertsons-merger/?utm_source=sillychillly
1,2023-05-01,Your Chance to get $750 to your Cash Account!,u/Anass-casper1920,https://www.reddit.com/r/Economics/comments/134tl3x/your_chance_to_get_750_to_your_cash_account/,Economics,https://www.mixo.io/site/cash-boost-j3299/index.html
4,2023-05-01,Why Is the IMF Pushing Putin's Economic Propaganda?,u/mhornberger,https://www.reddit.com/r/Economics/comments/134u4kk/why_is_the_imf_pushing_putins_economic_propaganda/,Economics,https://time.com/6270540/imf-pushing-putins-economic-propaganda/
1,2023-05-01,What “The People’s Republic of Walmart” Got Wrong about the Nature of Economic Planning,u/[deleted],https://www.reddit.com/r/Economics/comments/134xa06/what_the_peoples_republic_of_walmart_got_wrong/,Economics,
1,2023-05-01,First Republic Bank Has Completed $25 Billion Acquisition By JPMorgan Chase,u/MelancholyCo,https://www.reddit.com/r/Economics/comments/134xx3d/first_republic_bank_has_completed_25_billion/,Economics,https://news.coincu.com/?p=184895
1,2023-05-01,What can a million dollar you earn from Crypto Trading 📊 do for you? Do you have the strategies to earn at least $500 a day? Send a message now to learn my technics for free times an condition apply.,u/Smilekid_Franklin,https://www.reddit.com/r/Economics/comments/134ywzk/what_can_a_million_dollar_you_earn_from_crypto/,Economics,https://wa.me/qr/J2ZFIWOPAM36D1
1,2023-05-01,I don't understand how sometimes when calculating the change in Money Supply we would subtract what is the Required Reserves and sometimes we don't?,u/AdMaleficent2789,https://www.reddit.com/r/Economics/comments/1350t9l/i_dont_understand_how_sometimes_when_calculating/,Economics,https://www.reddit.com
1277,2023-05-01,"Treasury says U.S. will hit the debt limit 'as early as June 1,' sooner than expected",u/Lionel54321,https://www.reddit.com/r/Economics/comments/135107a/treasury_says_us_will_hit_the_debt_limit_as_early/,Economics,https://www.nbcnews.com/politics/white-house/treasury-says-us-will-hit-debt-limit-early-june-1-sooner-expected-rcna82323
11,2023-05-01,The Unexpected Compression: Competition at Work in the Low Wage Labor Market,u/jeffwulf,https://www.reddit.com/r/Economics/comments/13514yh/the_unexpected_compression_competition_at_work_in/,Economics,https://www.nber.org/papers/w31010
17,2023-05-01,FDIC recommends raising insured deposit limit for businesses,u/wrldruler21,https://www.reddit.com/r/Economics/comments/1351umm/fdic_recommends_raising_insured_deposit_limit_for/,Economics,https://apnews.com/article/fdic-banks-insurance-first-republic-0a8bc823eec4e3bef0825206c610de15
1,2023-05-01,Interview with Former Fed Chair Paul Volcker on banking and finance,u/[deleted],https://www.reddit.com/r/Economics/comments/1352pl3/interview_with_former_fed_chair_paul_volcker_on/,Economics,
70,2023-05-01,"LVMH Billionaire Bernard Arnault Says He’s Confident About US Economy, At Star-Studded Tiffany Event",u/cool_core_down,https://www.reddit.com/r/Economics/comments/1355ejy/lvmh_billionaire_bernard_arnault_says_hes/,Economics,https://www.businessoffashion.com/news/luxury/lvmh-billionaire-bernard-arnault-says-hes-confident-about-us-economy-at-star-studded-tiffany-event/
1,2023-05-01,"""Thank you sir! May I have another?""",u/gam1776,https://www.reddit.com/r/Economics/comments/1357eg2/thank_you_sir_may_i_have_another/,Economics,https://johnsmustache.com/thank-you-sir-may-i-have-another/
114,2023-05-01,"US manufacturing contracts six straight months, but pace slows",u/Peugeot905,https://www.reddit.com/r/Economics/comments/13589ik/us_manufacturing_contracts_six_straight_months/,Economics,https://www.reuters.com/markets/us/us-manufacturing-sector-contracts-sixth-straight-month-april-ism-2023-05-01/
5,2023-05-02,The First Republic deal has come at a crucial point for the markets and economy,u/ProcedureFun410,https://www.reddit.com/r/Economics/comments/135boj5/the_first_republic_deal_has_come_at_a_crucial/,Economics,https://www.cnbc.com/2023/05/01/the-first-republic-deal-has-come-at-a-crucial-point-for-the-markets-and-economy.html
1,2023-05-02,Buy Sony Bravia TV Online at Best Prices in India | ShopatSC,u/Narrow-Spend-4813,https://www.reddit.com/r/Economics/comments/135cfoo/buy_sony_bravia_tv_online_at_best_prices_in_india/,Economics,https://shopatsc.com/collections/television?utm_medium=Paid%20Search&utm_source=PMax&utm_campaign=Sony_SSC-TV_HO_SUS_PMax_IN_Keyword_TXT_CPC_Apr_22&gclid=CjwKCAjwxr2iBhBJEiwAdXECw0L5RE9jfI8g1oob2sZ9G_5GR6ooa3iLYCGTgtE4c4pn4NJsmj8nJhoCnjcQAvD_BwE
1,2023-05-02,https://youtube.com/shorts/PTUlUcjackI?feature=share,u/Minimum-Marzipan-534,https://www.reddit.com/r/Economics/comments/135d2pa/httpsyoutubecomshortsptulucjackifeatureshare/,Economics,https://youtube.com/shorts/PTUlUcjackI?feature=share
8,2023-05-02,Oil major BP reports drop in first-quarter profit on weaker commodity prices,u/Oli_01,https://www.reddit.com/r/Economics/comments/135e8vh/oil_major_bp_reports_drop_in_firstquarter_profit/,Economics,https://www.cnbc.com/2023/05/02/bp-earnings-q1-2023.html
33,2023-05-02,"Flush with cash, states face an uneasy economy.",u/Otherwise_Plum9333,https://www.reddit.com/r/Economics/comments/135ebzl/flush_with_cash_states_face_an_uneasy_economy/,Economics,https://www.usnews.com/news/best-states/articles/2023-05-02/flush-with-cash-states-face-an-uneasy-economy-in-2023
1,2023-05-02,First casualty of economic warfare: The free market,u/enkrstic,https://www.reddit.com/r/Economics/comments/135ewvx/first_casualty_of_economic_warfare_the_free_market/,Economics,https://www.politico.eu/article/the-first-casualty-of-economic-warfare-is-the-free-market/
0,2023-05-02,Change My Mind: Density Increases Local But Decreases Global Prices,u/AncientRate,https://www.reddit.com/r/Economics/comments/135ftea/change_my_mind_density_increases_local_but/,Economics,https://astralcodexten.substack.com/p/change-my-mind-density-increases
4,2023-05-02,"Singapore’s largest lender expects net interest margins will decline, but sees other growth drivers",u/xavier_mamba,https://www.reddit.com/r/Economics/comments/135gih7/singapores_largest_lender_expects_net_interest/,Economics,https://www.cnbc.com/2023/05/02/dbs-expects-net-interest-margins-will-decline-sees-other-growth-drivers.html
49,2023-05-02,"Euro-Zone Core Inflation Slows, Supporting Smaller ECB Rate Hike",u/rudy_batts,https://www.reddit.com/r/Economics/comments/135gur4/eurozone_core_inflation_slows_supporting_smaller/,Economics,https://www.bloomberg.com/news/articles/2023-05-02/euro-zone-core-inflation-slows-supporting-smaller-ecb-rate-hike?srnd=premium-europe
1,2023-05-02,Unniyarcha - Buy Stunning Silver Jewlery Online,u/Narrow-Spend-4813,https://www.reddit.com/r/Economics/comments/135h4oi/unniyarcha_buy_stunning_silver_jewlery_online/,Economics,https://unniyarcha.com/
118,2023-05-02,Explainer: Why First Republic Bank failed and what JPMorgan's deal means,u/reggie_morris,https://www.reddit.com/r/Economics/comments/135hlwd/explainer_why_first_republic_bank_failed_and_what/,Economics,https://www.reuters.com/business/finance/why-first-republic-bank-failed-what-jpmorgans-deal-means-2023-05-01/
349,2023-05-02,Hollywood writers strike over pay in streaming TV 'gig economy',u/dreaded_python,https://www.reddit.com/r/Economics/comments/135jk30/hollywood_writers_strike_over_pay_in_streaming_tv/,Economics,https://www.reuters.com/lifestyle/hollywood-writers-studios-stage-last-minute-talks-strike-deadline-looms-2023-05-01/
7,2023-05-02,Kicking the gas can down the road: why a gas price cap is the worst way to protect energy consumers.,u/Helicase21,https://www.reddit.com/r/Economics/comments/135kga4/kicking_the_gas_can_down_the_road_why_a_gas_price/,Economics,https://theconversation.com/kicking-the-gas-can-down-the-road-why-a-gas-price-cap-is-the-worst-way-to-protect-energy-consumers-204752
888,2023-05-02,Citigroup’s Fraser Says Return-to-Office Trends Drive Property Fears,u/TinyTornado7,https://www.reddit.com/r/Economics/comments/135kql4/citigroups_fraser_says_returntooffice_trends/,Economics,https://www.bloomberg.com/news/articles/2023-05-01/citi-s-fraser-says-return-to-office-trends-drive-property-fears?srnd=premium
1,2023-05-02,The Man in the Arena,u/MasterpieceSudden169,https://www.reddit.com/r/Economics/comments/135krqf/the_man_in_the_arena/,Economics,https://open.substack.com/pub/giovannigicci/p/the-man-in-the-arena?utm_source=direct&r=2bgu12&utm_campaign=post&utm_medium=web
0,2023-05-02,One Up On Wall Street: How To Use What You Already Know To Make Money In The Market (a book suggestion),u/davinci-code,https://www.reddit.com/r/Economics/comments/135kvd3/one_up_on_wall_street_how_to_use_what_you_already/,Economics,https://bostonlibrary.org/b/one-up-on-wall-street-how-to-use-what-you-already-know-to-make-money-in-the-market
1,2023-05-02,Samsung employees banned from using ChatGPT-like AI tools. What do you think?,u/[deleted],https://www.reddit.com/r/Economics/comments/135lg4y/samsung_employees_banned_from_using_chatgptlike/,Economics,
1,2023-05-02,IBM to Replace 7.8K Jobs with AI: A Threat or Opportunity?,u/MelancholyCo,https://www.reddit.com/r/Economics/comments/135lpng/ibm_to_replace_78k_jobs_with_ai_a_threat_or/,Economics,https://news.coincu.com/?p=184953
1,2023-05-02,May 31st national prank the banks!,u/Copperscrapper42069,https://www.reddit.com/r/Economics/comments/135m1h3/may_31st_national_prank_the_banks/,Economics,https://home.treasury.gov/news/press-releases/jy1454
1,2023-05-02,True Money Supply Contraction Signals Economic Concerns. Money Supply part of article pasted below.,u/Dull_Biscotti7205,https://www.reddit.com/r/Economics/comments/135m8u3/true_money_supply_contraction_signals_economic/,Economics,https://www.americaneconomydaily.com/p/red-flag-negative-true-money-supply
1,2023-05-02,IAR 18 Response to Mr. Beat and Johnny Harris Inflation,u/steph-anglican,https://www.reddit.com/r/Economics/comments/135mn9o/iar_18_response_to_mr_beat_and_johnny_harris/,Economics,https://youtube.com/watch?v=13FAeuHUojE&feature=share
7177,2023-05-02,Half of America's banks are already insolvent,u/lughnasadh,https://www.reddit.com/r/Economics/comments/135na94/half_of_americas_banks_are_already_insolvent/,Economics,https://www.telegraph.co.uk/business/2023/05/02/half-of-americas-banks-are-already-insolvent-credit-crunch/
1,2023-05-02,BITCOIN PRICE PREDICTION,u/Kind_Concern_713,https://www.reddit.com/r/Economics/comments/135nra1/bitcoin_price_prediction/,Economics,https://www.youtube.com/shorts/w4hJvHNjYtY
89,2023-05-02,Job openings fell more than expected in March to lowest in nearly two years,u/joe4942,https://www.reddit.com/r/Economics/comments/135oxwa/job_openings_fell_more_than_expected_in_march_to/,Economics,https://www.cnbc.com/2023/05/02/jolts-march-2023-.html
3,2023-05-02,"PacWest, Western Alliance Stocks Plunge More Than 25%, Regional Bank Fears Return",u/[deleted],https://www.reddit.com/r/Economics/comments/135qne5/pacwest_western_alliance_stocks_plunge_more_than/,Economics,
174,2023-05-02,"PacWest, Western Alliance Crash as Regional Bank Fears Continue to Shake Markets",u/BabyLlama-Drama,https://www.reddit.com/r/Economics/comments/135rd46/pacwest_western_alliance_crash_as_regional_bank/,Economics,https://finance.yahoo.com/news/pacwest-western-alliance-crash-as-regional-bank-fears-continue-to-shake-markets-151815103.html
13,2023-05-02,S&P Upgrades Rating Outlook on Greece to Positive,u/L0o0o0o0o0o0L,https://www.reddit.com/r/Economics/comments/135rzbv/sp_upgrades_rating_outlook_on_greece_to_positive/,Economics,https://greekreporter.com/2023/04/22/sp-upgrades-rating-outlook-greece/
1,2023-05-02,Dividend Investing Portfolio Update: Dividend Growth Increases April: Gr...,u/Investor1914,https://www.reddit.com/r/Economics/comments/135sfy5/dividend_investing_portfolio_update_dividend/,Economics,https://youtube.com/watch?v=gMctC4DIH70&feature=share
1,2023-05-02,Comet EV KMI | MG Motor India,u/Narrow-Spend-4813,https://www.reddit.com/r/Economics/comments/135sga9/comet_ev_kmi_mg_motor_india/,Economics,https://www.mgmotor.co.in/vehicles/comet-ev-electric-car-in-india/digital-kmi?gclid=Cj0KCQjw6cKiBhD5ARIsAKXUdybvgRwNVjkJxwj3lP73TjSZc4R1hlcWWJF9PebmGyduCQkBovOpe50aAoBuEALw_wcB&ecid=Display:IA:MG:Comet:YTDiscovery-Banner:KMI:Launch:Apr-23&ef_id=Cj0KCQjw6cKiBhD5ARIsAKXUdybvgRwNVjkJxwj3lP73TjSZc4R1hlcWWJF9PebmGyduCQkBovOpe50aAoBuEALw_wcB:G:s&s_kwcid=AL!8805!3!656337402903!!!!!
46,2023-05-02,"U.S. Could Run Out of Cash by June 1, Yellen Warns",u/BabyLlama-Drama,https://www.reddit.com/r/Economics/comments/135snb7/us_could_run_out_of_cash_by_june_1_yellen_warns/,Economics,https://archive.is/lsdJS
1,2023-05-02,Free money trick just daily login and claim money,u/12ka4_42kaone,https://www.reddit.com/r/Economics/comments/135so2x/free_money_trick_just_daily_login_and_claim_money/,Economics,https://www.riv-ian.com/#/pages/register/register?id=1045196
105,2023-05-02,Economic trouble signs emerge for NYC as office vacancy rate keeps rising,u/marketrent,https://www.reddit.com/r/Economics/comments/135t7sr/economic_trouble_signs_emerge_for_nyc_as_office/,Economics,https://www.thecity.nyc/2023/4/20/23691821/office-vacancy-rate-rising
0,2023-05-02,Doge Blue's Decentralized Community invites artists to Help Propose the new Logo for its social media project,u/RukkiRuudi,https://www.reddit.com/r/Economics/comments/135tftq/doge_blues_decentralized_community_invites/,Economics,https://www.marketwatch.com/press-release/doge-blues-decentralized-community-invites-artists-to-help-propose-the-new-logo-for-its-social-media-project-2023-04-30?mod=search_headline
1,2023-05-02,404,u/Narrow-Spend-4813,https://www.reddit.com/r/Economics/comments/135u5se/404/,Economics,https://www.rolls-roycemotorcars.com/en_GB/information/fb-dat-wltp.html
12,2023-05-02,U.S. Monetary Deflation Intensifies,u/BabyLlama-Drama,https://www.reddit.com/r/Economics/comments/135uk3q/us_monetary_deflation_intensifies/,Economics,https://archive.is/13Fn1#selection-1213.0-1213.110
127,2023-05-02,The current economic cycle is following the same pattern as every economic cycle over the last 50 years.,u/teehugss,https://www.reddit.com/r/Economics/comments/135v19y/the_current_economic_cycle_is_following_the_same/,Economics,https://epbresearch.com/historical-leads-lags/
1,2023-05-02,Mom love her baby😘,u/strait333,https://www.reddit.com/r/Economics/comments/135v547/mom_love_her_baby/,Economics,https://v.redd.it/xqp3z11dzhxa1
1,2023-05-02,"The ability to spot opportunities is key to succeeding in the world of crypto. Many people have profited from previous drops, and this upcoming one could be the next big opportunity.",u/Used_Cantaloupe2698,https://www.reddit.com/r/Economics/comments/135x3bp/the_ability_to_spot_opportunities_is_key_to/,Economics,https://twitter.com/pepememetoken/status/1651521587068424192?s=20
1,2023-05-02,"The ability to spot opportunities is key to succeeding in the world of crypto. Many people have profited from previous drops, and this upcoming one could be the next big opportunity.",u/Mths-nsfw,https://www.reddit.com/r/Economics/comments/135xlw2/the_ability_to_spot_opportunities_is_key_to/,Economics,https://twitter.com/ThePepeToken/status/1651356667655733250?s=20
299,2023-05-02,"U.S. could default on its debt by June 1, Janet Yellen warns : NPR",u/redithotx3,https://www.reddit.com/r/Economics/comments/135xtm9/us_could_default_on_its_debt_by_june_1_janet/,Economics,https://www.npr.org/2023/05/01/1173148677/debt-ceiling-limit-default-standoff
0,2023-05-02,Economy,u/[deleted],https://www.reddit.com/r/Economics/comments/135zi69/economy/,Economics,
37,2023-05-02,The 2023 crony-capitalism index,u/uhhhwhatok,https://www.reddit.com/r/Economics/comments/13611gf/the_2023_cronycapitalism_index/,Economics,https://www.economist.com/international/2023/05/02/the-2023-crony-capitalism-index
4,2023-05-02,"WSJ News Exclusive | China Locks Information on the Country Inside a Black Box | China’s party-state, long steeped in secrecy, is creating a black box around information on the world’s second-largest economy, alarming global businesses and investors.",u/koukouvagia777,https://www.reddit.com/r/Economics/comments/136158q/wsj_news_exclusive_china_locks_information_on_the/,Economics,https://www.wsj.com/articles/china-locks-information-on-the-country-inside-a-black-box-9c039928?mod=world_major_1_pos1
40,2023-05-02,Why hadn’t Federal Reserve rescued Lehman Brothers in 2008?,u/ThinkOutCloud,https://www.reddit.com/r/Economics/comments/13621py/why_hadnt_federal_reserve_rescued_lehman_brothers/,Economics,https://en.econreporter.com/2018/09/why-hadnt-the-federal-reserve-rescued-lehman-brothers-ten-years-ago/
1,2023-05-02,Bloomberg: Druckenmiller Warns US Debt Crisis Worse Than Imagined,u/[deleted],https://www.reddit.com/r/Economics/comments/1362ko8/bloomberg_druckenmiller_warns_us_debt_crisis/,Economics,
36,2023-05-02,"After Pandemic Rebound, U.S. Manufacturing Droops",u/uhhhwhatok,https://www.reddit.com/r/Economics/comments/13637gi/after_pandemic_rebound_us_manufacturing_droops/,Economics,https://www.nytimes.com/2023/05/02/business/economy/manufacturing-recession-economy.html
6,2023-05-02,Penn State/ACY Alternative Inflation Index – Negative Reading,u/NominalNews,https://www.reddit.com/r/Economics/comments/136587e/penn_stateacy_alternative_inflation_index/,Economics,http://sites.psu.edu/inflation/
188,2023-05-02,"IBM Will Stop Hiring Humans For Jobs AI Can Do, Report Says.",u/BeautifulLife1,https://www.reddit.com/r/Economics/comments/1366whi/ibm_will_stop_hiring_humans_for_jobs_ai_can_do/,Economics,https://www.google.com/amp/s/www.forbes.com/sites/nicholasreimann/2023/05/01/ibm-will-stop-hiring-humans-for-jobs-ai-can-do-report-says/amp/
