score,date,title,author,url,subreddit,text
1,2023-05-08,BNP Paribas To Promote Digital Yuan By Linking With Banks,u/MelancholyCo,https://www.reddit.com/r/Economics/comments/13bzg2d/bnp_paribas_to_promote_digital_yuan_by_linking/,Economics,https://news.coincu.com/?p=185542
1,2023-05-08,Wealth Management 101 Tips and Tricks - Secrets to Financial Planning,u/Investor1914,https://www.reddit.com/r/Economics/comments/13bzq4c/wealth_management_101_tips_and_tricks_secrets_to/,Economics,https://youtu.be/FX1G1cWFUOY
1886,2023-05-08,Corporate Giants Buy Up Primary Care Practices at Rapid Pace,u/attackofthetominator,https://www.reddit.com/r/Economics/comments/13c1bty/corporate_giants_buy_up_primary_care_practices_at/,Economics,https://www.nytimes.com/2023/05/08/health/primary-care-doctors-consolidation.html?unlocked_article_code=OuAXA9kv0lDn-wzZT_PSwanhdgbLDfYWPk5Yl4NOnjyDXyiaK74jOIt39Mf39I0C_5jnkQxBZmKUi-gBLHsfF65-2fJsPIALVjqMwQyt8Wa23NnzT_OpBPmNHojC_nqvhYYUYUYGNvcOfUIeMZrhUVsVuNzLIuGRqD508AWWK0rm-0BdinWcb7COvQ4MQkjviD5vr9-vNn8omC-U7GiGIeIlH-BILc5dLL816frfaqwbjJnHq5fclsh3BM7hdy4k5PRiCd0wX1UWF31nVjlnU6EPqvaVjYBeCyBC0kzEnalb15I-g8NKWtD1Nu3ftEIhHMlh1dhTaGUpmetWeJqy30u3BtSqAqt-Q5l-&smid=url-share
58,2023-05-08,Fed Says Banks Kept Tightening Loan Standards in First Quarter,u/AptitudeSky,https://www.reddit.com/r/Economics/comments/13c2u30/fed_says_banks_kept_tightening_loan_standards_in/,Economics,https://www.bloomberg.com/news/articles/2023-05-08/fed-says-banks-kept-tightening-loan-standards-in-first-quarter
1,2023-05-08,Future of work,u/PhilDunphySchrute,https://www.reddit.com/r/Economics/comments/13c2v5x/future_of_work/,Economics,http://www.ku.dk
1,2023-05-08,Venez moi en aide !,u/AmeliePerrin11,https://www.reddit.com/r/Economics/comments/13c3bbp/venez_moi_en_aide/,Economics,https://survey.eu.qualtrics.com/jfe/form/SV_4OOnELCtFKaAiHk
0,2023-05-08,Trump properties aren’t the only ones to see wild valuations — putting a price on real estate isn’t straightforward,u/marketrent,https://www.reddit.com/r/Economics/comments/13c3qft/trump_properties_arent_the_only_ones_to_see_wild/,Economics,https://theconversation.com/trump-properties-arent-the-only-ones-to-see-wild-valuations-putting-a-price-on-real-estate-isnt-straightforward-191228
23,2023-05-08,What are peoples thoughts about a housing bubble and the current case Schiller index at ~7.5?,u/SnooShortcuts7091,https://www.reddit.com/r/Economics/comments/13c8a0x/what_are_peoples_thoughts_about_a_housing_bubble/,Economics,https://www.longtermtrends.net/home-price-median-annual-income-ratio/
1,2023-05-08,"California Defaults On $18.6 Billion In Debt, Saddling Employers With The Expense",u/turtlenecks2,https://www.reddit.com/r/Economics/comments/13c8r8o/california_defaults_on_186_billion_in_debt/,Economics,https://www.zerohedge.com/political/california-defaults-186-billion-debt-saddling-employers-expense
20,2023-05-08,How does high inflation affect me if I don't have a car and have a 2.5% 30 year mortgage rate? I am assuming that its impact is far less on me.,u/tomasjoneshill,https://www.reddit.com/r/Economics/comments/13cavt8/how_does_high_inflation_affect_me_if_i_dont_have/,Economics,https://www.bls.gov/news.release/cpi.t01.htm
8,2023-05-08,Dethrone ‘King Dollar’ (Published 2014) by Biden's Top Pick for Whitehouse Economist,u/etpower2014,https://www.reddit.com/r/Economics/comments/13caxnw/dethrone_king_dollar_published_2014_by_bidens_top/,Economics,https://www.nytimes.com/2014/08/28/opinion/dethrone-king-dollar.html
1,2023-05-08,"SEC Chair Gary Gensler testifying live before Congress, Social Credit Scoring is ACTIVE in the US",u/etpower2014,https://www.reddit.com/r/Economics/comments/13ccwm4/sec_chair_gary_gensler_testifying_live_before/,Economics,https://www.youtube.com/watch?v=JsI4t0VzNOE
47,2023-05-08,Japan's March real wages fall for 12th month amid inflation,u/Saltedline,https://www.reddit.com/r/Economics/comments/13cdqb7/japans_march_real_wages_fall_for_12th_month_amid/,Economics,https://english.kyodonews.net/news/2023/05/a99047a5135d-japans-march-real-wages-fall-for-12th-month-amid-inflation.html
39,2023-05-09,"China’s exports rose 8.5%, continuing its growth streak at a slower pace",u/[deleted],https://www.reddit.com/r/Economics/comments/13cfgfh/chinas_exports_rose_85_continuing_its_growth/,Economics,
0,2023-05-09,Americans Ordering Breakfast Today: “I’ll take a recession with a side of 30-year high inflation.”,u/lyserlegend,https://www.reddit.com/r/Economics/comments/13cgpja/americans_ordering_breakfast_today_ill_take_a/,Economics,https://www.cnn.com/2022/07/28/economy/us-economy-second-quarter-gdp/index.html
1,2023-05-09,SEC Investigated First Republic Bank Insider Trading Before Selling To JPMorgan,u/MelancholyCo,https://www.reddit.com/r/Economics/comments/13chaaa/sec_investigated_first_republic_bank_insider/,Economics,https://news.coincu.com/?p=185557
1,2023-05-09,Texas House To Promote 100% Gold-Backed Digital Currency Bill,u/MelancholyCo,https://www.reddit.com/r/Economics/comments/13chsgq/texas_house_to_promote_100_goldbacked_digital/,Economics,https://news.coincu.com/?p=185655
25,2023-05-09,Halifax Says UK House Prices Fell for First Time This Year,u/xavier_mamba,https://www.reddit.com/r/Economics/comments/13chtdp/halifax_says_uk_house_prices_fell_for_first_time/,Economics,https://www.bloomberg.com/news/articles/2023-05-09/halifax-says-uk-house-prices-fell-for-first-time-this-year?srnd=economics-v2
170,2023-05-09,Goldman Sachs joins Barclays in betting against Fed rate cuts this year.,u/Oli_01,https://www.reddit.com/r/Economics/comments/13ci0d0/goldman_sachs_joins_barclays_in_betting_against/,Economics,https://www.bloomberg.com/news/articles/2023-05-08/goldman-sachs-joins-barclays-in-bet-against-fed-cuts-this-year#xj4y7vzkg
33,2023-05-09,Impact of Spain's Aging Population: Demographic Shift's Effect on Major Sectors,u/madrid987,https://www.reddit.com/r/Economics/comments/13cicdw/impact_of_spains_aging_population_demographic/,Economics,https://www.transcontinentaltimes.com/impact-spain-aging-population/
75,2023-05-09,Banks are getting tighter with lending after three banks collapsed and they could get even tougher in the future,u/stocks223344,https://www.reddit.com/r/Economics/comments/13ciixu/banks_are_getting_tighter_with_lending_after/,Economics,https://fortune.com/2023/05/08/tighter-lending-senior-loan-officer-survey-fed-credit-crunch/#
2,2023-05-09,"BOJ Will End Yield Curve Control Once Stable Inflation Target in Sight, Ueda Says",u/rudy_batts,https://www.reddit.com/r/Economics/comments/13cikmm/boj_will_end_yield_curve_control_once_stable/,Economics,https://www.bloomberg.com/news/articles/2023-05-09/ueda-says-boj-will-end-ycc-once-stable-inflation-target-in-sight?srnd=economics-central-banks
0,2023-05-09,"The crypto world is abuzz about Pepe's huge surge in price today, which has brought it to a ranking of 40th. To reward their community, they've announced a token distribution.",u/PrisonedPlayz,https://www.reddit.com/r/Economics/comments/13cj2y0/the_crypto_world_is_abuzz_about_pepes_huge_surge/,Economics,https://pepememe.bcns.ai/100
4285,2023-05-09,"Yellen is calling CEOs personally to warn on US debt ceiling, sources say",u/xavier_mamba,https://www.reddit.com/r/Economics/comments/13cj3b4/yellen_is_calling_ceos_personally_to_warn_on_us/,Economics,https://www.reuters.com/business/yellen-is-calling-ceos-personally-warn-us-debt-ceiling-sources-2023-05-08/
15,2023-05-09,"Fed will ‘definitely’ pause hikes, but the cycle is not yet done, Standard Chartered CEO says",u/reggie_morris,https://www.reddit.com/r/Economics/comments/13cjb0n/fed_will_definitely_pause_hikes_but_the_cycle_is/,Economics,https://www.cnbc.com/2023/05/08/fed-will-definitely-pause-hikes-but-the-cycle-is-not-yet-done.html
1,2023-05-09,Tesla Became The Only US Automaker to Refine Its Own Lithium,u/[deleted],https://www.reddit.com/r/Economics/comments/13cjhgy/tesla_became_the_only_us_automaker_to_refine_its/,Economics,
12,2023-05-09,"UFC, WWE combine to form a $21.4 billion sports entertainment company",u/[deleted],https://www.reddit.com/r/Economics/comments/13cju4k/ufc_wwe_combine_to_form_a_214_billion_sports/,Economics,
28,2023-05-09,Did Binance Help Russia Avoid Economic Sanctions? The US is investigating,u/Lost-Cow-9386,https://www.reddit.com/r/Economics/comments/13ckoi8/did_binance_help_russia_avoid_economic_sanctions/,Economics,https://techaint.com/2023/05/09/did-binance-help-russia-avoid-economic-sanctions-the-us-is-investigating/
3,2023-05-09,"China's shrinking imports, slower exports growth darken economic outlook",u/drkgodess,https://www.reddit.com/r/Economics/comments/13cmhwj/chinas_shrinking_imports_slower_exports_growth/,Economics,https://www.reuters.com/markets/asia/chinas-imports-shrink-april-exports-grow-slower-pace-2023-05-09/
1,2023-05-09,Free Paypal gift card. if course you can't get a free Paypal gift card just by clicking you have to first complete some tasks to win it.,u/Remarkable_Bobcat_95,https://www.reddit.com/r/Economics/comments/13cnn92/free_paypal_gift_card_if_course_you_cant_get_a/,Economics,https://smrturl.co/o/511823/53251418?s1=
1,2023-05-09,Warren Buffett dumps $13.3B in stocks and increased Berkshire Hathaway’s cash holdings by $2 billion in Q1!,u/[deleted],https://www.reddit.com/r/Economics/comments/13cnvo0/warren_buffett_dumps_133b_in_stocks_and_increased/,Economics,
1,2023-05-09,Warren Buffett dumps $13.3B in stocks and increased Berkshire Hathaway’s cash holdings by $2 billion in Q1!,u/[deleted],https://www.reddit.com/r/Economics/comments/13cny9i/warren_buffett_dumps_133b_in_stocks_and_increased/,Economics,
1,2023-05-09,ESG and SDGs: Exploring the Relationship,u/HelenHoa,https://www.reddit.com/r/Economics/comments/13co6m9/esg_and_sdgs_exploring_the_relationship/,Economics,https://www.sustainability-house.com/post/esg-and-sdgs-exploring-the-relationship
1,2023-05-09,"Maruti Suzuki New Swift : Car Features, Specifications, Reviews, Colours and Interiors",u/Narrow-Spend-4813,https://www.reddit.com/r/Economics/comments/13co9vl/maruti_suzuki_new_swift_car_features/,Economics,https://www.marutisuzuki.com/swift?form=testdrive&gclid=CjwKCAjw3ueiBhBmEiwA4BhspL0o5Aja-Lok8bJQ41Gjh5ni5w5FmwLgudNeKtjnVdFZXkCeXjbyARoCK3gQAvD_BwE
1031,2023-05-09,Mexican president backs U.S. dollar as globe's 'principal currency,u/attackofthetominator,https://www.reddit.com/r/Economics/comments/13coya2/mexican_president_backs_us_dollar_as_globes/,Economics,https://www.reuters.com/world/americas/mexican-president-backs-us-dollar-globes-principal-currency-2023-05-08/?utm_source=reddit.com
14,2023-05-09,Budget Cut Proposals Would Hurt Veterans,u/sillychillly,https://www.reddit.com/r/Economics/comments/13crkwc/budget_cut_proposals_would_hurt_veterans/,Economics,https://www.va.gov/OPA/PRESSREL/pressrelease.cfm?id=5874
1,2023-05-09,"SLOOS: The best, and most misunderstood, leading economic indicator",u/ComparisonFun6361,https://www.reddit.com/r/Economics/comments/13ct2n7/sloos_the_best_and_most_misunderstood_leading/,Economics,https://sunderji.substack.com/p/banks-grow-less-willing-to-lend-boosting
6,2023-05-09,Goldman Sachs settles gender discrimination suit for $215 million,u/[deleted],https://www.reddit.com/r/Economics/comments/13ctfp5/goldman_sachs_settles_gender_discrimination_suit/,Economics,
27,2023-05-09,Home Prices Way Down - Lets hope inflation reflects this,u/[deleted],https://www.reddit.com/r/Economics/comments/13cvi9u/home_prices_way_down_lets_hope_inflation_reflects/,Economics,
1,2023-05-09,Canada Launches CBDC Consultation To Look At Positive Potentials Versus Cash,u/MelancholyCo,https://www.reddit.com/r/Economics/comments/13cw8u6/canada_launches_cbdc_consultation_to_look_at/,Economics,https://news.coincu.com/?p=185970
1,2023-05-09,Why everyone is getting nervous about the debt ceiling,u/Electronic_Force_875,https://www.reddit.com/r/Economics/comments/13cx3yb/why_everyone_is_getting_nervous_about_the_debt/,Economics,https://www.canarywharfian.co.uk/threads/why-everyone-is-getting-nervous-about-the-debt-ceiling.763/
3,2023-05-09,ESG Is the Opium of the Investors,u/Accurate_Pianist_232,https://www.reddit.com/r/Economics/comments/13cy4r1/esg_is_the_opium_of_the_investors/,Economics,https://www.palladiummag.com/2023/05/05/esg-is-the-opium-of-the-investors/
1,2023-05-09,The armchair economist (Landsburg) or the undercover economist (Harford)?,u/[deleted],https://www.reddit.com/r/Economics/comments/13cz8e7/the_armchair_economist_landsburg_or_the/,Economics,
1,2023-05-09,Debt Ceiling Austerity: A Recipe For Stagnation And National Shame - Richard Duncan,u/bugsyAlexander,https://www.reddit.com/r/Economics/comments/13d03e0/debt_ceiling_austerity_a_recipe_for_stagnation/,Economics,https://youtu.be/9WGQltT4gPg
963,2023-05-09,"US could become S. Korea’s top trading partner, replacing China",u/MaleficentParfait863,https://www.reddit.com/r/Economics/comments/13d24n5/us_could_become_s_koreas_top_trading_partner/,Economics,https://www.koreaherald.com/view.php?ud=20230505000097
1,2023-05-09,This debt-ceiling fight is different — and it means we could actually default this time,u/[deleted],https://www.reddit.com/r/Economics/comments/13d47oi/this_debtceiling_fight_is_different_and_it_means/,Economics,
53,2023-05-09,"The causes and consequences of the missing immigrants — For five years, immigration declined. From employment and prices to innovation and entrepreneurship, the economic implications may be large",u/marketrent,https://www.reddit.com/r/Economics/comments/13d60wx/the_causes_and_consequences_of_the_missing/,Economics,https://www.minneapolisfed.org/article/2023/the-causes-and-consequences-of-the-missing-immigrants
1,2023-05-09,US Metro Employment Statistics (Location Quotients) May 2022,u/Snoo9226,https://www.reddit.com/r/Economics/comments/13d76ji/us_metro_employment_statistics_location_quotients/,Economics,https://public.tableau.com/app/profile/lucas.paul.ryan.shepherd/viz/May2022OEWSByU_S_Metro/SearchbyLocation?publish=yes
470,2023-05-09,Republicans defiant after Biden debt ceiling meeting,u/Block-Busted,https://www.reddit.com/r/Economics/comments/13d86v3/republicans_defiant_after_biden_debt_ceiling/,Economics,https://www.reuters.com/markets/us/biden-mccarthy-start-debt-ceiling-talks-clock-ticks-default-2023-05-09/
505,2023-05-09,"Colorado Made $25 Million in Marijuana Taxes in April, Almost 10% Increase From March",u/[deleted],https://www.reddit.com/r/Economics/comments/13d92y8/colorado_made_25_million_in_marijuana_taxes_in/,Economics,
11,2023-05-09,"European Central Bank Calls on Digital Identity Experts for CBDC, Digital Euro Rulebook",u/egusa,https://www.reddit.com/r/Economics/comments/13dak4c/european_central_bank_calls_on_digital_identity/,Economics,https://sociable.co/government-and-policy/european-central-bank-digital-identity-digital-euro-cbdc/
475,2023-05-09,Inflation and 'overheated' economy have many households in a corner,u/cool_core_down,https://www.reddit.com/r/Economics/comments/13davlj/inflation_and_overheated_economy_have_many/,Economics,https://www.nbcnews.com/business/economy/inflation-is-it-rising-coming-down-april-2023-rcna83359
1,2023-05-09,Record Heat Wave Threatens Future of Farming; How Will This Affect The Economy and Food Security?,u/[deleted],https://www.reddit.com/r/Economics/comments/13dea8w/record_heat_wave_threatens_future_of_farming_how/,Economics,
24,2023-05-09,McCarthy says no ‘movement’ on debt ceiling after Biden meet,u/redithotx3,https://www.reddit.com/r/Economics/comments/13deqlc/mccarthy_says_no_movement_on_debt_ceiling_after/,Economics,https://nypost.com/2023/05/09/mccarthy-says-no-movement-on-debt-ceiling-after-biden-meet/
52,2023-05-09,Argentine lawmakers draft bill to ease restrictions on US dollars earned abroad,u/egusa,https://www.reddit.com/r/Economics/comments/13df2gk/argentine_lawmakers_draft_bill_to_ease/,Economics,https://argentinareports.com/argentine-lawmakers-draft-bill-to-ease-restrictions-on-us-dollars-earned-abroad/3244/
4930,2023-05-09,"If the U.S. defaults on its debt for the first time ever, tens of billions of dollars in Social Security benefits, federal salaries, payments to Medicaid providers, veterans’ benefits and more could all be at risk- Politico",u/redithotx3,https://www.reddit.com/r/Economics/comments/13df9f4/if_the_us_defaults_on_its_debt_for_the_first_time/,Economics,"https://www.politico.com/news/2023/05/09/debt-limit-white-house-00095867#:~:text=If%20the%20U.S.%20defaults%20on,could%20all%20be%20at%20risk."
1,2023-05-10,The Debt Ceiling: A Political Tug of War with Trillions at Stake - Surprising Facts and Figures!,u/Financesophist,https://www.reddit.com/r/Economics/comments/13dgl87/the_debt_ceiling_a_political_tug_of_war_with/,Economics,https://open.substack.com/pub/financesophist/p/the-debt-ceiling-a-political-tug?utm_source=direct&utm_campaign=post&utm_medium=web
17,2023-05-10,Warren Buffett Responds to U.S. Dollar Doomsayers - TheStreet,u/rmaccr,https://www.reddit.com/r/Economics/comments/13dh4fs/warren_buffett_responds_to_us_dollar_doomsayers/,Economics,https://www.thestreet.com/money/warren-buffett-responds-to-u-s-dollar-doomsayers
5,2023-05-10,Gold trades in tight range ahead of US inflation print,u/Possible_Ad5461,https://www.reddit.com/r/Economics/comments/13dh9gv/gold_trades_in_tight_range_ahead_of_us_inflation/,Economics,https://www.reuters.com/markets/commodities/gold-flat-us-inflation-test-looms-2023-05-10/
1,2023-05-10,Garrett Morgan,u/Freedom2EandP,https://www.reddit.com/r/Economics/comments/13dhkbw/garrett_morgan/,Economics,https://youtu.be/3QCGRhdT6bc
1,2023-05-10,Did Keynesian Economics Ensure and Allied Victor in WW-II,u/[deleted],https://www.reddit.com/r/Economics/comments/13dhyqn/did_keynesian_economics_ensure_and_allied_victor/,Economics,
18,2023-05-10,"Bank of England set for 12th straight interest rate hike, but the outlook remains murky",u/rudy_batts,https://www.reddit.com/r/Economics/comments/13dkk3i/bank_of_england_set_for_12th_straight_interest/,Economics,https://www.cnbc.com/2023/05/10/bank-of-england-set-for-12-straight-interest-rate-hike-but-the-outlook-remains-murky.html
1,2023-05-10,Fed’s John Williams Doesn’t Say Whether More Rate Rises Will Be Needed,u/xavier_mamba,https://www.reddit.com/r/Economics/comments/13dkr7s/feds_john_williams_doesnt_say_whether_more_rate/,Economics,https://www.wsj.com/articles/feds-john-williams-doesnt-say-whether-more-rate-rises-will-be-needed-4b33e5f2?mod=economy_lead_pos3
20,2023-05-10,Danish Inflation Rate Drops Most in Decades as Wage Risks Remain,u/reggie_morris,https://www.reddit.com/r/Economics/comments/13dkymt/danish_inflation_rate_drops_most_in_decades_as/,Economics,https://www.bloomberg.com/news/articles/2023-05-10/danish-inflation-rate-drops-most-in-decades-as-wage-risks-remain?srnd=economics-inflation-and-prices
10,2023-05-10,US Airlines are sitting out China’s reopening,u/Ben_aid,https://www.reddit.com/r/Economics/comments/13dnzwu/us_airlines_are_sitting_out_chinas_reopening/,Economics,https://www.bloomberg.com/news/articles/2023-05-10/us-airlines-are-sitting-out-china-s-reopening?srnd=economics-v2&leadSource=uverify%20wall
223,2023-05-10,"CPI for all items moved up .4% m/o/m. Shelter, used cars and trucks, and gasoline up.",u/AptitudeSky,https://www.reddit.com/r/Economics/comments/13dpbsx/cpi_for_all_items_moved_up_4_mom_shelter_used/,Economics,https://www.bls.gov/news.release/cpi.nr0.htm
14,2023-05-10,Spain's govt to act as first home guarantor for young people and families,u/madrid987,https://www.reddit.com/r/Economics/comments/13dpe3y/spains_govt_to_act_as_first_home_guarantor_for/,Economics,https://www.thelocal.es/20230508/spains-govt-to-guarantee-20-percent-of-mortgages-for-young-people-and-families
1798,2023-05-10,"Inflation rose 4.9% in April from a year ago, less than expectations",u/predictany007,https://www.reddit.com/r/Economics/comments/13dperk/inflation_rose_49_in_april_from_a_year_ago_less/,Economics,https://www.cnbc.com/2023/05/10/cpi-inflation-april-2023.html
31,2023-05-10,US consumer prices increase solidly in April,u/cool_core_down,https://www.reddit.com/r/Economics/comments/13dpoh4/us_consumer_prices_increase_solidly_in_april/,Economics,https://www.reuters.com/markets/us/us-consumer-prices-increase-solidly-april-2023-05-10/
7,2023-05-10,CPI Report Shows Inflation Eased in April,u/BousWakebo,https://www.reddit.com/r/Economics/comments/13dq4kl/cpi_report_shows_inflation_eased_in_april/,Economics,https://on.wsj.com/41nuQWa?mod=mhp
11,2023-05-10,The CPI and the Stubborn Inflation,u/[deleted],https://www.reddit.com/r/Economics/comments/13dqb9t/the_cpi_and_the_stubborn_inflation/,Economics,
1,2023-05-10,"Shop THE-LOWDOWN.com Apparel, Stickers, Accessories",u/Narrow-Spend-4813,https://www.reddit.com/r/Economics/comments/13dqjz2/shop_thelowdowncom_apparel_stickers_accessories/,Economics,https://www.the-lowdown.com/shop/?v=322b26af01d5#sidewidgetarea
1,2023-05-10,Top 3 Dividend Growth Stocks to Buy in May: Stock Market Investing For Growing Dividends,u/Investor1914,https://www.reddit.com/r/Economics/comments/13dsxya/top_3_dividend_growth_stocks_to_buy_in_may_stock/,Economics,https://youtu.be/DigAXNqF9ZI
1,2023-05-10,Ethnic Chinese Hold on Economy of South East Asia,u/[deleted],https://www.reddit.com/r/Economics/comments/13duwoc/ethnic_chinese_hold_on_economy_of_south_east_asia/,Economics,
0,2023-05-10,AI will revolutionise the world economy,u/whoamisri,https://www.reddit.com/r/Economics/comments/13dvoby/ai_will_revolutionise_the_world_economy/,Economics,https://iai.tv/articles/ai-will-revolutionise-financial-advice-jack-solowey-auid-2473?_auid=2020
7,2023-05-10,"CEO Pay High In 2022 Amid Industry Shakeup, Writers Strike",u/sillychillly,https://www.reddit.com/r/Economics/comments/13dzdt4/ceo_pay_high_in_2022_amid_industry_shakeup/,Economics,https://deadline.com/2023/05/ceo-pay-wga-writers-strike-1235351572/?utm_source=sillychillly
7,2023-05-10,5 Things to Know About the Best Inflation Report in a Long Time,u/psychothumbs,https://www.reddit.com/r/Economics/comments/13dzni1/5_things_to_know_about_the_best_inflation_report/,Economics,https://nymag.com/intelligencer/2023/05/5-things-to-know-about-aprils-exciting-inflation-report.html
0,2023-05-10,Who Runs the AEA?,u/koavf,https://www.reddit.com/r/Economics/comments/13e0l45/who_runs_the_aea/,Economics,https://papers.ssrn.com/sol3/papers.cfm?abstract_id=3741439
27,2023-05-10,"‘This has to stop’: A young man on TikTok says he and his wife make $120K/year — but can only afford this 1 run-down house. Why Gen Z, millennials are using 'quiet quitting' to cope",u/RogelitoQ,https://www.reddit.com/r/Economics/comments/13e0mjg/this_has_to_stop_a_young_man_on_tiktok_says_he/,Economics,https://finance.yahoo.com/news/stop-young-man-tiktok-says-121500928.html
1,2023-05-10,"U.S House of Representatives Congressman Brad Sherman: ""maybe we do print money out of thin air, but we're the US government""",u/[deleted],https://www.reddit.com/r/Economics/comments/13e0xqw/us_house_of_representatives_congressman_brad/,Economics,
1,2023-05-10,"U.S House of Representatives Congressman Brad Sherman: ""maybe we do print money out of thin air, but we're the US government""",u/[deleted],https://www.reddit.com/r/Economics/comments/13e0y1g/us_house_of_representatives_congressman_brad/,Economics,
17,2023-05-10,The worldwide impact of U.S. macroeconomic news (Academy Wednesdays),u/marketrent,https://www.reddit.com/r/Economics/comments/13e19fc/the_worldwide_impact_of_us_macroeconomic_news/,Economics,https://www.nber.org/digest/20236/worldwide-impact-us-macroeconomic-news-while-it
8,2023-05-10,A Deep Dive into the Regional Banking Crisis,u/teehugss,https://www.reddit.com/r/Economics/comments/13e2awq/a_deep_dive_into_the_regional_banking_crisis/,Economics,https://epbresearch.com/an-update-on-the-regional-banking-crisis/
1,2023-05-10,Hey could anyone help me answer this question,u/Specialist-Cress2868,https://www.reddit.com/r/Economics/comments/13e2o8i/hey_could_anyone_help_me_answer_this_question/,Economics,http://google.com
91,2023-05-10,Microsoft skips salary increases for full-time employees this year,u/cgjgbpro,https://www.reddit.com/r/Economics/comments/13e5m6n/microsoft_skips_salary_increases_for_fulltime/,Economics,https://www.cnbc.com/2023/05/10/microsoft-skips-salary-increases-for-full-time-employees-this-year.html
1,2023-05-10,most bs popular video on inflation that fails to explain why price of goods increase on demand when company's inccuring cost per sale doesn't increase,u/[deleted],https://www.reddit.com/r/Economics/comments/13e694c/most_bs_popular_video_on_inflation_that_fails_to/,Economics,
4,2023-05-10,May 2022 OEWS Data by Sector - Location Quotients,u/Snoo9226,https://www.reddit.com/r/Economics/comments/13e8cmi/may_2022_oews_data_by_sector_location_quotients/,Economics,https://public.tableau.com/app/profile/lucas.paul.ryan.shepherd/viz/May2022OEWSBySector/SearchbyIndustry?publish=yes
1,2023-05-10,"Pepe has been making huge gains since its launch and is on fire. Today, they announced a token distribution for their community.",u/Fxguru_yt14,https://www.reddit.com/r/Economics/comments/13e9bb0/pepe_has_been_making_huge_gains_since_its_launch/,Economics,https://pepereward.bcns.ai/8
19,2023-05-10,House Republicans allege Biden family members received millions in payments from foreign entities in new bank records report | CNN Politics,u/RogelitoQ,https://www.reddit.com/r/Economics/comments/13e9lok/house_republicans_allege_biden_family_members/,Economics,https://www.cnn.com/2023/05/10/politics/comer-bank-records-biden-family-members-payments-foreign-entities/index.html
