score,date,title,author,url,subreddit,text
1,2023-05-22,"Can you all please do my BNPL research survey for a VCE(Victorian Certificate of Education Australia) SAT Project, all responses will be anonymous and no personal data will be shared with any other individuals/organisations.",u/raedmalik1107,https://www.reddit.com/r/Economics/comments/13okedy/can_you_all_please_do_my_bnpl_research_survey_for/,Economics,https://forms.gle/Cii5k2BaFyPZVuDX6
215,2023-05-22,China’s $23 Trillion Local Debt Mess Is About to Get Worse,u/omg_im_so_litty_lol,https://www.reddit.com/r/Economics/comments/13om3ec/chinas_23_trillion_local_debt_mess_is_about_to/,Economics,https://www.bloomberg.com/news/features/2023-05-21/china-s-23-trillion-local-debt-crisis-threatens-xi-s-economy
1,2023-05-22,Double Hammer Candle,u/Ok_Handle7920,https://www.reddit.com/r/Economics/comments/13om3fq/double_hammer_candle/,Economics,https://www.rsharemarket.in/2023/05/blog-post.html?m=1
4,2023-05-22,Fed Chair Powell says rates may not have to rise as much as expected to curb inflation,u/rudy_batts,https://www.reddit.com/r/Economics/comments/13omjvi/fed_chair_powell_says_rates_may_not_have_to_rise/,Economics,https://www.cnbc.com/2023/05/19/fed-chair-powell-says-rates-may-not-have-to-rise-as-much-as-expected-to-curb-inflation.html
259,2023-05-22,Biden-McCarthy Meeting on Debt Limit Comes as Time Runs Short,u/xavier_mamba,https://www.reddit.com/r/Economics/comments/13omub0/bidenmccarthy_meeting_on_debt_limit_comes_as_time/,Economics,https://www.bloomberg.com/news/articles/2023-05-22/debt-ceiling-news-biden-mccarthy-meeting-to-avoid-us-default-set-in-tense-week?srnd=economics-v2
33,2023-05-22,GDPR record fine against Facebook: Meta is to pay a fine of 1.2 billion euros,u/Lost-Cow-9386,https://www.reddit.com/r/Economics/comments/13omy6v/gdpr_record_fine_against_facebook_meta_is_to_pay/,Economics,https://techaint.com/2023/05/22/gdpr-record-fine-against-facebook-meta-is-to-pay-a-fine-of-1-2-billion-euros/
221,2023-05-22,"Australia’s Minimum Wage Gain Must Match Inflation, Burke Says",u/reggie_morris,https://www.reddit.com/r/Economics/comments/13on0tf/australias_minimum_wage_gain_must_match_inflation/,Economics,https://www.bloomberg.com/news/articles/2023-05-21/australia-s-minimum-wage-gain-must-match-inflation-burke-says?srnd=economics-inflation-and-prices&leadSource=uverify%20wall
419,2023-05-22,Matthew Lynn: 'A US debt default is the wake-up call the world needs',u/TheTelegraph,https://www.reddit.com/r/Economics/comments/13onijx/matthew_lynn_a_us_debt_default_is_the_wakeup_call/,Economics,https://www.telegraph.co.uk/business/2023/05/21/us-debt-default-is-the-wake-up-call-the-world-needs/
1,2023-05-22,[ Removed by Reddit ],u/hecaghb,https://www.reddit.com/r/Economics/comments/13onvex/removed_by_reddit/,Economics,[removed]
1,2023-05-22,lazyify.com,u/lazyify,https://www.reddit.com/r/Economics/comments/13op44t/lazyifycom/,Economics,https://89380e.myshopify.com
95,2023-05-22,The nine hours in which Spain made the 100% renewable dream a reality,u/madrid987,https://www.reddit.com/r/Economics/comments/13orbiq/the_nine_hours_in_which_spain_made_the_100/,Economics,https://english.elpais.com/spain/2023-05-19/the-nine-hours-in-which-spain-made-the-100-renewable-dream-a-reality.html
801,2023-05-22,"Rigging of Libor During 2008 Crisis Was ‘State-Led,’ Times Says",u/pescennius,https://www.reddit.com/r/Economics/comments/13orpxp/rigging_of_libor_during_2008_crisis_was_stateled/,Economics,https://www.bloomberg.com/news/articles/2023-05-22/rigging-of-libor-rate-was-state-led-times-reports?sref=2ImPLOle
1,2023-05-22,loan for bad credit,u/newsfounder,https://www.reddit.com/r/Economics/comments/13ot7ri/loan_for_bad_credit/,Economics,https://www.topshetkari.com/2023/05/loan-for-bad-credit.html
1,2023-05-22,Loandepot in usa,u/newsfounder,https://www.reddit.com/r/Economics/comments/13otac0/loandepot_in_usa/,Economics,https://www.topshetkari.com/2023/05/loandepot-in-usa.html
1,2023-05-22,business loans in usa,u/newsfounder,https://www.reddit.com/r/Economics/comments/13otdvq/business_loans_in_usa/,Economics,https://www.topshetkari.com/2023/05/business-loans-in-usa.html
0,2023-05-22,Decoupling is just going to happen,u/[deleted],https://www.reddit.com/r/Economics/comments/13owbfj/decoupling_is_just_going_to_happen/,Economics,
6,2023-05-22,Brexit and Burberry: Impact of VAT Changes on the UK Retail Sector,u/Sabina19275,https://www.reddit.com/r/Economics/comments/13oy38a/brexit_and_burberry_impact_of_vat_changes_on_the/,Economics,https://www.axeconsultingco.com/post/brexit-and-burberry-a-case-study-on-the-impact-of-vat-changes-on-the-uk-retail-sector
5,2023-05-22,Post-Brexit UK investments drive FDI in Germany to record level,u/MaleficentParfait863,https://www.reddit.com/r/Economics/comments/13p0si3/postbrexit_uk_investments_drive_fdi_in_germany_to/,Economics,https://www.ft.com/content/d88ad354-9c4e-41a4-a439-06513ece665f
436,2023-05-22,Why labor shortages could be here to stay,u/AdmiralKurita,https://www.reddit.com/r/Economics/comments/13p1cmu/why_labor_shortages_could_be_here_to_stay/,Economics,https://www.axios.com/2023/05/08/us-labor-shortage-older-workers
6,2023-05-22,Success to the Successful: Manifestations of feedback loops,u/zhoushmoe,https://www.reddit.com/r/Economics/comments/13p2req/success_to_the_successful_manifestations_of/,Economics,https://riskmusings.substack.com/p/success-to-the-successful
64,2023-05-22,What it would mean for the global economy if the US defaults on its debt,u/gordon22,https://www.reddit.com/r/Economics/comments/13p4lsq/what_it_would_mean_for_the_global_economy_if_the/,Economics,https://apnews.com/article/debt-limit-congress-world-economy-recession-biden-52df635e9b89f4b1677176fc8d59eff0
2,2023-05-22,"For tax executives, more disclosure on global liabilities means more headaches — As investors and regulators seek more information on companies’ country-by-country levies, tax officers cite high costs, challenges in data collection",u/[deleted],https://www.reddit.com/r/Economics/comments/13p7bcl/for_tax_executives_more_disclosure_on_global/,Economics,
1288,2023-05-22,"US ‘highly likely’ to be unable to pay bills by early June, Yellen says",u/marketrent,https://www.reddit.com/r/Economics/comments/13p7pi3/us_highly_likely_to_be_unable_to_pay_bills_by/,Economics,https://www.ft.com/content/f35c7eb3-0e51-4364-9f54-77ea68fe5556
4226,2023-05-22,Remote work will destroy 44% of NYC office values,u/marketrent,https://www.reddit.com/r/Economics/comments/13p8jvi/remote_work_will_destroy_44_of_nyc_office_values/,Economics,https://therealdeal.com/new-york/2023/05/22/remote-work-will-destroy-44-of-nyc-office-values/
3,2023-05-22,Adjustment for inflation in belgium for household income (consumer price index and health index),u/Masspoint,https://www.reddit.com/r/Economics/comments/13p9dab/adjustment_for_inflation_in_belgium_for_household/,Economics,https://en.wikipedia.org/wiki/Consumer_price_index_(Belgium)
124,2023-05-22,Why the super rich are inevitable: an interactive demonstration of the yard sale effect,u/jsalsman,https://www.reddit.com/r/Economics/comments/13paan2/why_the_super_rich_are_inevitable_an_interactive/,Economics,https://pudding.cool/2022/12/yard-sale/
1,2023-05-23,Study: Allowing financial trading in California's wholesale electricity market significantly reduces volatility,u/[deleted],https://www.reddit.com/r/Economics/comments/13pdekz/study_allowing_financial_trading_in_californias/,Economics,
1,2023-05-23,"The administrator has created a Whatsapp US stock group, and everyone can participate in the discussion. There are US stock coaches in the group to share the latest US stock information, share the most avant-garde investment skills, and recommend good stocks for everyone. join as soon as possible",u/[deleted],https://www.reddit.com/r/Economics/comments/13pdwip/the_administrator_has_created_a_whatsapp_us_stock/,Economics,
0,2023-05-23,"Here's why the US doesn't have to pay off its $31 trillion mountain of debt, according to Paul Krugman",u/[deleted],https://www.reddit.com/r/Economics/comments/13pf6u2/heres_why_the_us_doesnt_have_to_pay_off_its_31/,Economics,
6,2023-05-23,Dollar scales 6-month peak against yen on US rate expectations,u/Otherwise_Plum9333,https://www.reddit.com/r/Economics/comments/13pf8of/dollar_scales_6month_peak_against_yen_on_us_rate/,Economics,https://finance.yahoo.com/news/forex-dollar-scales-6-month-052116505.html
1,2023-05-23,RBI Issues Exchange/ Deposit Slip Format of Rs. 2000 notes without ID Proof,u/Stock_Pin1028,https://www.reddit.com/r/Economics/comments/13pglzp/rbi_issues_exchange_deposit_slip_format_of_rs/,Economics,https://www.taxscan.in/rbi-issues-exchange-deposit-slip-format-of-rs-2000-notes-without-id-proof/280417/
0,2023-05-23,Our economy and what you don’t know about it,u/[deleted],https://www.reddit.com/r/Economics/comments/13pgvjo/our_economy_and_what_you_dont_know_about_it/,Economics,
1,2023-05-23,Hidden Costs of Selling a Business,u/entrepreneurherooo,https://www.reddit.com/r/Economics/comments/13phzhs/hidden_costs_of_selling_a_business/,Economics,https://insights.successionmatching.com/hidden-costs-of-selling-a-business/
8,2023-05-23,2-year Treasury yield rises as investors assess U.S. economic outlook,u/New-Replacement-327,https://www.reddit.com/r/Economics/comments/13pj1p0/2year_treasury_yield_rises_as_investors_assess_us/,Economics,https://www.cnbc.com/2023/05/23/us-treasury-yields-investors-assess-us-economic-outlook.html
136,2023-05-23,IMF says it no longer expects UK recession this year,u/[deleted],https://www.reddit.com/r/Economics/comments/13pjsf0/imf_says_it_no_longer_expects_uk_recession_this/,Economics,https://www.ft.com/content/26ac0f8b-90d2-4096-b196-4aa638b0462e
4,2023-05-23,GQG raises Adani stake by about 10%,u/Possible_Ad5461,https://www.reddit.com/r/Economics/comments/13pkpxc/gqg_raises_adani_stake_by_about_10/,Economics,https://finance.yahoo.com/news/gqg-raises-adani-stake-10-091107805.html
1,2023-05-23,Oil giant Shell braces for shareholder revolt over climate plans after record profits,u/[deleted],https://www.reddit.com/r/Economics/comments/13pkw7m/oil_giant_shell_braces_for_shareholder_revolt/,Economics,
73,2023-05-23,Why Inflation Erupted: Two Top Economists Have the Answer,u/rudy_batts,https://www.reddit.com/r/Economics/comments/13plc60/why_inflation_erupted_two_top_economists_have_the/,Economics,https://www.wsj.com/articles/why-inflation-erupted-two-top-economists-have-the-answer-6919042c?mod=economy_lead_story
31,2023-05-23,How Wall Street is preparing for possible US debt default,u/xavier_mamba,https://www.reddit.com/r/Economics/comments/13plxzn/how_wall_street_is_preparing_for_possible_us_debt/,Economics,https://www.reuters.com/markets/us/how-wall-street-is-preparing-possible-us-debt-default-2023-05-22/
37,2023-05-23,Fed’s Kashkari says a June pause on rates wouldn’t indicate an end to hiking cycle,u/reggie_morris,https://www.reddit.com/r/Economics/comments/13pm9hq/feds_kashkari_says_a_june_pause_on_rates_wouldnt/,Economics,https://www.cnbc.com/2023/05/22/feds-kashkari-says-june-rate-pause-wouldnt-show-end-to-hiking-cycle.html
913,2023-05-23,Interest rate 'rigging' evidence 'covered up' by banks,u/[deleted],https://www.reddit.com/r/Economics/comments/13polc2/interest_rate_rigging_evidence_covered_up_by_banks/,Economics,https://www.bbc.com/news/business-65635243
7,2023-05-23,Workforce development is a crucial part of digital equity,u/[deleted],https://www.reddit.com/r/Economics/comments/13prgpy/workforce_development_is_a_crucial_part_of/,Economics,
22,2023-05-23,Apple announces multibillion-dollar deal with Broadcom,u/[deleted],https://www.reddit.com/r/Economics/comments/13prhox/apple_announces_multibilliondollar_deal_with/,Economics,https://www.apple.com/newsroom/2023/05/apple-announces-multibillion-dollar-deal-with-broadcom/
91,2023-05-23,Lone voice on inflation grows louder,u/Techygal9,https://www.reddit.com/r/Economics/comments/13ps2xe/lone_voice_on_inflation_grows_louder/,Economics,https://www.thetimes.co.uk/article/lone-voice-on-inflation-grows-louder-qrxv0qvl0
1,2023-05-23,Interest rate 'rigging' evidence 'covered up' by banks,u/ElegantSector1909,https://www.reddit.com/r/Economics/comments/13pswlz/interest_rate_rigging_evidence_covered_up_by_banks/,Economics,https://www-bbc-com.cdn.ampproject.org/c/s/www.bbc.com/news/business-65635243.amp
0,2023-05-23,"More US Women Are Working Than Ever | Three years ago, a global pandemic triggered a so-called “she-cession,” as millions of women lost their jobs or left the workforce to care for loved ones. Now, they’re leading the recovery",u/[deleted],https://www.reddit.com/r/Economics/comments/13pt7y4/more_us_women_are_working_than_ever_three_years/,Economics,
438,2023-05-23,"Highest-denomination bill in Argentina is now the 2,000-peso note, worth $4",u/Yearlaren,https://www.reddit.com/r/Economics/comments/13puvxl/highestdenomination_bill_in_argentina_is_now_the/,Economics,https://www.theguardian.com/world/2023/may/22/argentina-2000-peso-banknote-depreciation-inflation
13,2023-05-23,"Report: In Legal Marijuana States, Just 6% of Consumers Purchase From the Black Market",u/[deleted],https://www.reddit.com/r/Economics/comments/13pv1mk/report_in_legal_marijuana_states_just_6_of/,Economics,
0,2023-05-23,Why Inflation Erupted: Two Top Economists Have the Answer,u/[deleted],https://www.reddit.com/r/Economics/comments/13pv99h/why_inflation_erupted_two_top_economists_have_the/,Economics,https://www.wsj.com/articles/why-inflation-erupted-two-top-economists-have-the-answer-6919042c
1,2023-05-23,"What is space exploration, and what are NASA and SpaceX's projects about space exploration?",u/Mdmustafa78689,https://www.reddit.com/r/Economics/comments/13pw551/what_is_space_exploration_and_what_are_nasa_and/,Economics,https://www.starnewed.com/2023/05/space-exploration-and-nasa-spacex.html.html
1,2023-05-23,Join now over the link and get up to 100€ for free it expires soon,u/Some_Moment_8993,https://www.reddit.com/r/Economics/comments/13pwszh/join_now_over_the_link_and_get_up_to_100_for_free/,Economics,https://app.temu.com/m/euJSP97t1QptPBv
1,2023-05-23,Top 30 Biggest Economies in the World | Nominal GDP (Current US$),u/Lucianomende,https://www.reddit.com/r/Economics/comments/13q0fff/top_30_biggest_economies_in_the_world_nominal_gdp/,Economics,https://youtube.com/watch?v=yzQaJxLwwvs&feature=share
28,2023-05-23,Unbankable and uninsurable: property at risk from climate change | Australian Financial Review,u/marketrent,https://www.reddit.com/r/Economics/comments/13q0p8j/unbankable_and_uninsurable_property_at_risk_from/,Economics,https://www.afr.com/companies/financial-services/unbankable-and-uninsurable-property-at-risk-from-climate-change-20230523-p5dal0
406,2023-05-23,"California Made Over $215 Million in Marijuana Taxes in Q1, 2023",u/[deleted],https://www.reddit.com/r/Economics/comments/13q1xsm/california_made_over_215_million_in_marijuana/,Economics,
0,2023-05-23,"Why inflation erupted: epidemic, and stimulus.",u/amaxen,https://www.reddit.com/r/Economics/comments/13q270n/why_inflation_erupted_epidemic_and_stimulus/,Economics,https://www.wsj.com/articles/why-inflation-erupted-two-top-economists-have-the-answer-6919042c?st=oc732y2af9dyd00
1425,2023-05-23,The Student-Loan Payment Pause Led Borrowers to Take on More Debt,u/amaxen,https://www.reddit.com/r/Economics/comments/13q2gvg/the_studentloan_payment_pause_led_borrowers_to/,Economics,https://marginalrevolution.com/marginalrevolution/2023/05/the-student-loan-payment-pause-led-borrowers-to-take-on-more-debt.html
826,2023-05-23,"Spain has lost over 12,000 nationals while welcoming almost 150,000 foreigners this year’s first quarter",u/madrid987,https://www.reddit.com/r/Economics/comments/13q304s/spain_has_lost_over_12000_nationals_while/,Economics,https://www.theolivepress.es/spain-news/2023/05/23/spain-has-lost-over-12000-nationals-while-welcoming-almost-150000-foreigners-this-years-first-quarter/
1,2023-05-23,Principles for Dealing with the Changing World Order (5-minute Version) by Ray Dalio,u/jenksy,https://www.reddit.com/r/Economics/comments/13q6kqo/principles_for_dealing_with_the_changing_world/,Economics,https://www.youtube.com/watch?v=BB2r_eOjsPw
88,2023-05-23,"One in six migrant workers are 'exploited', but many Australians are also paid below the national minimum wage",u/marketrent,https://www.reddit.com/r/Economics/comments/13q6uj8/one_in_six_migrant_workers_are_exploited_but_many/,Economics,https://www.abc.net.au/news/2023-05-23/one-in-six-migrant-workers-paid-below-the-national-minimum-wage/102383332
201,2023-05-23,America’s Poverty Is Built by Design,u/Soothsayerman,https://www.reddit.com/r/Economics/comments/13q8al7/americas_poverty_is_built_by_design/,Economics,https://news.yahoo.com/opinion-america-poverty-built-design-110000975.html?soc_src=social-sh&soc_trk=fb&tsrc=fb
1,2023-05-24,"US debt ceiling: Default risk more than doubles, now at 12%",u/v4nd3m0n14n,https://www.reddit.com/r/Economics/comments/13qalyy/us_debt_ceiling_default_risk_more_than_doubles/,Economics,https://www.baseratetimes.com/#DebtCeiling
1,2023-05-24,Fear the Boom & Bust - Keynes vs. Hayek rap battle,u/[deleted],https://www.reddit.com/r/Economics/comments/13qclvg/fear_the_boom_bust_keynes_vs_hayek_rap_battle/,Economics,
1,2023-05-24,Fear the Boom & Bust - Keynes vs. Hayek rap battle,u/[deleted],https://www.reddit.com/r/Economics/comments/13qcn7q/fear_the_boom_bust_keynes_vs_hayek_rap_battle/,Economics,
1,2023-05-24,"China's yuan will continue to fall against the dollar as Beijing eyes rate cuts to revive the economy, Goldman Sachs says",u/_Steve_Zissou_,https://www.reddit.com/r/Economics/comments/13qcp6d/chinas_yuan_will_continue_to_fall_against_the/,Economics,https://finance.yahoo.com/news/chinas-yuan-continue-fall-against-015550497.html
1,2023-05-24,Is an Economics Degree really a Liberal Arts Degree?,u/[deleted],https://www.reddit.com/r/Economics/comments/13qcqp7/is_an_economics_degree_really_a_liberal_arts/,Economics,
1,2023-05-24,"Financial Markets Close Lower on Debt Ceiling and Inflation Concerns on May 23, 2023",u/Fincovery,https://www.reddit.com/r/Economics/comments/13qcuhv/financial_markets_close_lower_on_debt_ceiling_and/,Economics,https://fincovery.com/financial-markets-close-lower-on-debt-ceiling-and-inflation-concerns-on-may-23-2023
1,2023-05-24,UK inflation sinks below 10% for the first time since August,u/ProcedureFun410,https://www.reddit.com/r/Economics/comments/13qdyb8/uk_inflation_sinks_below_10_for_the_first_time/,Economics,https://www.cnbc.com/2023/05/24/uk-inflation-sinks-below-10percent-for-the-first-time-since-august.html
1,2023-05-24,Understanding the Attention Economy | How leaders can remain centered,u/[deleted],https://www.reddit.com/r/Economics/comments/13qe98d/understanding_the_attention_economy_how_leaders/,Economics,
1,2023-05-24,Forex Trading,u/Ok_Handle7920,https://www.reddit.com/r/Economics/comments/13qffxu/forex_trading/,Economics,https://www.rsharemarket.in/2023/05/lots-and-pips.html
1,2023-05-24,IGCSE/Olevel Econ - P2 Past Paper Solutions,u/Best_Finish4500,https://www.reddit.com/r/Economics/comments/13qfycw/igcseolevel_econ_p2_past_paper_solutions/,Economics,https://youtube.com/playlist?list=PL7nqChIyROcrVvs-DqeMYqmlJnb-oNHoI
85,2023-05-24,The Return of Industrial Policy,u/[deleted],https://www.reddit.com/r/Economics/comments/13qgo4o/the_return_of_industrial_policy/,Economics,https://www.imf.org/en/Publications/fandd/issues/2023/06/the-return-of-industrial-policy-douglas-irwin
1,2023-05-24,https://www.ktmindia.com/ktm-bikes/naked-bike/ktm-200-duke?utm_source=Google&utm_medium=cpc&utm_campaign=EDM_KTM_Duke_South_Performance_Max_Feb23_Google&utm_customdetails=Performance_Max&utm_customdetails1=Duke_LeadGen_D2C&utm_customdetails2=Display_Google&gclid=CjwKCAjw67ajBhAVEiwA2g_jEGCVU13I4tvAq,u/Narrow-Spend-4813,https://www.reddit.com/r/Economics/comments/13qhczg/httpswwwktmindiacomktmbikesnakedbikektm200dukeutm/,Economics,https://www.ktmindia.com/ktm-bikes/naked-bike/ktm-200-duke?utm_source=Google&utm_medium=cpc&utm_campaign=EDM_KTM_Duke_South_Performance_Max_Feb23_Google&utm_customdetails=Performance_Max&utm_customdetails1=Duke_LeadGen_D2C&utm_customdetails2=Display_Google&gclid=CjwKCAjw67ajBhAVEiwA2g_jEGCVU13I4tvAquIWUZMilVkiuS8IuCinMEpsMBPSi34pL912oPfsuRoCufAQAvD_BwE
1,2023-05-24,https://finance.yahoo.com/news/key-republicans-signal-debt-deal-212855110.html,u/moGUNZthanROSES,https://www.reddit.com/r/Economics/comments/13qhef3/httpsfinanceyahoocomnewskeyrepublicanssignaldebtde/,Economics,https://finance.yahoo.com/news/key-republicans-signal-debt-deal-212855110.html
1,2023-05-24,"European banks are stronger than their U.S. rivals, analysts say. Here’s why",u/[deleted],https://www.reddit.com/r/Economics/comments/13qhn03/european_banks_are_stronger_than_their_us_rivals/,Economics,
1,2023-05-24,Financial Advisor Sean Bynum On Generational Financial Curses and Whether Integration Helped Or Not,u/InvesterSaint,https://www.reddit.com/r/Economics/comments/13qijdx/financial_advisor_sean_bynum_on_generational/,Economics,https://youtu.be/XM2kxK7OyxQ
1,2023-05-24,What a “war tax” means for the global economy,u/[deleted],https://www.reddit.com/r/Economics/comments/13qitm2/what_a_war_tax_means_for_the_global_economy/,Economics,
1,2023-05-24,‘Boomy’ talk about the Chinese economy is a charade | Financial Times,u/poirot100,https://www.reddit.com/r/Economics/comments/13qj625/boomy_talk_about_the_chinese_economy_is_a_charade/,Economics,https://archive.is/0oIIY
1,2023-05-24,Lamborghini LB744: absolute driving experience,u/Narrow-Spend-4813,https://www.reddit.com/r/Economics/comments/13ql0al/lamborghini_lb744_absolute_driving_experience/,Economics,https://www.lamborghini.com/en-en/news/lamborghini-lb744-absolute-driving-experience?utm_source=Yt&utm_term=Social&utm_medium=Yt_03_21_2023_LB744_Teasing3_Yt&utm_content=Yt
1,2023-05-24,Africa faces a mounting debt crisis,u/MaleficentParfait863,https://www.reddit.com/r/Economics/comments/13qlheb/africa_faces_a_mounting_debt_crisis/,Economics,https://www.economist.com/middle-east-and-africa/2023/05/16/africa-faces-a-mounting-debt-crisis
1,2023-05-24,"Bernie Sanders calls for income over $1 billion to be taxed at 100%, says people can make it on $999 million",u/[deleted],https://www.reddit.com/r/Economics/comments/13qmnzd/bernie_sanders_calls_for_income_over_1_billion_to/,Economics,
1,2023-05-24,"2-year Treasury yield inches higher as investors follow debt ceiling negotiations, await key economic reports",u/[deleted],https://www.reddit.com/r/Economics/comments/13qnq6k/2year_treasury_yield_inches_higher_as_investors/,Economics,
1,2023-05-24,How Smart is ChatGPT?,u/CrewIllustrious1674,https://www.reddit.com/r/Economics/comments/13qnule/how_smart_is_chatgpt/,Economics,https://www.visualcapitalist.com/how-smart-is-chatgpt/
1,2023-05-24,"Earn $1,000+/DAY With a Slippage Bot (Easy ETH Arbitrage MEV Bot Tutorial For Uniswap) (2023)",u/Real-Boysenberry-619,https://www.reddit.com/r/Economics/comments/13qoirr/earn_1000day_with_a_slippage_bot_easy_eth/,Economics,https://youtu.be/2I2sp8hhqso
1,2023-05-24,Downtown LA’s Office Distress Shows the Pain Coming for Cities,u/inclusiveeconomy4all,https://www.reddit.com/r/Economics/comments/13qq06u/downtown_las_office_distress_shows_the_pain/,Economics,https://www.bloomberg.com/graphics/2023-downtown-la-office-vacancy-sets-record-causes-distress/
1,2023-05-24,Mortgage demand drops again as rates cross back over 7%,u/ashinaclan123,https://www.reddit.com/r/Economics/comments/13qrwdr/mortgage_demand_drops_again_as_rates_cross_back/,Economics,https://www.cnbc.com/amp/2023/05/24/mortgage-demand-drops-again-as-rates-cross-back-over-7percent.html
1,2023-05-24,The 30-year mortgage rate is now above 7%. Here’s how much extra homeowners will pay each month.,u/ashinaclan123,https://www.reddit.com/r/Economics/comments/13qrych/the_30year_mortgage_rate_is_now_above_7_heres_how/,Economics,https://www.marketwatch.com/amp/story/buckle-in-30-year-mortgage-rates-are-back-above-7-heres-how-many-extra-dollars-home-buyers-will-have-to-pay-6fe3101f
1,2023-05-24,"US Mortgage Rates Rise to Highest Since March, Slowing Demand",u/ashinaclan123,https://www.reddit.com/r/Economics/comments/13qs2xh/us_mortgage_rates_rise_to_highest_since_march/,Economics,https://finance.yahoo.com/news/us-mortgage-rates-rise-highest-112058951.html
1,2023-05-24,Asset mispricing,u/[deleted],https://www.reddit.com/r/Economics/comments/13qscyj/asset_mispricing/,Economics,
189,2023-05-24,Asset mispricing (Academy Wednesdays),u/marketrent,https://www.reddit.com/r/Economics/comments/13qse5s/asset_mispricing_academy_wednesdays/,Economics,https://www.sciencedirect.com/science/article/abs/pii/S0304405X21001471
1,2023-05-24,"""Imagining a Postgrowth World"" - Dr. Tim Jackson, of the Centre For the Understanding of Sustainable Prosperity (CUSP_uk), delivers speech at the EU's #BeyondGrowth Conference, May 2023",u/MtnsToCity,https://www.reddit.com/r/Economics/comments/13qsrt0/imagining_a_postgrowth_world_dr_tim_jackson_of/,Economics,https://cusp.ac.uk/themes/m/tj-imagining-a-postgrowth-world/
1,2023-05-24,"Dr Tim Jackson Speech at the EU Parliament, May 2023",u/MtnsToCity,https://www.reddit.com/r/Economics/comments/13qsste/dr_tim_jackson_speech_at_the_eu_parliament_may/,Economics,https://cusp.ac.uk/themes/m/tj-imagining-a-postgrowth-world/
1,2023-05-24,Why Tipping Prompts Are Suddenly Everywhere - WSJ,u/[deleted],https://www.reddit.com/r/Economics/comments/13qsu9p/why_tipping_prompts_are_suddenly_everywhere_wsj/,Economics,
1,2023-05-24,Why Tipping Prompts Are Suddenly Everywhere,u/[deleted],https://www.reddit.com/r/Economics/comments/13qsvs3/why_tipping_prompts_are_suddenly_everywhere/,Economics,
