score,date,title,author,url,subreddit,text
1,2023-08-17,Osaka Metropolitan University (OMU) carried out an innovative study that shows how appearance can hint at hidden health problems. They used an AI-powered system that analyzes chest X-rays to guess a person's age accurately.,u/Finance_risktaker,https://www.reddit.com/r/Futurology/comments/15tnnae/osaka_metropolitan_university_omu_carried_out_an/,Futurology,https://theswedishtimes.se/articles/revolutionizing-healthcare-ai-and-x-rays-detecting-early-signs-of-illness
1,2023-08-17,How will Africa's youth population drive global growth?,u/Gari_305,https://www.reddit.com/r/Futurology/comments/15tnwad/how_will_africas_youth_population_drive_global/,Futurology,https://www.weforum.org/agenda/2023/08/africa-youth-global-growth-digital-economy/
1,2023-08-17,Buy Local,u/boxyoursocksoff,https://www.reddit.com/r/Futurology/comments/15tpnme/buy_local/,Futurology,https://www.rulellc.com/post/buy-local
1,2023-08-17,The Sinister Rise of AI Female Influencers,u/whatstoyou101,https://www.reddit.com/r/Futurology/comments/15tre96/the_sinister_rise_of_ai_female_influencers/,Futurology,https://m.youtube.com/watch?v=rAI9IE39LHQ&t=487s
1,2023-08-17,Mining's Next Frontier: The Moon,u/tim_b_er,https://www.reddit.com/r/Futurology/comments/15trf5s/minings_next_frontier_the_moon/,Futurology,https://www.thenew.money/article/minings-next-frontier-the-moon
1,2023-08-17,Snapchat users freak out over AI bot that had a mind of its own,u/saidurnayeem,https://www.reddit.com/r/Futurology/comments/15trs7e/snapchat_users_freak_out_over_ai_bot_that_had_a/,Futurology,https://youtu.be/twFfQ8SGvFs
1,2023-08-17,Cheap Movers Agency,u/marton1122,https://www.reddit.com/r/Futurology/comments/15tscxg/cheap_movers_agency/,Futurology,[removed]
1,2023-08-17,"One year after passage of the IRA, the renaissance has begun. The historic bill has already begun to stimulate the economy and move the U.S. toward a carbon-neutral future. NREL expects that the IRA will increase clean energy in the range of 71% to 90% of total U.S. generation by 2030.",u/mafco,https://www.reddit.com/r/Futurology/comments/15tsz3z/one_year_after_passage_of_the_ira_the_renaissance/,Futurology,https://pv-magazine-usa.com/2023/08/16/one-year-after-passage-of-the-ira-the-renaissance-has-begun/
1,2023-08-17,The scourge of climate doomerism. The truth about global warming is bad enough. We don’t need harmful hyperbole,u/altmorty,https://www.reddit.com/r/Futurology/comments/15tt4l0/the_scourge_of_climate_doomerism_the_truth_about/,Futurology,https://www.ft.com/content/60f6e94a-eb3b-4a3e-9ef6-273262967121
1,2023-08-17,"I created1,500+ fine tuning prompts",u/TheVellerShow,https://www.reddit.com/r/Futurology/comments/15ttad7/i_created1500_fine_tuning_prompts/,Futurology,https://firebasestorage.googleapis.com/v0/b/postly-548c1.appspot.com/o/rLFNJIge9vw0QAaV-1691419643165-Fine%20Tuning%20101%20Cover.png?alt=media&token=e4abfdcc-e029-4c56-9596-d9b308f57647
1,2023-08-17,'We Own the Science' Remix: YouTube Bans Health Guidance Not Approved by WHO,u/egusa,https://www.reddit.com/r/Futurology/comments/15tu3is/we_own_the_science_remix_youtube_bans_health/,Futurology,https://sociable.co/big-tech/we-own-science-remix-youtube-bans-health-information-who-local-authorities/
1,2023-08-17,The Mark of the Blockchain: Cryptocurrencies and the Book of Revelation,u/faithnutrition,https://www.reddit.com/r/Futurology/comments/15tvxj9/the_mark_of_the_blockchain_cryptocurrencies_and/,Futurology,https://youtu.be/8CiouA2FAhE
1,2023-08-17,Scientists recorded a Pink Floyd song from patients’ brain waves. The tech could eventually allow for communication without words,u/__The__Anomaly__,https://www.reddit.com/r/Futurology/comments/15txjtw/scientists_recorded_a_pink_floyd_song_from/,Futurology,https://fortune.com/well/2023/08/15/researchers-recorded-pink-floyd-song-from-brain-waves-machine-interface-eeg/
1,2023-08-17,It's Not 1995 Anymore: Craig Newmark on Why the US Needs to 'Move Fast' on AI,u/Equal_Ad_8124,https://www.reddit.com/r/Futurology/comments/15tzsw2/its_not_1995_anymore_craig_newmark_on_why_the_us/,Futurology,https://www.pcmag.com/news/craig-newmark-on-why-the-us-needs-to-move-fast-on-artificial-intelligence
1,2023-08-17,"David Sinclair describes why he takes NMN, resveratrol, and berberine to increase life expectancy.",u/Impossible_Today8279,https://www.reddit.com/r/Futurology/comments/15u0s6f/david_sinclair_describes_why_he_takes_nmn/,Futurology,https://brainflow.co/2022/07/11/dr-david-sinclairs-supplement-list-for-longevity/
1,2023-08-17,We mixed AI + Music sampling,u/Mindless-Investment1,https://www.reddit.com/r/Futurology/comments/15u1bqj/we_mixed_ai_music_sampling/,Futurology,[removed]
1,2023-08-17,Would it ever be possible for AI to create an advance and different form of anonymity?,u/JamesPuppy3000,https://www.reddit.com/r/Futurology/comments/15u1eyw/would_it_ever_be_possible_for_ai_to_create_an/,Futurology,IIII
1,2023-08-17,are woke games the future???,u/ZealousidealCod4365,https://www.reddit.com/r/Futurology/comments/15u1j2t/are_woke_games_the_future/,Futurology,[removed]
1,2023-08-17,"Facial Recognition Software Rolling Out Across U.S. Airports: Next Stop, Miami",u/SFT3076,https://www.reddit.com/r/Futurology/comments/15u1sit/facial_recognition_software_rolling_out_across_us/,Futurology,[removed]
1,2023-08-17,The renewable energy revolution is happening faster than you think,u/V2O5,https://www.reddit.com/r/Futurology/comments/15u57bw/the_renewable_energy_revolution_is_happening/,Futurology,https://www.newscientist.com/article/2387712-the-renewable-energy-revolution-is-happening-faster-than-you-think/
1,2023-08-17,Shocking Footage: 6 Unexplained UFO And UAP Sightings V53,u/DifferentStandard489,https://www.reddit.com/r/Futurology/comments/15u73ph/shocking_footage_6_unexplained_ufo_and_uap/,Futurology,https://youtube.com/watch?v=Ms5ofC1xwaU&feature=share
1,2023-08-18,AliensInsideMe,u/Ok-Professional5793,https://www.reddit.com/r/Futurology/comments/15ubcdn/aliensinsideme/,Futurology,https://youtube.com/playlist?list=PLYin8CxiRSiVuKpuQ6Oo6oIifjAPuG5ff
1,2023-08-18,AI-Driven News Curation: A Glimpse into the Future of Unbiased Reporting,u/neuraltimes,https://www.reddit.com/r/Futurology/comments/15ubrd2/aidriven_news_curation_a_glimpse_into_the_future/,Futurology,[removed]
1,2023-08-18,😭,u/Darksoul_76,https://www.reddit.com/r/Futurology/comments/15uce0s/_/,Futurology,[removed]
1,2023-08-18,AI in Supply Chain Market to be Worth $41.23 Billion by 2030,u/Educational_Main7366,https://www.reddit.com/r/Futurology/comments/15uddab/ai_in_supply_chain_market_to_be_worth_4123/,Futurology,[removed]
1,2023-08-18,TIL the DEA is now using Apple AirTags to track suspects,u/Candid_Echo7896,https://www.reddit.com/r/Futurology/comments/15ufjn0/til_the_dea_is_now_using_apple_airtags_to_track/,Futurology,"In May last year, the DEA placed an Apple AirTag into a suspect shipment of pill presses, before tracking it's movement across Massachusetts. [The perpetrator was not found guilty in federal court](https://medium.com/p/39b631159588).

Apple's privacy measures continue to be absurdly unfit for purpose - and the company still denies any misuse of its AirTags."
1,2023-08-18,The richest Americans account for 40 percent of U.S. climate emissions,u/chrisdh79,https://www.reddit.com/r/Futurology/comments/15uhlf8/the_richest_americans_account_for_40_percent_of/,Futurology,https://journals.plos.org/climate/article?id=10.1371/journal.pclm.0000190
1,2023-08-18,Help with my thesis in Gastronomic Sciences,u/No-Low2748,https://www.reddit.com/r/Futurology/comments/15uhx10/help_with_my_thesis_in_gastronomic_sciences/,Futurology,[removed]
1,2023-08-18,"""Crystalline Nanotechnology: Unveiling the Marvels of Cutting-Edge Advancements""",u/waqaskhan007,https://www.reddit.com/r/Futurology/comments/15uiq28/crystalline_nanotechnology_unveiling_the_marvels/,Futurology,https://techphillic.com/crystalline-nanotechnology-unveiling-the-marvels-of-cutting-edge-advancements/
1,2023-08-18,"Psyche asteroid is worth $10,000-quadrillion, and NASA wants to mine it",u/dustofoblivion123,https://www.reddit.com/r/Futurology/comments/15ukkvh/psyche_asteroid_is_worth_10000quadrillion_and/,Futurology,https://www.earth.com/news/psyche-asteroid-is-worth-10000-quadrillion-and-nasa-is-sending-a-space-probe/
1,2023-08-18,Our Future,u/ossa_bellator,https://www.reddit.com/r/Futurology/comments/15ukop1/our_future/,Futurology,[removed]
1,2023-08-18,Autonomy - a free book about future alternatives(auto-translate needed),u/shanoshamanizum,https://www.reddit.com/r/Futurology/comments/15uln42/autonomy_a_free_book_about_future/,Futurology,https://forum.chitanka.info/viewtopic.php?t=6799
1,2023-08-18,"US can cut building emissions by up to 91%, saving $100 billion per year in energy-related costs, modeling study shows",u/BousWakebo,https://www.reddit.com/r/Futurology/comments/15umywq/us_can_cut_building_emissions_by_up_to_91_saving/,Futurology,https://www.eurekalert.org/news-releases/998417
1,2023-08-18,I think i found a possible way of making an Omnitrix,u/OveeBlitz,https://www.reddit.com/r/Futurology/comments/15un0mc/i_think_i_found_a_possible_way_of_making_an/,Futurology,[removed]
1,2023-08-18,Saudi Arabia’s NEOM city enlists Dutch greenhouse company to grow crops in desert,u/dustofoblivion123,https://www.reddit.com/r/Futurology/comments/15un414/saudi_arabias_neom_city_enlists_dutch_greenhouse/,Futurology,https://english.alarabiya.net/News/saudi-arabia/2023/08/08/Saudi-Arabia-s-NEOM-city-enlists-Dutch-greenhouse-company-to-grow-crops-in-desert
1,2023-08-18,Buy Local,u/boxyoursocksoff,https://www.reddit.com/r/Futurology/comments/15un78h/buy_local/,Futurology,https://www.rulellc.com/post/buy-local
1,2023-08-18,A Journey Through The Ocean’s Depths: Alex Dawson Photograph,u/Bamboospandadiary,https://www.reddit.com/r/Futurology/comments/15uo2my/a_journey_through_the_oceans_depths_alex_dawson/,Futurology,https://bamboospanda.com/a-journey-through-the-oceans-depths-the-underwater-photography-of-alex-dawson/?amp=1
1,2023-08-18,How Augmented Reality Helps Patients Feel Less Worried Before Surgery,u/Technologies_quo,https://www.reddit.com/r/Futurology/comments/15uo80q/how_augmented_reality_helps_patients_feel_less/,Futurology,https://theswedishtimes.se/articles/how-augmented-reality-helps-patients-feel-less-worried-before-surgery
1,2023-08-18,"Autonomous and fully electric ship is halfway through it's two year testing in Oslo Fjord, Norway. I saw it yesterday and is so excited the future is finally here.",u/DummeFar,https://www.reddit.com/r/Futurology/comments/15upndm/autonomous_and_fully_electric_ship_is_halfway/,Futurology,https://www.bairdmaritime.com/ship-world/dry-cargo-world/ro-ro-world/vessel-review-marit-therese-autonomous-electric-ro-ro-pair-for-norways-asko-maritime/
1,2023-08-18,"An NYU professor with 560,000 followers says he's been locked out of his X account for over 2 weeks after declining to meet with Elon Musk",u/Mixima101,https://www.reddit.com/r/Futurology/comments/15uqoqy/an_nyu_professor_with_560000_followers_says_hes/,Futurology,https://www.businessinsider.com/scott-galloway-says-hes-locked-out-x-after-upsetting-musk-2023-8
1,2023-08-18,Last Stand | Sci-Fi Short Film Made with Artificial Intelligence Now I understand why the writers and actors are worried and on strike. They should be.,u/rockyunicorn,https://www.reddit.com/r/Futurology/comments/15urlus/last_stand_scifi_short_film_made_with_artificial/,Futurology,https://youtube.com/watch?v=6dtSqhYhcrs&feature=share
1,2023-08-18,"What is the most compelling piece of research or literature I can share to my employer, to persuade them to try 4-day work week?",u/daaagnabit,https://www.reddit.com/r/Futurology/comments/15us3gu/what_is_the_most_compelling_piece_of_research_or/,Futurology,"I feel like a peer-reviewed study would be more persuasive, but the only ones I found so far are from Europe. We're in the US."
1,2023-08-18,🔒Yapay Zeka ve Güvenlik Tehlikeleri: Casuslar Savaşının Truva Atı mı? 🔒(Language: Turkish),u/sonmezmat,https://www.reddit.com/r/Futurology/comments/15ussl6/yapay_zeka_ve_güvenlik_tehlikeleri_casuslar/,Futurology,[removed]
1,2023-08-18,"A global wave of protests is underway, as anger mounts among those who’ll have to live with climate change.",u/ribaramt,https://www.reddit.com/r/Futurology/comments/15usvuz/a_global_wave_of_protests_is_underway_as_anger/,Futurology,https://www.washingtonpost.com/world/2019/01/25/global-wave-protests-is-underway-anger-mounts-among-those-wholl-have-live-with-global-warming/
1,2023-08-18,Tesla’s giant battery in Australia made around $1 million in just a few days,u/puworm52lz,https://www.reddit.com/r/Futurology/comments/15ut7dx/teslas_giant_battery_in_australia_made_around_1/,Futurology,https://electrek.co/2018/01/23/tesla-giant-battery-australia-1-million/
1,2023-08-18,25 countries now face ‘extreme water stress’ every year - three of them are in Europe,u/ethereal3xp,https://www.reddit.com/r/Futurology/comments/15utyid/25_countries_now_face_extreme_water_stress_every/,Futurology,https://www.euronews.com/green/2023/08/17/25-countries-now-face-extreme-water-stress-every-year-three-of-them-are-in-europe
1,2023-08-18,Does anyone know if there is footage of Sergey Brin's recent Q&A at AGI House?,u/anonboxis,https://www.reddit.com/r/Futurology/comments/15uusw1/does_anyone_know_if_there_is_footage_of_sergey/,Futurology,https://www.theverge.com/2023/8/18/23837372/command-line-google-co-founder-sergey-brin-ai
1,2023-08-18,Weird,u/Muted-Passion3176,https://www.reddit.com/r/Futurology/comments/15ux7zg/weird/,Futurology,Hello everyone I hope you guys have a great day I'm abdo or Steven i got sum problems this summer and idk so I'm trying this if it worked if anyone could help with anything or could donate for me it's just for school to buy books and notebooks And registration and also I worked this summer but it wasn't enough I don't wanna take money from my parents cause I don't wanna be Burden that them so if it possible a bit of help would be great from you guys thank you.
1,2023-08-18,Dream Hacking - the Future of Advertising,u/WizRainparanormal,https://www.reddit.com/r/Futurology/comments/15v0jsa/dream_hacking_the_future_of_advertising/,Futurology,https://youtube.com/watch?v=X79THkU1Tk0&feature=share
1,2023-08-18,Dream Hacking - the Future of Advertising,u/WizRainparanormal,https://www.reddit.com/r/Futurology/comments/15v149n/dream_hacking_the_future_of_advertising/,Futurology,https://youtu.be/X79THkU1Tk0
1,2023-08-18,19 [F4M] looking for some hot guys here.want to see my naughty pics? just kik me khatya34,u/khatya34,https://www.reddit.com/r/Futurology/comments/15v1sbc/19_f4m_looking_for_some_hot_guys_herewant_to_see/,Futurology,[removed]
1,2023-08-18,This Police Robot Pulls a Car Over Just Like a Real Officer,u/tiredogarden,https://www.reddit.com/r/Futurology/comments/15v1sut/this_police_robot_pulls_a_car_over_just_like_a/,Futurology,https://interestingengineering.com/video/this-police-robot-pulls-a-car-over-just-like-a-real-officer
1,2023-08-18,This Police Robot Pulls a Car Over Just Like a Real Officer,u/tiredogarden,https://www.reddit.com/r/Futurology/comments/15v1vh1/this_police_robot_pulls_a_car_over_just_like_a/,Futurology,https://interestingengineering.com/video/this-police-robot-pulls-a-car-over-just-like-a-real-officer
1,2023-08-18,Shocking Footage: Unexplained UFO And UAP Sightings,u/DifferentStandard489,https://www.reddit.com/r/Futurology/comments/15v2jpp/shocking_footage_unexplained_ufo_and_uap_sightings/,Futurology,https://youtube.com/watch?v=lthcY5zXdvE&feature=share
1,2023-08-18,What Is Shopify And How Does It Work (2023),u/mrfezu,https://www.reddit.com/r/Futurology/comments/15v4m14/what_is_shopify_and_how_does_it_work_2023/,Futurology,https://earningpksolution.blogspot.com/2023/03/What-Is-Shopify%20.html
1,2023-08-19,How AI will Utterly Transform Society: A New Era of Intelligence,u/PrincipleLevel4529,https://www.reddit.com/r/Futurology/comments/15v71pc/how_ai_will_utterly_transform_society_a_new_era/,Futurology,https://youtu.be/q0JIc7m_J8k
1,2023-08-19,How AI will Utterly Transform Society: A New Era of Intelligence,u/nickg52200,https://www.reddit.com/r/Futurology/comments/15v738u/how_ai_will_utterly_transform_society_a_new_era/,Futurology,https://youtu.be/q0JIc7m_J8k
1,2023-08-19,A video I made on the future of generative AI & Artificial general intelligence,u/nickg52200,https://www.reddit.com/r/Futurology/comments/15v77al/a_video_i_made_on_the_future_of_generative_ai/,Futurology,https://youtu.be/q0JIc7m_J8k
1,2023-08-19,ElijahCods Community Tab,u/Professional_Shift84,https://www.reddit.com/r/Futurology/comments/15v8znr/elijahcods_community_tab/,Futurology,For info on body text call 832999713
1,2023-08-19,Are there any recent studies or articles that examine the socio-economic impact of AI on employment and speculate about the future of jobs and political dynamics?,u/sheisilana,https://www.reddit.com/r/Futurology/comments/15vaicz/are_there_any_recent_studies_or_articles_that/,Futurology,"After browsing through numerous comments on the solarpunk subreddit, I noticed a prevalent leaning towards communism among many users. This led me to wonder about the varying perspectives individuals have on the future based on their income levels and occupations."
1,2023-08-19,Bored right now want to trade nudes? i'm female 21 just k1k me khatya34,u/khatya34,https://www.reddit.com/r/Futurology/comments/15vaofl/bored_right_now_want_to_trade_nudes_im_female_21/,Futurology,[removed]
1,2023-08-19,Highest Mountain From Different Countries,u/davidkim01,https://www.reddit.com/r/Futurology/comments/15vckre/highest_mountain_from_different_countries/,Futurology,https://youtu.be/o2ykGCVC710?si=2Yg30D4y47L4zuW7
1,2023-08-19,No-Code and Low-Code Platforms: The Ultimate Solution for AI Development,u/MAKBTech,https://www.reddit.com/r/Futurology/comments/15vemag/nocode_and_lowcode_platforms_the_ultimate/,Futurology,[removed]
1,2023-08-19,"AI-Created Art Isn’t Copyrightable, Judge Says in Ruling That Could Give Hollywood Studios Pause",u/Pkmatrix0079,https://www.reddit.com/r/Futurology/comments/15vfv3h/aicreated_art_isnt_copyrightable_judge_says_in/,Futurology,https://www.hollywoodreporter.com/business/business-news/ai-works-not-copyrightable-studios-1235570316/
1,2023-08-19,"An AI weapons race may create a world where everyone stays inside out of fear of being 'chased down by swarms of slaughterbots,' warns founding Skype engineer",u/izumi3682,https://www.reddit.com/r/Futurology/comments/15vjb5n/an_ai_weapons_race_may_create_a_world_where/,Futurology,https://www.businessinsider.com/skype-engineer-warns-ai-weapons-race-people-stay-inside-drones-2023-8
1,2023-08-19,Cruise and Waymo see a surge in robotaxi app downloads,u/izumi3682,https://www.reddit.com/r/Futurology/comments/15vk9ea/cruise_and_waymo_see_a_surge_in_robotaxi_app/,Futurology,https://techcrunch.com/2023/08/17/cruise-and-waymo-see-a-surge-in-robotaxi-app-downloads/?guccounter=1&guce_referrer=aHR0cHM6Ly9uZXdzLmdvb2dsZS5jb20v&guce_referrer_sig=AQAAAAByGpQZ3IpbY9TwJw9cTM-6UWhb-Wh5fbjIWSS8qjVFDZ0hwniOuRy0Wh7E75daLdLxvjWMsP_HUQl3ZD-UHFTmM7hmgNJwwwoLRMYFk5ISszg9To4-JKB60Odfkn5KNDux17CYLlp2k5GdZ-Uy4QQ48yhS4EnwlDk6KOcXUL42
1,2023-08-19,Why Are You Afraid of Us? Let's Talk AI with ! 🤖😂🎙️,u/Comed_Ai_n,https://www.reddit.com/r/Futurology/comments/15vl06o/why_are_you_afraid_of_us_lets_talk_ai_with/,Futurology,https://youtu.be/WmcRJbf0rK0
1,2023-08-19,'Gene in part of the brain holds the key to treating severe anxiety disorders',u/Sithlord006,https://www.reddit.com/r/Futurology/comments/15vl3pw/gene_in_part_of_the_brain_holds_the_key_to/,Futurology,https://www.mirror.co.uk/news/health/gene-part-human-brain-holds-30650252
1,2023-08-19,"I created 9,000+ work prompts.",u/TheVellerShow,https://www.reddit.com/r/Futurology/comments/15vljl4/i_created_9000_work_prompts/,Futurology,https://firebasestorage.googleapis.com/v0/b/postly-548c1.appspot.com/o/S8xcdEfVtCV1dyHO-1691420209803-Work%20Skills%20Career%20Cover.png?alt=media&token=3174a90f-c9a6-4840-9e8c-e51bfa4b0c85
1,2023-08-19,How to create screenplays and generate narrated videos using free AI tools,u/1BlueSpork,https://www.reddit.com/r/Futurology/comments/15vm4tp/how_to_create_screenplays_and_generate_narrated/,Futurology,[removed]
1,2023-08-19,Attention deficit disorder evolutionary?,u/BonFemmes,https://www.reddit.com/r/Futurology/comments/15vm69b/attention_deficit_disorder_evolutionary/,Futurology,"A guy I work with has ADD.  He barely made it out of high school. He dropped out of community college.    He had not academic credibility.  

I've watched him work.  He can write code AND listen to podcasts on very technical subjects at the same time.  He sits in meetings answering emails while actively providing excellent insights into whatever problem that are stumping the group.

He tells me that ADD is evolutionary.  It is how mans brain is evolving in a world of increasing distraction.   Nobody had ADD in 1900.  Today its really common. Is ADD evolutionary?"
1,2023-08-19,Engineering Breakthroughs That Will FEED The World,u/mhornberger,https://www.reddit.com/r/Futurology/comments/15vm7zc/engineering_breakthroughs_that_will_feed_the_world/,Futurology,https://youtu.be/tQZM38N9ICo
1,2023-08-19,Any Enterprising Lawyers Trying to Figure Out How To Prevent A.I. From Making Our Jobs Obsolete?,u/Admirable_Size_3914,https://www.reddit.com/r/Futurology/comments/15vmkvf/any_enterprising_lawyers_trying_to_figure_out_how/,Futurology,"With the U.S. patent office saying A.I. created content can't be copyrighted, that got me thinking: How can the law be used to prevent companies from outsourcing our jobs to A.I.? Let's discuss."
1,2023-08-19,AI created this awesome song! I wonder if one day it will be able to created epic soundtracks?,u/Omz_97,https://www.reddit.com/r/Futurology/comments/15vn4cf/ai_created_this_awesome_song_i_wonder_if_one_day/,Futurology,https://www.youtube.com/watch?v=GhJL5P5bA7Y
1,2023-08-19,Video I made on the future of AI and jobs it will automate,u/nickg52200,https://www.reddit.com/r/Futurology/comments/15voxtw/video_i_made_on_the_future_of_ai_and_jobs_it_will/,Futurology,https://youtu.be/q0JIc7m_J8k
1,2023-08-19,Cruise will reduce robotaxi fleet by 50% in San Francisco while California DMV investigates ‘incidents’,u/izumi3682,https://www.reddit.com/r/Futurology/comments/15vpgv2/cruise_will_reduce_robotaxi_fleet_by_50_in_san/,Futurology,https://www.cnbc.com/2023/08/19/cruise-will-reduce-robotaxi-fleet-by-50percent-in-san-francisco.html
1,2023-08-19,This AI Research from UCLA Indicates Large Language Models (such as GPT-3) have Acquired an Emergent Ability to Find Zero-Shot Solutions to a Broad Range of Analogy Problems,u/izumi3682,https://www.reddit.com/r/Futurology/comments/15vqg47/this_ai_research_from_ucla_indicates_large/,Futurology,https://www.marktechpost.com/2023/08/17/this-ai-research-from-ucla-indicates-large-language-models-such-as-gpt-3-have-acquired-an-emergent-ability-to-find-zero-shot-solutions-to-a-broad-range-of-analogy-problems/
1,2023-08-19,What changes will Generation Alpha make to society?,u/Drayko718,https://www.reddit.com/r/Futurology/comments/15vqjrw/what_changes_will_generation_alpha_make_to_society/,Futurology,"People born between 2010 and 2024 will come of age around 2030-2035. 

P.S. No cocomelon jokes please"
1,2023-08-19,Can We Trust ChatGPT and Our New Machine Overlords?,u/SensitiveAd6425,https://www.reddit.com/r/Futurology/comments/15vs2b3/can_we_trust_chatgpt_and_our_new_machine_overlords/,Futurology,https://www.themiddleland.com/can-we-trust-chatgpt-and-our-new-machine-overlords/
1,2023-08-19,"CMV: AI art shouldn’t be treated like something created, it should be treated like something discovered",u/Benmichawl,https://www.reddit.com/r/Futurology/comments/15vuuf3/cmv_ai_art_shouldnt_be_treated_like_something/,Futurology,[removed]
1,2023-08-19,Video Games and the Future of Education,u/justicecalawayog,https://www.reddit.com/r/Futurology/comments/15vv55q/video_games_and_the_future_of_education/,Futurology,https://www.youtube.com/watch?v=xPEo0uGhCQU&ab_channel=%E5%8C%BF%E5%90%8D
1,2023-08-19,"""Navigating Success with Jupiter Grades: A Comprehensive Overview""",u/BeingCounselling23,https://www.reddit.com/r/Futurology/comments/15vyjl4/navigating_success_with_jupiter_grades_a/,Futurology,https://beingcounselling.com/jupiter-grades/
1,2023-08-19,Big Oil is Going Green,u/416SuitGuy,https://www.reddit.com/r/Futurology/comments/15w0f9n/big_oil_is_going_green/,Futurology,https://www.thenew.money/article/big-oil-is-going-green
1,2023-08-20,"PlexiFlow, Where AI Meets Blockchain",u/WordofDoge,https://www.reddit.com/r/Futurology/comments/15w3m8m/plexiflow_where_ai_meets_blockchain/,Futurology,https://plexiflow.com
1,2023-08-20,Who is Linus Sebastian? Linus Tech Tips suddenly became mired in controversy,u/Celebsweekcom,https://www.reddit.com/r/Futurology/comments/15w63s6/who_is_linus_sebastian_linus_tech_tips_suddenly/,Futurology,https://www.celebsweek.com/linus-sebastian/
1,2023-08-20,How to make money with Crypto Mining Passive daily income,u/kierstin743,https://www.reddit.com/r/Futurology/comments/15w74ht/how_to_make_money_with_crypto_mining_passive/,Futurology,[removed]
