score,date,title,author,url,subreddit,text
1,2023-07-31,Willkommen am Anfang.,u/DieLetzenSozios,https://www.reddit.com/r/Futurology/comments/15ezjpf/willkommen_am_anfang/,Futurology,[removed]
1,2023-07-31,"Do you guys know any full body entire exercise routines that are 100% optimized for maximizing longevity (not for looks, bodybuilding etc.), other than blueprint?",u/hardworkforgrowth,https://www.reddit.com/r/Futurology/comments/15f07q1/do_you_guys_know_any_full_body_entire_exercise/,Futurology,"I want it to be optimized in the sense that every work out is done on purpose to ensure that can I live as long as possible while ideally also having a functional body and minimizing injury risk. Muscle size and performance in extreme or niche scenarios is irrelevant to me.

I have 10 years of experience working out and already looked at Bryan Johnson's blueprint, but apparently it was designed by his 18 year-old son so I don't really think it's reliable as something to commit to. My work outs were also more performance or bodybuilding focused, so I'm discarding them."
1,2023-07-31,Berkley Material Sciences corroborate Room Temperature Superconductor Research,u/EckhartsLadder,https://www.reddit.com/r/Futurology/comments/15f1axs/berkley_material_sciences_corroborate_room/,Futurology,https://arxiv.org/abs/2307.16892
1,2023-07-31,Protein in Cow's Milk Speeds Wound Healing,u/dmitry-pustovoit,https://www.reddit.com/r/Futurology/comments/15f1g4p/protein_in_cows_milk_speeds_wound_healing/,Futurology,https://www.laboratoryequipment.com/598751-Protein-in-Cow-s-Milk-Speeds-Wound-Healing/
1,2023-08-01,Silly Thoughts,u/Gantzen,https://www.reddit.com/r/Futurology/comments/15f1u3s/silly_thoughts/,Futurology,"I was sitting here thinking. what would happen if we had some super computer network, say like CERN has, can train an AI Chat bot on the Internet as a whole. Then I thought, was is the likelihood that the AI that takes on the personality of a Nigerian Prince wants to send you a $10,000,000 if you help him escape the country, but somehow the conversation always somehow turns into an advertisement for Viagra."
1,2023-08-01,Is this a dangerous level of misinformation or am I just confused?,u/soundgarden777,https://www.reddit.com/r/Futurology/comments/15f22hd/is_this_a_dangerous_level_of_misinformation_or_am/,Futurology,https://youtu.be/p3mYOtEqdaU
1,2023-08-01,Living on the 🌙,u/retleo08,https://www.reddit.com/r/Futurology/comments/15f3b4z/living_on_the/,Futurology,Would creating room caves on the moon be a safe alternative to living in 3D printed building on the moon surface? Would the caves be airtight?
1,2023-08-01,Will deep learning be needed for any future tech/science discoveries?,u/Milk_Man21,https://www.reddit.com/r/Futurology/comments/15f3bwk/will_deep_learning_be_needed_for_any_future/,Futurology,"What I mean is that it's possible we've gotten all the ""low hanging fruit"", and even a team would be unable to effectively come up with new tech and science."
1,2023-08-01,How Is AI Used in Android App Development?,u/Rlogical_Techsoft,https://www.reddit.com/r/Futurology/comments/15f58w3/how_is_ai_used_in_android_app_development/,Futurology,https://ai.plainenglish.io/how-is-ai-used-in-android-app-development-2a000fd94c76
1,2023-08-01,Is this all misinformation?,u/soundgarden777,https://www.reddit.com/r/Futurology/comments/15f5ab9/is_this_all_misinformation/,Futurology,https://youtu.be/p3mYOtEqdaU
1,2023-08-01,Mbappe New info,u/NoCoyote8868,https://www.reddit.com/r/Futurology/comments/15f5jaj/mbappe_new_info/,Futurology,[removed]
1,2023-08-01,High probability of LK-99 being real - Lawrence Berkeley National Lab,u/n035,https://www.reddit.com/r/Futurology/comments/15f5mci/high_probability_of_lk99_being_real_lawrence/,Futurology,https://twitter.com/Andercot/status/1686215574177841152
1,2023-08-01,"July's heat waves, high ocean temperatures shows extreme weather to come",u/Brave-Drag3336,https://www.reddit.com/r/Futurology/comments/15f5n5b/julys_heat_waves_high_ocean_temperatures_shows/,Futurology,https://ghostarchive.org/archive/tyrRg
1,2023-08-01,First successful reproduction of LK-99 ?,u/Virtual_Reveal_121,https://www.reddit.com/r/Futurology/comments/15f6mbx/first_successful_reproduction_of_lk99/,Futurology,https://twitter.com/Andercot/status/1686286684424691712?t=Qiu9bukFP6JGsckLQxhAtA&s=19
1,2023-08-01,First successful replication of LK-99 ?,u/Virtual_Reveal_121,https://www.reddit.com/r/Futurology/comments/15f6na9/first_successful_replication_of_lk99/,Futurology,https://twitter.com/Andercot/status/1686286684424691712?t=Qiu9bukFP6JGsckLQxhAtA&s=19
1,2023-08-01,First replication of LK-99 ?,u/Virtual_Reveal_121,https://www.reddit.com/r/Futurology/comments/15f6r0m/first_replication_of_lk99/,Futurology,https://m.bilibili.com/opus/824788851023151224
1,2023-08-01,"Supposedly Scientists Huazhong University of Science and Technology successfully synthesized LK-99 ""room temperature superconducting crystal"" that can be magnetically levitated",u/Virtual_Reveal_121,https://www.reddit.com/r/Futurology/comments/15f6s5g/supposedly_scientists_huazhong_university_of/,Futurology,https://www.bilibili.com/opus/824788851023151224
1,2023-08-01,Clothing 101 Book,u/ElkCute1216,https://www.reddit.com/r/Futurology/comments/15f8zqj/clothing_101_book/,Futurology,[removed]
1,2023-08-01,A dark fiction world based on today facts,u/voidionn,https://www.reddit.com/r/Futurology/comments/15f8zqn/a_dark_fiction_world_based_on_today_facts/,Futurology,[removed]
1,2023-08-01,Meta to Launch AI-Powered Personas Like Abraham Lincoln: Report,u/rudy_batts,https://www.reddit.com/r/Futurology/comments/15f9hr0/meta_to_launch_aipowered_personas_like_abraham/,Futurology,https://tokenist.com/meta-to-launch-ai-powered-personas-like-abraham-lincoln-report/
1,2023-08-01,Try a game I made about the EU AI Act,u/Mossy-Man,https://www.reddit.com/r/Futurology/comments/15fa8s2/try_a_game_i_made_about_the_eu_ai_act/,Futurology,[removed]
1,2023-08-01,China Lays Out Plan to Accelerate Lunar Ambitions,u/Gari_305,https://www.reddit.com/r/Futurology/comments/15fb66n/china_lays_out_plan_to_accelerate_lunar_ambitions/,Futurology,https://spaceref.com/science-and-exploration/china-lays-out-plan-to-accelerate-lunar-ambitions/
1,2023-08-01,"Remote and hybrid jobs are making a comeback—businesses have a ‘requirement to be flexible,’ says expert",u/Arbrevoiture,https://www.reddit.com/r/Futurology/comments/15fc7mm/remote_and_hybrid_jobs_are_making_a/,Futurology,https://www.cnbc.com/2023/07/17/remote-and-hybrid-jobs-are-making-a-comeback-heres-why.html
1,2023-08-01,3D-printed hearts on ISS could help astronauts travel to deep space,u/spacedotc0m,https://www.reddit.com/r/Futurology/comments/15fcy7v/3dprinted_hearts_on_iss_could_help_astronauts/,Futurology,https://www.space.com/international-space-station-3d-printed-hearts-astronauts-deep-space-travel
1,2023-08-01,"TikTok, YouTube Influencers Pressured by Brands to Buy Insurance | Companies that contract with influencers are beginning to demand that even second-tier social media personalities buy insurance protection against legal action",u/bloomberglaw,https://www.reddit.com/r/Futurology/comments/15fdy55/tiktok_youtube_influencers_pressured_by_brands_to/,Futurology,https://news.bloomberglaw.com/insurance/tiktok-youtube-influencers-pressured-by-brands-to-buy-insurance
1,2023-08-01,Blue Origin has been awarded $35 million in funding from NASA to improve the company’s commercial solution that produces silicon from lunar regolith. The funding will result in a demonstration of autonomous operation in a simulated lunar environment by 2026.,u/PorkyPigDid911,https://www.reddit.com/r/Futurology/comments/15fe4b8/blue_origin_has_been_awarded_35_million_in/,Futurology,https://pv-magazine-usa.com/2023/07/31/renewed-efforts-to-build-solar-cells-from-moondust/
1,2023-08-01,How did you know about LK99 so many days before me?,u/4laman_,https://www.reddit.com/r/Futurology/comments/15fek2w/how_did_you_know_about_lk99_so_many_days_before_me/,Futurology,[removed]
1,2023-08-01,Is Elon Musk an alien?,u/zidan-saha,https://www.reddit.com/r/Futurology/comments/15ffgsh/is_elon_musk_an_alien/,Futurology,[removed]
1,2023-08-01,simple superconducting diode created by MIT scientists,u/WaitformeBumblebee,https://www.reddit.com/r/Futurology/comments/15fgq8k/simple_superconducting_diode_created_by_mit/,Futurology,https://physics.mit.edu/news/team-creates-simple-superconducting-device-that-could-dramatically-cut-energy-use-in-computing-among-other-important-applications/
1,2023-08-01,Ramifications of human augmentation for aesthetic or identity purposes,u/TheRappingSquid,https://www.reddit.com/r/Futurology/comments/15fi0hv/ramifications_of_human_augmentation_for_aesthetic/,Futurology,"So, I think we can all agree that on an individual basis, some people are just genetically shafted.  Guys with pattern baldness, for example, or trans folk who have their egg cracked after puberty.  Hell, even people that would rather just have green eyes over blue.  We'd probably all be better off if we were able to directly change out bodies I align with what we wish to be, which is probably a given.  However, in this hypothetical world where all this is possible, could it lead to trends halting diversity?  If a single look, for example, is seen as attractive, so everyone changes to fit into it, wouldn't everyone just be the same?  Would this even be a bad thing, or just a different thing?"
1,2023-08-01,is there any stock that i can invest related to LK-99 Superconductor ?,u/Marcus_Aguiar,https://www.reddit.com/r/Futurology/comments/15fj9ld/is_there_any_stock_that_i_can_invest_related_to/,Futurology,"Is no surprise to everyone that if the rumors are correct , it should be one of the best advances of humanity in a while. Is there anything related to this topic at all that i could/should invest ? Yeah , i know... DYOR.. so here i am searching at least"
1,2023-08-01,Potential cancer breakthrough as pill destroys ALL solid tumors,u/BousWakebo,https://www.reddit.com/r/Futurology/comments/15fktu3/potential_cancer_breakthrough_as_pill_destroys/,Futurology,https://www.dailymail.co.uk/health/article-12360701/amp/Potential-cancer-breakthrough-groundbreaking-pill-annihilates-types-solid-tumors-early-study.html
1,2023-08-01,Shocking Footage: 6 Unexplained UFO Sightings V40,u/DifferentStandard489,https://www.reddit.com/r/Futurology/comments/15fl0gs/shocking_footage_6_unexplained_ufo_sightings_v40/,Futurology,https://youtube.com/watch?v=hRJFmsX862Y&feature=share
2658,2023-08-01,Canada will be the first nation to start printing warnings directly onto individual cigarettes in a bid to deter young people from starting smoking and encourage others to quit,u/thebelsnickle1991,https://www.reddit.com/r/Futurology/comments/15fn0nu/canada_will_be_the_first_nation_to_start_printing/,Futurology,https://www.bbc.co.uk/news/world-us-canada-66364465
1,2023-08-01,Euclid telescope shares its first glimpses of the universe | CNN,u/ScienceWorld92,https://www.reddit.com/r/Futurology/comments/15fnpw6/euclid_telescope_shares_its_first_glimpses_of_the/,Futurology,https://edition.cnn.com/2023/08/01/world/euclid-telescope-first-test-images-scn/index.html
1,2023-08-01,Frameless Solar Panels Introduced in Australia,u/Fickle-Flamingo1922,https://www.reddit.com/r/Futurology/comments/15fp475/frameless_solar_panels_introduced_in_australia/,Futurology,[removed]
1,2023-08-01,"This platform uses AI to write news articles, generate images, and generate analysis all automatically. Basically AI automating journalism.",u/gronkulus,https://www.reddit.com/r/Futurology/comments/15fqcg5/this_platform_uses_ai_to_write_news_articles/,Futurology,https://current.report/
1,2023-08-01,"This platform uses AI to write news articles, generate images, and generate analysis all automatically",u/gronkulus,https://www.reddit.com/r/Futurology/comments/15frblf/this_platform_uses_ai_to_write_news_articles/,Futurology,https://current.report/
1,2023-08-01,🌐🚀 The Sphere: Revolutionizing Social Networks with Ai Magic! 🤖✨,u/AugmentedGlobal,https://www.reddit.com/r/Futurology/comments/15fuu9g/the_sphere_revolutionizing_social_networks_with/,Futurology,https://thesphere.social/
1,2023-08-01,"If LK99 is real, does that not make AGI inevitable",u/illusion_ahead,https://www.reddit.com/r/Futurology/comments/15fw2dl/if_lk99_is_real_does_that_not_make_agi_inevitable/,Futurology,"*If* it is a real superconductor and all that stuff, would the massive boost to computing make AGI a matter of (a short amount of) time?
As in it speeds up AI development and improvement like nothing ever seen before.
Or not. I don't know, that's why I'm asking."
1,2023-08-02,Predicting earthquakes is currently impossible. GPS data could help change that,u/dmitry-pustovoit,https://www.reddit.com/r/Futurology/comments/15fza2k/predicting_earthquakes_is_currently_impossible/,Futurology,https://www.livescience.com/planet-earth/earthquakes/predicting-earthquakes-is-currently-impossible-gps-data-could-help-change-that
1,2023-08-02,Is Ai ethical?,u/Pale-Question2609,https://www.reddit.com/r/Futurology/comments/15g2afm/is_ai_ethical/,Futurology,https://the-aiguy.medium.com/the-ethics-of-ai-cb8823df9d8b
1,2023-08-02,Apple iBaby Commercial - Dystopian Take into The Future,u/Opening-Ad5541,https://www.reddit.com/r/Futurology/comments/15g2p7h/apple_ibaby_commercial_dystopian_take_into_the/,Futurology,https://youtube.com/watch?v=9OSkALThuvM&feature=share
1,2023-08-02,Apple iBaby Commercial - Dystopian Take into The Future,u/Opening-Ad5541,https://www.reddit.com/r/Futurology/comments/15g3gnc/apple_ibaby_commercial_dystopian_take_into_the/,Futurology,https://youtube.com/watch?v=9OSkALThuvM&feature=share
1,2023-08-02,Finding fun activities ideas for our companion,u/AtumXofficial,https://www.reddit.com/r/Futurology/comments/15g46wl/finding_fun_activities_ideas_for_our_companion/,Futurology,https://www.instagram.com/reel/Ct_f59VutJH/?igshid=MzRlODBiNWFlZA==
1,2023-08-02,Need fun ideas for our companion.,u/AtumXofficial,https://www.reddit.com/r/Futurology/comments/15g4a28/need_fun_ideas_for_our_companion/,Futurology,https://drive.google.com/file/d/1L14gAe5EVOQltoCVTwQ9evxOiMBgkLHV/view?usp=drivesdk
1,2023-08-02,NexusGPT Premium One-Time Plan,u/Mustafa_409,https://www.reddit.com/r/Futurology/comments/15g5can/nexusgpt_premium_onetime_plan/,Futurology,[removed]
1,2023-08-02,Teesside Airport To Gain Hydrogen Refuelling Station After Funding Success,u/daliksheppy,https://www.reddit.com/r/Futurology/comments/15g5t3o/teesside_airport_to_gain_hydrogen_refuelling/,Futurology,https://teesvalley-ca.gov.uk/news/teesside-airport-to-gain-hydrogen-refuelling-station-after-funding-success/?utm_source=Twitter&utm_medium=social&utm_campaign=Orlo
1,2023-08-02,‘Cancer-stopping’ drug ‘annihilates’ solid cancerous tumours - it targets a protein in all cancers,u/Huijausta,https://www.reddit.com/r/Futurology/comments/15g8d8v/cancerstopping_drug_annihilates_solid_cancerous/,Futurology,https://archive.md/sCg9z
1,2023-08-02,AI-supported mammography screening resulted in a similar cancer detection rate compared with standard double reading in a randomized controlled trial,u/sinefromabove,https://www.reddit.com/r/Futurology/comments/15g8xtj/aisupported_mammography_screening_resulted_in_a/,Futurology,https://www.thelancet.com/journals/lanonc/article/PIIS1470-2045(23)00298-X/fulltext
1,2023-08-02,Researchers Discover Universal Attack to Manipulate AI Chatbots,u/InvestigatorOldd,https://www.reddit.com/r/Futurology/comments/15ga90t/researchers_discover_universal_attack_to/,Futurology,https://securnerd.com/researchers-discover-universal-attack-to-manipulate-ai-chatbots/
1,2023-08-02,"America’s Manufacturing Renaissance: What Changed in a Year? The Inflation Reduction Act seeks to revive manufacturing in the U.S. How did we get to the point of needing this intervention? One year in, the law has already unleashed a manufacturing renaissance.",u/mafco,https://www.reddit.com/r/Futurology/comments/15gbe9o/americas_manufacturing_renaissance_what_changed/,Futurology,https://themessenger.com/opinion/americas-manufacturing-renaissance-what-changed-in-a-year
1,2023-08-02,Are Biological Neural Networks (BNN) and Spiking Neural Networks (SNN) the Future of Robotics? (Literature Review of the Latest BNN and SNN Endeavors),u/No-Platypus4021,https://www.reddit.com/r/Futurology/comments/15gbj8y/are_biological_neural_networks_bnn_and_spiking/,Futurology,https://www.youtube.com/watch?v=le7kBjhTE_w
1,2023-08-02,Glass-coated DNA Five Times Lighter and Four Times Stronger Than Steel,u/Time_Reputation3573,https://www.reddit.com/r/Futurology/comments/15gci74/glasscoated_dna_five_times_lighter_and_four_times/,Futurology,[removed]
1,2023-08-02,Interested in 3D data but don't know where to begin? Here's a great overview of 3D data!,u/stitch_3d,https://www.reddit.com/r/Futurology/comments/15gcsh3/interested_in_3d_data_but_dont_know_where_to/,Futurology,https://www.stitch3d.io/blog/post/understanding-the-fascinating-world-of-3d-data/?utm_source=reddit&utm_medium=blog&utm_campaign=blog1
1,2023-08-02,Meta releases AudioCraft AI tool to create music from text| now audio will be clear even in GPRS/EDGE internet,u/Nearby-Illustrator86,https://www.reddit.com/r/Futurology/comments/15gdbk5/meta_releases_audiocraft_ai_tool_to_create_music/,Futurology,https://youtu.be/NzW1cQdSOmo
1,2023-08-02,"Young workers are flocking to renewable jobs, but the sector remains short on labor, reports show",u/dianadigangi,https://www.reddit.com/r/Futurology/comments/15gdc5i/young_workers_are_flocking_to_renewable_jobs_but/,Futurology,https://www.utilitydive.com/news/workers-gen-z-renewable-energy-industry-solar-workforce/689271/
1,2023-08-02,This rapper was generated via AI,u/DANGERD0OM,https://www.reddit.com/r/Futurology/comments/15gegoz/this_rapper_was_generated_via_ai/,Futurology,https://youtu.be/OBHKL01n5Uo
1,2023-08-02,This Heat Is Shaking the Very Foundation of the Ocean Food Web,u/altbekannt,https://www.reddit.com/r/Futurology/comments/15getio/this_heat_is_shaking_the_very_foundation_of_the/,Futurology,https://www.wired.com/story/this-heat-is-shaking-the-very-foundation-of-the-ocean-food-web/
1,2023-08-02,"Korean team claims to have created the first room-temperature, ambient-pressure superconductor",u/Avieshek,https://www.reddit.com/r/Futurology/comments/15gg0sr/korean_team_claims_to_have_created_the_first/,Futurology,https://phys.org/news/2023-07-korean-team-room-temperature-ambient-pressure-superconductor.html
1,2023-08-02,Agnostic,u/ErrorSuspicious8357,https://www.reddit.com/r/Futurology/comments/15ghflj/agnostic/,Futurology,If the Rapture is ever going to happen. It will probably happen before AGI
1,2023-08-02,"Longshot, a startup that has received US military funding, is testing a system to launch cargo into space at Mach 30 from several kilometer long concrete tunnels.",u/lughnasadh,https://www.reddit.com/r/Futurology/comments/15gio2t/longshot_a_startup_that_has_received_us_military/,Futurology,https://techcrunch.com/2023/07/10/longshot-space-wants-to-make-space-launch-dumb-and-really-cheap-too/?
1,2023-08-02,Should we just not study age rejuvenation?,u/TheRappingSquid,https://www.reddit.com/r/Futurology/comments/15giv1g/should_we_just_not_study_age_rejuvenation/,Futurology,"Alright, so I made a post about genetic altering of the body and it's effects on human diversity, I wanna try tackling something else now.  Everyone pretty much likes the idea of not growing older.  People like the idea of avoiding the pratfalls of age, to keep our hair, to not suffer any organ loss, etc.  Whether it be cosmetic or functional, people want to keep their youth, generally.  So, there's been PLEEEENTY of research on the topic (like David Sinclair, although all we get from that is the same recycled article about the mouse over and over again so who knows if that's actually going to amount to anything), but are we maybe rushing into this?  I feel like some people take aging for granted, and the roles it plays in society.  As someone who WANTS to support this sort of technology (although let's face it, it probably won't happen in my lifetime and I'm only 20), I can't help but feel reserved.  A lot of our morals, goals, and overall experience being alive is driven by death and age.  We move forward as to not be left behind.  We think up of knew ideas to let the future generations lead better lives than our's.  But, were we to remove this barrier, could we be certain that growth would still occur in our species?  Even down to an individual level?  Would those lessons we learn as we age just never end up coming to us?  Would the lifestyle changes that accompanies growing older just never happen?  Would dating change?  Would it be seen as okay to go out with someone 100 years older than you if you're both over 18, and physically the same? I'm not even going to get into overpopulation, but just on a single level, how could we grow mentally and emotionally if our bodies and brains don't age physically?  Would we even need to grow at all, if the threat of old age and death wasn't looming over us?  Idk, it all seems a bit much to fathom."
1,2023-08-02,"New podcast about humanity, civilization, and the fate of the world",u/humannatureodyssey,https://www.reddit.com/r/Futurology/comments/15gizhc/new_podcast_about_humanity_civilization_and_the/,Futurology,https://linktr.ee/humannatureodyssey
1,2023-08-02,Social Media Manager Template is out!,u/frhnhq,https://www.reddit.com/r/Futurology/comments/15gjyvp/social_media_manager_template_is_out/,Futurology,[removed]
1,2023-08-02,"US Spy Community Wants to ID Threats Posed by Tech Behind ChatGPT, LLMs",u/egusa,https://www.reddit.com/r/Futurology/comments/15gl662/us_spy_community_wants_to_id_threats_posed_by/,Futurology,https://sociable.co/government-and-policy/spy-community-threats-tech-chatgpt-language-models/
1,2023-08-02,Wood wind turbines outperform their counterparts. The IKEA of wind turbines?,u/chfp,https://www.reddit.com/r/Futurology/comments/15gnonq/wood_wind_turbines_outperform_their_counterparts/,Futurology,https://www.thecooldown.com/green-tech/modvion-wooden-wind-turbine-sweden/
1,2023-08-02,The team of Southeast University observed zero resistance below 110 K.,u/bartturner,https://www.reddit.com/r/Futurology/comments/15go1zr/the_team_of_southeast_university_observed_zero/,Futurology,https://twitter.com/lipez400/status/1686793608626663441
1,2023-08-02,This rapper was generated via AI,u/DANGERD0OM,https://www.reddit.com/r/Futurology/comments/15gop9o/this_rapper_was_generated_via_ai/,Futurology,https://youtu.be/OBHKL01n5Uo
1,2023-08-02,Scientists Create New Material Five Times Lighter and Four Times Stronger Than Steel,u/Dr_Singularity,https://www.reddit.com/r/Futurology/comments/15gozr8/scientists_create_new_material_five_times_lighter/,Futurology,https://scitechdaily.com/scientists-create-new-material-five-times-lighter-and-four-times-stronger-than-steel/
1,2023-08-02,Tom Scott Visits a New Cryonics Facility in Switzerland,u/CryonicsGandhi,https://www.reddit.com/r/Futurology/comments/15gp4o6/tom_scott_visits_a_new_cryonics_facility_in/,Futurology,https://www.youtube.com/watch?v=85BykUan6pw
1,2023-08-02,Shocking Footage: 6 Unexplained UFO And UAP Sightings V41,u/DifferentStandard489,https://www.reddit.com/r/Futurology/comments/15gqv4v/shocking_footage_6_unexplained_ufo_and_uap/,Futurology,https://youtube.com/watch?v=c2tbl4ZvRQo&feature=share
1,2023-08-02,Infobot Internet Tips: TikTok Safety,u/otrebor1605,https://www.reddit.com/r/Futurology/comments/15grf86/infobot_internet_tips_tiktok_safety/,Futurology,https://youtu.be/EXMJEDacZgc
1,2023-08-02,Wood wind turbines outperform their counterparts. The IKEA of wind turbines?,u/chfp,https://www.reddit.com/r/Futurology/comments/15gt6w9/wood_wind_turbines_outperform_their_counterparts/,Futurology,https://www.thecooldown.com/green-tech/modvion-wooden-wind-turbine-sweden/
1,2023-08-03,"Martian Airlines..Alien Cinematic Music, Little Green Martian Records Ma...",u/Ok_Pop7586,https://www.reddit.com/r/Futurology/comments/15gud3e/martian_airlinesalien_cinematic_music_little/,Futurology,https://youtube.com/watch?v=gDW9SvNeRyo&feature=share
1,2023-08-03,How Is Artificial Intelligence (AI) Used in Android App Development?,u/Rlogical_Techsoft,https://www.reddit.com/r/Futurology/comments/15gv8xl/how_is_artificial_intelligence_ai_used_in_android/,Futurology,[removed]
1,2023-08-03,Does anybody else feel that the advent of AI is accelerating tech advancement?,u/Milk_Man21,https://www.reddit.com/r/Futurology/comments/15gvqxm/does_anybody_else_feel_that_the_advent_of_ai_is/,Futurology,"Like, AI made cool new materials and it helped design new GPUs. It seems so cool. What next, a new battery that can last weeks on a single charge?"
1,2023-08-03,Small molecule oral cancer drug kills 100% of solid tumors across 70 evaluated cancer types in vitro and in animal models with a therapeutic index of 6 and no discernible side effects. Phase 1 trials are now underway,u/0zi1,https://www.reddit.com/r/Futurology/comments/15gzfvy/small_molecule_oral_cancer_drug_kills_100_of/,Futurology,https://www.cell.com/cell-chemical-biology/pdfExtended/S2451-9456(23)00221-0
1,2023-08-03,Microsoft Intensifies Commitment to Generative AI with Copilot Pricing and New AI Skills,u/cybersourcenews,https://www.reddit.com/r/Futurology/comments/15h0wp9/microsoft_intensifies_commitment_to_generative_ai/,Futurology,https://securnerd.com/microsoft-intensifies-commitment-to-generative-ai-with-copilot-pricing-and-new-ai-skills/
1,2023-08-03,"Paquik | Send & Save, Travel & Earn",u/GeorgeAntaki,https://www.reddit.com/r/Futurology/comments/15h0wpu/paquik_send_save_travel_earn/,Futurology,https://l.linklyhq.com/l/1sGxI
