score,date,title,author,url,subreddit,text
1,2023-08-11,The US just invested more than $1 billion in carbon removal,u/climeworks,https://www.reddit.com/r/Futurology/comments/15o90o0/the_us_just_invested_more_than_1_billion_in/,Futurology,https://www.technologyreview.com/2023/08/11/1077756/the-us-just-invested-more-than-1-billion-into-carbon-removal/
1,2023-08-11,Chinese scientists achieve laser weapon technology ‘breakthrough’ - High-energy laser weapons can now operate ‘infinitely’ thanks to a new cooling system that completely eliminates the build-up of waste heat,u/Gari_305,https://www.reddit.com/r/Futurology/comments/15o97ul/chinese_scientists_achieve_laser_weapon/,Futurology,https://www.scmp.com/news/china/science/article/3230589/chinese-military-scientists-claim-have-achieved-huge-breakthrough-laser-weapon-technology
1,2023-08-11,Future wars will turn on space-cyber-special operations triad: Army SOF chief,u/Gari_305,https://www.reddit.com/r/Futurology/comments/15o9hwk/future_wars_will_turn_on_spacecyberspecial/,Futurology,https://www.defenseone.com/policy/2023/08/space-cyber-special-operations-triad-critical-future-wars-says-army-special-operations-head/389243/
1,2023-08-11,Scientist Unveils a Bold Plan to Turn an Asteroid Into a Space Habitat,u/Gari_305,https://www.reddit.com/r/Futurology/comments/15oa2k7/scientist_unveils_a_bold_plan_to_turn_an_asteroid/,Futurology,https://www.guardianmag.us/2023/08/scientists-plan-to-transform-asteroids.html?m=1
1,2023-08-11,Generative AI and future of OnlyFans-like platforms,u/petburiraja,https://www.reddit.com/r/Futurology/comments/15oayfj/generative_ai_and_future_of_onlyfanslike_platforms/,Futurology,"As generative AI now able to produce top notch content, visual and textual (including NSFW), I wonder what is the future of OF adult content creators.

Apparently, there are several girlfriend experience services already exists, which leverage AI to generate very realistic photos and to support a meaningful dialogue with user. 

It seems no way any OnlyFans (and Instagram?) models can compete with that.

Thoughts?"
1,2023-08-11,Why you shouldn't mix Barbie with biased AI Image Generators,u/jonc1234,https://www.reddit.com/r/Futurology/comments/15ob3av/why_you_shouldnt_mix_barbie_with_biased_ai_image/,Futurology,https://www.youtube.com/watch?v=L2sQRrf1Cd8
1,2023-08-11,"World’s largest study shows the more you walk, the lower your risk of death, even if you walk fewer than 5,000 steps",u/myself-tracker,https://www.reddit.com/r/Futurology/comments/15ob3cy/worlds_largest_study_shows_the_more_you_walk_the/,Futurology,https://www.escardio.org/The-ESC/Press-Office/Press-releases/World-s-largest-study-shows-the-more-you-walk-the-lower-your-risk-of-death-even-if-you-walk-fewer-than-5-000-steps
1,2023-08-11,Insect population: let's get practical,u/TTTRIOS,https://www.reddit.com/r/Futurology/comments/15ocb12/insect_population_lets_get_practical/,Futurology,"I've recently become aware of the insect population decline due to various factors like pesticides, climate change, industrialization, city building, etc. Hardly anyone talks about it, despite how apparently serious it is. As a result, there's hardly any news articles on the issue other than the occasional article by the guardian, nor is there much discussion on it aside from people saying ""I used to see lots of insects before but not anymore""

So skipping the initial ""we're all gonna die"" reaction and getting more into practical talk, I've made this post to get insight from people who're more informed in this than me. Can we have a practical discussion on the human implications of this decline in the present and future? What could humanity do to adapt to this pressing issue? Are there any indications of this adaptation today?"
1,2023-08-11,Your Voice Matters in Our Project!,u/[deleted],https://www.reddit.com/r/Futurology/comments/15occrl/your_voice_matters_in_our_project/,Futurology,[removed]
1,2023-08-11,Geppetto AI Game and Film creation,u/Healthy-Tech,https://www.reddit.com/r/Futurology/comments/15ocdp4/geppetto_ai_game_and_film_creation/,Futurology,https://form.zootools.co/go/55mOpnZtO7JD0Kz7vsCQ?ref=pxxYBvLjm5JQlWmbLMCf
1,2023-08-11,"The Case Against AI Everything, Everywhere, All at Once",u/brianswichkow,https://www.reddit.com/r/Futurology/comments/15odavt/the_case_against_ai_everything_everywhere_all_at/,Futurology,https://time.com/6302761/ai-risks-autonomy/
1,2023-08-11,Why you shouldn't mix Barbie with biased AI Image Generators,u/jonc1234,https://www.reddit.com/r/Futurology/comments/15odir8/why_you_shouldnt_mix_barbie_with_biased_ai_image/,Futurology,"Buzzfeed recently published a now deleted article on what AI thinks Barbies would look like from different countries around the world.  
The results contained extreme forms of representational bias - including colourist and racist depictions of Barbies from Germany in uniforms reminiscent of SS Nazi uniforms, and Barbies from South Sudan holding guns.

Are these sorts of representational bias a problem for society? Should governments try to regulate these harms? Or are these images fair reflections of the reality we live in? Or is none of this a big deal at all?"
1,2023-08-11,Why you shouldn't mix Barbie with biased AI Image Generators,u/jonc1234,https://www.reddit.com/r/Futurology/comments/15odrya/why_you_shouldnt_mix_barbie_with_biased_ai_image/,Futurology,https://youtu.be/L2sQRrf1Cd8
1,2023-08-11,Could an AI write Spare? Take our quiz to spot the fake literary intros,u/TheTelegraph,https://www.reddit.com/r/Futurology/comments/15oitcr/could_an_ai_write_spare_take_our_quiz_to_spot_the/,Futurology,https://www.telegraph.co.uk/technology/2023/08/11/ai-imitating-author-literature-publishing-amazon/
1,2023-08-11,What is science -no more than monkey homo sapiens big noting itself,u/qiling,https://www.reddit.com/r/Futurology/comments/15oj3gh/what_is_science_no_more_than_monkey_homo_sapiens/,Futurology,https://www.scribd.com/document/660607834/Scientific-Reality-is-Only-the-Reality-of-a-Monkey
1,2023-08-11,Moon mining - Why major powers are eyeing a lunar gold rush?,u/MaleficentParfait863,https://www.reddit.com/r/Futurology/comments/15omeuj/moon_mining_why_major_powers_are_eyeing_a_lunar/,Futurology,https://www.reuters.com/technology/space/moon-mining-why-major-powers-are-eyeing-lunar-gold-rush-2023-08-11/
1,2023-08-11,General fusion plans new fusion demo machine,u/Ok_University_1395,https://www.reddit.com/r/Futurology/comments/15ompqk/general_fusion_plans_new_fusion_demo_machine/,Futurology,[removed]
1,2023-08-11,Shocking Footage: 6 Unexplained UFO And UAP Sightings V49,u/DifferentStandard489,https://www.reddit.com/r/Futurology/comments/15oqn47/shocking_footage_6_unexplained_ufo_and_uap/,Futurology,https://youtube.com/watch?v=i_z-BiN0b7g&feature=share
1,2023-08-11,Shocking Footage: 6 Unexplained UFO And UAP Sightings V49,u/DifferentStandard489,https://www.reddit.com/r/Futurology/comments/15oqqpl/shocking_footage_6_unexplained_ufo_and_uap/,Futurology,https://youtube.com/watch?v=i_z-BiN0b7g&feature=share
1,2023-08-11,What / how much will realistically change in the foreseeable future?,u/Phoenix5869,https://www.reddit.com/r/Futurology/comments/15osr05/what_how_much_will_realistically_change_in_the/,Futurology,"I’ve been thinking about this a lot, actually. Printed organs,  AGI, Miracle stem cell cures, CRISPR gene therapy, nanobots, precision, personalised, and regenerative medicine, self driving cars, etc are all constantly hyped.

But then I take a look at reality, and honestly? Things seem to be moving quite slowly.

&#x200B;

*  Printed organs are still hype, the best we can do is grow a few scraps of tissue and maybe some organoids the size of a large grape. And yes, i am aware of the lab grown bladders and vaginas. These are not good points to make as they are by far the simplest organs to grow. The other, more complex organs are still decades and decades away at best, just like they were 30+ years ago
* AGI is still as distant as ever, just like It was a decade ago. And no, LLM’s will not bring us anywhere close to AGI, unfortunately. 
* Stem cell cures are nowhere to be seen. The best we have is basically just “we can give you a transplant to minimise the effects a bit” or “this may help to alleviate your symptoms for a short time”. We are simply nowhere close to all the miracle headlines and the hype.
* CRISPR is likely just going to be used as a research tool. It is prone to off site errors and is likely to cause cancer.
* Nanobots have proven to be pure hype, the best we can do (and may ever be able to do) is DNA robots with limited functionality.
* Precision / personalised / regenerative medicine? What’s that? No seriously, when has anyone ever mentioned it in a serious capacity? It is nothing but vaporwave, currently.
*  Self driving cars are just starting to be used, and they still are very primitive. They also can’t even drive in the rain, let alone live up to all the grand promises.

So Yeah, this is just a few things and you can see that pretty much all of them are still “5-10“ years away, just like they have been for decades. Things are moving very very slowly.

Ngl, only real things I see changing in the next decade or so is maybe some more self driving cars, better chatbots, a larger share of renewable energy… and, that’s about it. But no one seems to realise it. They all think we are on the brink of massive and radical changes for some reason, even though there is basically 0 evidence to support that. "
1,2023-08-12,Invent New Marital Arts with AI !? (iMartial Arts),u/vcube2300,https://www.reddit.com/r/Futurology/comments/15oxybg/invent_new_marital_arts_with_ai_imartial_arts/,Futurology,"It has taken many generations of observations by the human mind to process & invent Martial Arts. 

Can it take AI just a few years of processing to come up with a new martial arts discipline ?

Give it an idea of human body & all the data of all the martial art forms that have been in practice. 

Will it be able to generate a new martial art ?"
1,2023-08-12,الخريطة التربوية Educational Map,u/mohdedu,https://www.reddit.com/r/Futurology/comments/15oysih/الخريطة_التربوية_educational_map/,Futurology,https://www.mohdedu.com/2023/08/educational-map.html
1,2023-08-12,Explore the tailored marketplace just for you,u/master3102051,https://www.reddit.com/r/Futurology/comments/15ozmgk/explore_the_tailored_marketplace_just_for_you/,Futurology,[removed]
1,2023-08-12,Discussion: Blockchain tech is only for the privileged and promote larger technological divide,u/RepresentativeSock9,https://www.reddit.com/r/Futurology/comments/15p1hsr/discussion_blockchain_tech_is_only_for_the/,Futurology,">Submission Statement: technology such as blockchain and AI is disrupting every sector in the developed world but in turn, the developing countries are left with even less opportunities because of this disadvantage. 

I want to discuss if there are any plans, projects, prospects to use emerging tech (in particular blockchain since it’s ’decentralized thus not impacted by powerful authority) t positively impact the underprivilege. Have you personally thought about it? What are the roadblocks around it

&#x200B;"
1,2023-08-12,Save yourself from Future! Keep yourself safe from Fraudsters,u/Constantknowledge_,https://www.reddit.com/r/Futurology/comments/15p2y6m/save_yourself_from_future_keep_yourself_safe_from/,Futurology,https://writetoearn.online/index.php/2023/08/11/worried-about-safeguarding-your-privacy-maximize-your-learning-here/
1,2023-08-12,Meta disbands IA protein-folding team in shift towards commercial AI,u/AntoItaly,https://www.reddit.com/r/Futurology/comments/15p48j8/meta_disbands_ia_proteinfolding_team_in_shift/,Futurology,"https://www.ft.com/content/919c05d2-b894-4812-aa1a-dd2ab6de794a  
Meta has disbanded a group that utilized artificial intelligence to develop the initial database containing over 600 million protein structures. This move suggests that the company is shifting away from purely scientific endeavors and prioritizing the creation of profitable AI products. Wow. .\_.  


\- ESMFold (Evolutionary Scale Modeling) is a deep learning-based method developed to predict protein structure from its amino acid sequence."
1,2023-08-12,https://vt.tiktok.com/ZSLqyqekU/,u/Sudden-Pay1479,https://www.reddit.com/r/Futurology/comments/15p48km/httpsvttiktokcomzslqyqeku/,Futurology,[removed]
1,2023-08-12,AI now lets you have real conversations with NPCs in video games - Future video games could feature a near-infinite number of possible storylines.,u/lughnasadh,https://www.reddit.com/r/Futurology/comments/15p77bg/ai_now_lets_you_have_real_conversations_with_npcs/,Futurology,https://www.freethink.com/robots-ai/ai-npc-voice-conversations?
1,2023-08-12,"How the Inflation Reduction Act Has Reshaped the U.S.—And The World. The IRA has spurred hundreds of billions of dollars in investment in clean technology. “I want to make it clear: the Inflation Reduction Act is the single most important climate action since the Paris Agreement in 2015.""",u/mafco,https://www.reddit.com/r/Futurology/comments/15p7w95/how_the_inflation_reduction_act_has_reshaped_the/,Futurology,https://time.com/6304143/inflation-reduction-act-us-global-impact/
1,2023-08-12,Invent New Martial Arts with AI !? (iMartial Arts),u/vcube2300,https://www.reddit.com/r/Futurology/comments/15p7zhs/invent_new_martial_arts_with_ai_imartial_arts/,Futurology,"[ Deleted the previous post because of spelling mistakes & reposting with correction. Sincerely apologise for the mistake. ]

It has taken many generations of observations by the human mind, to process & invent Martial arts.

Can it take AI just a few years to come up with a new martial arts discipline ?

Give it an idea of the human body & all the date of all the martial art forms that have in practice.

Will it be able to generate a new martial art ?"
1,2023-08-12,Is your Job at Risk? Do this now! 10 IT jobs affected! This the question if you work in the Information Technology sector. Is your job in jeopardy due to the emergence of Artificial Intelligence!,u/Due-Reindeer7568,https://www.reddit.com/r/Futurology/comments/15p9ka7/is_your_job_at_risk_do_this_now_10_it_jobs/,Futurology,https://youtu.be/lvIBmwMCpm4
1,2023-08-12,Why is eating insects considered healthy ?,u/Hopeful_Village_7946,https://www.reddit.com/r/Futurology/comments/15p9kr3/why_is_eating_insects_considered_healthy/,Futurology,[removed]
1,2023-08-12,SC9863A SoC Block Diagram or Technical Insights for Learning Purposes,u/Atole_cj,https://www.reddit.com/r/Futurology/comments/15p9qo4/sc9863a_soc_block_diagram_or_technical_insights/,Futurology,[removed]
1,2023-08-12,SC9863A SoC Block Diagram or Technical Insights for Learning Purposes,u/Historical_Relief435,https://www.reddit.com/r/Futurology/comments/15p9tfl/sc9863a_soc_block_diagram_or_technical_insights/,Futurology,"I'm currently on a journey to expand my knowledge about semiconductor technologies, specifically the SC9863A SoC developed by Unisoc. I'm interested in delving into the technical aspects and understanding the architecture behind this chip.  
  
I've scoured various resources but have yet to find a comprehensive block diagram or technical insights related to the SC9863A. As a learner passionate about technology, I'm eager to understand the inner workings of this SoC.  
  
To foster a future-focused discussion, I'm reaching out to this community to inquire if anyone has come across detailed technical documentation, block diagrams, or insightful resources regarding the SC9863A SoC. Learning about the architecture, components, and design principles would that would be very helpful to me."
1,2023-08-12,Do you have some time to take a look at our fediverse site before it launches?,u/FuturologyModTeam,https://www.reddit.com/r/Futurology/comments/15p9ue0/do_you_have_some_time_to_take_a_look_at_our/,Futurology,"We’ll soon (next couple of weeks) be going live with an r/futurology fediverse site. If you have an hour or two to spare and are interested, could you help us get it ready for launch?

We need people to test the site's functionality by posting, commenting on the site, and using it to interact with other sites within the fediverse. We’d also like your feedback and suggestions on how the site can be improved before launch. 

The site is built with software called Lemmy and looks much the same as Reddit. It even uses the r/subreddit naming conventions for different sections, just swapping out ‘r’ and using ‘c’ instead. The biggest difference is that alongside subscribing to these sections (subreddit equivalents) on our site, you can also subscribe to them on other fediverse sites, and their content will show up on your front page on our site, alongside our content.

If you’d like to help either comment here, and we’ll DM you details, or hit the message the Mod button and we can DM you from there."
1,2023-08-12,"Pat 2: SPECIAL REPORT: Jonathan Hollerman, GRID DOWN: DEATH OF A NATION",u/TonyR48,https://www.reddit.com/r/Futurology/comments/15pau4g/pat_2_special_report_jonathan_hollerman_grid_down/,Futurology,https://www.spreaker.com/user/sitchradio/part-2-special-report-jonathan-hollerman_2
1,2023-08-12,Law,u/TonyR48,https://www.reddit.com/r/Futurology/comments/15pazwo/law/,Futurology,https://www.usnews.com/news/best-countries/articles/2021-10-18/global-rule-of-law-declines-during-pandemic-study-shows?src=usn_rd
1,2023-08-12,Rise of the machines: AI spells danger for Hollywood stunt workers,u/izumi3682,https://www.reddit.com/r/Futurology/comments/15pb7m7/rise_of_the_machines_ai_spells_danger_for/,Futurology,https://news.yahoo.com/rise-machines-ai-spells-danger-014733770.html
1,2023-08-12,Do you have some time to take a look at r/futurology's fediverse site before it launches?,u/FuturologyModTeam,https://www.reddit.com/r/Futurology/comments/15pbknv/do_you_have_some_time_to_take_a_look_at/,Futurology,"We’ll soon (next couple of weeks) be going live with an r/futurology fediverse site. If you have an hour or two to spare and are interested, could you help us get it ready for launch?

We need people to test the site's functionality by posting, commenting on the site, and using it to interact with other sites within the fediverse. We’d also like your feedback and suggestions on how the site can be improved before launch.

The site is built with software called Lemmy and looks much the same as Reddit. It even uses the r/subreddit naming conventions for different sections, just swapping out ‘r’ and using ‘c’ instead. The biggest difference is that alongside subscribing to these sections (subreddit equivalents) on our site, you can also subscribe to them on other fediverse sites, and their content will show up on your front page on our site, alongside our content.

If you’d like to help either comment here, and we’ll DM you details, or hit the 'Message the Mods' button and we can DM you from there."
1,2023-08-12,Reviving Voices from the Past: How AI Could Let Us Converse with Historical Icons,u/stefanbg92,https://www.reddit.com/r/Futurology/comments/15pcd4z/reviving_voices_from_the_past_how_ai_could_let_us/,Futurology,https://www.youtube.com/watch?v=_IOSBLVQtmA
1,2023-08-12,"Global heating likely to hit world food supply before 1.5C, says UN expert",u/MesterenR,https://www.reddit.com/r/Futurology/comments/15pcemj/global_heating_likely_to_hit_world_food_supply/,Futurology,https://www.theguardian.com/environment/2023/aug/12/global-heating-likely-to-hit-world-food-supply-faster-than-expected-says-united-nations-desertification-expert
1,2023-08-12,Reviving Voices from the Past: How AI Could Let Us Converse with Historical Icons,u/stefanbg92,https://www.reddit.com/r/Futurology/comments/15pda11/reviving_voices_from_the_past_how_ai_could_let_us/,Futurology,https://www.youtube.com/watch?v=_IOSBLVQtmA
1,2023-08-12,EctoLife: The World’s First Artificial Womb Facility,u/AmbassadorUnusual250,https://www.reddit.com/r/Futurology/comments/15pde4p/ectolife_the_worlds_first_artificial_womb_facility/,Futurology,https://youtu.be/O2RIvJ1U7RE
1,2023-08-12,"I am a musician. A real human one. And today, I was accused of being an AI for the first time. Yes, the video is called Internet Girl and I intentionally made it look ""glitchy,"" but I didn't think people would ACTUALLY mistake me for an AI.",u/EvaViaMusic,https://www.reddit.com/r/Futurology/comments/15pe1iv/i_am_a_musician_a_real_human_one_and_today_i_was/,Futurology,https://www.youtube.com/watch?v=lnMPEu7tg1g
1,2023-08-12,Diffusion in metals,u/Material_world2112,https://www.reddit.com/r/Futurology/comments/15peefz/diffusion_in_metals/,Futurology,[removed]
1,2023-08-12,the best hosting website,u/rahhalia2,https://www.reddit.com/r/Futurology/comments/15pf31q/the_best_hosting_website/,Futurology,[removed]
1,2023-08-12,"I posted a song I wrote on Youtube. Yes, I made the video look ""glitchy"" for effect, but people are actually mistaking me for an AI. Which I actually find disturbing. Do we really live in a world where real people are accused of being AIs and artists no longer get credit for their work?",u/EvaViaMusic,https://www.reddit.com/r/Futurology/comments/15pf3hk/i_posted_a_song_i_wrote_on_youtube_yes_i_made_the/,Futurology,https://www.youtube.com/watch?v=lnMPEu7tg1g
1,2023-08-12,"AI will be at the center of the next financial crisis, SEC chair warns",u/Gari_305,https://www.reddit.com/r/Futurology/comments/15pj3um/ai_will_be_at_the_center_of_the_next_financial/,Futurology,https://www.axios.com/2023/08/12/artificial-intelligent-stock-market-algorithms
1,2023-08-12,We Need Smart Intellectual Property Laws for Artificial Intelligence,u/Gari_305,https://www.reddit.com/r/Futurology/comments/15pj738/we_need_smart_intellectual_property_laws_for/,Futurology,https://www.scientificamerican.com/article/we-need-smart-intellectual-property-laws-for-artificial-intelligence/
1,2023-08-12,Interoception,u/kylehankee,https://www.reddit.com/r/Futurology/comments/15pk8dz/interoception/,Futurology,[removed]
1,2023-08-12,"Napkin math: With ~3 trillion dollars of barium sulfate paint (and a place to paint it), If I did my math right, I could plunge the earth into an ice age.",u/Pbleadhead,https://www.reddit.com/r/Futurology/comments/15pnzfh/napkin_math_with_3_trillion_dollars_of_barium/,Futurology,"So, one of the many cool things going around right now is Barium Sulfate cooling panels, which act in the exact same way greenhouses dont: they reflect away visible light, and emit infrared. (greenhouses obviously let visible light though, and reflect infrared)  This cool paper has tons of details:

https://arxiv.org/ftp/arxiv/papers/2011/2011.01161.pdf#:~:text=BaSO4%20has%20a%20high%20electron,sky%20window%20emissivity%20of%200.96.

So, if you have a surface that emits ~100 watts per square meter, and an atmosphere with a heat capacity of ~700 joules per kilogram, and a weight of ~5.5 quadrillion tons ~908 kg per ton, and You come up with the ability to cool the atmosphere by ~1K per year with the surface area of ~1/8th the Sahara desert. 

If the coating is 150 microns thick (as the paper suggests is possible) that comes out to ~150 million cubic meters of paint, which means you need about ~30 million cement mixers filled with the stuff to paint that large of an area. 

If this video is to be believed, the material in question can be purchased for $4000 per ton. https://www.youtube.com/watch?v=dNs_kNilSjk  You would have to turn that into a paint, of course, but lets just fudge that part. But at 4.5grams per CC, or 4500 kg per cubic meter, that comes out to 20,000 bucks per cubic meter, thus 3 trillion dollars of barium sulfate paint. 

Obviously I am ignoring heat transfer between the ground and the atmosphere, and the ocean and the atmosphere, and of course we also have to assume the atmosphere is 'well mixed' and cools evenly. (or your cooling panels are spread out a tad)  And of course as the temperature drops, the panels become less effective, partly because radiation is to the 4th power of temperature, and partly because after a decade or 2 of 1k per year of cooling they would get covered with glaciers. 

I am obviously not suggesting this as a serious thing to do (covering the same area in solar panels might be a more efficient use of space), but it was fun to calculate it out, and it does help put into perspective one of the ways you could cool a planet, if you were worried about such things. And if you are worried about such things, it is important to consider all possible methods... if we are currently gaining 0.018 degree C (https://www.climate.gov/news-features/understanding-climate/climate-change-global-temperature ) every years, then perhaps ~60 billion dollars worth of paint should be about able to cancel out our current warming trend. Seems relatively cheap to me, but feel free to double check my math."
1,2023-08-13,Where Do Crop Circles come From ?,u/DifferentStandard489,https://www.reddit.com/r/Futurology/comments/15ppy3y/where_do_crop_circles_come_from/,Futurology,https://youtube.com/watch?v=Tt7FKj3ufd4&feature=share
1,2023-08-13,All the hype around LK99 being a superconductor is slowly cooling down right now.,u/Individual-Ad2646,https://www.reddit.com/r/Futurology/comments/15prhns/all_the_hype_around_lk99_being_a_superconductor/,Futurology,https://www.theregister.com/2023/08/09/lk99_more_physicists_fail_reproduce/
1,2023-08-13,Catching Immortality,u/catchingimmortality,https://www.reddit.com/r/Futurology/comments/15pt4hz/catching_immortality/,Futurology,https://www.catchingimmortality.com
