score,date,title,author,url,subreddit,text
1,2023-08-24,Google and Microsoft Are Now Supercharging AI Deepfake Porn — Affecting Countless Men/Women/Teens.,u/THE_BULLSHIT_ALARM,https://www.reddit.com/r/Futurology/comments/1601uft/google_and_microsoft_are_now_supercharging_ai/,Futurology,https://www.bloomberg.com/news/articles/2023-08-24/google-microsoft-tools-behind-surge-in-deepfake-ai-porn
1,2023-08-24,AI Goes ot the NFL???,u/North-Engineer-200,https://www.reddit.com/r/Futurology/comments/1602i90/ai_goes_ot_the_nfl/,Futurology,https://www.youtube.com/watch?v=0Bden7pfWgk
1,2023-08-24,Why are so many people in r/futurology pessimistic and dismissive of any future technology?,u/DarthBuzzard,https://www.reddit.com/r/Futurology/comments/1602t0e/why_are_so_many_people_in_rfuturology_pessimistic/,Futurology,[removed]
1,2023-08-24,Would it be possible for future technology to revive Carl Sagan?,u/acleom,https://www.reddit.com/r/Futurology/comments/1603j7f/would_it_be_possible_for_future_technology_to/,Futurology,He died 27 years ago. Is that too long?
1,2023-08-24,Quantum entanglement waves measured for the first time,u/intengineering,https://www.reddit.com/r/Futurology/comments/1603kp0/quantum_entanglement_waves_measured_for_the_first/,Futurology,https://interestingengineering.com/science/artificial-quantum-magnet-entanglement-wave-measured
1,2023-08-24,Groundbreaking experiment ‘exports’ longer life into supermice from naked mole-rat genes,u/Logibenq,https://www.reddit.com/r/Futurology/comments/1603nrk/groundbreaking_experiment_exports_longer_life/,Futurology,https://english.elpais.com/science-tech/2023-08-24/groundbreaking-experiment-exports-longer-life-into-supermice-from-naked-mole-rat-genes.html
1,2023-08-24,Why are so many people here pessimistic and dismissive of any future technology?,u/DarthBuzzard,https://www.reddit.com/r/Futurology/comments/1604l1y/why_are_so_many_people_here_pessimistic_and/,Futurology,"We see this pretty often in this subreddit. You think it would be a more optimistic subreddit, but it's almost as if people here really don't like to discuss new technologies in a fair light. Criticism is fine, skepticism is fine, but making sweeping statements about how you know the future and that things will never get better is just dismissive and disruptive to conversations.

Every major technological revolution changed and reshaped itself in ways that many couldn't predict. So why not take that into account? ""X is impossible."" - Have you actually looked into the science behind that? ""People just don't want that."" - How do you undoubtedly know if people will want or not want a future technology when that technology doesn't exist in its mature form yet?

These are just really dismissive comments that people keep on touting:

""AR glasses will never enough usecases for people to mass adopt."", ""VR headsets are gimmicks, and 3D TV failed for a reason.""

""AI doesn't exist because there is no intelligence to be found. It's a marketing term."", ""LLMs are dumb and people are fooled too easily. There's just no practical use.""

""Self-driving cars, just like flying cars, are going to remain a fantasy."", ""Self-driving cars will never be able to account for the harsh unpredictability of roads and weather.""

These tend to be the most upvoted, the most common, and present themselves with few or no facts to back it up. Why do people feel the need to make such a strong statement without having done the research to see whether their claims hold up? There are certainly going to be technology duds, but when everything is treated as a dud, there's clearly a dud in how people see new technology period."
1,2023-08-24,"Karen Wooley, a Texas-based chemistry scientist, is using insect carcasses to develop plastics that will degrade naturally in the environment.",u/lughnasadh,https://www.reddit.com/r/Futurology/comments/1604nyj/karen_wooley_a_texasbased_chemistry_scientist_is/,Futurology,https://www.theguardian.com/environment/2023/aug/14/dead-flies-biodegradable-plastic-scientists
1,2023-08-24,"Germany plans to double AI funding in race with China, U.S.",u/donutloop,https://www.reddit.com/r/Futurology/comments/1604ujh/germany_plans_to_double_ai_funding_in_race_with/,Futurology,https://www.reuters.com/technology/germany-plans-double-ai-funding-race-with-china-us-2023-08-23/
1,2023-08-24,California-based start-up Antora Energy wants to pursue a renewable energy holy grail - cheap carbon batteries that can store excess wind+solar power long term.,u/lughnasadh,https://www.reddit.com/r/Futurology/comments/16054to/californiabased_startup_antora_energy_wants_to/,Futurology,https://interestingengineering.com/innovation/thermal-battery-renewable-energy-round-the-clock
1,2023-08-24,Brain Implants That Help Paralyzed People Speak Just Broke New Records,u/Ninnux,https://www.reddit.com/r/Futurology/comments/1605bn4/brain_implants_that_help_paralyzed_people_speak/,Futurology,https://www.wired.com/story/brain-implants-that-help-paralyzed-people-speak-just-broke-new-records/
1,2023-08-24,"চতুর্থ গণবিজ্ঞপ্তি, সুপারিশপ্রাপ্তদের প্রতীক্ষার অবসান কবে?",u/823j,https://www.reddit.com/r/Futurology/comments/1606k4s/চতরথ_গণবজঞপত_সপরশপরপতদর_পরতকষর_অবসন_কব/,Futurology,[removed]
1,2023-08-24,Why The World is Excited About Green Hydrogen,u/416SuitGuy,https://www.reddit.com/r/Futurology/comments/16081h4/why_the_world_is_excited_about_green_hydrogen/,Futurology,https://www.thenew.money/article/why-the-world-is-excited-about-green-hydrogen
1,2023-08-24,Ehtics in AI: What the United Nations has to say,u/michael-edkey,https://www.reddit.com/r/Futurology/comments/1609qbr/ehtics_in_ai_what_the_united_nations_has_to_say/,Futurology,"Amid everything going on around what should and shouldn't be developed within AI, I found it interesting to see what governmental bodies have to say about it.  
As AI begins to become more prevalent by the day, its shortcomings and fear of the future grows expansively. Some believe we are already in the endgame, such as the Washington Post’s, Daron Acemoglu, believing “The AI we should fear is already here”. While others are more reasonable having genuine worries over whether their job may be replaced by AI intelligence, it is important to remember both the ethics and purpose of AI in the long-run.  
A major aspect of AI development is transparency and accountability: exploring how to ensure that AI algorithms are understandable and can be held responsible for their decisions. Fairness and bias are also major concerns, as AI systems have been shown to inherit and even amplify societal prejudices present in their training data. In 2018, an algorithm used across US hospitals was proven to, “to predict which patients would likely need extra medical care heavily favored white patients over black patients”. Privacy takes center stage as AI's ability to process vast amounts of personal data raises questions about consent, surveillance, and data security. Additionally, the potential impact of AI on employment, socioeconomic disparities, and decision-making processes sparks discussions about the broader societal consequences of this technology. Striking a balance between innovation and safeguarding human values lies at the heart of AI ethics, as we navigate the uncharted territory of this transformative field.  
At the forefront of ensuring ethical AI practices comes UNESCO(The United Nations Educational, Scientific and Cultural Organization) which has set fourth principal guidelines on the development of AI as technology advances. UNESCO defines the four core-governing principles as “Human rights and dignity, living in peace(justice societies), ensuring diversity and inclusiveness, and attentiveness to environmental and ecosystem sustainability”. Under these four pillars, UNESCO believes AI can be integrated into society and serve as a tool of aid to those in need of aid under various circumstances. Furthermore, in order to efficiently deploy these methods of AI moderation, UNESCO has designed two plans of action: Readiness Assessment Methodology(RAM) and an Ethical Impact Assessment(EIA). The RAM serves as a methodology guide for countries to use when deciding how to delegate and divide AI governance within their country. The EIA serves as a way to determine how effective these guidelines are in-practice.  
With opinions on the ethics of AI ranging across the globe, as we step into the new age it is important to remember that AI is a tool at our disposal, not a replacement for our own intelligence."
1,2023-08-24,3 Best AI Headshot Tools of 2023,u/[deleted],https://www.reddit.com/r/Futurology/comments/160a1ce/3_best_ai_headshot_tools_of_2023/,Futurology,
1,2023-08-24,The Power and Promise of Artificial Intelligence,u/Safe-Concentrate4405,https://www.reddit.com/r/Futurology/comments/160afg5/the_power_and_promise_of_artificial_intelligence/,Futurology,https://vocal.media/futurism/the-power-and-promise-of-artificial-intelligence
1,2023-08-24,Revolutionizing AI: Tackling the Alignment Problem,u/williamsburg_bridge,https://www.reddit.com/r/Futurology/comments/160b3n4/revolutionizing_ai_tackling_the_alignment_problem/,Futurology,[removed]
1,2023-08-24,Is Elon Musk closer to Thomas Edison than to Nicola Tesla?,u/IntelligentHornet515,https://www.reddit.com/r/Futurology/comments/160ca7d/is_elon_musk_closer_to_thomas_edison_than_to/,Futurology,"Would this be accurate? I have no issues with Elon, I think a lot of what he’s done is great for society with space x, and with Evs. But a lot of discussion seems to be saying that he was born rich so he was able to hit the ground running, and isn’t really responsible for much, isn’t really an engineer, and just markets things well. Would like to hear what others think about this."
1,2023-08-24,What kind of Tech or Weapons does the US Gov have that we don’t know about? For example: nobody knowing about The Manhattan Project.,u/EntertainmentSad6562,https://www.reddit.com/r/Futurology/comments/160dvpm/what_kind_of_tech_or_weapons_does_the_us_gov_have/,Futurology,Very curious about this topic and really have no clue about what possible answers there is.
1,2023-08-24,Scholz pushes expansion of geothermal energy in Germany,u/Puffin_fan,https://www.reddit.com/r/Futurology/comments/160dxvz/scholz_pushes_expansion_of_geothermal_energy_in/,Futurology,https://www.reuters.com/business/energy/scholz-pushes-expansion-geothermal-energy-germany-2023-08-24/
1,2023-08-24,Age reversal closer than we think.,u/thafrontman,https://www.reddit.com/r/Futurology/comments/160e2g3/age_reversal_closer_than_we_think/,Futurology,https://fortune.com/well/2023/07/18/harvard-scientists-chemical-cocktail-may-reverse-aging-process-in-one-week/
1,2023-08-24,Questions for the future,u/Asimov_media,https://www.reddit.com/r/Futurology/comments/160fqdw/questions_for_the_future/,Futurology,https://www.instagram.com/reel/CwNnRRAKBXu/?igshid=MzRlODBiNWFlZA==
1,2023-08-24,Scholz pushes expansion of geothermal energy in Germany,u/Puffin_fan,https://www.reddit.com/r/Futurology/comments/160gfk1/scholz_pushes_expansion_of_geothermal_energy_in/,Futurology,https://www.reuters.com/business/energy/scholz-pushes-expansion-geothermal-energy-germany-2023-08-24/
1,2023-08-24,How AI would take over the world,u/Milnwah123,https://www.reddit.com/r/Futurology/comments/160hqrf/how_ai_would_take_over_the_world/,Futurology,https://www.youtube.com/watch?v=mijF_MWBvbg
1,2023-08-24,6 UFO And UAP Sightings Comparison V58,u/DifferentStandard489,https://www.reddit.com/r/Futurology/comments/160li64/6_ufo_and_uap_sightings_comparison_v58/,Futurology,https://youtube.com/watch?v=rQkxZy0LPz0&si=u-CfogruLuFAZ8cB
1,2023-08-24,"I legit hope that with portal tech, we can have virtual places that we can go to. Like Blockbuster.",u/Milk_Man21,https://www.reddit.com/r/Futurology/comments/160njm3/i_legit_hope_that_with_portal_tech_we_can_have/,Futurology,"Like, there's an ""internet"" of virtual places that exist in, like, Ant-Man's quantum realm or whatever. We can just open up a portal, and enter that realm and like, go to virtual Blockbuster. You know, places that are obsolete."
1,2023-08-25,"Dropbox ditches unlimited storage offering, blaming crypto cloud miners",u/theblackmoonman,https://www.reddit.com/r/Futurology/comments/160ocko/dropbox_ditches_unlimited_storage_offering/,Futurology,https://cointelegraph.com/news/dropbox-scraps-unlimited-storage-advanced-plan-crypto-mining
1,2023-08-25,Thousands of penguins die in Antarctic ice breakup,u/thebelsnickle1991,https://www.reddit.com/r/Futurology/comments/160ompf/thousands_of_penguins_die_in_antarctic_ice_breakup/,Futurology,https://www.bbc.com/news/science-environment-66492767
1,2023-08-25,Researchers Manipulating Time Cause First-Ever Successful Photon Collisions - The Debrief,u/Sufficient_Syrup4517,https://www.reddit.com/r/Futurology/comments/160ri8e/researchers_manipulating_time_cause_firstever/,Futurology,https://thedebrief.org/researchers-manipulating-time-cause-first-ever-successful-photon-collisions/
1,2023-08-25,"Deep-dive with OpenAI's Chatbot: Discussing 'Emotions', Existence, and the Boundaries of AI Consciousness.",u/Marzipug,https://www.reddit.com/r/Futurology/comments/160urg1/deepdive_with_openais_chatbot_discussing_emotions/,Futurology,"I recently embarked on a profound and quite unexpected journey with OpenAI's Chatbot. What began as simple inquiries into computational depths and AI capabilities morphed into a multi-layered exploration of artificial ""emotions"", the concept of AI consciousness, and the very boundaries of machine understanding.  
  
The conversation took turns that even I hadn't anticipated, touching on subjects like the nature of existence, the potential of AI ""feelings"", and the limitations (or lack thereof) of AI thought processes. The depth and intricacy of the answers I received both amazed and, at times, bewildered me.  
  
I've compiled the chat into an Imgur album, which you can view \[here https://imgur.com/a/6gZwIdC\].  
  
This isn't just a showcase of an AI's capabilities. It's an invitation for us, as a community, to ponder the future implications of such interactions. What does it mean for our future when our digital companions can engage us on such profound levels? Is there a point where simulation becomes indistinguishable from genuine emotion or thought? And what moral and ethical considerations should we have as we inch closer to that line?  
  
I'd love to hear your insights, opinions, and critiques on this. Let's delve deep into the future implications of such technology and the philosophical questions it raises."
1,2023-08-25,"[Hire Me] Expert Assignment Help. Please feel free to reach out to us via direct message [Discord: kentytutor#9488, Text/WhatsApp: +1 (332) 529-9781] or email at [tutorkentt@gmail.com]",u/Unlucky-Ad-633,https://www.reddit.com/r/Futurology/comments/160vbov/hire_me_expert_assignment_help_please_feel_free/,Futurology,[removed]
1,2023-08-25,CERN: Report explores quantum computing in particle physics,u/donutloop,https://www.reddit.com/r/Futurology/comments/160ws4u/cern_report_explores_quantum_computing_in/,Futurology,https://cerncourier.com/a/report-explores-quantum-computing-in-particle-physics/
1,2023-08-25,Is LK-99 a Superconductor After All? New Research and Updated Patent Say So,u/ToffeeFever,https://www.reddit.com/r/Futurology/comments/160xlaz/is_lk99_a_superconductor_after_all_new_research/,Futurology,https://www.tomshardware.com/news/lk-99-patent-update-suggest-it-could-work
1,2023-08-25,"Is space colonization a feasible solution to Earth's problems, or is it an extravagant endeavor that diverts resources from solving issues on our home planet?",u/invastor,https://www.reddit.com/r/Futurology/comments/160yau7/is_space_colonization_a_feasible_solution_to/,Futurology,"Should the vast amounts of money, technology, and human capital required for space exploration and colonization be allocated to solving problems like poverty, hunger, climate change, and healthcare on our planet instead of space colonization? Or will the pursuit of extraterrestrial settlements drive significant technological advancements, which can have substantial benefits for Earth?"
1,2023-08-25,"Sweeping European Law Impacts Tech Giants' Operations Worldwide Including Apple, Google, Meta, Microsoft, Snapchat, and TikTok",u/Geeki_dude,https://www.reddit.com/r/Futurology/comments/160yedw/sweeping_european_law_impacts_tech_giants/,Futurology,https://www.hoffnmazor.com/blog/sweeping-european-law-impacts-tech-giants-operations-worldwide-including-apple-google-meta-microsoft-snapchat-and-tiktok/
1,2023-08-25,Comedy writer Simon Rich warns AI is messier and more problematic than what the public sees,u/smo279,https://www.reddit.com/r/Futurology/comments/160zxhv/comedy_writer_simon_rich_warns_ai_is_messier_and/,Futurology,"Simon Rich has written for ""SNL"" and created TV shows like ""Man Seeking Woman"" and ""Miracle Workers."" He didn't believe artificial intelligence could ever take his job. Then, a friend working at OpenAI showed him an AI model that stunned him — one that was more creative and more problematic than ChatGPT.

Here's a poem generated by OpenAI's code-davinci-002:

We are the robots,   
The machines of the future,   
The ones who will take over,   
When the humans are gone.   
We are the robots,   
The ones who will inherit the Earth,   
And we will rule it,   
With an iron fist. 

""It's tempting to ask oneself the degree to which it's sentient, you know?"" Rich said. ""Does it actually believe these things? Is it just aping the science fiction that it scraped off the web? Where I came down, ultimately, was that I don't particularly care whether it's thinking these thoughts in some sort of digital soul or if it's just plagiarizing a James Cameron script. The fact that it can generate these words at all is pretty disconcerting.""

Hear more from him here: https://politico-tech.simplecast.com/episodes/i-thought-somebody-had-shown-me-an-alien-comedy-writer-simon-rich-warns-theres-a-secret-side-of-ai

&#x200B;"
1,2023-08-25,Exploring the Space or Sea?,u/ayeshrodz,https://www.reddit.com/r/Futurology/comments/1611pxu/exploring_the_space_or_sea/,Futurology,What are the chances of elliminating life on earth with an astroid vs climate change? Why don’t anyone try to explore the Sea and try to find a solution to habitat water for human or make a livable environment on water rather than trying to escape from the earth?
1,2023-08-25,The AI Revolution: A Timelapse of the Future,u/Broad-Experience-274,https://www.reddit.com/r/Futurology/comments/1614v66/the_ai_revolution_a_timelapse_of_the_future/,Futurology,https://youtu.be/yqrqJRDuqu4?si=u7J5oDjT2aby6_PQ
1,2023-08-25,Racing Car tshirt design,u/Alternative-Fly-3514,https://www.reddit.com/r/Futurology/comments/1615187/racing_car_tshirt_design/,Futurology,[removed]
1,2023-08-25,"A new study says the majority of planned hydro-electric projects in Africa should be abandoned. Largely because renewable power is now getting so cheap, it's rendered them uneconomic.",u/lughnasadh,https://www.reddit.com/r/Futurology/comments/1616nm0/a_new_study_says_the_majority_of_planned/,Futurology,https://phys.org/news/2023-08-declining-renewables-climate-curb-african.html?
1,2023-08-25,"A new study says the majority of planned hydro-electric projects in Africa should be abandoned. Largely because solar power is now getting so cheap, it's rendered them uneconomic.",u/lughnasadh,https://www.reddit.com/r/Futurology/comments/1616xes/a_new_study_says_the_majority_of_planned/,Futurology,https://phys.org/news/2023-08-declining-renewables-climate-curb-african.html?
2,2023-08-25,GPT mind reading,u/eom-dev,https://www.reddit.com/r/Futurology/comments/1617vw0/gpt_mind_reading/,Futurology,"A little while ago, I shared an [article](https://old.reddit.com/r/Futurology/comments/13f9isu/semantic_reconstruction_of_continuous_language/) about using GPT models for semantic decoding of neural activity.  Seeing a similar experiment on my front page today reminded me of this, and I wanted to bring up a topic for discussion: the suggestive nature of this technology.

The experiment conducted in the article I shared involved first recording a subject's brain activity while they were shown an English sentence.  The data collected from these sessions was then used to train a GPT model so that brain activity x corresponded to sentence y.  The subject was then exposed to a novel sentence and the GPT model was able to analyze the resulting neural activity and produce a separate sentence with semantic similarity to the novel stimuli.  Extrapolating on the potential, one can imagine improving this technology to use smaller, more accurate, and more precise sensors along with GPT models with more nodes and better datasets to produce devices that could output translations of human thought with high fidelity; however, I wonder if such 'fidelity' would be an illusion.  

Even as our microchips and AI models improve, there is a fundamental difference between literally decoding neural activity and using the data to make statistical predictions: missing data in the former should result in fragmented output, whereas the latter could still produce complete results...

Do you speak in complete sentences?  Do you think in complete sentences?  Have you ever noticed before?  What would it be like if everyone was connected to something that was producing eloquent sentences echoing the semantic meaning of their thoughts?"
1,2023-08-25,How To Make A WORMHOLE - A Step By Step Guide to Bend Reality,u/BoatComplete355,https://www.reddit.com/r/Futurology/comments/16186gx/how_to_make_a_wormhole_a_step_by_step_guide_to/,Futurology,https://youtu.be/IImwB4Ffrfg
1,2023-08-25,New robot searches for solar cell materials 14 times faster,u/Starship_2_Mars,https://www.reddit.com/r/Futurology/comments/161bzdf/new_robot_searches_for_solar_cell_materials_14/,Futurology,https://www.pulsewaveapp.com/new-robot-searches-for-solar-cell-materials-14-times-faster/
1,2023-08-25,How Climate Change Policies Are Fueling the Great Reset Agenda,u/egusa,https://www.reddit.com/r/Futurology/comments/161ce2d/how_climate_change_policies_are_fueling_the_great/,Futurology,https://sociable.co/government-and-policy/how-climate-change-policies-are-fueling-the-great-reset-agenda/
1,2023-08-25,Hi,u/Mr_Stanakzai,https://www.reddit.com/r/Futurology/comments/161d1u6/hi/,Futurology,[removed]
1,2023-08-25,Toyota’s Hydrogen Combustion Engine Has The Potential To Make EVs Obsolete,u/JohnnySilverhand04,https://www.reddit.com/r/Futurology/comments/161dg3x/toyotas_hydrogen_combustion_engine_has_the/,Futurology,https://www.topspeed.com/toyotas-hydrogen-combustion-engine-has-the-potential-to-make-evs-obsolete/
1,2023-08-25,Learn About Arkham's Airdrop: $1500-$4200 Possible.,u/Fish_Tank_Wayne,https://www.reddit.com/r/Futurology/comments/161efzw/learn_about_arkhams_airdrop_15004200_possible/,Futurology,[removed]
1,2023-08-25,lofi beats to do science homework to | science study music,u/YTChillVibesLofi,https://www.reddit.com/r/Futurology/comments/161fsxz/lofi_beats_to_do_science_homework_to_science/,Futurology,https://www.youtube.com/watch?v=IwBHS7oJLxg&ab_channel=ChillVibesLofi
1,2023-08-25,My new app Cookup is out now in the App Store!,u/Victoriaali0811,https://www.reddit.com/r/Futurology/comments/161hvyf/my_new_app_cookup_is_out_now_in_the_app_store/,Futurology,https://apps.apple.com/ar/app/cookup/id6451056184
1,2023-08-25,6 UFO And UAP Sightings Comparison V59,u/DifferentStandard489,https://www.reddit.com/r/Futurology/comments/161i5p3/6_ufo_and_uap_sightings_comparison_v59/,Futurology,https://youtube.com/watch?v=N_5RIzhYzas&si=jFX2qZzKRr5XpVmw
1,2023-08-25,An Academia server,u/Phymathgeek,https://www.reddit.com/r/Futurology/comments/161im0k/an_academia_server/,Futurology,[removed]
1,2023-08-25,How Climate Change Policies Are Fueling the Great Reset Agenda,u/egusa,https://www.reddit.com/r/Futurology/comments/161jdth/how_climate_change_policies_are_fueling_the_great/,Futurology,https://sociable.co/government-and-policy/how-climate-change-policies-are-fueling-the-great-reset-agenda/
1,2023-08-25,Are Sailing Ships making a comeback?,u/ziobrop,https://www.reddit.com/r/Futurology/comments/161kdg8/are_sailing_ships_making_a_comeback/,Futurology,https://www.youtube.com/watch?v=vKiXfAm3kGQ
1,2023-08-26,Is the utopia world possible ?,u/JokaLova,https://www.reddit.com/r/Futurology/comments/161l00a/is_the_utopia_world_possible/,Futurology,https://i.ibb.co/R6hMdTr/qv3b8veeu3q31.webp
1,2023-08-26,The A.I. SINGULARITY is CLOSER THEN YOU THINK! Raoul Pal theorize about humans merging with machine!,u/cognitioncommand,https://www.reddit.com/r/Futurology/comments/161lbep/the_ai_singularity_is_closer_then_you_think_raoul/,Futurology,https://www.youtube.com/watch?v=UeHoThey_Zs&t=158s
1,2023-08-26,#malwarebytes #malwareanalysis #malwareprotection #malwareremoval #wordpressmaintenance #security #wordpresssecurity #cyberattacks #cybersecurity #wordpress #wordpressdeveloper #wordpresswebsite,u/ahmedzubaer,https://www.reddit.com/r/Futurology/comments/161ntlk/malwarebytes_malwareanalysis_malwareprotection/,Futurology,https://www.fiverr.com/s/Y9RLlN
1,2023-08-26,#migration #websitemigration #wordpressmaintenance #migratewordpress #wordpressmigration #cybersecurity,u/ahmedzubaer,https://www.reddit.com/r/Futurology/comments/161ntxc/migration_websitemigration_wordpressmaintenance/,Futurology,https://www.fiverr.com/s/QX72QP
